review_id,url,hotel_name,review_date,review_body,user_location,user_name,helpful_vote,rating
750586365,https://www.tripadvisor.com/Hotel_Review-g14129477-d12158513-Reviews-Ascott_Marunouchi_Tokyo-Otemachi_Chiyoda_Tokyo_Tokyo_Prefecture_Kanto-or0.html?filterLang=en,Ascott Marunouchi Tokyo,"March 12, 2020","I stayed here on business in November for a week. The self serviced apartment had everything I needed and was a lovely size, bed super comfy and linen gorgeous. I had an issue with not understanding the washing machine but thats to do with my ineptness. The whole building is beautiful and effortlessly run. I loved it and was so close to the office for me. The pool is a saving grace too, its open til 10pm so was good to get a swim in every evening before bed to help with the jet lag.","London, United Kingdom","Emily B</div><div class=""userLoc""><strong>London, United Kingdom</strong>",87,5.0
748805879,https://www.tripadvisor.com/Hotel_Review-g14129477-d12158513-Reviews-Ascott_Marunouchi_Tokyo-Otemachi_Chiyoda_Tokyo_Tokyo_Prefecture_Kanto-or0.html?filterLang=en,Ascott Marunouchi Tokyo,"March 2, 2020","Great location (for us at least); very clean rooms with high quality fixtures, appliances, bedding, toiletries, etc; helpful staff. Great view too facing the imperial palace gardens. I would definitely stay here again... the amount of space and amenities really helped make the trip comfortable for 2 people.",,Ann H,0,5.0
741981881,https://www.tripadvisor.com/Hotel_Review-g14129477-d12158513-Reviews-Ascott_Marunouchi_Tokyo-Otemachi_Chiyoda_Tokyo_Tokyo_Prefecture_Kanto-or0.html?filterLang=en,Ascott Marunouchi Tokyo,"January 29, 2020","Very large room for the price. Extremely well maintained and clean. Awesome bathrooms/showers. Very very friendly and helpful staff who assisted us with restaurant bookings and advice. In a very good location, and the view from our apartment on the 28th floor overlooking the imperial palace and gardens was spectacular.","Sydney, Australia","dbsgmac</div><div class=""userLoc""><strong>Sydney, Australia</strong>",2,5.0
740706556,https://www.tripadvisor.com/Hotel_Review-g14129477-d12158513-Reviews-Ascott_Marunouchi_Tokyo-Otemachi_Chiyoda_Tokyo_Tokyo_Prefecture_Kanto-or0.html?filterLang=en,Ascott Marunouchi Tokyo,"January 22, 2020","Stayed here as a Platinum Ascott member. Location great - near Tokyo Station and therefore lots of different dining options from cheap and cheerful to high class. Check in fast and efficient. Upgraded a room type due to Ascott status so a very positive start to the stay and hard to go backwards from there!Room was big and spacious and very well decked out. Huge bathroom with bath, with great amenities. Beautiful view over the area from the 25th floor. Comfortable beds. Well appointed kitchenette. Only real gripe is that while the furniture is relatively tasteful and functional, the decor is a bit twee - reminds me of a professional Airbnb fit out, especially the wall hangings which I suspect are identical in every room. Hallways also have pretty ugly carpet and trimmings, but the lobby and shared lounge and outdoor area were actually very stylish. Pretty nice gym, and a small indoor infinity 'gym' pool which is closed to children.Would stay again happily, but maybe more of a business hotel than a family hotel.","Melbourne, Australia","Propofool</div><div class=""userLoc""><strong>Melbourne, Australia</strong>",3,5.0
739564097,https://www.tripadvisor.com/Hotel_Review-g14129477-d12158513-Reviews-Ascott_Marunouchi_Tokyo-Otemachi_Chiyoda_Tokyo_Tokyo_Prefecture_Kanto-or0.html?filterLang=en,Ascott Marunouchi Tokyo,"January 16, 2020","The chick in was easy and fast, staff was very friendly and helpful, the room was clean and big, the room quitenes, nice view. Near of Tokyo station And restaurants. The quality of bathroom shampoo body cream was excellent. ","Abu Dhabi, United Arab Emirates","Alhosani537</div><div class=""userLoc""><strong>Abu Dhabi, United Arab Emirates</strong>",0,5.0
738754143,https://www.tripadvisor.com/Hotel_Review-g14129477-d12158513-Reviews-Ascott_Marunouchi_Tokyo-Otemachi_Chiyoda_Tokyo_Tokyo_Prefecture_Kanto-or5.html?filterLang=en,Ascott Marunouchi Tokyo,"January 12, 2020","Ascott Marunouchi is one of the cleanest and most comfortable hotels I've stayed in. The rooms are huge, some having in-room laundry which is great for travelers on long trips. The views are excellent, and the location makes it very easy to get around. You can also jog around the imperial palace just across the street.Ascott Marunouchi is also an excellent deal, when compared to other hotels nearby.","San Francisco, California","charmikarmicat</div><div class=""userLoc""><strong>San Francisco, California</strong>",2,5.0
737187883,https://www.tripadvisor.com/Hotel_Review-g14129477-d12158513-Reviews-Ascott_Marunouchi_Tokyo-Otemachi_Chiyoda_Tokyo_Tokyo_Prefecture_Kanto-or5.html?filterLang=en,Ascott Marunouchi Tokyo,"January 5, 2020","Location is right next to the station, easy to reach and travel from. rooms are spacious and very clean. Staff are very good. Check-in and check out is very quick and easy. Would stay there again no doubt.","Abu Dhabi, United Arab Emirates","Compass34867797083</div><div class=""userLoc""><strong>Abu Dhabi, United Arab Emirates</strong>",0,5.0
736625369,https://www.tripadvisor.com/Hotel_Review-g14129477-d12158513-Reviews-Ascott_Marunouchi_Tokyo-Otemachi_Chiyoda_Tokyo_Tokyo_Prefecture_Kanto-or5.html?filterLang=en,Ascott Marunouchi Tokyo,"January 3, 2020","We stayed at 2712 from Dec 29.2019 to Jan 1, 2020.We really enjoyed our stay there. We will come back next time for sure. Here are some high lights:1: This hotel is very close to Tokyo station and 大手町 station.We took monorail from 羽田 airport to downtown area then we took a taxi to hotel. It was super easy.2: our room was a Executive suite. It has a kitchen, dining area, living room, bedroom. The best parts are two toilets and one washer plus dryer in one machine.3: it was in a quiet street. I am very worry about the noise. This hotel was clean and quiet.4: all of front desk hotel people can speak very good English. They helped you to reserve restaurants and shipped your luggages to your next travel location.5: one compliant from my son: we added a roll away bed for my 16 years old boy. The bed was tiny and not very comfortable to sleep. Wish hotel can improve it in the future. One compliant from me: they should have a person or doorman in the first floor to help customers for their luggages. Hotel's front desk and lobby was on the 22nd floors.",California,"justteresa</div><div class=""userLoc""><strong>California</strong>",37,5.0
736251702,https://www.tripadvisor.com/Hotel_Review-g14129477-d12158513-Reviews-Ascott_Marunouchi_Tokyo-Otemachi_Chiyoda_Tokyo_Tokyo_Prefecture_Kanto-or5.html?filterLang=en,Ascott Marunouchi Tokyo,"January 2, 2020","Very conveniently located. Friendly staff assisted me throughout - checking in, checking out, hailing taxis, printing in the middle of the night.... rooms are big and spacious. Breakfast buffet choices are a bit limited though. But new, clean and very convenient. Overall a very enjoyable stay.","Kuala Lumpur, Malaysia","princessofmorocco</div><div class=""userLoc""><strong>Kuala Lumpur, Malaysia</strong>",6,4.0
735099696,https://www.tripadvisor.com/Hotel_Review-g14129477-d12158513-Reviews-Ascott_Marunouchi_Tokyo-Otemachi_Chiyoda_Tokyo_Tokyo_Prefecture_Kanto-or5.html?filterLang=en,Ascott Marunouchi Tokyo,"December 28, 2019","This is an excellent hotel. The staff is very helpful and attentive. Stayed here while on business in early December 2019. The front desk staff will call for a taxi for you and write your destination on a card in Japanese for you to give to the driver. There is also a currency exchange machine right in the lobby. The rooms are very comfortable and Include a small kitchenette with everything you need for an extended stay. Large bathroom, but like most hotels, the lighting in the bathroom is not good, so bringing a travel light up makeup mirror is a must. Once in the room, you cannot hear any outside or hallway noises, very nice after a long day. The lobby is on the 22nd floor of the building. Easy walk to the Imperial Palace Gardens. Subway access and access to convenience stores and food court is in the ground floor (basement) of the building. Nice restaurant within the hotel. Breakfast buffet was very good.","Milwaukee, Wisconsin","Pauline199001</div><div class=""userLoc""><strong>Milwaukee, Wisconsin</strong>",23,5.0
731306425,https://www.tripadvisor.com/Hotel_Review-g14129477-d12158513-Reviews-Ascott_Marunouchi_Tokyo-Otemachi_Chiyoda_Tokyo_Tokyo_Prefecture_Kanto-or10.html?filterLang=en,Ascott Marunouchi Tokyo,"December 7, 2019","I enjoyed my stay at Ascott Marunouchi Hotel, primarily because of its spacious, bright and modern design, coupled with a sense of privacy for guests. The bathroom is especially nice, with the bath, toilet and and basin compartmentalized into three different sections. Bath salt and wash cloth are a nice touch. It felt really good soaking in a deep tub with sea salt after a long walk. The bathroom comes with a rain shower and another hand-held shower spray. I personally prefer the square-shaped rain shower head, this hotel installs a rectangular rain shower head. There is also a gap above the bathroom door so it will be impossible to create a steam shower, which is a pity.On my first night, though, I was bitten on my leg by a bug on the bed, leaving five very red and itchy bite marks that remained for days. I couldn't find anything on the bed. I called the hotel staff who sent someone to clean the room, but on the second night I was still bitten. The hotel did not offer another room until I requested it. There was no further follow up either. After that, no bug biting incident in the new room. However, on my last night of stay, I put on the pajama provided and my back started to feel itchy. Turned out there were mites on the pajama. Once I removed it, there was no more itch. Another note on housekeeping, I found a cup in the cupboard stained and had a few specks of black dust in it. There were also two hardened small stains in the bathtubs that were not removed. ",,SecondKoala,2,4.0
730039620,https://www.tripadvisor.com/Hotel_Review-g14129477-d12158513-Reviews-Ascott_Marunouchi_Tokyo-Otemachi_Chiyoda_Tokyo_Tokyo_Prefecture_Kanto-or10.html?filterLang=en,Ascott Marunouchi Tokyo,"December 1, 2019",This hotel was extremely comfortable. The rooms were spacious and attractive and the kitchen area was very nice. It's difficult finding king beds in Japan so this hotel was a great find for us. Being located a short walking distance form Tokyo Station made it extremely convenient. ,,Sightseer01217214214,0,5.0
729051660,https://www.tripadvisor.com/Hotel_Review-g14129477-d12158513-Reviews-Ascott_Marunouchi_Tokyo-Otemachi_Chiyoda_Tokyo_Tokyo_Prefecture_Kanto-or10.html?filterLang=en,Ascott Marunouchi Tokyo,"November 26, 2019","We stayed for one night after we first landed in Tokyo. The location was very convenient to Tokyo Station and was surrounded by other nice shopping malls/centers with plenty of stores and restaurants. The hotel is located on the upper floors of the building. When you enter the building, you take an elevator up to the 22nd floor to get to the lobby. The entire hotel was extremely modern and beautiful. The lobby had high ceilings and was impeccably decorated. The gym was modern, large, and had a variety of equipment. We were upgraded from a studio to a one bedroom. This was super spacious with 1.5 bathrooms, separate living room with dining area, kitchen, etc... This is a perfect hotel if you're staying with a family or for a long period of time. I can't recommend enough.",,710elizabethc,10,5.0
726502412,https://www.tripadvisor.com/Hotel_Review-g14129477-d12158513-Reviews-Ascott_Marunouchi_Tokyo-Otemachi_Chiyoda_Tokyo_Tokyo_Prefecture_Kanto-or10.html?filterLang=en,Ascott Marunouchi Tokyo,"November 14, 2019","My mom and I (and some friends in another room) just had the most glorious stay at the Ascott Marunouchi. The hotel’s reception is located on the 22nd floor of a rather plain office building. But once inside, it’s pure luxury. The front desk staff are so helpful and nice. Check in was a breeze. We stayed on the 26th floor in a deluxe room with a city view. There was a living room area as well. The room itself is equipped with everything you could possibly want. It is so clean and feels brand new. The furniture feels expensive and luxe. There is a kitchen with a full size fridge, dishes, and pans. There is a washing machine/dryer. There is a tub and a shower. Bathrobes too. So much space to spread out in. The hotel itself is located in a pretty business area. Not much going on after hours, but that was fine by us. It’s about a 15-20 min walk from Tokyo Station, where there is a lot going on and tons to do. If in Tokyo again, I would only stay here!","Los Angeles, California","faithc</div><div class=""userLoc""><strong>Los Angeles, California</strong>",108,5.0
722995293,https://www.tripadvisor.com/Hotel_Review-g14129477-d12158513-Reviews-Ascott_Marunouchi_Tokyo-Otemachi_Chiyoda_Tokyo_Tokyo_Prefecture_Kanto-or10.html?filterLang=en,Ascott Marunouchi Tokyo,"November 1, 2019",this is my second stay at the Ascott Marunouchi and I plan on staying again when Tokyo calls. The rooms are large and comfortable and very clean. The furnishings are top end as are the amenities. No complaints. It's worth it. ,"Dover, Delaware","nunurbiz0011</div><div class=""userLoc""><strong>Dover, Delaware</strong>",19,5.0
721851516,https://www.tripadvisor.com/Hotel_Review-g14129477-d12158513-Reviews-Ascott_Marunouchi_Tokyo-Otemachi_Chiyoda_Tokyo_Tokyo_Prefecture_Kanto-or15.html?filterLang=en,Ascott Marunouchi Tokyo,"October 27, 2019","This was definitely the nicest hotel accommodation we stayed at during our four week vacation of Japan. The views of the palace were excellent, the facilities are first class and the staff were available to meet our needs when required. ","Adelaide, Australia","Carmelot1</div><div class=""userLoc""><strong>Adelaide, Australia</strong>",5,5.0
717199261,https://www.tripadvisor.com/Hotel_Review-g14129477-d12158513-Reviews-Ascott_Marunouchi_Tokyo-Otemachi_Chiyoda_Tokyo_Tokyo_Prefecture_Kanto-or15.html?filterLang=en,Ascott Marunouchi Tokyo,"October 10, 2019",We thoroughly enjoyed our stay. The location is hard to beat. The view over the Imperial Palace and Mt Fuji (on a clear day) is enthralling. The staff were very efficient. Quality of room amenities was exceptional. ,"Melbourne, Australia","Glen P</div><div class=""userLoc""><strong>Melbourne, Australia</strong>",13,5.0
714640526,https://www.tripadvisor.com/Hotel_Review-g14129477-d12158513-Reviews-Ascott_Marunouchi_Tokyo-Otemachi_Chiyoda_Tokyo_Tokyo_Prefecture_Kanto-or15.html?filterLang=en,Ascott Marunouchi Tokyo,"October 1, 2019","Great location, just a few steps away from train station as well as 10 mins walk from Tokyo Station. It's such a peaceful environment in Tokyo, while, it's close to the Imperial Palace, perfect for jogging, not to mention the best facilities and amenities with very helpful staff. ","Hong Kong, China","Vivian L</div><div class=""userLoc""><strong>Hong Kong, China</strong>",0,5.0
714509407,https://www.tripadvisor.com/Hotel_Review-g14129477-d12158513-Reviews-Ascott_Marunouchi_Tokyo-Otemachi_Chiyoda_Tokyo_Tokyo_Prefecture_Kanto-or15.html?filterLang=en,Ascott Marunouchi Tokyo,"October 1, 2019","A serviced apartment is a great way to feel at home as opposed to a hotel room. You have the option of cooking a meal, doing laundry and just relaxing at your leisure. The gym and pool are nice-and the Palace is just a block away which has a 5K perimeter running route...be sure to run counterclockwise as the signs note and as the local runners run! The staff is very helpful. I have stayed here many times and plan to stay here for future visits.",,Catherine M,0,5.0
711778140,https://www.tripadvisor.com/Hotel_Review-g14129477-d12158513-Reviews-Ascott_Marunouchi_Tokyo-Otemachi_Chiyoda_Tokyo_Tokyo_Prefecture_Kanto-or15.html?filterLang=en,Ascott Marunouchi Tokyo,"September 21, 2019",Perfectly located close to the Tokyo station. View over the East gardiens of the Imperial palace. Impeccable service modern room with quality bathroom all the comfort you might expect is there including fast and reliable internet.I strongly recommend this hotel very discreet and not si easy to find !,"Saint-Nom-la-Breteche, France","francoisl548</div><div class=""userLoc""><strong>Saint-Nom-la-Breteche, France</strong>",260,5.0
711060966,https://www.tripadvisor.com/Hotel_Review-g14129477-d12158513-Reviews-Ascott_Marunouchi_Tokyo-Otemachi_Chiyoda_Tokyo_Tokyo_Prefecture_Kanto-or20.html?filterLang=en,Ascott Marunouchi Tokyo,"September 19, 2019",First time staying at a hotel/residence property. I was very impressed from the start on the quality of Ascott. Starting with the employees who were exceptional in their treatment of guests and the quality of the residence in itself. The service received and the amenities were all very good ! I'll certainly consider staying at one of their properties on my next travels. If anyone is going to Tokyo I would definitely recommend staying at the Ascott Marunoucho !! ,"San Juan, Puerto Rico","rocaclimber</div><div class=""userLoc""><strong>San Juan, Puerto Rico</strong>",6,5.0
706219379,https://www.tripadvisor.com/Hotel_Review-g14129477-d12158513-Reviews-Ascott_Marunouchi_Tokyo-Otemachi_Chiyoda_Tokyo_Tokyo_Prefecture_Kanto-or20.html?filterLang=en,Ascott Marunouchi Tokyo,"September 3, 2019","We recently returned from a week and a half trip to Japan, during which we spent a few of those days in Tokyo. First, the area where the hotel is located is great. Quiet, very clean and right by the Imperial Garden. In addition, it is a few mins walk to Tokyo Station and two nearby shopping malls. The closest station is Otemachi and there are several subway lines crossing that station so it is very convenient to get wherever in Tokyo. The hotel itself is very well maintained and the staff are very friendly. We booked a room with a great view of the Garden and the city in the back. The room was clean and a good size. Also, we had a washer and dryer (all in one) in our room which was very convenient. I would certainly recommend this hotel to anyone visiting Tokyo.","Toronto, Canada","Tamyhchen</div><div class=""userLoc""><strong>Toronto, Canada</strong>",9,5.0
705980007,https://www.tripadvisor.com/Hotel_Review-g14129477-d12158513-Reviews-Ascott_Marunouchi_Tokyo-Otemachi_Chiyoda_Tokyo_Tokyo_Prefecture_Kanto-or20.html?filterLang=en,Ascott Marunouchi Tokyo,"September 3, 2019",If you’re working in the area a great location. If you’re travelling to see the sights of Tokyo while it’s easy to get around the location is very quiet. Hotel itself is beautiful. Very clean. Great service. No room service but Uber Eats is easy. Would stay here for work (like I did) but sold choose another location for pleasure travel. ,"Hong Kong Island, China","scottp835</div><div class=""userLoc""><strong>Hong Kong Island, China</strong>",7,4.0
705309578,https://www.tripadvisor.com/Hotel_Review-g14129477-d12158513-Reviews-Ascott_Marunouchi_Tokyo-Otemachi_Chiyoda_Tokyo_Tokyo_Prefecture_Kanto-or20.html?filterLang=en,Ascott Marunouchi Tokyo,"September 1, 2019","I spent 3 nights at Ascott Marunouchi Tokyo on a business trip in July 2019 and was very satisfied with the hotel. Rooms - designed for extended stays with a kitchen corner and a washing machine - are very spacious, well appointed and comfortable. However, the best thing with at least part of them is the view. My room was located on the 27th floor and offered great views over the Imperial Palace, the Imperial Palace Garden and the Parliament. Probably not many hotels in Tokyo can match Ascott Marunouchi in that respect. Efficient and professional service. Very good breakfast buffet. Ascott Marunouchi is an excellent option for short and long stays inTokyo that I have no hesitation to recommend. ","Brussels, Belgium","vingre</div><div class=""userLoc""><strong>Brussels, Belgium</strong>",77,5.0
704509037,https://www.tripadvisor.com/Hotel_Review-g14129477-d12158513-Reviews-Ascott_Marunouchi_Tokyo-Otemachi_Chiyoda_Tokyo_Tokyo_Prefecture_Kanto-or20.html?filterLang=en,Ascott Marunouchi Tokyo,"August 30, 2019","Great location and agree with others its great when you need to stay more than 2-3 night. Hotel has a washing machine (instructions in english but no instructions about where to place the powder or liquid). It also has a kitchen if you're not too fond of eating out every night or don't like the variety of restaurants you find in Tokyo. My room this time (7night stay) had probably been upgraded and so i had a lounge as well as the standard bedroom with extra study space . Only issue is the restaurant. Poor or limited breakfast choice. The restaurant closes at weekends, and even on a weekday, lunch service is short. I heard one lady this morning being turned away because she was 5 minutes late arriving for last orders. She could have surely just sat and ate the buffet menu. The hot order food choices is fried eggs, omelette or scrambled eggs. Again that takes seconds to prepare. The food in buffet choices should be hot but i ate very cold sausages three days in a row. For a luxury hotel apartment i think this is poor. I also came back just a few minutes past three, asked if I could have a beer and nibbles in their restaurant but was turned away as they were only serving tea. Again no ""omotenashi"" mindset. Given it incredible cost, think they don't live up to the first class standards. And house keeping cut corners as the week progressed. Missing toilet roll, dirty un- emptied bins, missing dressing gowns, no slippers replaced, tea towel wet (ie not changed)... Needs to be reviewed hotel managers! I know we get corporate rates but its still an expensive hotel. Wont recommend to my colleagues in future..","London, United Kingdom","Japanesegirl17</div><div class=""userLoc""><strong>London, United Kingdom</strong>",13,2.0
700727598,https://www.tripadvisor.com/Hotel_Review-g14129477-d12158513-Reviews-Ascott_Marunouchi_Tokyo-Otemachi_Chiyoda_Tokyo_Tokyo_Prefecture_Kanto-or25.html?filterLang=en,Ascott Marunouchi Tokyo,"August 19, 2019","Staff were friendly and professional. They all spoke fluent English.The rooms were spacious and clean. Each of our rooms got a pantry and a washing machine.As we stayed on a high floor, the view was gorgeous!Wifi was strong too! :)","Hong Kong, China","cheungchan2018</div><div class=""userLoc""><strong>Hong Kong, China</strong>",0,5.0
697427866,https://www.tripadvisor.com/Hotel_Review-g14129477-d12158513-Reviews-Ascott_Marunouchi_Tokyo-Otemachi_Chiyoda_Tokyo_Tokyo_Prefecture_Kanto-or25.html?filterLang=en,Ascott Marunouchi Tokyo,"August 10, 2019",What a great way to start a trip to Tokyo. The Ascott apartments are spacious and luxurious. Was a great way to unwind from a long flight. Rooms are exceptionally well kept and clean. It’s also located in a great area. Not overly busy and walking distance from great eateries and things to do. Loved it and highly recommend. ,"Melbourne, Australia","absolutetraveler</div><div class=""userLoc""><strong>Melbourne, Australia</strong>",2,5.0
697360960,https://www.tripadvisor.com/Hotel_Review-g14129477-d12158513-Reviews-Ascott_Marunouchi_Tokyo-Otemachi_Chiyoda_Tokyo_Tokyo_Prefecture_Kanto-or25.html?filterLang=en,Ascott Marunouchi Tokyo,"August 9, 2019","I had a great stay here. Complimentary upgrade, fantastic service and location.The food was excellent and great location to have as basis to explore Tokyo.I am pleasently surprised by the cleanliness and staff members.","Ghent, Belgium","YD91207</div><div class=""userLoc""><strong>Ghent, Belgium</strong>",0,5.0
693647725,https://www.tripadvisor.com/Hotel_Review-g14129477-d12158513-Reviews-Ascott_Marunouchi_Tokyo-Otemachi_Chiyoda_Tokyo_Tokyo_Prefecture_Kanto-or25.html?filterLang=en,Ascott Marunouchi Tokyo,"July 29, 2019","I enjoyed my one bedroom apartment for my week stay in Tokyo. The hotel was clean and need and if you need to be in the Business District of Tokyo, this is a nice choice. It was great be able to do laundry also. It would have been nice if there was a Bar/Lounge or a place to get a cocktail on site, but otherwise no complaints.","Paris, France","Eileen C</div><div class=""userLoc""><strong>Paris, France</strong>",7,5.0
692757316,https://www.tripadvisor.com/Hotel_Review-g14129477-d12158513-Reviews-Ascott_Marunouchi_Tokyo-Otemachi_Chiyoda_Tokyo_Tokyo_Prefecture_Kanto-or25.html?filterLang=en,Ascott Marunouchi Tokyo,"July 25, 2019","This is my third time staying in Ascott Mauronuchi Tokyo. The staff are very friendly and the service, location and facilities are just great! My stay in the deluxe room equips with kitchen and decent dining room. I just want to stay here as like my home ",,PrisPris_Wong,0,5.0
