review_id,url,hotel_name,review_date,review_body,user_location,user_name,helpful_vote,rating
549837658,https://www.tripadvisor.com/Hotel_Review-g14129477-d12158513-Reviews-Ascott_Marunouchi_Tokyo-Otemachi_Chiyoda_Tokyo_Tokyo_Prefecture_Kanto-or155.html?filterLang=en,Ascott Marunouchi Tokyo,"December 28, 2017","We stayed for two nights but you could live here for a month. The apartment had a bed room and separate lounge, bathroom and kitchen/laundry that made good use of space and compared to some Tokyo accommodation we have had was spacious enough to feel you could live here for an extended stay. The furniture, fittings and inclusions were all high-end and while no where is cheap to stay in Tokyo we felt was good value for money. The apartment tower is a 10-15 minutes walk from Tokyo Station and if its cold you can can wind your way through the underground rabbit warren of the Tokyo subway. It is close to Marunouchi Nakadori with its interesting shops and night-time illuminations. Great spot and highly recommended.","Canberra, Australia","davidbV3911JY</div><div class=""userLoc""><strong>Canberra, Australia</strong>",43,5.0
549705390,https://www.tripadvisor.com/Hotel_Review-g14129477-d12158513-Reviews-Ascott_Marunouchi_Tokyo-Otemachi_Chiyoda_Tokyo_Tokyo_Prefecture_Kanto-or155.html?filterLang=en,Ascott Marunouchi Tokyo,"December 28, 2017","We were amazed at the size of the Premier Room that we got, especially for the price we got on Expedia. We’ve been coming almost every year to Tokyo for the last 6 years, and this is the biggest room that we have had (we’ve stayed in Suites at the Capitol Tokyo, Conrad, Park Hyatt and Grand Hyatt Hotels in Tokyo). It also has a Tatami space that could fit in 2 mattresses, perfect for a family with 2 kids like us. 2 bathrooms, and the main En-suite bathroom is hugeService was professional and friendly. Rooms are well maintained, extremely clean and facilities in the room were good.The only downside is that it’s located in the business district which is very quiet at night and there are no restaurants or dining options nearby after 10pm. And there are no room service as well. Only option is the FamilyMart opposite of the road which is 24 hours.Otherwise, location is good, near to Imperial Palace and Tokyo Station. And the room has a great view of Mt Fuji!","Petaling Jaya, Malaysia","juanh187</div><div class=""userLoc""><strong>Petaling Jaya, Malaysia</strong>",37,5.0
549611670,https://www.tripadvisor.com/Hotel_Review-g14129477-d12158513-Reviews-Ascott_Marunouchi_Tokyo-Otemachi_Chiyoda_Tokyo_Tokyo_Prefecture_Kanto-or155.html?filterLang=en,Ascott Marunouchi Tokyo,"December 27, 2017","If you are looking for some piece and quiet area in Tokyo area, try this place. Loaction is within walking distance to tokyo station. Plenty of good restaurant in basement of each buildings. Many good stores and caffee in Marunouchi area. Will definitely going back to rhis area for my next visit to Tokyo.","Surabaya, Indonesia","Jemie_Ang</div><div class=""userLoc""><strong>Surabaya, Indonesia</strong>",2,5.0
549071000,https://www.tripadvisor.com/Hotel_Review-g14129477-d12158513-Reviews-Ascott_Marunouchi_Tokyo-Otemachi_Chiyoda_Tokyo_Tokyo_Prefecture_Kanto-or155.html?filterLang=en,Ascott Marunouchi Tokyo,"December 24, 2017","We were surprised it was much more than a 5 stars hotel. Elegant and prestige environment. With well train staffs who speak English very well. All furniture are new and clean. Classy and nice smell of fragrance. The sound proof is good, quiet walk way with beautiful posters. ","Singapore, Singapore","lin7577</div><div class=""userLoc""><strong>Singapore, Singapore</strong>",10,5.0
548923614,https://www.tripadvisor.com/Hotel_Review-g14129477-d12158513-Reviews-Ascott_Marunouchi_Tokyo-Otemachi_Chiyoda_Tokyo_Tokyo_Prefecture_Kanto-or160.html?filterLang=en,Ascott Marunouchi Tokyo,"December 23, 2017","An excellent 5 nights here. We stayed in 2 apartments -2 bedroom and 3 bedroom ( family of 9). Great facilities, decor and fittings and best of all spacious by Tokyo standards. What was impressive was the level of care and service. One of my kids fell ill and the Assistant Manager went of his way to get a doctor to visit and the team was thoughtful to suggest that they skip Housekeeping the next day so she could rest (they came by to change towels). They also proactively provided us with a thermometer and cold compress. ",Singapore,"evieang7</div><div class=""userLoc""><strong>Singapore</strong>",4,5.0
547977145,https://www.tripadvisor.com/Hotel_Review-g14129477-d12158513-Reviews-Ascott_Marunouchi_Tokyo-Otemachi_Chiyoda_Tokyo_Tokyo_Prefecture_Kanto-or160.html?filterLang=en,Ascott Marunouchi Tokyo,"December 18, 2017","We stayed on My wife's birthday,we were relax and happy.Room is very spacious,late check out is very good. Thank you for present for my wife,candy,etc.We want to visit Ascott Marunouchi Tokyo again,in a few days.",東京,"GlobeTrotting811278</div><div class=""userLoc""><strong>東京</strong>",0,4.0
547272260,https://www.tripadvisor.com/Hotel_Review-g14129477-d12158513-Reviews-Ascott_Marunouchi_Tokyo-Otemachi_Chiyoda_Tokyo_Tokyo_Prefecture_Kanto-or160.html?filterLang=en,Ascott Marunouchi Tokyo,"December 14, 2017","The rooms are so clean, nice decoratian, brand new , suitable for children, the kitchen is so clean , the staff is so helpful , and huge for 4 guests, we will consider to return back in the next trip to tokyo","Jakarta, Indonesia","antoniusnizar</div><div class=""userLoc""><strong>Jakarta, Indonesia</strong>",0,5.0
546996710,https://www.tripadvisor.com/Hotel_Review-g14129477-d12158513-Reviews-Ascott_Marunouchi_Tokyo-Otemachi_Chiyoda_Tokyo_Tokyo_Prefecture_Kanto-or160.html?filterLang=en,Ascott Marunouchi Tokyo,"December 13, 2017","123/5000Wǒmen shì dìng jīběn fáng, rùzhù shí yǒu shēng yī děngzhùfáng xiàng jiālǐ yīyàng ānjìng yǔ shūfú, fángjiān nèi de shèbèi fēicháng qíquán yǔ háohuáchuáng hěn dà, shuì dé hěn shūfú, yóuqí yǒu yīgè dà yùgāng, wánle yītiān pào pào rè shuǐ zǎo fēicháng shūfúpángbiān jiù yǒu dìtiě, lí dōngjīng chēzhàn bùxíng yuē 7~10 fēnzhōng (qǐng zǒu mǎlù, bùyào zǒu dìxiàdào)We are a basic room, a first-class check-inThe home is as quiet and comfortable as home, and the equipment in the room is complete and luxuriousVery large bed, very comfortable to sleep, especially with a large bathtub, playing a day hot bubble bath very comfortableNext to the subway, walk from Tokyo Station about 7 to 10 minutes (please take the road, do not go underground)   ","Kaohsiung, Taiwan","hsuanyih2017</div><div class=""userLoc""><strong>Kaohsiung, Taiwan</strong>",0,5.0
546091377,https://www.tripadvisor.com/Hotel_Review-g14129477-d12158513-Reviews-Ascott_Marunouchi_Tokyo-Otemachi_Chiyoda_Tokyo_Tokyo_Prefecture_Kanto-or160.html?filterLang=en,Ascott Marunouchi Tokyo,"December 8, 2017",Stayed at the maranouchi for work for several days. The rooms are very spacious and comfortable. I don’t think I have ever stayed in such a high tech hotel. The rooms are also exceptionally quiet. Everything has a switch. Breakfast is a smaller buffet but very delicious they do eggs to order. The hotel doesn’t have a bar but underneath the building is a whole underground street of restaurants and bars. ,"Sydney, Australia","TanSea</div><div class=""userLoc""><strong>Sydney, Australia</strong>",79,5.0
544922997,https://www.tripadvisor.com/Hotel_Review-g14129477-d12158513-Reviews-Ascott_Marunouchi_Tokyo-Otemachi_Chiyoda_Tokyo_Tokyo_Prefecture_Kanto-or165.html?filterLang=en,Ascott Marunouchi Tokyo,"December 3, 2017","Ascott Marunouchi was opened last March 2017. They have state of the art decor and fully equipped rooms. We stayed at a 54 square meters - 1 bedroom deluxe and they have a washing machine available. Cleanliness - five stars, staff were very helpful (well almost all the people we have encountered in Tokyo were helpful) and polite. The hotel atmosphere is very cozy and the interior is very elegant. Location is accessible. The nearest station is Otemachi which is a few (3-5) minutes walk. It is also near The Imperial palace East Gardens and Ginza the high-end shopping district.Because Ascott is new, there were few restaurants around. The building beside Ascott have restaurants and a convenient store (Family Mart) in the basement. Value for money? No, it is quite expensive in my opinion. Worth it? Definitely!","Metro Manila, Philippines","MaCrisD</div><div class=""userLoc""><strong>Metro Manila, Philippines</strong>",3,5.0
543551101,https://www.tripadvisor.com/Hotel_Review-g14129477-d12158513-Reviews-Ascott_Marunouchi_Tokyo-Otemachi_Chiyoda_Tokyo_Tokyo_Prefecture_Kanto-or165.html?filterLang=en,Ascott Marunouchi Tokyo,"November 27, 2017","This is a place for mature travelers.Very friendly, caring and helpful staffs.Checked in pretty late and found it doesn’t as room service.Please double check on the advice given by the staff regarding transportation to airport.","Hong Kong, China","Oscar H</div><div class=""userLoc""><strong>Hong Kong, China</strong>",0,4.0
542913299,https://www.tripadvisor.com/Hotel_Review-g14129477-d12158513-Reviews-Ascott_Marunouchi_Tokyo-Otemachi_Chiyoda_Tokyo_Tokyo_Prefecture_Kanto-or165.html?filterLang=en,Ascott Marunouchi Tokyo,"November 23, 2017","we spent four nights here, very satisfied! my room facing the Palace, is nice view! front desk staff is friendly and professional, very grateful to the staff for our efforts to communicate with the Japanese restaurant! will stay next time!",,WongPui6,5,4.0
542547745,https://www.tripadvisor.com/Hotel_Review-g14129477-d12158513-Reviews-Ascott_Marunouchi_Tokyo-Otemachi_Chiyoda_Tokyo_Tokyo_Prefecture_Kanto-or165.html?filterLang=en,Ascott Marunouchi Tokyo,"November 21, 2017","modern clean one bedroom with good location. Facilities are in good condition. Good house keeping work. There are plenty of restaurants, shops nearly the Tokyo station and Marunouchi area. I would stay in this area again. ","Taipei, Taiwan","ph0ebelin</div><div class=""userLoc""><strong>Taipei, Taiwan</strong>",1,4.0
542137181,https://www.tripadvisor.com/Hotel_Review-g14129477-d12158513-Reviews-Ascott_Marunouchi_Tokyo-Otemachi_Chiyoda_Tokyo_Tokyo_Prefecture_Kanto-or165.html?filterLang=en,Ascott Marunouchi Tokyo,"November 19, 2017",This is a beautiful apartment. I stayed in the 1br Deluxe apartment. High end finishes and lovely decor. Fantastic location in the business district and super close to Tokyo station. It doesn't have a bar but has a lovely lobby lounge. Great for the business traveller.,"Melbourne, Australia","Tina C</div><div class=""userLoc""><strong>Melbourne, Australia</strong>",8,5.0
541050739,https://www.tripadvisor.com/Hotel_Review-g14129477-d12158513-Reviews-Ascott_Marunouchi_Tokyo-Otemachi_Chiyoda_Tokyo_Tokyo_Prefecture_Kanto-or170.html?filterLang=en,Ascott Marunouchi Tokyo,"November 14, 2017",Very good location ( near Tokyo station and ginza The rooms are beautiful the lobby as well All the design is beautiful The pool is amazing The hotel Worths room service or food 24/day ( because of jet lag) ,"Casablanca, Morocco","831youssefb</div><div class=""userLoc""><strong>Casablanca, Morocco</strong>",3,4.0
540591015,https://www.tripadvisor.com/Hotel_Review-g14129477-d12158513-Reviews-Ascott_Marunouchi_Tokyo-Otemachi_Chiyoda_Tokyo_Tokyo_Prefecture_Kanto-or170.html?filterLang=en,Ascott Marunouchi Tokyo,"November 12, 2017","Stayed here for 6 nights in the 1 bedroom apartment/hotel (55sqm). This is definitely one of the best service apartments that I have stayed at. The furnishings are very modern and the amenities very good. The location is in the heart of the financial district, so its quiet at night. Tokyo station is about a 5-10 minute walk away, but there is a train station nearby (Otemachi). There's one restaurant in the building (didn't try it) as there are plenty of options available nearby. Overall, I would highly recommend Ascott, if you like modern, new, spacious and decently located (for holiday and business trips alike). There is plenty of food within walking distance!","Singapore, Singapore","Wolfain</div><div class=""userLoc""><strong>Singapore, Singapore</strong>",20,5.0
540543213,https://www.tripadvisor.com/Hotel_Review-g14129477-d12158513-Reviews-Ascott_Marunouchi_Tokyo-Otemachi_Chiyoda_Tokyo_Tokyo_Prefecture_Kanto-or170.html?filterLang=en,Ascott Marunouchi Tokyo,"November 12, 2017","The services and facilities are exceeds our expectations.Location is very convenient, Subway station is underneath the building.Highly recommend. Breakfast is very fresh and various. We werereally glad we made this choice. ",,michelle_han_yu,0,5.0
540336417,https://www.tripadvisor.com/Hotel_Review-g14129477-d12158513-Reviews-Ascott_Marunouchi_Tokyo-Otemachi_Chiyoda_Tokyo_Tokyo_Prefecture_Kanto-or170.html?filterLang=en,Ascott Marunouchi Tokyo,"November 11, 2017","Rooms are generous in size, service is bad. I checked in around 11pm and there is no restaurant opened in the vicinity. I asked the reception who looked like no one ever asked about food past 11pm. They took very long to find a solution and a venue opened","Bangkok, Thailand","706florl</div><div class=""userLoc""><strong>Bangkok, Thailand</strong>",1,2.0
540310890,https://www.tripadvisor.com/Hotel_Review-g14129477-d12158513-Reviews-Ascott_Marunouchi_Tokyo-Otemachi_Chiyoda_Tokyo_Tokyo_Prefecture_Kanto-or170.html?filterLang=en,Ascott Marunouchi Tokyo,"November 11, 2017","I was thoroughly enjoyed my stay in Ascott Serviced apartments in Tokyo.It was short business trip and the hotel was an oasis after whole day of work . I had a room with wonderful view on the Imperial Palace, quiet and in very convenient location. Having breakfast in the hotel, kitchen facilities ans washing machine in the room: all this made my stay comfortable and enjoyable. I will try to book this hotel every time I am in Tokyo","Sydney, Australia","Irina T</div><div class=""userLoc""><strong>Sydney, Australia</strong>",3,5.0
539249930,https://www.tripadvisor.com/Hotel_Review-g14129477-d12158513-Reviews-Ascott_Marunouchi_Tokyo-Otemachi_Chiyoda_Tokyo_Tokyo_Prefecture_Kanto-or175.html?filterLang=en,Ascott Marunouchi Tokyo,"November 7, 2017","The Best room i have in Tokyo, the hotel is new and the room is big, including a dinning area, kitchen, washing machine with clothes dryer. The JR station just in minutes. The hotel is located in a commercial area, so is quiet and relax. ",Hk,"Sam C</div><div class=""userLoc""><strong>Hk</strong>",0,5.0
538621866,https://www.tripadvisor.com/Hotel_Review-g14129477-d12158513-Reviews-Ascott_Marunouchi_Tokyo-Otemachi_Chiyoda_Tokyo_Tokyo_Prefecture_Kanto-or175.html?filterLang=en,Ascott Marunouchi Tokyo,"November 5, 2017",somewhat disappointed due to it DOES NOT CONFORMED AS ADVERTIST/ PROMTOTED in booking.com. The place as cool and vibrant + high end hotel service apartment. Ascott need to review it's offer in all their partners as this will damaged their reputation.The place is far from mall/s and not so many places to eat within the area. ,"Manila, Philippines","angv2017</div><div class=""userLoc""><strong>Manila, Philippines</strong>",0,4.0
534990380,https://www.tripadvisor.com/Hotel_Review-g14129477-d12158513-Reviews-Ascott_Marunouchi_Tokyo-Otemachi_Chiyoda_Tokyo_Tokyo_Prefecture_Kanto-or175.html?filterLang=en,Ascott Marunouchi Tokyo,"October 21, 2017","This is our second time stay in Ascott. We traveled in Tokyo last July and have very good impression of Ascott that’s why we chose Ascott again . Good location, comfortable room, professional and kind staff. Highly recommended!","Nantou, Taiwan","572hsiuy</div><div class=""userLoc""><strong>Nantou, Taiwan</strong>",0,5.0
534238506,https://www.tripadvisor.com/Hotel_Review-g14129477-d12158513-Reviews-Ascott_Marunouchi_Tokyo-Otemachi_Chiyoda_Tokyo_Tokyo_Prefecture_Kanto-or175.html?filterLang=en,Ascott Marunouchi Tokyo,"October 19, 2017",The hotel has very good service where the rooms and the gym are perfect for business or pleasure traveler. I would online invest in a more diversed breakfast. The overall experience was perfect and I recommend,"Sao Paulo, SP","ricardolopespinto</div><div class=""userLoc""><strong>Sao Paulo, SP</strong>",2,5.0
532292292,https://www.tripadvisor.com/Hotel_Review-g14129477-d12158513-Reviews-Ascott_Marunouchi_Tokyo-Otemachi_Chiyoda_Tokyo_Tokyo_Prefecture_Kanto-or175.html?filterLang=en,Ascott Marunouchi Tokyo,"October 12, 2017","These are exceptionally high quality serviced apartments with super interior décor and appointments. Very comfortable, and we had an excellent large TV screen with many English channels including movies. The staff are very friendly and speak English. An easy walk to the Tokyo station, a food mart opposite and a restaurant area in the basement floor. A very comfortable and convenient place to stay.","Sydney, Australia","James W</div><div class=""userLoc""><strong>Sydney, Australia</strong>",15,5.0
531510686,https://www.tripadvisor.com/Hotel_Review-g14129477-d12158513-Reviews-Ascott_Marunouchi_Tokyo-Otemachi_Chiyoda_Tokyo_Tokyo_Prefecture_Kanto-or180.html?filterLang=en,Ascott Marunouchi Tokyo,"October 9, 2017","This is more of a ""serviced apartment"" type establishment but with luxury hotel touches like excellent service, super clean and comfortable rooms. Very modern style which is a plus to me. You feel like you are staying somewhere special. Although it's in the business district it is very well located to the train and subway systems so travelling is a breeze. This is really a superb place to stay if you are on business or if you like a more independent hotel experience. I'll be back. Recommended!","Toronto ,Ontario","multilingual</div><div class=""userLoc""><strong>Toronto ,Ontario</strong>",19,5.0
529790697,https://www.tripadvisor.com/Hotel_Review-g14129477-d12158513-Reviews-Ascott_Marunouchi_Tokyo-Otemachi_Chiyoda_Tokyo_Tokyo_Prefecture_Kanto-or180.html?filterLang=en,Ascott Marunouchi Tokyo,"October 4, 2017","Very nice hotel, we stayed there for about a week in September. Great views to Tokyo and gardens (at least from 29 floor). Very friendly and helpful staff, great location.Would recommend to stay if you visiting Tokyo","Tallinn, Estonia","antonilj</div><div class=""userLoc""><strong>Tallinn, Estonia</strong>",0,5.0
528591715,https://www.tripadvisor.com/Hotel_Review-g14129477-d12158513-Reviews-Ascott_Marunouchi_Tokyo-Otemachi_Chiyoda_Tokyo_Tokyo_Prefecture_Kanto-or180.html?filterLang=en,Ascott Marunouchi Tokyo,"September 30, 2017","We stayed for 4 days at the start of our travels in Japan. Everything was perfect; the room (great view of the skyline over the Imperial Palace), linens, service, amenities (gym, pool, and morning yoga class) and restaurant for breakfast. The place feels almost brand new and the staff are very attentive and helpful. ","Toronto, Canada","TravelCrazedToronto</div><div class=""userLoc""><strong>Toronto, Canada</strong>",6,5.0
528481482,https://www.tripadvisor.com/Hotel_Review-g14129477-d12158513-Reviews-Ascott_Marunouchi_Tokyo-Otemachi_Chiyoda_Tokyo_Tokyo_Prefecture_Kanto-or180.html?filterLang=en,Ascott Marunouchi Tokyo,"September 30, 2017","Al you want for your stay in Tokyo: apartments have a full kitchen including washer/dryer, a gym, pool and stunning city views. Only a 15 minute walk from Tokyo station and two steps away from Otemachi metro station.",,JudithsKitchen,1,5.0
528162768,https://www.tripadvisor.com/Hotel_Review-g14129477-d12158513-Reviews-Ascott_Marunouchi_Tokyo-Otemachi_Chiyoda_Tokyo_Tokyo_Prefecture_Kanto-or180.html?filterLang=en,Ascott Marunouchi Tokyo,"September 28, 2017","We stayed in a studio room for 3 nights, and we were so happy we chose this hotel/apartment. The room is modern and clean and luckily with a washer/dryer and a kitchenette. The hotel provided a packet of detergent (refill next day when we used one). The view from the windows - Tokyo skyline and the Imperial Park - was incredible. The hotel is in the Otemachi business area close to Tokyo Station with a lot of places to eat, have a drink, and shop within a walking distance, including Ginza and Marunouchi. We walked and biked around the Imperial Park. The service was excellent. We hope to stay here again when we return to Tokyo. ","Seattle, Washington","mako1232</div><div class=""userLoc""><strong>Seattle, Washington</strong>",0,5.0
527533787,https://www.tripadvisor.com/Hotel_Review-g14129477-d12158513-Reviews-Ascott_Marunouchi_Tokyo-Otemachi_Chiyoda_Tokyo_Tokyo_Prefecture_Kanto-or185.html?filterLang=en,Ascott Marunouchi Tokyo,"September 26, 2017","Stayed here during 2weeks business trip. Very nice location and quality. Compared to nearby hotels, rate for a flat here is more or less the same. But what a difference a flat brings when away for 2 weeks.Staff very friendly and making you feel ""at home""Nice selection for breakfast. The hours could however be a little longer for breakfast (L.O 09:30 all days). Especially to allow for a ""lazy sunday"" with a little later breakfast. But this is probably a matter of habits. :-)Nice gym open 24/7.","Zurich, Switzerland","kimanders</div><div class=""userLoc""><strong>Zurich, Switzerland</strong>",0,5.0
526910856,https://www.tripadvisor.com/Hotel_Review-g14129477-d12158513-Reviews-Ascott_Marunouchi_Tokyo-Otemachi_Chiyoda_Tokyo_Tokyo_Prefecture_Kanto-or185.html?filterLang=en,Ascott Marunouchi Tokyo,"September 24, 2017","This property is quite new with service apt style. Room is very big with good location, so closed to Imperial Palace and connected Ometachi Station. The lobby is on 22nd floor with good view of Tokyo Skyline. The service from the staffs are excellent. In the room, the kitchen utensils and equipments are complete so it is possible to cook and do laundry. Although the swimming pool is very small, the gym room is quite good and spacious. Although the Airport limousine bus is not stop here, the staff would be happy to help book the ticket and bring luggages to the nearest stop. All in all, I would stay here again whenever I visit Tokyo and would recommend other to stay here too",Jakarta,"Ferliana21</div><div class=""userLoc""><strong>Jakarta</strong>",83,5.0
526851656,https://www.tripadvisor.com/Hotel_Review-g14129477-d12158513-Reviews-Ascott_Marunouchi_Tokyo-Otemachi_Chiyoda_Tokyo_Tokyo_Prefecture_Kanto-or185.html?filterLang=en,Ascott Marunouchi Tokyo,"September 23, 2017","We stayed in a 2 bedroom suite for 3 days, then another 1 night returning through Tokyo.We got the same suite both stays--> 2913.This suite is HUGE by Asian standards. One of the nicest suites I have ever stayed in.Bedrooms were large, with comfortable beds. Plenty of charging ports for electronics.Fast Wifi. Robes and pyjamas provided.Amazing water pressure in the bathroom showers.Nespresso machine is a nice touch.Very convenient location for tourists. Directly connected to Otemachi Metro station (exit C6a towards the Otemachi Park Building/Otemachi Hotoria). If you have luggage--take a cab to and from Tokyo Station--the Marunouchi line is a bit a walk with bags. (Tourist should definitely download the iPhone Tokyo Subway App!)We took taxis twice to the hotel. Both times we were dropped in the taxi area to the side of the building. This was a bit worrisome when we first arrived as we didn't quite know where we were going, but once we found the front sign, the lobby was easily accessed by elevator. I would highly recommend this hotel for Families wishing to stay in a suite together. Friendly and helpful staff!Only thing I didn't find stellar was breakfast. We had breakfast in their restaurant the first morning we were there. It was a bit underwhelming for the cost. Much better options in the city. Would definitely stay here again!",,Tinage81,8,5.0
525451555,https://www.tripadvisor.com/Hotel_Review-g14129477-d12158513-Reviews-Ascott_Marunouchi_Tokyo-Otemachi_Chiyoda_Tokyo_Tokyo_Prefecture_Kanto-or185.html?filterLang=en,Ascott Marunouchi Tokyo,"September 18, 2017","Ascott is a well known serviced apartment. I like Ascott Marunouchi Tokyo very much. Modern design, comfortable bed, nice view, fully equipped kitchen and washing machine, friendly and helpful staff, convenient location - subway is located at the basement of the apartment. It is not an issue they only have one restaurant as you could find more downstairs. Only one thing they need to improve is get someone to attend the entrance area - it is good for customers.","Vancouver, Canada","Venus L</div><div class=""userLoc""><strong>Vancouver, Canada</strong>",8,5.0
524468916,https://www.tripadvisor.com/Hotel_Review-g14129477-d12158513-Reviews-Ascott_Marunouchi_Tokyo-Otemachi_Chiyoda_Tokyo_Tokyo_Prefecture_Kanto-or185.html?filterLang=en,Ascott Marunouchi Tokyo,"September 14, 2017","Loved staying here, it felt like home after the week stay. The value for the money was great compared to other hotels. Neighborhood was not lively, but it was convenient. The room was very spacious and felt luxurious. Much better than a standard corp apartment and everything felt brand new. Will be back!","Brooklyn, New York","ccpp2016</div><div class=""userLoc""><strong>Brooklyn, New York</strong>",15,5.0
