review_id,url,hotel_name,review_date,review_body,user_location,user_name,helpful_vote,rating
664114458,https://www.tripadvisor.com/Hotel_Review-g14129477-d12158513-Reviews-Ascott_Marunouchi_Tokyo-Otemachi_Chiyoda_Tokyo_Tokyo_Prefecture_Kanto-or55.html?filterLang=en,Ascott Marunouchi Tokyo,"April 5, 2019","A friend recommended the Ascott as it was newly built and within a 10 min walk from Tokyo station. Super accessible from various subway lines nearby made this hotel awesome for us.We have always missed sakura season with all of our previous trips and was fortunate to catch the sakuras in full bloom this trip. This hotel is less than a 20 min walk to Chidorigafuchi park which is a spectacular place to view cherry blossoms. It was so good that we went back there 4x. Hotels were super expensive late Mar/Apr and our usual hotel was over 1k/night. Decided to finally try this hotel as it's location is awesome and even had a washing machine in the room. Exchanged several emails asking for confirmation and booked our room the next day. Wasn't expecting much but was blown away as I walked into the room. Inside was a full kitchen w/stove, a fridge, dining table, couch, tatami mattress area, full king sized bed and 2 bathrooms. Had to pinch myself as I couldn't believe the sheer size of this room. As with every hotel in Japan, everything was clean and is well maintained. Cleaning service did a great job of tidying up each morning. Front desk personnel were there to help answer questions and always welcomed us back. Internet here is amazingly fast and reliable.My only complaint was with the bath products they offer. Wasn't exactly a fan or the scent and ended up picking some stuff up at a Lawson's. Wished they still offered the l'occitane products. Will more than likely be staying here going forward.I freaking love this hotel but wished they were apart of a bigger chain.","Los Angeles, California","dek526</div><div class=""userLoc""><strong>Los Angeles, California</strong>",17,5.0
661742621,https://www.tripadvisor.com/Hotel_Review-g14129477-d12158513-Reviews-Ascott_Marunouchi_Tokyo-Otemachi_Chiyoda_Tokyo_Tokyo_Prefecture_Kanto-or55.html?filterLang=en,Ascott Marunouchi Tokyo,"March 27, 2019","We love our 5 nights at Ascott Marunouchi. It’s awesome in so many ways - clean, great view of Mount Fuji on clear days and very comfortable beds(even the day bed is great!). The room is spacious with plenty of thoughtful storage. The water pressure in the bathroom is strong and the temperature is consistent - our next hotel in Disney Resort wasn’t. We like the wooden flooring, our kids will sit on the floor and eat which we do not allow on carpeted floor. The kitchenette is very useful - Ascott provides detergent and also wiping cloth. Location wise, we found it much easier to walk on the pavement rather than taking a subway to Tokyo Station. It feels shorter and we used Google Maps to navigate rather than the signage in the subways to avoid the many staircases underground. The hotel is friendly to businesses and families but it’s quiet in most areas - as we have 2 young kids, we avoid the breakfast and do not hang around much in the common areas/lobby. Overall, it’s as great as the reviews earlier on and we are looking forward to returning in June. ",,Veronicakoh,0,5.0
661406467,https://www.tripadvisor.com/Hotel_Review-g14129477-d12158513-Reviews-Ascott_Marunouchi_Tokyo-Otemachi_Chiyoda_Tokyo_Tokyo_Prefecture_Kanto-or55.html?filterLang=en,Ascott Marunouchi Tokyo,"March 26, 2019","I am happy I chose this hotel for my first night stay in Tokyo. It is conveniently located to Tokyo Station and a few minutes walk away from the Imperial Gardens. The hotel is spotlessly clean, great service and the breakfast buffet was quite tasty. The spa facilities were actually way nicer than I imagined as well. The indoor pool is lovely and pretty awesome. The rooms and bathrooms were spacious. I did not use the kitchenette in the room as we wanted to try the local restaurants. I personally do not like to cook on vacation, but it is a good option for families with fussy eaters.","Los Angeles, California","Tanya A</div><div class=""userLoc""><strong>Los Angeles, California</strong>",20,5.0
661247262,https://www.tripadvisor.com/Hotel_Review-g14129477-d12158513-Reviews-Ascott_Marunouchi_Tokyo-Otemachi_Chiyoda_Tokyo_Tokyo_Prefecture_Kanto-or60.html?filterLang=en,Ascott Marunouchi Tokyo,"March 25, 2019","Amazing service. Great efficiency on check I and check out. Hard to beat location. Got lucky and got a free upgrade; this was great as I was on my honey moon.A great place for traveling families, couples or bruisesses.",,Travel16545852269,0,5.0
657288597,https://www.tripadvisor.com/Hotel_Review-g14129477-d12158513-Reviews-Ascott_Marunouchi_Tokyo-Otemachi_Chiyoda_Tokyo_Tokyo_Prefecture_Kanto-or60.html?filterLang=en,Ascott Marunouchi Tokyo,"March 8, 2019","This place was awesome! First the convenience being attached to the Otemachi station is perfect, then you take the elevator to the 22nd floor to check in. The views from our room were captivating and the room itself felt very upscale, clean, great Wi-Fi, very nice bathroom and amenities with a good sizes kitchenette that had a refrigerator and besides so machine and small over/ microwave. They even had a few English channels on tv! There are so many restaurants and shopping within minutes and it is literally a few minutes walk (whether above ground or using the underground system) from Tokyo station. You can take the Narita express from the airport to Tokyo station and save so much money rather than using a taxi and it is way faster! We loved the staff, so friendly and accommodating and eager to please, you feel special from the minute you walk in the door. We will be back!","Clovis, California","Vaya_con_dios_AO</div><div class=""userLoc""><strong>Clovis, California</strong>",1,5.0
657176546,https://www.tripadvisor.com/Hotel_Review-g14129477-d12158513-Reviews-Ascott_Marunouchi_Tokyo-Otemachi_Chiyoda_Tokyo_Tokyo_Prefecture_Kanto-or60.html?filterLang=en,Ascott Marunouchi Tokyo,"March 8, 2019","Everything is great at this hotel! The staff, cleaning, location, bathroom, breakfast - and basically all!!!Highly recommended!!! :)The best hotel ever!My 3rd time at this hotel and it's a great experience and conviniance every time!",,A1n1a1t,2,5.0
656693877,https://www.tripadvisor.com/Hotel_Review-g14129477-d12158513-Reviews-Ascott_Marunouchi_Tokyo-Otemachi_Chiyoda_Tokyo_Tokyo_Prefecture_Kanto-or60.html?filterLang=en,Ascott Marunouchi Tokyo,"March 5, 2019","The apartment we stayed in was awesome! It was well designed with very nice kitchen, dining, living area, baths and even a patio for yoga, etc. We got to enjoy superb view of the Imperial Gardens overlooking nearby buildings. Service was immaculate too!","Singapore, Singapore","KC L</div><div class=""userLoc""><strong>Singapore, Singapore</strong>",99,5.0
655917474,https://www.tripadvisor.com/Hotel_Review-g14129477-d12158513-Reviews-Ascott_Marunouchi_Tokyo-Otemachi_Chiyoda_Tokyo_Tokyo_Prefecture_Kanto-or60.html?filterLang=en,Ascott Marunouchi Tokyo,"March 2, 2019","As first time travellers to Tokyo we loved staying at the Ascott Marunouchi, these serviced apartments are exquisite in every single way. Despite being serviced apartments, in no way did we feel like the services were in any way less than a 5 star hotel. Fantastic location in the business district. Right next to the Imperial Palace, Otemachi subway station and Tokyo train station. The one bedroom executive was spacious, luxurious and perfect for our needs as a base to explore Tokyo. We couldn't recommend this accomodation more highly.","Sydney, Australia","iseeirene</div><div class=""userLoc""><strong>Sydney, Australia</strong>",16,5.0
655719114,https://www.tripadvisor.com/Hotel_Review-g14129477-d12158513-Reviews-Ascott_Marunouchi_Tokyo-Otemachi_Chiyoda_Tokyo_Tokyo_Prefecture_Kanto-or65.html?filterLang=en,Ascott Marunouchi Tokyo,"March 1, 2019",Clean & fresh fragrance environment with designed ambience. Able to communicate in clear English language. Supply sufficient mineral water without asking. Most latest and branded toiletries with excellent fragrance in bathroom.Well equipped kitchen ware. Cool lighting all around. ,"Singapore, Singapore","lin7577</div><div class=""userLoc""><strong>Singapore, Singapore</strong>",10,5.0
655114213,https://www.tripadvisor.com/Hotel_Review-g14129477-d12158513-Reviews-Ascott_Marunouchi_Tokyo-Otemachi_Chiyoda_Tokyo_Tokyo_Prefecture_Kanto-or65.html?filterLang=en,Ascott Marunouchi Tokyo,"February 26, 2019","We stayed for 3 nights and was delighted with the friendliness and helpful attitude of the staff. The apartment, its facilities and its cleanliness was just perfect. Ascott Marunouchi is in a wonderful position in Tokyo; very close to both the Imperial Palace and its gardens but also Tokyo Station for easy access to explore other parts of Tokyo.","Adelaide, Australia","jasmv</div><div class=""userLoc""><strong>Adelaide, Australia</strong>",16,5.0
654470980,https://www.tripadvisor.com/Hotel_Review-g14129477-d12158513-Reviews-Ascott_Marunouchi_Tokyo-Otemachi_Chiyoda_Tokyo_Tokyo_Prefecture_Kanto-or65.html?filterLang=en,Ascott Marunouchi Tokyo,"February 24, 2019","We stayed one night while passing through Tokyo. This was our third stay at the Ascott Marunouchi and it was still as good as the first time we stayed. Staff were very polite and helpful. The location is great as it is either one stop by underground (Otemachi Station) or a 5-10 minute walk on foot from the Marunouchi exit of the Tokyo Station. The apartment was spacious, light and the bed was very comfortable with beautiful linen. It is great having a washing machine within the apartment. The bathroom is lovely and the products are luxurious. We used the indoor pool which is on the 22nd floor and has great views of Tokyo. Definitely plan on staying here when we are next in Tokyo and would highly recommend it.","Perth, Australia","mdandmw</div><div class=""userLoc""><strong>Perth, Australia</strong>",2,5.0
651502506,https://www.tripadvisor.com/Hotel_Review-g14129477-d12158513-Reviews-Ascott_Marunouchi_Tokyo-Otemachi_Chiyoda_Tokyo_Tokyo_Prefecture_Kanto-or65.html?filterLang=en,Ascott Marunouchi Tokyo,"February 11, 2019","perfect location with helpful and friendly staff. Very welcoming atmosphere. The room is exceptionally clean and well-furnished with everything you need, you just feel like home staying here. very likely to stay again ",,PrisPris_Wong,0,5.0
650447941,https://www.tripadvisor.com/Hotel_Review-g14129477-d12158513-Reviews-Ascott_Marunouchi_Tokyo-Otemachi_Chiyoda_Tokyo_Tokyo_Prefecture_Kanto-or65.html?filterLang=en,Ascott Marunouchi Tokyo,"February 5, 2019","We were looking for a serviced residence near Tokyo Station that was well-rated and had direct access to the subway. Since this was just one stop away (Otemachi) and we had a good deal as an Ascott member, it was a straightforward decision to stay here.While we expect a certain standard from Ascott, the property still surprised us on the upside - great service from the staff and a wonderfully appointed and spacious room (with a fantastic bed) really helped us to end our holiday on a high note.Thank you so much for the experience! ",Singapore,"melwynt</div><div class=""userLoc""><strong>Singapore</strong>",26,5.0
646873765,https://www.tripadvisor.com/Hotel_Review-g14129477-d12158513-Reviews-Ascott_Marunouchi_Tokyo-Otemachi_Chiyoda_Tokyo_Tokyo_Prefecture_Kanto-or70.html?filterLang=en,Ascott Marunouchi Tokyo,"January 18, 2019",stayed for a night before we departed to Lake Karuizawa and returned for another 3 nights. was glad we did ans we enjoyed the vast spacious lobby and sitting lounge and the one bedroom apartment. place is clean and feels comfortable. staff are definetly polite and helpful and eager to please. booked restaurants through them and the assistance extended is impressive !!! looking forward to a return visit. ,"Singapore, Singapore","Y1667TUjohnc</div><div class=""userLoc""><strong>Singapore, Singapore</strong>",85,5.0
645649430,https://www.tripadvisor.com/Hotel_Review-g14129477-d12158513-Reviews-Ascott_Marunouchi_Tokyo-Otemachi_Chiyoda_Tokyo_Tokyo_Prefecture_Kanto-or70.html?filterLang=en,Ascott Marunouchi Tokyo,"January 13, 2019","Hotel is located at center of Tokyo, most of major tube stop at Otemachi station which is very close to the hotel. Very clean and big room. There was a laundry machine which was easy to use. I will stay this hotel next time.","Swiss Alps, Switzerland","OnAir50823513822</div><div class=""userLoc""><strong>Swiss Alps, Switzerland</strong>",0,5.0
645337879,https://www.tripadvisor.com/Hotel_Review-g14129477-d12158513-Reviews-Ascott_Marunouchi_Tokyo-Otemachi_Chiyoda_Tokyo_Tokyo_Prefecture_Kanto-or70.html?filterLang=en,Ascott Marunouchi Tokyo,"January 12, 2019","The rooms and building are exceptionally beautiful. Just note this is not truly a hotel. I'd consider it more of a high-end residential building. Therefore, there is not a typical lobby and hotel staff. It was hard to find the entrance. Even the taxi driver from the trains station had trouble. Hence my rating of 3/5. Otherwise very nice. Expensive for the lack of standard features however, if I were having a longer stay - say 2 weeks or more I would certain stay here over a standard hotel. Rooms were very nice, shower and bathtub, full kitchen, large oversize windows, etc...","Charleston, South Carolina","SParkerJr</div><div class=""userLoc""><strong>Charleston, South Carolina</strong>",42,3.0
643736091,https://www.tripadvisor.com/Hotel_Review-g14129477-d12158513-Reviews-Ascott_Marunouchi_Tokyo-Otemachi_Chiyoda_Tokyo_Tokyo_Prefecture_Kanto-or70.html?filterLang=en,Ascott Marunouchi Tokyo,"January 5, 2019","We stayed one night in the “Executive” and we thoroughly enjoyed it. The room did not have a view of any kind (disappointing) but was super comfortable and luxurious. You get free access to the pool and gym on the 22F. We didn’t try the restaurant; we prepared food in our kitchen so as to enjoy the room as much as possible. Our oven actually broke and couldn’t be fixed, though I doubt this is usual(?). Overall, a great relaxing place to stay but remember it is a residence and not a hotel. ",Tokyo,"paulbK6910XD</div><div class=""userLoc""><strong>Tokyo</strong>",23,4.0
643630739,https://www.tripadvisor.com/Hotel_Review-g14129477-d12158513-Reviews-Ascott_Marunouchi_Tokyo-Otemachi_Chiyoda_Tokyo_Tokyo_Prefecture_Kanto-or70.html?filterLang=en,Ascott Marunouchi Tokyo,"January 4, 2019","I simply cannot find anything to complain about. Many times I do not write reviews because I cannot decide between 4 and 5 but this is a pure 5. Size of the room, places to put clothes and bags, kitchen, bed comfort, amenities' variety and quality, air conditioning, sound isolation were all good. Amenities and towels were replaced daily. Actually I was storing back the towels and there was no need to replace them daily. They were also changing the sheets daily. Thinking back maybe there was a paper to put on top of the bed, but had not noticed back then.Cleanness was top, though other places we stayed in Japan also had high hygiene standards. Even much more expensive hotels elsewhere in the world were nowhere near this cleanliness level.Our room was on one of the top floors. This was the best view of the city. I had been to a number of other recommended locations, but this was actually way better. Our room was facing the imperial gardens and then the rest of the city and one day we could even see mount Fuji. But even without this element the hotel would have been best one I've stayed in so far. It is sad that the restaurant does not have the view.Service was also very good taking into account these are served apartments. At the lobby floor there is also a foreign exchange machine. It does not have the best rates (around 5% above the rates in exchange offices of Japanese banks), but can be convenient.Location-wise: it is in the business district with lots of cafes and restaurants, especially on the ground and underground floors of the building nearby. Marounochi station is closeby. It is also close to shopping areas, but is still some distance from the main shopping areas and/or touristic places. But I have an impression you do have to walk a lot in Tokyo anyways due to big distances between public transportation stops or use taxi/uber.What can be improved:The only thing that comes to my mind variety and quality of black teas could be better. They offer a good Darjeeling, but Darjeeling is not my favourite.","Zurich, Switzerland","sirine313</div><div class=""userLoc""><strong>Zurich, Switzerland</strong>",41,5.0
643229594,https://www.tripadvisor.com/Hotel_Review-g14129477-d12158513-Reviews-Ascott_Marunouchi_Tokyo-Otemachi_Chiyoda_Tokyo_Tokyo_Prefecture_Kanto-or75.html?filterLang=en,Ascott Marunouchi Tokyo,"January 3, 2019","Perfect location, and very good services. All of my requests have been realized, such as room with Fuji mountain view... This has made my stay wonderful. Also the hotel staffs are very nice, even prepared a lovely gift to me on my birthday. Though it is not expensive, it's out of my expectation and felt warm. ","Beijing, China","Excursion30633872020</div><div class=""userLoc""><strong>Beijing, China</strong>",0,5.0
642330973,https://www.tripadvisor.com/Hotel_Review-g14129477-d12158513-Reviews-Ascott_Marunouchi_Tokyo-Otemachi_Chiyoda_Tokyo_Tokyo_Prefecture_Kanto-or75.html?filterLang=en,Ascott Marunouchi Tokyo,"December 29, 2018",This residence is reasonably big esoecially the luxurious bathroom. The kitchenette is very impressive; they provide us with an oven and not just microwave so we were able to grill some fish. Housekeeping has excellent service. Really enjoy our stay!,,Navigate740685,0,5.0
641979220,https://www.tripadvisor.com/Hotel_Review-g14129477-d12158513-Reviews-Ascott_Marunouchi_Tokyo-Otemachi_Chiyoda_Tokyo_Tokyo_Prefecture_Kanto-or75.html?filterLang=en,Ascott Marunouchi Tokyo,"December 28, 2018","The washer + dryer is very useful and efficient. Although I did not use the stove for cooking, the kitchenware and refrigerator are well appreciated, as I bought fruits, yoghurt, and juice in the department store food hall and the nearby convenience store. The wooden-screen divider between bedroom and living room is very stylish; at night, when I stayed in living room to work and had the light on, it did not disturb my son who was sleeping inside. There is a restaurant street located at B1 level of the office building (to which this apartment occupied 22/F to 27/F), one convenience store as well. Breakfast was good, both the conventional western-style breakfast as well as Japanese (miso soup, seaweed slices, congee). Front desk staffs are all friendly and helpful.","Hong Kong, China","xixi_west6</div><div class=""userLoc""><strong>Hong Kong, China</strong>",2,5.0
641360794,https://www.tripadvisor.com/Hotel_Review-g14129477-d12158513-Reviews-Ascott_Marunouchi_Tokyo-Otemachi_Chiyoda_Tokyo_Tokyo_Prefecture_Kanto-or75.html?filterLang=en,Ascott Marunouchi Tokyo,"December 24, 2018",It was my wife’s 30 years old birthday and I wanted to make the stay memorable to her. We could enjoy our stay more than we expected. Room’s condition was well enough. Overall interior and atmosphere was great. Staff’s service was professional and kind.,,hirokim555,0,5.0
640944267,https://www.tripadvisor.com/Hotel_Review-g14129477-d12158513-Reviews-Ascott_Marunouchi_Tokyo-Otemachi_Chiyoda_Tokyo_Tokyo_Prefecture_Kanto-or75.html?filterLang=en,Ascott Marunouchi Tokyo,"December 21, 2018","The actual property is good, rooms are spacious and I had no problem with the check in, check out and actual stay of my recent trip. The problem lies with the instructions front desk provided for travel to Haneda airport. I enquired front desk as to best method to go to Haneda airport and the attendant they told me the easiest way would be by metro. He explained to me it would be 1 change at Mitai station and I should take the red line train to the ""end of the line"" where I would be at Haneda airport, he said the trip would take 40mins. He also drew arrows on the metro map which indicated the starting station, changeover station and an arrow going all the way to the end of the red metro line with a star to alight at the last station. The following morning, I departed an extra 30mins early to ensure there would be no issues on the way. At the Mitai station there are actually 2 different (trains - 1 local which requires another change at the next station or the Haneda express airport train - however this was NOT explained by the front desk staff). In order to make sure we were going on the train for the airport I checked with the station attendant who confirmed I can take the next train which was a local train which would go to the airport. However, he did not say there would be another change over required and because I had been told there would be only ONE changeover, we stayed on the train for a further 3 stops until a train conductor kindly told us we should go back to to Sengakuji station to take the Haneda express. This confusion led me and my travel companion to miss our flight at Haneda airport and incur $2,500 in additional cost to re-book the flights. I contacted the hotel to request a full or partial compensation, or some type of resolution to this terrible experience. I received an phone call asking why I didn't call the hotel when I became lost (I was not aware that I was on the wrong train until the conductor told us to ""go back"" at which point we were definitely late so we were running and the Tokyo metro has signs saying ""turn off phone when crowded"" and no one was talking so we were not sure if it was allowed), and then the manager of the hotel told me it was my fault and the fault of the train attendant that we became lost. I also received an email from the manager offering no resolution with no responsibility taken for the poor directions of the front desk staff. I am still waiting for a satisfactory reply. ","Houston, Texas","AliD04</div><div class=""userLoc""><strong>Houston, Texas</strong>",27,1.0
640515852,https://www.tripadvisor.com/Hotel_Review-g14129477-d12158513-Reviews-Ascott_Marunouchi_Tokyo-Otemachi_Chiyoda_Tokyo_Tokyo_Prefecture_Kanto-or80.html?filterLang=en,Ascott Marunouchi Tokyo,"December 19, 2018","hotel locates nearby the subway station with very nice enviornment around, no hurries and not crowded, very relax, facilities in. room is good for me to cook for self and the washing machine helps me a lot.","Hong Kong, China","498bennyl</div><div class=""userLoc""><strong>Hong Kong, China</strong>",0,4.0
639771085,https://www.tripadvisor.com/Hotel_Review-g14129477-d12158513-Reviews-Ascott_Marunouchi_Tokyo-Otemachi_Chiyoda_Tokyo_Tokyo_Prefecture_Kanto-or80.html?filterLang=en,Ascott Marunouchi Tokyo,"December 15, 2018","This was our second visit to Japan and decided to stay in Tokyo for about 8 days. We had previously stayed at the Palace Hotel which was very impressive and we enjoyed the area enough to stay close by. That's when we came across the Ascott Marunouchi Hotel. It was fairly new so some of the taxi drivers weren't familiar with the hotel since it sits at the top portion of a high rise building. However, it's a gem given it's amenities and modern finishes, it feels like your own apartment. Our room had a kitchen with a washer/dryer and truly made our experience feel as though we were at home. The staff helped arrange numerous reservations for us as well as Sumo tickets which is a must if you travel while tournaments are in place. Altogether, I highly recommend this hotel. It's close enough to Ginza and other main attractions but tucked away in the business district allowing for a peaceful stay.","Los Angeles, California","Mario S</div><div class=""userLoc""><strong>Los Angeles, California</strong>",18,5.0
