review_id,url,hotel_name,review_date,review_body,user_location,user_name,helpful_vote,rating
596558152,https://www.tripadvisor.com/Hotel_Review-g14129477-d12158513-Reviews-Ascott_Marunouchi_Tokyo-Otemachi_Chiyoda_Tokyo_Tokyo_Prefecture_Kanto-or105.html?filterLang=en,Ascott Marunouchi Tokyo,"July 15, 2018","Called to get a copy of the invoice for my stay and was told that this was not possible because I booked through an OTA. Entire situation was handled very poorly with no solutions offered. While the property itself was well maintained, I would not recommend staying at this property due to poorly trained staff and poor reservation tracking systems.","New York City, New York","Iris Y</div><div class=""userLoc""><strong>New York City, New York</strong>",1,1.0
596254307,https://www.tripadvisor.com/Hotel_Review-g14129477-d12158513-Reviews-Ascott_Marunouchi_Tokyo-Otemachi_Chiyoda_Tokyo_Tokyo_Prefecture_Kanto-or105.html?filterLang=en,Ascott Marunouchi Tokyo,"July 14, 2018","For Tokyo, this hotel was absolutely good value for money. The rooms were spacious and well-maintained (and very new, I think). There were some funkier appliances like hot plates and a washer - so I think the hotel is geared more as an apartment-style short-to-medium stay residence.The location could have been slightly better since the lines connecting to the Otemachi Station is not the best, but Tokyo Station is only a short walk away. But overall, it's still very convenient.Will definitely be coming back!","Hong Kong, China","Eugene L</div><div class=""userLoc""><strong>Hong Kong, China</strong>",55,5.0
594787340,https://www.tripadvisor.com/Hotel_Review-g14129477-d12158513-Reviews-Ascott_Marunouchi_Tokyo-Otemachi_Chiyoda_Tokyo_Tokyo_Prefecture_Kanto-or105.html?filterLang=en,Ascott Marunouchi Tokyo,"July 10, 2018","Nothing small about the rooms here. A good sized bedroom with a bench kitchen and washing machine above a railway station. Make sure you get a room with a park view.Really good gym, swimming pool and you get a buffet breakfast with western and Japanese food . Everything works.","Bondi, Australia","Connolly47</div><div class=""userLoc""><strong>Bondi, Australia</strong>",152,5.0
587591558,https://www.tripadvisor.com/Hotel_Review-g14129477-d12158513-Reviews-Ascott_Marunouchi_Tokyo-Otemachi_Chiyoda_Tokyo_Tokyo_Prefecture_Kanto-or110.html?filterLang=en,Ascott Marunouchi Tokyo,"June 15, 2018","Located in the business area of Tokyo, a few meters away from the subway station, this hotel is actually located on the 22nd floor and up. Entrance and reception are beautiful, staff very professional and dedicated. Room was amazing, huge and arrange with style. Modern, luxurious, separated living room and bedroom, washing machine and kitchen. It felt more like an apartment rather than a hotel room. Amazing swimming pool ans nice restaurant. Overall a very good experience, we will absolutely go back to this hotel next time we are in Tokyo. We recommend this establishment absolutely as it matched our need completely.",Genève,"jedi27</div><div class=""userLoc""><strong>Genève</strong>",59,5.0
585720741,https://www.tripadvisor.com/Hotel_Review-g14129477-d12158513-Reviews-Ascott_Marunouchi_Tokyo-Otemachi_Chiyoda_Tokyo_Tokyo_Prefecture_Kanto-or110.html?filterLang=en,Ascott Marunouchi Tokyo,"June 7, 2018",We stayed st Ascott Tokyo for 5 nights. The apartment is very well decorated and model. Super clean. With good view of Tokyo city. Very convenient. It is linked to subway station and walking distance to Major shopping district and imperial garden. Staff are Friend and speak good English. Highly recommend. ,"Singapore River, Singapore","Luciasiu</div><div class=""userLoc""><strong>Singapore River, Singapore</strong>",1,5.0
584184862,https://www.tripadvisor.com/Hotel_Review-g14129477-d12158513-Reviews-Ascott_Marunouchi_Tokyo-Otemachi_Chiyoda_Tokyo_Tokyo_Prefecture_Kanto-or110.html?filterLang=en,Ascott Marunouchi Tokyo,"May 31, 2018","Could not fault this apartment hotel not far from Tokyo Station. We loved everything about it. We had a corner studio on the 28th floor with spectacular views over the Imperial Palace Gardens, the Tokyo skyline and Mt Fuji in the distance. As well as the beautiful modern decor, the kitchen and washer/dryer make it an ideal place to stay and so spacious compared to most Japanese hotels. It is in the business district, so quiet at night but the subway Otemachi is right at the entrance to the hotel so it is easy to get to the lively areas of Tokyo. Staff were exceptional.",Sydney Australia,"TheEls12</div><div class=""userLoc""><strong>Sydney Australia</strong>",6,5.0
583336529,https://www.tripadvisor.com/Hotel_Review-g14129477-d12158513-Reviews-Ascott_Marunouchi_Tokyo-Otemachi_Chiyoda_Tokyo_Tokyo_Prefecture_Kanto-or110.html?filterLang=en,Ascott Marunouchi Tokyo,"May 28, 2018",We had a lovely Corner room (studio) on the 28th floor and there is nothing to complain about! I can highly recommend Ascott Marunouchi as a hotel to stay in Tokyo and its amazing apartments. Located in Tokyo city centre it offers top standard facilities and splendid views from its huge windows.,,AnastasiaS1234,2,5.0
581035451,https://www.tripadvisor.com/Hotel_Review-g14129477-d12158513-Reviews-Ascott_Marunouchi_Tokyo-Otemachi_Chiyoda_Tokyo_Tokyo_Prefecture_Kanto-or110.html?filterLang=en,Ascott Marunouchi Tokyo,"May 18, 2018","I really don't have anything bad to say about this place - beautiful apartments - spacious, modern and luxurious, immaculately clean, comfy beds, all the amenities you need, great location, great staff. We stayed 3 nights when we first arrived in Japan and found it very comfortable, easy to find as it's a 10 minute walk from Tokyo main station and it's great having the kitchen area as it meant we could bring all sorts of snacks in from the fab shops in the city and eat them comfortably in the room. There is a good swimming pool and gym on site and if you do want to have breakfast at the hotel you can pay extra and have it in their restaurant if you want. Highly recommended and really good value for money.","York, United Kingdom","MANGOKITTEN82</div><div class=""userLoc""><strong>York, United Kingdom</strong>",17,5.0
581005771,https://www.tripadvisor.com/Hotel_Review-g14129477-d12158513-Reviews-Ascott_Marunouchi_Tokyo-Otemachi_Chiyoda_Tokyo_Tokyo_Prefecture_Kanto-or115.html?filterLang=en,Ascott Marunouchi Tokyo,"May 18, 2018","The location very close to Otemachi Station (Marunouchi Line Tokyo)I ask for top floor room and the view was wonderful. In the morning you can see the scene of wonderful tokyo and Mt. FujiThe bathroom was huge and the bed were very comfortable with lots of pillows (my fave)The room service and housekeeping doing a great job to serve my needs like a bucket of ice, request for extra blanket, extra pillow. ","Singapore, Singapore","Irvan R</div><div class=""userLoc""><strong>Singapore, Singapore</strong>",2,5.0
580134455,https://www.tripadvisor.com/Hotel_Review-g14129477-d12158513-Reviews-Ascott_Marunouchi_Tokyo-Otemachi_Chiyoda_Tokyo_Tokyo_Prefecture_Kanto-or115.html?filterLang=en,Ascott Marunouchi Tokyo,"May 14, 2018","I stayed her for four nights on my first visit to Tokyo. The hotel is very modern and plush which you notice as soon as you enter the Level 22 main lobby (although a bit lacking at street level with no staff to greet nor much of a driveway). Staff are very friendly and greet you everytime you walk past the reception desk which is everytime you come and go from the hotel. Given it is a sky lobby, it did become a bit of a pain to have to change lifts each time you wanted to leave the hotel and the lifts aren’t near each other. I had a 1br apartment on Level 27 and the view over the Imperial Gardens towards Shibuya/Shinjuku was amazing. On a clear day you can see Mt Fuji which was a novelty. The apartment itself is very spacious with kitchen incl dishwasher, laundry facilities, generous sized bathroom and King size bed. The room is very modern and very comfortable except a more comfy armchair would have completed this. The hotel location was convenient for Metro transport (connected to Otemachi station which is the main Metro interchange) although note it is still quite a walk to some Metro lines albeit underground and well signposted (in English) signage. The location is a downside as well being in Maranouchi which is the Financial District and not a lot of food or entertainment options nearby. There is also no room service in the hotel which adds to the location issue. The indoor Pool was fantastic and a very comfortable temperature. Overall I loved the hotel and would recommend to anyone with the caveat about being mindful of the location with what you are wanting to get out of your Tokyo stay.","Sydney, Australia","aarong155</div><div class=""userLoc""><strong>Sydney, Australia</strong>",29,5.0
579770012,https://www.tripadvisor.com/Hotel_Review-g14129477-d12158513-Reviews-Ascott_Marunouchi_Tokyo-Otemachi_Chiyoda_Tokyo_Tokyo_Prefecture_Kanto-or115.html?filterLang=en,Ascott Marunouchi Tokyo,"May 12, 2018",Nice location and great service but they don't have spa . I enjoy with yoga classes and the concierge prepared all what do you need it and you will like it and love it and don't forget going to ginza zone.,"Riyadh, Saudi Arabia","Musaad A</div><div class=""userLoc""><strong>Riyadh, Saudi Arabia</strong>",0,5.0
579153580,https://www.tripadvisor.com/Hotel_Review-g14129477-d12158513-Reviews-Ascott_Marunouchi_Tokyo-Otemachi_Chiyoda_Tokyo_Tokyo_Prefecture_Kanto-or115.html?filterLang=en,Ascott Marunouchi Tokyo,"May 9, 2018","I like their Location, its near every place in Tokyo. And staffs has very good attitude of their job. Room was very clean. Their was cutlery in the room, I could understand what is that for. But I was so disappointed with their Breakfast. First you have to bring your breakfast voucher, when you want have breakfast. (I didn't bring it so I paid it twice.) And food quality was not that expected too. ","Seoul, South Korea","ox48614</div><div class=""userLoc""><strong>Seoul, South Korea</strong>",0,3.0
579098984,https://www.tripadvisor.com/Hotel_Review-g14129477-d12158513-Reviews-Ascott_Marunouchi_Tokyo-Otemachi_Chiyoda_Tokyo_Tokyo_Prefecture_Kanto-or115.html?filterLang=en,Ascott Marunouchi Tokyo,"May 9, 2018","We chose this hotel based on price and reviews and we were so happy we did. The room was extremely large, especially by Tokyo standards, with a nicely equipped kitchen and washer/dryer. The bed was comfortable and the AC was excellent. It is located minutes from 3 metro stations, so we didn't mind being a little off the beaten tourist path. The staff at the front desk and in the restaurant were helpful and friendly, making us reservations, calling cabs, etc. We enjoyed the variety of the buffet breakfast in the dining room. The hotel is a part of an office complex, so there are also lots of other food options nearby. The only thing I found strange was that the restaurant was closed for dinner on Saturday night. I would happily stay here again!","New York City, New York","Pegstra</div><div class=""userLoc""><strong>New York City, New York</strong>",15,5.0
578922401,https://www.tripadvisor.com/Hotel_Review-g14129477-d12158513-Reviews-Ascott_Marunouchi_Tokyo-Otemachi_Chiyoda_Tokyo_Tokyo_Prefecture_Kanto-or120.html?filterLang=en,Ascott Marunouchi Tokyo,"May 8, 2018","Absolutely phenomenal serviced appartment couple of minutes of a nice walk from the Tokyo Station. Undergorund station directly at the hotel entrance. Professional and polite staff prepared to respond to all wishes of the hotel guests - they helped us a lot ot send our luggage via Taqubin, recive some packages etc.Spacious rooms with wooden floor, large bathrooms, great kitchen, well equipped appartmens with everything you need.Absolute perfection.One picture is worth thousand words - I am unable to praise more this hotel, so just go there and check it by yourself. :-)Note: 1.) No possibility to open the windows2.) Children under 18 y are not permitted to use the swimming pool. What a pity for my 3,5 years old daughter - I promised her the pool. :-(","Zagreb County, Croatia","Mishija123</div><div class=""userLoc""><strong>Zagreb County, Croatia</strong>",2,5.0
578689962,https://www.tripadvisor.com/Hotel_Review-g14129477-d12158513-Reviews-Ascott_Marunouchi_Tokyo-Otemachi_Chiyoda_Tokyo_Tokyo_Prefecture_Kanto-or120.html?filterLang=en,Ascott Marunouchi Tokyo,"May 7, 2018","Well equipped kitchen and laundry. Convenient location and nearby Otemachi Station. 24hr gym (well equipped) in the building. Restaurant options in the basement of the (left) building next door. However, better options available about 10 - 15mins down the road in Marunouchi area. However, Guest Services needs improvement:- Reception asked me to bring my own dry cleaning down instead of collecting it from my room.- housekeeping only able to replace amenities (shower caps) after 12pm l.- Shampoo, shower gel, coffeee etc are a “once off” and won’t be replaced. Even if you’re staying for a month. - Guest Services don’t show you to your room nor offer to assist with baggage. Having visited Japan on a regular basis for 6 years, I feel the Guest Services team doesn’t meet what is expected of “Japanese hospitality and service.” However, the location of the building and convenience of a long term stay options as a Serviced Apartment makes Ascott Marunouchi a place I’d return to but the Service is very disappointing. ","Melbourne, Australia","Su-AnnKhaw15</div><div class=""userLoc""><strong>Melbourne, Australia</strong>",19,3.0
577132758,https://www.tripadvisor.com/Hotel_Review-g14129477-d12158513-Reviews-Ascott_Marunouchi_Tokyo-Otemachi_Chiyoda_Tokyo_Tokyo_Prefecture_Kanto-or120.html?filterLang=en,Ascott Marunouchi Tokyo,"May 1, 2018","Have travelled widely and can honestly say this is one of my top three hotel experiences anywhere. Faultless service, warm, welcoming and efficient. So tranquil it’s hard to believe you’re in the heart of one of the world’s busiest cities. Pristine, luxurious, ulra-modern apartment apparently serviced by invisible pixies who never disturbed us. Great restaurant food. Superb, central location, just a few minutes from the Imperial Palace Gardens. Lots of additional restaurants in the basement station walkway. Tokyo is not a cheap city to visit, but the Ascott was considerably better value than some of the more well-known high-end hotels. Stayed with my husband and two teenage children. All four of us raving about it ever since. Can’t recommend highly enough! ","Belfast, United Kingdom","SnaskBask</div><div class=""userLoc""><strong>Belfast, United Kingdom</strong>",1,5.0
576980126,https://www.tripadvisor.com/Hotel_Review-g14129477-d12158513-Reviews-Ascott_Marunouchi_Tokyo-Otemachi_Chiyoda_Tokyo_Tokyo_Prefecture_Kanto-or120.html?filterLang=en,Ascott Marunouchi Tokyo,"April 30, 2018","Excellent stay on top of the Otemachi subway, near tokyo station in Maranouchi district. For strictly tourist purposes, it would be better to stay in a less business-y area but for quality of the apartment and convenience on top of the subway lines, this suited our family well. ","Hong Kong, China","desireesk</div><div class=""userLoc""><strong>Hong Kong, China</strong>",78,5.0
576731549,https://www.tripadvisor.com/Hotel_Review-g14129477-d12158513-Reviews-Ascott_Marunouchi_Tokyo-Otemachi_Chiyoda_Tokyo_Tokyo_Prefecture_Kanto-or120.html?filterLang=en,Ascott Marunouchi Tokyo,"April 30, 2018","This is my 2nd time staying at Ascott Marunouchi. I stayed the first time in August last year, when they were still brand new and now they are celebrating their 1st year anniversary. I really enjoyed staying at this apartment. Clean, modern, well designed, and with good location. Very close to the nearest subway station which is connected to Tokyo Sta. Basically, you can go anywhere from there. The facility is good. 24Hr gym. A yoga class in the morning. The only downside perhaps, they do not have a limousine bus stop. However, you can walk to the nearest hotel which is really close. ","Jakarta, Indonesia","761leilad</div><div class=""userLoc""><strong>Jakarta, Indonesia</strong>",7,5.0
576644613,https://www.tripadvisor.com/Hotel_Review-g14129477-d12158513-Reviews-Ascott_Marunouchi_Tokyo-Otemachi_Chiyoda_Tokyo_Tokyo_Prefecture_Kanto-or125.html?filterLang=en,Ascott Marunouchi Tokyo,"April 29, 2018",We stayed here at the end of our March Break trip to Asia. The rooms are small but very well kept. The small kitchenette is a nice touch. Lunch is very reasonably priced. The hotel is in a great location to attractions and the subway. There is no bar which is too bad and they could use a small / quick Cafe. The gym is very well equipped but the pool is too small to be worthwhile. ,"Toronto, Canada","Biff5804</div><div class=""userLoc""><strong>Toronto, Canada</strong>",26,4.0
575864451,https://www.tripadvisor.com/Hotel_Review-g14129477-d12158513-Reviews-Ascott_Marunouchi_Tokyo-Otemachi_Chiyoda_Tokyo_Tokyo_Prefecture_Kanto-or125.html?filterLang=en,Ascott Marunouchi Tokyo,"April 26, 2018","I was initially scared that being an apartment rather than a hotel room it would not be nice but I was totally wrong. The bathroom was large and of course Japan toilets are the latest spec. They also had all complimentary items such toothbrush etc.. and by the L'Occatiane brand which is excellent.The bedroom ""section"" looks stunning and the full windows give a great view of Tokyo. The 4K tvs are all perfect and the Wifi was very quick. (You actually connect to your own apartments router which makes its easier) . I have many gadgets and phones that needed to be charged and each socket in the bedroom area had two USB charging ports which was superb, I didn't need to use any silly adapters which as we know are never quite right.The kitchen I never used as I was on a business trip but it all looked state of the art. The hotel itself is above a business building with its own lift and entrance at the front, I actually walked from the Tokyo station even in rush hour with a trolley bag it took 10 minutes (most of the time is waiting at lights to cross) Location wise, you have the imperial palace within 5 minutes, main station within 10 and if you walk 15mins your into Ginza which has the upmarket shops. Underneath the building via the subway connections you have a variety of restaurants.Check in was very quick, just be aware you need to take your bags to your room (not an issue if your a business traveller) and the breakfast was surprisingly good, though not as much variety as 5* hotels but easily enough to be happy with. Overall the hotel is stunning as its brand new and has the latest tech and very close to main sites of Tokyo. Would I come back again, yes definitely.","London, United Kingdom","akzah</div><div class=""userLoc""><strong>London, United Kingdom</strong>",35,5.0
575170378,https://www.tripadvisor.com/Hotel_Review-g14129477-d12158513-Reviews-Ascott_Marunouchi_Tokyo-Otemachi_Chiyoda_Tokyo_Tokyo_Prefecture_Kanto-or125.html?filterLang=en,Ascott Marunouchi Tokyo,"April 23, 2018","Stayed in a one bedroom appartment up on the 26th floor, and it seemed pretty heavenly to me!! Soooo quiet and restful, and the housekeeping staff were so discreet that you could have slept through the whole day and not been disturbed.The kitchen had every appliance/utensil you could think of, and there was a small dining area plus lounge with TV and sofa, in addition to the TV in the bedroom, a few metres away. I mean, wow!!!Breakfast was an additional 7,000 yen for two, but it was to die for!!! Tropical fruit salad, cereals, eggs, noodles (for my partner!), toast, waffles and cinnanmon whirls, in that order, hardly needed to eat for the rest of the day!! Lovely staff as well, the chef overseeing proceedings was so polite and welcoming, they all were, could've stayed here forever, sigh!",United Kingdom,"Suzanne P</div><div class=""userLoc""><strong>United Kingdom</strong>",49,5.0
575059649,https://www.tripadvisor.com/Hotel_Review-g14129477-d12158513-Reviews-Ascott_Marunouchi_Tokyo-Otemachi_Chiyoda_Tokyo_Tokyo_Prefecture_Kanto-or125.html?filterLang=en,Ascott Marunouchi Tokyo,"April 22, 2018",We travelled as a couple during New year vacation for 5 days. The location was a bit far from the metro station. Hotel staff were friendly and helpful. The room was large and fully equipped. Quality of sleep was excellent.,"Bangkok, Thailand","Saran S</div><div class=""userLoc""><strong>Bangkok, Thailand</strong>",18,4.0
574142695,https://www.tripadvisor.com/Hotel_Review-g14129477-d12158513-Reviews-Ascott_Marunouchi_Tokyo-Otemachi_Chiyoda_Tokyo_Tokyo_Prefecture_Kanto-or125.html?filterLang=en,Ascott Marunouchi Tokyo,"April 18, 2018","Room Type: Premium 1-BedroomThe Good: - Huge 1-bedroom by Tokyo standard for the price with large living room and a fully equipped kitchen - 2 bathrooms with showers (1 bathtub) - Property is adjacent to subway (20m) - Lots of storage spacesThe Bad: - The view from my room is blocked by a large metal bar outside that runs across the building - Reception in on the upper floor and often time there is no one at the entrance on the 1st floor. So if you're hauling lots of luggages, might have to haul them up yourselfThe Noteworthy:  - Living room has a tatami area - While this area is full of office/government building, there's actually quite a few nice restaurants, high-end retail stores, and a walking street with artisans plying their trades on weekend - definitely worth a checking outThe Verdict: It might not feel as upscale as certain nearby 5 stars hotels costing 2-3 times as much, but it certainly is the best value for the money in the area (and better than a few other 5 stars hotels). I'd definitely consider staying here on a mid-to-long term basis.","Bangkok, Thailand","EsotericVagabond</div><div class=""userLoc""><strong>Bangkok, Thailand</strong>",17,5.0
572308556,https://www.tripadvisor.com/Hotel_Review-g14129477-d12158513-Reviews-Ascott_Marunouchi_Tokyo-Otemachi_Chiyoda_Tokyo_Tokyo_Prefecture_Kanto-or130.html?filterLang=en,Ascott Marunouchi Tokyo,"April 9, 2018"," Excellent location, right in the financial district of Tokyo. One block from the best designer shopping centers. Walking distance from the OEDO Antique Open Market Sunday morning-kimonos and much more-must go!!).5 min walk from Tokyo Station.The Apartments are spacious, contemporary but warmly decorated. They have all the amenities including kitchen, washer and dryer, tub and shower in the master bathroom, and a few closets to storage all your luggage and all your new acquisitions. I highly recommend this place.","La Jolla, California","anabM3968RV</div><div class=""userLoc""><strong>La Jolla, California</strong>",5,5.0
571515740,https://www.tripadvisor.com/Hotel_Review-g14129477-d12158513-Reviews-Ascott_Marunouchi_Tokyo-Otemachi_Chiyoda_Tokyo_Tokyo_Prefecture_Kanto-or130.html?filterLang=en,Ascott Marunouchi Tokyo,"April 6, 2018","The staff was fantastic, we even saw someone inspecting the housecleaning work. The view over the Imperial gardens with a view of Mt Fuji was the best I have seen in a long time. The room was very comfortable and modern and the location is perfect to explore Tokyo.","Titusville, New Jersey","J M</div><div class=""userLoc""><strong>Titusville, New Jersey</strong>",37,4.0
571143953,https://www.tripadvisor.com/Hotel_Review-g14129477-d12158513-Reviews-Ascott_Marunouchi_Tokyo-Otemachi_Chiyoda_Tokyo_Tokyo_Prefecture_Kanto-or130.html?filterLang=en,Ascott Marunouchi Tokyo,"April 4, 2018",The apartment was spacious and clean. The view was great. They prepared the room to our special request of not using perfume in room and bed linens. There is a lot of restaurants around and metro is just outside the door. Would stay here again.,"Gothenburg, Sweden","C2082OXdaniell</div><div class=""userLoc""><strong>Gothenburg, Sweden</strong>",28,5.0
571074907,https://www.tripadvisor.com/Hotel_Review-g14129477-d12158513-Reviews-Ascott_Marunouchi_Tokyo-Otemachi_Chiyoda_Tokyo_Tokyo_Prefecture_Kanto-or130.html?filterLang=en,Ascott Marunouchi Tokyo,"April 4, 2018","I have never written a review prior to staying at a hotel, but the customer service from the Ascott Tokyo has been exceptional so far. We emailed a few times with some special requests, and their responses have been both immediate and extremely positive.This really is causing us to anticipate an exceptional stay later this month.","Ra'anana, Israel","dykan</div><div class=""userLoc""><strong>Ra'anana, Israel</strong>",0,5.0
