review_id,url,hotel_name,review_date,review_body,user_location,user_name,helpful_vote,rating
264678497,https://www.tripadvisor.com/Hotel_Review-g14129573-d526766-Reviews-Hotel_Monteray_Ginza-Ginza_Chuo_Tokyo_Tokyo_Prefecture_Kanto-or215.html?filterLang=en,Hotel Monteray Ginza,"April 9, 2015","We stayed at for 8 nights. This is my third time at this hotel and I am sorely disappointed. I have always liked this hotel as the location is excellent. Granted the rooms are small but it is a reasonable trade off for the price and location. However, the service during in this trip was below average. It lack even basic attention to detail. The room was dirty and dusty. The cleaners did a very shoddy job. Beds were made but floors were not swept, used cups were not replaced nor cleaned. MInibar was not topped up. The toilet was not cleaned regularly. The list goes on. I will not stay here for my next trip to Tokyo.","London, United Kingdom","bjules1</div><div class=""userLoc""><strong>London, United Kingdom</strong>",1,2.0
263528661,https://www.tripadvisor.com/Hotel_Review-g14129573-d526766-Reviews-Hotel_Monteray_Ginza-Ginza_Chuo_Tokyo_Tokyo_Prefecture_Kanto-or220.html?filterLang=en,Hotel Monteray Ginza,"April 4, 2015","The trip from Narita Airport to the Hotel Monterey Ginza by public transportation was straightforward, and the hotel is located within walking distance to the upscale shops in Ginza, the Tsukiji Fish Market, small noodles shops,convenience stores, and a few Michelin starred restaurants. The bed was comfortable and room was very compact but serviceable with many outlets for charging electronics. As noted in other reviews, there were dust bunnies under the bed, but the bathroom was spotless and without any mildew that sometimes plagues older bathtooms. The bathroom also had the fancy Toyo toilet with the heated seat. This hotel is a good choice and a moderate price.","Winchester, MA","Graciewin</div><div class=""userLoc""><strong>Winchester, MA</strong>",6,4.0
262374488,https://www.tripadvisor.com/Hotel_Review-g14129573-d526766-Reviews-Hotel_Monteray_Ginza-Ginza_Chuo_Tokyo_Tokyo_Prefecture_Kanto-or220.html?filterLang=en,Hotel Monteray Ginza,"March 28, 2015","Hotel Monterey GinzaWe arrived at Tokyo station & took the very short taxi ride to the hotel (was $7.50) & so worth it when you have bags....... The hotel is very cosy, great front office team, very helpful & it's very well located. The rooms are small but is is Tokyo after all, take a walk & you will be surprised at the amazing local food, try eat where the locals eat, it's very good & super cheap......the small place we picked you bought a ticket at the vending machine & gave it to the chef.......within 5 mins you food is delivered...... Super good & was $11 for the 2 of us :))","Melbourne, Australia","Declanj51</div><div class=""userLoc""><strong>Melbourne, Australia</strong>",77,4.0
261597894,https://www.tripadvisor.com/Hotel_Review-g14129573-d526766-Reviews-Hotel_Monteray_Ginza-Ginza_Chuo_Tokyo_Tokyo_Prefecture_Kanto-or220.html?filterLang=en,Hotel Monteray Ginza,"March 25, 2015","I chose the Monterey ginza as it was both near to my office and also situated neear to shops, restaurants and bars in the heart of Ginza.As expected from a Japanese hotel, it was comfortable and clean and had good facilities, the in-room WiFi was a particular bonus for keeping in touch with home.I would recommend this hotel to anyone wanting value, service and a good location.","London, United Kingdom","Markywoods</div><div class=""userLoc""><strong>London, United Kingdom</strong>",0,4.0
259331983,https://www.tripadvisor.com/Hotel_Review-g14129573-d526766-Reviews-Hotel_Monteray_Ginza-Ginza_Chuo_Tokyo_Tokyo_Prefecture_Kanto-or220.html?filterLang=en,Hotel Monteray Ginza,"March 13, 2015","Stayed for 5 nights in February 2015. Positives: Great location - only a 5 minute walk away from the Ginza shopping precinct (Chuo-dori) and the Ginza/Ginza-Itchome metro stop. Really handy for accessing all the Tokyo sights including a walk to Tsukiji and Imperial Palace.Friendly staff were helpful with sightseeing ideas and baggage minding after checkout. Clean and tidy - rooms were serviced daily and cleaning was great. Bed was very comfortable.Free Wi-FiNegatives: Smoke city! My partner and I are non-smokers and requested a smoke-free room. We were told our room was smoke free but the smoke from neighboring rooms was really noticeable upon arriving at our level (8) and inside room. Really gross. Due to Chinese new Year, we weren't able to be moved elsewhere.The air conditioning wasn't great. Even in winter, the room was really warm and unable to cool down.Standard size Tokyo room - a bit of a squeeze with ski bags etc but we expected as much.All in all - great location but don't expect to have a smoke free room!","Brisbane, Australia","steeeeveeeeeee</div><div class=""userLoc""><strong>Brisbane, Australia</strong>",9,3.0
257386229,https://www.tripadvisor.com/Hotel_Review-g14129573-d526766-Reviews-Hotel_Monteray_Ginza-Ginza_Chuo_Tokyo_Tokyo_Prefecture_Kanto-or220.html?filterLang=en,Hotel Monteray Ginza,"March 2, 2015","Very convenient location. Staff efficient. On this occasion, I spent 3 nights. I made a reservation for the first 2 nights spearate from the 3rd . it was only during check in that I realized I made a booking for the 3rd night at their sister hotel instead . Th hotel was already full . But he gentlemen at the front desk made extra effort and made arrangements so I could stay the 3 nights . ","London, United Kingdom","346fl</div><div class=""userLoc""><strong>London, United Kingdom</strong>",0,4.0
254201124,https://www.tripadvisor.com/Hotel_Review-g14129573-d526766-Reviews-Hotel_Monteray_Ginza-Ginza_Chuo_Tokyo_Tokyo_Prefecture_Kanto-or225.html?filterLang=en,Hotel Monteray Ginza,"February 14, 2015","Hotel is 2 short blocks from Chuo-dori, the main street in Ginza. The building was old, not well sign posted, and entrance very small so we initially missed it and went to the sister hotel, which was a couple blocks away and were re-directed here. The triple room and bathroom were small but adequate, very clean, and sufficiently comfortable. In addition to the standard toiletries, there were complimentary toothbrush and paste, hair brush and razors. The breakfast buffet was generous with both Western and Asian options. Wifi connection was very good and worked well. Closest JR station is Yurakucho, and subway station Ginza-Itchome. Walking distance to Kabuki-za, Tsukiji Fishmarket, Tokyo station and Imperial Palace.","Brisbane, Australia","LNorton62</div><div class=""userLoc""><strong>Brisbane, Australia</strong>",46,3.0
253395003,https://www.tripadvisor.com/Hotel_Review-g14129573-d526766-Reviews-Hotel_Monteray_Ginza-Ginza_Chuo_Tokyo_Tokyo_Prefecture_Kanto-or225.html?filterLang=en,Hotel Monteray Ginza,"February 9, 2015","Location is unbeatable (near several subway lines, walking distance to Tokyo station, 2 blocks to center of Ginza, restaurants and stores galore!)Room was comfortable and clean. Reasonable amount of space for a Tokyo single. Price was good.",Vienna,"Chris G</div><div class=""userLoc""><strong>Vienna</strong>",20,4.0
253103509,https://www.tripadvisor.com/Hotel_Review-g14129573-d526766-Reviews-Hotel_Monteray_Ginza-Ginza_Chuo_Tokyo_Tokyo_Prefecture_Kanto-or225.html?filterLang=en,Hotel Monteray Ginza,"February 7, 2015","This little hotel is lovely. I really liked their Victorian looking (but modern lift).The room we had was small but I think it was good by Tokyo standards. The hotel was generous with amenities. They gave us good quality toothbrushes, body wash, shampoo, conditioner, hair brushes etc and I find these little things can make a big different to how much you enjoy your stay.The bathroom was a good size, the toilet seat can be heated if you like and there's a little heated patch behind the mirror so it doesn't fog up and you can still see yourself (very considerate!)The room was clean and they had a good number of power points which is always a big plus! The hotel also Yamato Transport services (where you can get your luggage delivered to another city/hotel for a reasonable fee).The staff were friendly and there are lots of restaurants nearby and a 7 Eleven just across it so it is quite handy. Staff here speak English and we found them amiable.We took a taxi to this hotel because it's actually within walking distance from Tokyo station (probably around 10 minute walk). Not much of a view, but that didn't bother us.The only improvement I would suggest is for staff not to take your toothbrush and replace it with a new one every day. It's nice of them but a little environmentally unfriendly! I recommend hiding your toothbrush so they don't throw it out! =PI wouldn't mind staying here again!",Sydney,"HarrieRW</div><div class=""userLoc""><strong>Sydney</strong>",25,4.0
251603752,https://www.tripadvisor.com/Hotel_Review-g14129573-d526766-Reviews-Hotel_Monteray_Ginza-Ginza_Chuo_Tokyo_Tokyo_Prefecture_Kanto-or225.html?filterLang=en,Hotel Monteray Ginza,"January 29, 2015","Great hotel in a very central location in Ginza. Walking distance to all train stations and was helpful as it was easy to navigate the city from the hotel. The hotel location was also clearly marked on all train maps within the subways, which is even better as you don't ever have to worry about getting lost or not being sure which exit to take. Key locations close to the hotel includes the Tsukiji fish market, the Noh theatre, Ginza shopping district, with many eateries, small shops and boutiques, and a convenience store right opposite. The hotel staff speaks English so there was no issue with communication, and was also flexible in storing our bags for us in concierge when we arrived early, and when we left later in the day for our flight. Key things to note:1. The hotel room is small, and we had huge bags as we were traveling long distance with Tokyo being our first stopover. So it was a huge challenge trying to lug our heavy bags up and down the subway stairs (no lift). And we hardly had any space to open and spread our things in the small room - but you just have to find a way. 2. The bed is small - so if you're almost 6 feet, your feet will probably be dangling off the side of the bed, and it will be quite a cozy sleeping experience. 3. There was no air con during the winter, so just air - and it can get stuffy. So do ask the front desk to have their technician open the room windows slightly to allow the air in, if you need to. Overall, it was still a pleasant stay - and it's no issue especially if you're spending all day outside and just coming back to crash for the night. I would stay again if I intend to be close to Ginza.",Malaysia,"Rachel L</div><div class=""userLoc""><strong>Malaysia</strong>",33,4.0
251588903,https://www.tripadvisor.com/Hotel_Review-g14129573-d526766-Reviews-Hotel_Monteray_Ginza-Ginza_Chuo_Tokyo_Tokyo_Prefecture_Kanto-or225.html?filterLang=en,Hotel Monteray Ginza,"January 29, 2015",Cheap and convenience location. Under 150US$ or 120Euro is reasonable butWhen you make reservation over 200US$ too much. Room is very small like a Paris but bed is very comfortabable. Good choice everybody except rich people.  ,"Osaka, Japan","leicanull</div><div class=""userLoc""><strong>Osaka, Japan</strong>",0,4.0
249366353,https://www.tripadvisor.com/Hotel_Review-g14129573-d526766-Reviews-Hotel_Monteray_Ginza-Ginza_Chuo_Tokyo_Tokyo_Prefecture_Kanto-or230.html?filterLang=en,Hotel Monteray Ginza,"January 14, 2015","the hotel is located in the heart of ginza district, close to many restaurants and shops. It's an expensive district so be open to the fact that the things around can be pricy. It is located about 10-15 walk to the JR station. The hotel itself was clean. Service was good. Complimentary wifi was useful. Not the best view from our room but that did not bother us since we spent most of the day outside.","Montreal, Canada","Trisha_Andrea</div><div class=""userLoc""><strong>Montreal, Canada</strong>",58,4.0
248914806,https://www.tripadvisor.com/Hotel_Review-g14129573-d526766-Reviews-Hotel_Monteray_Ginza-Ginza_Chuo_Tokyo_Tokyo_Prefecture_Kanto-or230.html?filterLang=en,Hotel Monteray Ginza,"January 12, 2015","Room was great in size, bed was comfortable and wifi was great. Front desk staff were excellent, stored our baggage when we went out of town skiing and helped with any requests we had. English level was excellent. Great location in Ginza and excellently priced for the expensive end of town. This is our second stay at this hotel and would happily stay again. ",,FKBnSMB,24,5.0
247801732,https://www.tripadvisor.com/Hotel_Review-g14129573-d526766-Reviews-Hotel_Monteray_Ginza-Ginza_Chuo_Tokyo_Tokyo_Prefecture_Kanto-or230.html?filterLang=en,Hotel Monteray Ginza,"January 6, 2015","The facade of the hotel looks promising but they just cant keep up with the traffic/no. of guests. The lobby always looks like a check-in counter at an airport. There is no vending machine. But the worst thingg about the hotel are the ff:1) They will not let you book a non-smoking room immediately. It is subject to availability at check-in. Well with my luck, I got a room smelling like a short-stay hotel.2) Our hotel room was FILTHY! I have allergic-Rhinitis and I kept sneezing all night. The culprits are evident, dust balls under the bed, accumulated dustin the bathroom vent, dust in the air purifier. Will never stay here again and I've stayed in many Tokyo hotels.","Manila, Philippines","eejster</div><div class=""userLoc""><strong>Manila, Philippines</strong>",24,1.0
247522486,https://www.tripadvisor.com/Hotel_Review-g14129573-d526766-Reviews-Hotel_Monteray_Ginza-Ginza_Chuo_Tokyo_Tokyo_Prefecture_Kanto-or230.html?filterLang=en,Hotel Monteray Ginza,"January 4, 2015",Arrived at the hotel an found it to be in a great location within walking distance to the local JR Railway Station . The Metro is even closer but as we had a JR rail pass it was an easy stroll.Our room was neat and tidy although small it was exactly what we required for a 10 day stay.Lots of local restaurants with great food and cheap.The desk staff spoke little English but this wasn't an issue .,"Camden, Australia","PrincessCastle</div><div class=""userLoc""><strong>Camden, Australia</strong>",10,5.0
247312354,https://www.tripadvisor.com/Hotel_Review-g14129573-d526766-Reviews-Hotel_Monteray_Ginza-Ginza_Chuo_Tokyo_Tokyo_Prefecture_Kanto-or230.html?filterLang=en,Hotel Monteray Ginza,"January 3, 2015","This hotel was very nice to the price we paid. The room was very small, but everything seems to be a tight fit in Tokyo. We were two adults and two kids, the kids slept in our beds, one in each (2 and 4 years old) and although it is a small room, we managed fine. The room was kept very clean and bathroom supplies were refilled each day (there were even spare toothbrush and toothpaste!). The room had two beds, a window and a desk, and a bathroom. The staff was very friendly, and although they did not speak much English, this was no problem, they knew enough. The staff also made sure to put my father, who was with us, in a room next to ours, thumbs up! We stayed here twice during our trip.The hotel is located on a walking distance from Ginza, and we walked a lot. 10 minutes by foot to Tokyo station, and this we managed with our bags and the kids. There are lots of restaurants and small quick-shops for water etc. close by. So, it is a small room, but if you set your expectations to this, it is a very good hotel and you do get your moneys worth, and you can get everywhere with this as a starting point. PS. No playgrounds anywhere near!","Malmo, Sweden","Maria H</div><div class=""userLoc""><strong>Malmo, Sweden</strong>",5,4.0
247285587,https://www.tripadvisor.com/Hotel_Review-g14129573-d526766-Reviews-Hotel_Monteray_Ginza-Ginza_Chuo_Tokyo_Tokyo_Prefecture_Kanto-or235.html?filterLang=en,Hotel Monteray Ginza,"January 3, 2015","We were satisfied with our three night stay at Hotel Monterey Ginza in a city where accommodation prices are a bit exaggerated. Our non-smoking room was clean, comfy and roomy for two people and a big suitcase. The wi-fi is free and fast as lightning! The location of the hotel is fantastic, near subway and JR lines, and perfect for shopping (if you have a LOT of money). Please don't forget to take a look at the big Muji store near Yurakucho station. There is also a LoFt right next to it. The area offers good dining options but we found that the little restaurants under the tracks of the JR line near Yurakucho station were the best value for our money. The hotel is conveniently located (5 minute walk) for the Access Narita shuttle that costs only 1000 yen/ way.","Shanghai, China","verolebel</div><div class=""userLoc""><strong>Shanghai, China</strong>",45,4.0
247095505,https://www.tripadvisor.com/Hotel_Review-g14129573-d526766-Reviews-Hotel_Monteray_Ginza-Ginza_Chuo_Tokyo_Tokyo_Prefecture_Kanto-or235.html?filterLang=en,Hotel Monteray Ginza,"January 2, 2015","Lovely homey feel hotel with all the basic necessities. Great location. Only minutes away from the train station, shopping and restaurants. Plus only 15 minute walk from Tsukiji market. Only fault was the room was too over heated and the thermostat didn't work. Good size rooms and bed.  ",,BeverlyJ18,1,5.0
243763520,https://www.tripadvisor.com/Hotel_Review-g14129573-d526766-Reviews-Hotel_Monteray_Ginza-Ginza_Chuo_Tokyo_Tokyo_Prefecture_Kanto-or235.html?filterLang=en,Hotel Monteray Ginza,"December 9, 2014","Stayed at the hotel for 3 nights in December (3 rooms booked)Overall: Fantastic location, just 2 blocks from Ginza main street. But rooms could be improved greatly.Pros: Location, Check-in, Sizeable roomsCons: Rooms are old and have cigarette smell, ionizer does not work well. ","Kuala Lumpur, Malaysia","Zia_Mohzani</div><div class=""userLoc""><strong>Kuala Lumpur, Malaysia</strong>",4,3.0
243616875,https://www.tripadvisor.com/Hotel_Review-g14129573-d526766-Reviews-Hotel_Monteray_Ginza-Ginza_Chuo_Tokyo_Tokyo_Prefecture_Kanto-or235.html?filterLang=en,Hotel Monteray Ginza,"December 9, 2014","Small rooms, but well laid out. Helpful staff. Good value for money. Lots of places to eat and see just near the hotel. Terrible map of the area provided by the hotel! Rooms are too hot, no ability to make it cooler, the air con is a dummy controller.","Melbourne, Australia","BecM_13</div><div class=""userLoc""><strong>Melbourne, Australia</strong>",16,4.0
242884228,https://www.tripadvisor.com/Hotel_Review-g14129573-d526766-Reviews-Hotel_Monteray_Ginza-Ginza_Chuo_Tokyo_Tokyo_Prefecture_Kanto-or235.html?filterLang=en,Hotel Monteray Ginza,"December 4, 2014",My objective of searching for reasonable price hotel in Tokyo was Room Space because i hate to skip across my luggage just to go to the toilet.This hotel is the right choice for those who share my POV. It got the largest space at affordable price and it's on GINZA! I can say this because i did compare at least 10 hotels in the prime areas.,"Bangkok, Krung Thep, Thailand","Putt V</div><div class=""userLoc""><strong>Bangkok, Krung Thep, Thailand</strong>",22,5.0
242044882,https://www.tripadvisor.com/Hotel_Review-g14129573-d526766-Reviews-Hotel_Monteray_Ginza-Ginza_Chuo_Tokyo_Tokyo_Prefecture_Kanto-or240.html?filterLang=en,Hotel Monteray Ginza,"November 29, 2014",Stayed here overnight when we arrived in Tokyo on route to Takayama. The staff were very helpful and the breakfast was very good. The downside was the room size and the double bed which was fairly small and not very comfortable.In fairness to the hotel we were attracted by their website and the very reasonable tariff for Tokyo. As the title says you get what you pay for.We subsequently cancelled our further five night stay at the hotel on our way back home and we're impressed by the professional attitude of their reservations manager. I believe now from staying at other hotels in Japan that you need to spend more for a comfortable stay than we had budgeted for. Our thanks to the hotel for their understanding. ,"Brisbane, Australia","ray f</div><div class=""userLoc""><strong>Brisbane, Australia</strong>",27,3.0
240901651,https://www.tripadvisor.com/Hotel_Review-g14129573-d526766-Reviews-Hotel_Monteray_Ginza-Ginza_Chuo_Tokyo_Tokyo_Prefecture_Kanto-or240.html?filterLang=en,Hotel Monteray Ginza,"November 21, 2014",Location is the key here. Service was basic. Rooms were very warm as we Approached End autumn. Heaters were turned on instead of aircons. We turned them off and had the staff open the windows for us. Rooms very very tight. ,"Pulau Ubin, Singapore","leong34</div><div class=""userLoc""><strong>Pulau Ubin, Singapore</strong>",96,3.0
240520937,https://www.tripadvisor.com/Hotel_Review-g14129573-d526766-Reviews-Hotel_Monteray_Ginza-Ginza_Chuo_Tokyo_Tokyo_Prefecture_Kanto-or240.html?filterLang=en,Hotel Monteray Ginza,"November 19, 2014","as often pictures look much better on the web site. Very tiny double bedroom but not really unusual in Tokyo. A/C was not working so the only way to get some cool air was to ask for the window ti be opened and then you get the noise coming from the street...Nickname of the hotel should be the ""1000 yen hotel"": if you check in earlier than 3PM you will be charged 1000 yen per hour even if your room is free and already ready, to watch satellite TV to get other channels than japanese channels you must buy a 1000 yen TV card and to borrow a converter from the reception to charge my computer I had to go back to my room and bring a 1000 yen bank note as a deposite... Excellent location, very central but very disappointed by this hotel and the quality of service",,Martine G,1,2.0
239741564,https://www.tripadvisor.com/Hotel_Review-g14129573-d526766-Reviews-Hotel_Monteray_Ginza-Ginza_Chuo_Tokyo_Tokyo_Prefecture_Kanto-or240.html?filterLang=en,Hotel Monteray Ginza,"November 13, 2014","We stayed at this hotel last year in a twin room which was tight but sufficed for 2 nights;this time we made the mistake of booking a double & we struggled to fit into this tiny space. I know rooms in Japan can be small but with 2 suitcases,one of which was cabin sized, the room felt very overcrowded.Having said that, it is a good location with Tokyo station about a 15 minute walk away,the fish market about 20 mins,subways close by and the main shopping of Ginza at the top of the street. There are quite a few department stores on the Main Street and many of these have good restaurant options on their upper floors. There are a couple of small supermarkets across the road for drinks and snacks.","Sydney, Australia","Kazoz2014</div><div class=""userLoc""><strong>Sydney, Australia</strong>",7,3.0
239589609,https://www.tripadvisor.com/Hotel_Review-g14129573-d526766-Reviews-Hotel_Monteray_Ginza-Ginza_Chuo_Tokyo_Tokyo_Prefecture_Kanto-or240.html?filterLang=en,Hotel Monteray Ginza,"November 12, 2014","This hotels most attractive quality is definitely it's convenient location. We arrived from Haneda airport and took the Keikyu airport line straight to Higashi Ginza station. We exited the station at exit A8 and the hotel was literally a small block and a half away. The trip took roughly 25 min. The hotel is located very close to many other subway stations as well. The Ginza-Itchome station (Y19) is a block away, the Ginza station is 5 blocks away and the JR Yurakucho station is 7 blocks away. Thus, it gives great access to many subway lines to navigate the sprawling city. The JR Yurakucho station gives easy access to the monorail which has express trains to Haneda airport via Hamamatsucho station. The hotel is a 730 yen taxi ride from Tokyo station. It is also a short walk from the Marriott hotel which the Hatobus company (which offers many sightseeing tours) uses as a possible pick up location.The hotel is located literally 3 small streets away from the heart of Ginza, an area full of upscale restaurants and shops. It is full of day long hustle bustle (on weekends they close the streets to vehicles due the sheer number of pedestrians). Most stores usually open at 11am and close late into the evening. Ginza is famous for its large department stores. For me (the food lover), the most impressive were the basements of these department stores specifically those of the Mitsukoshi Ginza department store (the most popular) but the Matsuya Ginza as well. The sheer offerings and varieties of food vendors in these basements are something to take in!!!There are 2 convenience stores directly outside of this hotel to meet most, if not all of your needs. The Kabuki theatre is 5 blocks away and the Tsukiji fish market is a short walk away.This hotel is clean and rather roomy in my opinion for Tokyo standards. There was also free WiFi. For my stay in Tokyo, I thought it was a great find.","Edmonton, Canada","0ni0n1</div><div class=""userLoc""><strong>Edmonton, Canada</strong>",27,5.0
