review_id,url,hotel_name,review_date,review_body,user_location,user_name,helpful_vote,rating
417324478,https://www.tripadvisor.com/Hotel_Review-g14129573-d526766-Reviews-Hotel_Monteray_Ginza-Ginza_Chuo_Tokyo_Tokyo_Prefecture_Kanto-or115.html?filterLang=en,Hotel Monteray Ginza,"September 11, 2016","The greatest thing about this hotel is its location. Literally 30 seconds to the subway station, right in the centre of ginza. The room is like budget hotel. Very basic. Bathroom is tiny, also very basic. If you are first time in Tokyo, you don't have to stay here, as long as you are on subway line. You can get a much nicer hotel with the same price. ","Halifax, Canada","190chrisx</div><div class=""userLoc""><strong>Halifax, Canada</strong>",2,3.0
416751235,https://www.tripadvisor.com/Hotel_Review-g14129573-d526766-Reviews-Hotel_Monteray_Ginza-Ginza_Chuo_Tokyo_Tokyo_Prefecture_Kanto-or115.html?filterLang=en,Hotel Monteray Ginza,"September 10, 2016","First time in Japan & Tokyo for myself, Husband and his parents. We chose this hotel based off Trip Advisor reviews and it was perfect! Amazing location - safe, easy to get anywhere via train or taxi, classy area, a TON of food options right around the corner and literally FIVE convenience stores across the street/around the corner for quick snacks and drinks. The Staff is so friendly and beyond accommodating. They speak wonderful English (I appreciate anyone that can help us get by...even when they don't think their English is good...it is!), and they are just wonderful and welcoming. The rooms are small (like most Japanese rooms) but plenty big enough and very comfortable...and most importantly...SPOTLESS! We love everything about this hotel and recommend it 100%! It's perfect for any type of vacation in Tokyo!! ","San Diego, California","ericaf639</div><div class=""userLoc""><strong>San Diego, California</strong>",11,5.0
416734305,https://www.tripadvisor.com/Hotel_Review-g14129573-d526766-Reviews-Hotel_Monteray_Ginza-Ginza_Chuo_Tokyo_Tokyo_Prefecture_Kanto-or115.html?filterLang=en,Hotel Monteray Ginza,"September 10, 2016","I think it was a worthwhile stay at this property. There are different choices of the subway within 3 to 10 minutes walk. The twin room I stayed in was clean although a little small even though my mom and I are ""regular-sized"" Asians. Otherwise, the room is really comfortable.I loved how it's just next to the Ginza shopping strip. And I could get to Tsukiji Market on foot within 30 minutes!","Singapore, Singapore","LookingforTim</div><div class=""userLoc""><strong>Singapore, Singapore</strong>",5,4.0
414759216,https://www.tripadvisor.com/Hotel_Review-g14129573-d526766-Reviews-Hotel_Monteray_Ginza-Ginza_Chuo_Tokyo_Tokyo_Prefecture_Kanto-or120.html?filterLang=en,Hotel Monteray Ginza,"September 4, 2016","I've been to Tokyo many times.the Hotel Monterey Ginza building always appealed to me due to its appearance and ultraclose position to the main shopping street Ginza chuo doreBeautiful well kept Art Deco ish .The reception area is 1950's well maintained and preserved charm just so cool.The reception staff are courteous and helpful and English friendly.Our room was ready and for the very reasonable amount of 1000 yen about $14 a day and we were offered an upgrade to a bigger room.The room was excellent , great big comfortable bed, beautiful bathroom great amenities in the bathroom, quiet clean, lots room for all our cases an armchair .CLEAN CLEAN CLEAN.A NICE touch a pair of cotton pyjamas provided daily in your size Very niceThe room was serviced perfectly daily and in a timely manner.I recommend that you stay at H MONTEREY GINZA and enjoy the city","Newcastle, Australia","Leonard F</div><div class=""userLoc""><strong>Newcastle, Australia</strong>",50,5.0
406470622,https://www.tripadvisor.com/Hotel_Review-g14129573-d526766-Reviews-Hotel_Monteray_Ginza-Ginza_Chuo_Tokyo_Tokyo_Prefecture_Kanto-or120.html?filterLang=en,Hotel Monteray Ginza,"August 17, 2016","Me and my friend stayed here for 4 nights during our trip to Tokyo. It's a nice hotel, located in the heart of Ginza. It's very close to the subway station and as a result it is very well connected to other areas/sights in Tokyo. The rooms are average sized, pleasant and very clean. The hotel staff are helpful and kind. Overall, we would both recommend this hotel as a good base for exploring Tokyo.","Prague, Czech Republic","PragueEnthusiast</div><div class=""userLoc""><strong>Prague, Czech Republic</strong>",8,4.0
405259697,https://www.tripadvisor.com/Hotel_Review-g14129573-d526766-Reviews-Hotel_Monteray_Ginza-Ginza_Chuo_Tokyo_Tokyo_Prefecture_Kanto-or120.html?filterLang=en,Hotel Monteray Ginza,"August 14, 2016","From February 26 to March 2, 2016, my family and I were on holiday in Tokyo and had the opportunity to stay at Hotel Monterey Ginza.Hotel Monterey Ginza may be categorized as a business hotel and very nicely located near Ginza's main shopping avenue (Chuo Dori). It's around an 8-10min walk if I remember correctly. It's tucked away in a quiet sidestreet, yet it's very accessible as there are train stations a few hundred feet away (Ginza Station, Ginza-Itchome Station, etc.). We just had trouble upon our arrival from Narita airport because we just took the airport limousine bus and got dropped off at a designated Ginza station. It could be quite difficult to find the hotel on foot if you don't know its exact location. But after that, we didn't have much trouble anymore. Across the street from the hotel, there is a Family Mart; and a Tomod's pharmacy and convenience store is just a corner away. That was great because that's where we bought our bottled water and snacks. There are a few small restaurants nearby, as well. There are a few high-end stores around, too (Tiffany & Co., Itoya, etc.). As mentioned, the main shopping avenue is just an 8-10min walk away. Stores such as Prada, Bulgari, Uniqlo, etc. could be found there. There are also Department Stores such as Matsuya Ginza. Of course, there are a number of higher-end restaurants to try, too. It's a great location, I don't think anyone will get bored staying there. We also just walked going to the Imperial Palace grounds. It's a bit of an effort on foot (around 2km), but there are so many things to see on the way there so you won't really notice the distance.The hotel itself is quaint. The decor is more trendy than modern, with a bit of a hipster vibe. The lobby is quite small, but it wasn't crowded when we went so it wasn't a problem. Also, the reception staff was efficient so whenever there was a line, turnover was quite quick. They also have a parking area in the building, although we didn't have a car so we didn't get to try it. They also have a restaurant, but we didn't get to try that, too, so I can't comment on the food. The area around the hotel was very clean.My friend and I stayed in a standard Double room, while my parents lucked out and were assigned a Double room, but a corner one (we booked through Booking.com). Our room was good enough for us. There was enough room for our luggage (1 luggage each), and there was a small cabinet where we could hang our jackets. The bed was big enough for the both of us to fit comfortably. They provided bedroom slippers, as well as pajamas. We liked that very much. There was a small desk, one sofa chair, and one desk chair. There wasn't much room to move / lounge around, we were more or less limited to lounging on the bed, but the room was just a place to sleep anyway so we were fine. The size of the bathroom was okay, too. They had a high-tech toilet (with heater, bidet, etc.), a sink, and a tub with a shower. They also had enough racks to hold our towels and clothes. There were toiletries provided, water pressure was strong, and hot water was readily available. There was ample lighting, an electric kettle, small refrigerator, cups and glasses, and a humidifier. There was also a flat-screen tv, but only had mostly local Japanese channels. My parents' room was pretty much the same, except they had a little more space since they had a corner room. Both had views of the street outside (no building blocking the natural light).We didn't need much customer service from them, but during our limited interaction with them, their staff was polite and approachable.Some comments:1. The central airconditioner / heater could get too warm at night. We didn't know how to adjust the temperature to make the room cooler. We just adjusted and resorted to either not using the comforter blanket, or turning on the humidifier to have some cold air circulating. It didn't bother us too much, though, because we were always so tired when we got back to the hotel that falling asleep right away wasn't too difficult.2. Please consider adding more English channels to the TV channel line-up. The only English channel was a news channel (NHK World, I think) with the featured shows replaying over and over. Although it was actually quite entertaining to watch Japanese shows, the language barrier could get a bit suffocating after a while. English channels similar to those in Hongkong hotels would do -- National Geographic, Discovery Channel, and any English movie channel.Overall, we enjoyed our stay in this hotel. It was comfortable, and good place to come home to after a day of exploring. It's smaller than we're used to; however, I do believe it's bigger than a lot of other Japanese hotel rooms. Plus, the location was really great.","Muntinlupa, Philippines","shutterbug07</div><div class=""userLoc""><strong>Muntinlupa, Philippines</strong>",31,4.0
401108939,https://www.tripadvisor.com/Hotel_Review-g14129573-d526766-Reviews-Hotel_Monteray_Ginza-Ginza_Chuo_Tokyo_Tokyo_Prefecture_Kanto-or120.html?filterLang=en,Hotel Monteray Ginza,"August 3, 2016",This is a lovely little boutique hotel in a great location right in Ginza. The room was quite small but perfectly fine for one person. The room was clean and quiet and had excellent wifi. The hotel staff were very helpful. Probably more suited to business travelers than families. Enjoyed the hotel breakfast.,"Auckland, New Zealand","NiknakNZ</div><div class=""userLoc""><strong>Auckland, New Zealand</strong>",34,5.0
400783686,https://www.tripadvisor.com/Hotel_Review-g14129573-d526766-Reviews-Hotel_Monteray_Ginza-Ginza_Chuo_Tokyo_Tokyo_Prefecture_Kanto-or120.html?filterLang=en,Hotel Monteray Ginza,"August 3, 2016","The hotel is not modern with facilities as gym or pool, but the location is great, in the heart of Ginza, with several options in terms of tube stops and walking distance from some attractions as fish market and imperial palace and central station.","London, United Kingdom","LittleFox81</div><div class=""userLoc""><strong>London, United Kingdom</strong>",136,5.0
397179793,https://www.tripadvisor.com/Hotel_Review-g14129573-d526766-Reviews-Hotel_Monteray_Ginza-Ginza_Chuo_Tokyo_Tokyo_Prefecture_Kanto-or125.html?filterLang=en,Hotel Monteray Ginza,"July 25, 2016","Good standard of hotel, well located for sightseeing. The rooms are typically small, which would have been for fine for two of us... but we had our teenage daughter in the room too, which made it a real squeeze.","St. Albans, United Kingdom","FHJasmine</div><div class=""userLoc""><strong>St. Albans, United Kingdom</strong>",10,3.0
390236374,https://www.tripadvisor.com/Hotel_Review-g14129573-d526766-Reviews-Hotel_Monteray_Ginza-Ginza_Chuo_Tokyo_Tokyo_Prefecture_Kanto-or125.html?filterLang=en,Hotel Monteray Ginza,"July 7, 2016","I was happy with this choice in Ginza, as it was in the exact location I wanted, and the building and general ambiance were a cut above the standard business hotel. Great outlook from the high floors, obliging, relatively friendly staff and quiet (despite being heavily booked, and hosting seemingly continuous weddings). This said, our triple room was tiny. Too small for us and all our luggage at the beginning of a three week Japanese tour. I sort of expected this given the reasonable price, so I'm not really complaining. Bathroom was good, and the public areas had a good feel except there was no lobby lounge to speak of. Lots of character in the decor, and felt Japanese rather than generic. It's hard to know the best area to stay in Tokyo but Ginza is good for world brand as well as boutique Japanese shopping, restaurants, lovely little lanes and of course ease of getting to other places. It's not something to agonise over as transport is so easy you can get to most places of interest quickly.","Sydney, Australia","aussiesinspain</div><div class=""userLoc""><strong>Sydney, Australia</strong>",118,4.0
390028241,https://www.tripadvisor.com/Hotel_Review-g14129573-d526766-Reviews-Hotel_Monteray_Ginza-Ginza_Chuo_Tokyo_Tokyo_Prefecture_Kanto-or125.html?filterLang=en,Hotel Monteray Ginza,"July 7, 2016","This hotel in Ginza has a very good location. Very near to the main shopping area 3 small blocks. Close to 2 main stations Ginza, yurakucho . Recomended hotel for 2 asian size people. Double bed is 140cm width. Room is small small small but for couple is good enough. But if ur not a couple get ready to become one. At night there is a local ramen restaurant . Very good. Hope this help","Jakarta, Indonesia","Daniel22T</div><div class=""userLoc""><strong>Jakarta, Indonesia</strong>",2,4.0
389906914,https://www.tripadvisor.com/Hotel_Review-g14129573-d526766-Reviews-Hotel_Monteray_Ginza-Ginza_Chuo_Tokyo_Tokyo_Prefecture_Kanto-or125.html?filterLang=en,Hotel Monteray Ginza,"July 6, 2016","Lovely hotel in the Ginza close to several subway stations, restaurants, shops and sight-seeing (Tsukiji is just a 10 minute walk).Don't be put off by the lobby which is a little decrepit. The rooms are larger than most in Tokyo for the same price and have all the amenities you will need: WiFi, TV (with English language channels), fridge, air-conditioning etc. The bathrooms were decent-sized (with nice toiletries) and the beds comfortable.Service was wonderful. The front desk speaks very competent English (not a given even in Tokyo). One night we wanted a window opened at 10 pm. We asked the front desk and someone was at our door within minutes.The hotel has a restaurant which looked nice but we didn't get to try. There is a great Starbucks for breakfast (if you just want something light) within two blocks and it opens at 7am (some of them don't open till 8 or later). There are also some other coffee places in the neighborhood.We would definitely stay here if we came back to Tokyo.","San Francisco, California","Francoise1948</div><div class=""userLoc""><strong>San Francisco, California</strong>",102,5.0
380277010,https://www.tripadvisor.com/Hotel_Review-g14129573-d526766-Reviews-Hotel_Monteray_Ginza-Ginza_Chuo_Tokyo_Tokyo_Prefecture_Kanto-or125.html?filterLang=en,Hotel Monteray Ginza,"June 6, 2016","The hotel was pretty nice, but the service was subpar and the rooms were very small (barely anywhere to talk walk in the room and had to pay extra for 2 twin beds). Location was excellent though--right in the heart of Ginza and easy access to metro.","Brooklyn, New York","Aaron S</div><div class=""userLoc""><strong>Brooklyn, New York</strong>",3,3.0
380064262,https://www.tripadvisor.com/Hotel_Review-g14129573-d526766-Reviews-Hotel_Monteray_Ginza-Ginza_Chuo_Tokyo_Tokyo_Prefecture_Kanto-or130.html?filterLang=en,Hotel Monteray Ginza,"June 5, 2016","location is A+, walking distant from Tokyo central (10 mins) and to many major attractions, breakfast is A+, but I suggest just walk down to Tsukiji Fish Market (about 10 mins), rooms on the small side but its got everything, and everything works.","Warsaw, Indiana","jy101</div><div class=""userLoc""><strong>Warsaw, Indiana</strong>",26,4.0
379275844,https://www.tripadvisor.com/Hotel_Review-g14129573-d526766-Reviews-Hotel_Monteray_Ginza-Ginza_Chuo_Tokyo_Tokyo_Prefecture_Kanto-or130.html?filterLang=en,Hotel Monteray Ginza,"June 3, 2016","The Monterey Hotel is in a very convenient location in Ginza.The rooms are well decorated, the bedding is comfortable and the bathrooms are a decent size. All of the staff were extremely polite and helpful. We didn't eat in the hotel but there are plenty of great places to eat close by. There is a really good ramen noodle place down one of the side streets opposite the hotel, and there is a Family Mart opposite if you need one.It is a 5 minute walk to Toyko station (Maranuchi end) and a taxi will cost approx 700yen from the station.We would definitely stay at this hotel again.","Gold Coast, Australia","Goldcoastau1</div><div class=""userLoc""><strong>Gold Coast, Australia</strong>",14,5.0
377123524,https://www.tripadvisor.com/Hotel_Review-g14129573-d526766-Reviews-Hotel_Monteray_Ginza-Ginza_Chuo_Tokyo_Tokyo_Prefecture_Kanto-or130.html?filterLang=en,Hotel Monteray Ginza,"May 27, 2016","From the exterior, the hotel looked very promising. Its in a good (if rather expensive) part of town but the area is very nice. There is good shopping nearby and there are some good restaurants too.The lobby looks like it was last decorated in the 1930s. It needs a serious upgrade. Its dour and miserable and too small to sit in.Hotel reception staff, however , were extremely helpful and I congratulate them on the high level of service which they offered. This was in stark contrast to those who organised breakfast. First, you have to present your ticket to someone akin to an army major. Lord help you if you forget your breakfast ticket or walk uninvited into the dining room! On the first morning, I had to queue for breakfast for nearly thirty minutes. Eventually, I was seated and accessed the rather limited variety of food on offer. Another morning, the bacon ran out and that entailed a fifteen minute wait. If you are lucky, you might be seated in the main dining area. On the other hand, you might be seated in a dismal room further away . Should this happen, you have to get your food on a tray and walk out of the main area.The room was disappointingly small but it was clean with all facilities in working order. The bed was comfortable and the room quiet. Mine was a no-smoking room but the corridor did smell of smoke on two or three occasions - a real ""turn off"" for me.The hotel certainly has potential but needs a manager who will drag it into the twenty first century. Queuing for food with a tray like people in a prison is not my idea of a good hotel.","Newcastle upon Tyne, United Kingdom","VinRichley</div><div class=""userLoc""><strong>Newcastle upon Tyne, United Kingdom</strong>",19,3.0
375307175,https://www.tripadvisor.com/Hotel_Review-g14129573-d526766-Reviews-Hotel_Monteray_Ginza-Ginza_Chuo_Tokyo_Tokyo_Prefecture_Kanto-or130.html?filterLang=en,Hotel Monteray Ginza,"May 21, 2016","I loved the classic atmosphere of this hotel: not the usual business like sense of urgency, but a feeling of calm and serenity - yet in the hearth of Ginza - very convenient to transportation, shopping and dining.A really great experience.","Nasushiobara, Japan","locomotore</div><div class=""userLoc""><strong>Nasushiobara, Japan</strong>",127,5.0
375294605,https://www.tripadvisor.com/Hotel_Review-g14129573-d526766-Reviews-Hotel_Monteray_Ginza-Ginza_Chuo_Tokyo_Tokyo_Prefecture_Kanto-or130.html?filterLang=en,Hotel Monteray Ginza,"May 21, 2016","Tucked away in the side street of Ginza, very convenient to go pretty much anywhere around there, and it's quiet in the evenings. Plenty of convenience stores within reach. Booked a small double room but took the option to upgrade to a double bed room (with a supplement) which was a good choice as it was more spacious - exactly what the front desk staff told me. While you may notice the chips in the paint and furniture, it was very clean and comfortable. Good bathroom & amenities. The whole place is very 'retro' and I loved it, especially the elevator. Helpful staff.","Hong Kong, China","takamidayon</div><div class=""userLoc""><strong>Hong Kong, China</strong>",9,4.0
372559189,https://www.tripadvisor.com/Hotel_Review-g14129573-d526766-Reviews-Hotel_Monteray_Ginza-Ginza_Chuo_Tokyo_Tokyo_Prefecture_Kanto-or135.html?filterLang=en,Hotel Monteray Ginza,"May 13, 2016","Spent 5 nights here early April 2016. As others have stated, it's in a great location and near all the metro stops. It's walk-able from Tokyo station, but not really with all your luggage the first night. A cab cost us 900 yen which was easily worth it and took less than 10 minutes.Initially we had a double room which was far too small, so after the first night we upgraded to the next size for 4000 yen a night. This was fine, and also on a higher floor.We didn't use the restaurant but it looked nice. We found the staff to be most helpful too. I accidentally left a credit card in our room and they mailed it on to our Kyoto hotel (charged for it though).So, to summarize, hotels in Tokyo are expensive, especially those in good areas like this one. The Monterey Ginza represented very good value for money and ticked all the boxes for us. Would definitely stay again","Chorley, United Kingdom","turgonuk</div><div class=""userLoc""><strong>Chorley, United Kingdom</strong>",112,4.0
372277890,https://www.tripadvisor.com/Hotel_Review-g14129573-d526766-Reviews-Hotel_Monteray_Ginza-Ginza_Chuo_Tokyo_Tokyo_Prefecture_Kanto-or135.html?filterLang=en,Hotel Monteray Ginza,"May 12, 2016","Perfect position for our traipsing around Tokyo - this hotel was efficient, clean and the staff were courteous. We'd been warned off the breakfast because it was apparently very costly for what you got. So we headed out each (rainy) morning in search of a wonderful breakfast where the value was better. We had a fair few disasters on that score until we found one near the Ginza station that was lovely. HOWEVER, on our last day in Tokyo, we decided to try the hotel breakfast for speed and ease – it was actually very nice! I don't know why all the negative comments. There was a wide range of both Japanese and European fare and we had a marvellous breakfast and it was not that expensive compared with other places. So, moral of the story - don't always take other people's word for things. Try it yourself and make your own mind up.",,Angels11,15,4.0
371098689,https://www.tripadvisor.com/Hotel_Review-g14129573-d526766-Reviews-Hotel_Monteray_Ginza-Ginza_Chuo_Tokyo_Tokyo_Prefecture_Kanto-or135.html?filterLang=en,Hotel Monteray Ginza,"May 8, 2016","The Hotel Monterey Ginza is a relatively good choice for anyone looking to stay in Ginza. Its location is probably its greatest strength, even though it is a fairly long walk from the metro station.As to the rooms, they are definitely small but not tiny either. At least you can stay there with young kids and this is why I picked this place.The staff was kind but probably not as warm as that of Hotel Monterey Kyoto where I also happened to stay during the same trip. All in all I recommend - probably not warmly though - but this hotel is a good choice for those on a shopping tour!","Singapore, Singapore","MisterM_TA</div><div class=""userLoc""><strong>Singapore, Singapore</strong>",58,3.0
370793887,https://www.tripadvisor.com/Hotel_Review-g14129573-d526766-Reviews-Hotel_Monteray_Ginza-Ginza_Chuo_Tokyo_Tokyo_Prefecture_Kanto-or135.html?filterLang=en,Hotel Monteray Ginza,"May 6, 2016",Had one night in Tokyo after arriving from a cruise. The hotel is right in the centre of Ginza and idea for shopping or getting around on the subway.The reception area is tired and old and needs redecoration but the rooms were clean and comfortable although there was only a shower over the bath and this caused problems for one friend who is unable to get into the bath.The restaurant is old fashioned but has lovely chandeliers and with some redecoration could be beautiful.,"Perth, Australia","hildaPerthWA</div><div class=""userLoc""><strong>Perth, Australia</strong>",48,4.0
369690056,https://www.tripadvisor.com/Hotel_Review-g14129573-d526766-Reviews-Hotel_Monteray_Ginza-Ginza_Chuo_Tokyo_Tokyo_Prefecture_Kanto-or135.html?filterLang=en,Hotel Monteray Ginza,"May 2, 2016",- Good Ginza location.- A one minute walk to the main street (they close it for pedestrians on Sundays from AM to PM)- Family Mart and a few other convenience stores are all across the street.- Rooms are small but they are nicely decorated- Better to spend a little bit more for an executive room -Fancy restaurants and chic stores are a stone throw away.,"Kuala Lumpur, Malaysia","RoyalRebel247</div><div class=""userLoc""><strong>Kuala Lumpur, Malaysia</strong>",30,4.0
369123531,https://www.tripadvisor.com/Hotel_Review-g14129573-d526766-Reviews-Hotel_Monteray_Ginza-Ginza_Chuo_Tokyo_Tokyo_Prefecture_Kanto-or140.html?filterLang=en,Hotel Monteray Ginza,"April 30, 2016","Travelling as a family of four in Tokyo is tricky and meant that we needed to book two rooms when staying in western hotels in Japan. The Hotel Monterey gave us two adjoining rooms with an interconnecting door that could be locked open. Contrary to other review, it was more spacious than I expected. It certainly wasn't huge, but the bathroom was a good size and there was plenty of room for us to place our luggage.The staff were helpful, the breakfasts set us up perfectly for hardcore sightseeing and we absolutely loved being so close to the beautiful wide, clean streets of Ginza.","Manly, Australia","MediaTart</div><div class=""userLoc""><strong>Manly, Australia</strong>",10,4.0
