review_id,url,hotel_name,review_date,review_body,user_location,user_name,helpful_vote,rating
157128473,https://www.tripadvisor.com/Hotel_Review-g14129573-d526766-Reviews-Hotel_Monteray_Ginza-Ginza_Chuo_Tokyo_Tokyo_Prefecture_Kanto-or345.html?filterLang=en,Hotel Monteray Ginza,"April 8, 2013","First when you ask about the location of this hotel, the only answer is prime location, perfect for those who like shopping or window shopping. Need a train ride? just walk you are already at Ginza Itchome. Second value for what you paid, very convenient accommodation, very clean and comfortable. That's what we usually need when staying in a hotel. Hotel staffs are very friendly.","Jakarta, Indonesia","Iki Abby S</div><div class=""userLoc""><strong>Jakarta, Indonesia</strong>",10,4.0
157122872,https://www.tripadvisor.com/Hotel_Review-g14129573-d526766-Reviews-Hotel_Monteray_Ginza-Ginza_Chuo_Tokyo_Tokyo_Prefecture_Kanto-or345.html?filterLang=en,Hotel Monteray Ginza,"April 8, 2013",My wife and I enjoyed our stay at the Monterey Ginza. Whilst it was quite a small room hotel it was very clean and handy to everything.Service was excellent. There is plenty of places to eat nearby and a convenience store across the road.Love the toilet.,"Caboolture South, Australia","Neville W</div><div class=""userLoc""><strong>Caboolture South, Australia</strong>",1,4.0
155865117,https://www.tripadvisor.com/Hotel_Review-g14129573-d526766-Reviews-Hotel_Monteray_Ginza-Ginza_Chuo_Tokyo_Tokyo_Prefecture_Kanto-or345.html?filterLang=en,Hotel Monteray Ginza,"March 28, 2013","This is modeled after a french hotel, even serving french food in its restaurant.You get the usually twin bed perks, including the supplied toothbrush, tooth paste, razer, shaving cream, etc. which is standard for all of the hotels I have stayed in Japan. Also, the room is small, as are some of the hotels with 2 twin beds and a small bathoom and a tub being easier to use at times than the shower. This is not a knock at this hotel, - this is consistent with what I experienced, except when I stay in the Prince or Hotel Nikko in Osaka or Tokyo. In fact, I like the location very much and the staff spoke English and consistent with Japanese service, was consistently very inconsistent. I didn't go with the standard breakfast meal plan, but there were Starbucks and other coffee shops very close by. Also, Lawson's and Family Mart and a knock-off 7-11 are across the street. We also ate at restaurants across the street which were very good.I would stay there again, as the subway entrance is vey close by and the main drag in Ginza about 2 blocks awat,",Honolulu,"DT808</div><div class=""userLoc""><strong>Honolulu</strong>",58,4.0
153337454,https://www.tripadvisor.com/Hotel_Review-g14129573-d526766-Reviews-Hotel_Monteray_Ginza-Ginza_Chuo_Tokyo_Tokyo_Prefecture_Kanto-or350.html?filterLang=en,Hotel Monteray Ginza,"February 27, 2013","I stayed here for 5 nights from 22-27 feb. This cozy French-style hotel is close to the Ginza itchome (round the corner) & Ginza metro ( about 8 minutes walk) stations, hence very convenient. To get to further places beyond Tokyo, one can also walk to the JR Yurakucho station abt 10 minutes away (there's MUJI & The Loft stores near it) and take the train for a stop to transit at Tokyo station (major hub) and then the Shinkansen. Family mart, Lawson's and Sunkus are just opposite for quick grabs. From Narita airport, take the airport limousine to Tokyo station (3000yen) and then cab to hotel (710yen) and vice versa to get to airport. My only complaint was the lousy, flat pillow :p","Singapore, Singapore","Hedgiebunny</div><div class=""userLoc""><strong>Singapore, Singapore</strong>",61,4.0
153258254,https://www.tripadvisor.com/Hotel_Review-g14129573-d526766-Reviews-Hotel_Monteray_Ginza-Ginza_Chuo_Tokyo_Tokyo_Prefecture_Kanto-or350.html?filterLang=en,Hotel Monteray Ginza,"February 26, 2013","This hotel is sited in a great location in the heart of the famous Ginza shopping area of Tokyo. Also convenient for the subway and about 5 mins by taxi to the famed fish market. Rooms are clean, and reasonably sized by Tokyo standards - decor is a bit dated and public areas spartan. The hotel reception staff were friendly and speak good english. We stayed for 5 days and still did not have enough time to see all the shops in Ginza! .","Hong Kong, China","RonTaiwan</div><div class=""userLoc""><strong>Hong Kong, China</strong>",35,3.0
153019014,https://www.tripadvisor.com/Hotel_Review-g14129573-d526766-Reviews-Hotel_Monteray_Ginza-Ginza_Chuo_Tokyo_Tokyo_Prefecture_Kanto-or350.html?filterLang=en,Hotel Monteray Ginza,"February 25, 2013","This Hotel was plain, but comfortable, the rooms were quite small even for two people. The staff were friendly and welcoming and it was nice to be spoken to in English even though we were in Japan. They kept our cases for us and were very happy to do so, this was convenient for us as we went on a trip to Kyoto during our stay at the Hotel. There was tea making equipment which is always nice, the place was very clean and the staff were efficient. Bathroom was neat and tidy even though it was small. A slight negative thing about the hotel was that the rooms were extremely hot, and staff had to come and unlock the windows for us, and even though we were high up there was no opening restriction, this was slightly scary.The position of the hotel is excellent, near by is central Ginza and the Tokyo Subway. We didn't eat breakfast or any meals at the Hotel, but food was available and there are loads of places just round the corner to eat.",London,"theMonkfish</div><div class=""userLoc""><strong>London</strong>",6,3.0
152869022,https://www.tripadvisor.com/Hotel_Review-g14129573-d526766-Reviews-Hotel_Monteray_Ginza-Ginza_Chuo_Tokyo_Tokyo_Prefecture_Kanto-or350.html?filterLang=en,Hotel Monteray Ginza,"February 23, 2013","Great location in a central part of Tokyo and close enough to the station (about a 1km walk), nice enough hotel although rooms are small. Otherwise hotel is clean, wifi included (but no breakfast). There's a lot to do around the area (shopping, food etc).","Dubai, United Arab Emirates","jamiep84</div><div class=""userLoc""><strong>Dubai, United Arab Emirates</strong>",167,4.0
152668114,https://www.tripadvisor.com/Hotel_Review-g14129573-d526766-Reviews-Hotel_Monteray_Ginza-Ginza_Chuo_Tokyo_Tokyo_Prefecture_Kanto-or350.html?filterLang=en,Hotel Monteray Ginza,"February 20, 2013","the hotel is easy to find, great location close to two subway lines, walking distance to tsukiji fish market and imperial palace and is two blocks from ritzy Ginza shopping area.  we stayed for 4 nights and had a great time. the rooms were clean, smoke free and all toiletries were available in the bathroom for free if you needed them. they also had a small frige and TV. the front desk was efficient, friendly and spoke a little English which I was grateful for since I didn't speak any Japanese. they were even able to cut my lock off my luggage when I lost the key! and gave good directions to tourist sights. I noticed few westerners in the hotel which was also nice, made it feel like I was in Tokyo instead of in a Hilton full of Americans speaking English. there are two convenient stores across the street and a cheap yummy ramen place 1 block away I'll post a pic if you want to try it.overall, I enjoyed my stay and will stay at this hotel  when I come to visit again. I read some of the other reviews and should mention that the room is on the small side but you're in Japan! We had plenty of room for two people and our big American luggage. I also noticed that they have a pull out couch for another adult or two small children (that they do not advertise on the website). The other complaint I noticed was the 10$ charge for the tv, you can get Japanese channels free but I don't know why you would waste time watching American tv while in Tokyo ......when there is so much to see and experience.Hope this helps and have a great time in Tokyo!!","Orlando, Florida","sora21</div><div class=""userLoc""><strong>Orlando, Florida</strong>",11,5.0
151437211,https://www.tripadvisor.com/Hotel_Review-g14129573-d526766-Reviews-Hotel_Monteray_Ginza-Ginza_Chuo_Tokyo_Tokyo_Prefecture_Kanto-or355.html?filterLang=en,Hotel Monteray Ginza,"February 4, 2013",I paid 220 a night to go back to college. The king size bed is a queen at best. The bathroom is the smallest I've ever seen and super raunchy looking. I got here and Super Bowl Sunday and naturally thinking I could watch in the room but they make you buy tv cards at $10 each! You would think if you paid 220usd you could get to use the tv right?! Not here at hotel Monterey ginza. The only good thing is the location. Never coming here again.,"Suzhou, China","Po L</div><div class=""userLoc""><strong>Suzhou, China</strong>",1,1.0
151412891,https://www.tripadvisor.com/Hotel_Review-g14129573-d526766-Reviews-Hotel_Monteray_Ginza-Ginza_Chuo_Tokyo_Tokyo_Prefecture_Kanto-or355.html?filterLang=en,Hotel Monteray Ginza,"February 4, 2013","first i want to start with saying that this hotel is by far one of the best hotels ive ever been in. i have stayed at some fantastic hotels across the world ie sheraton in thailand, club med in sicily and some other fantastic hotels all across the globe. this hotel is not only situated in my favourite part of the world but the suburb/district is not only amazingly beautiful but ever so clean and amazing! this hotel is crafted beautifully and the receptionists are just fantastic. we stayed here for one week and as soon as we went to shinjuku we regretted booking other hotels this one was that fantastic!definitely will return to this hotel!","Melbourne, Australia","lucachizz</div><div class=""userLoc""><strong>Melbourne, Australia</strong>",67,5.0
151403226,https://www.tripadvisor.com/Hotel_Review-g14129573-d526766-Reviews-Hotel_Monteray_Ginza-Ginza_Chuo_Tokyo_Tokyo_Prefecture_Kanto-or355.html?filterLang=en,Hotel Monteray Ginza,"February 4, 2013","I stayed in this place for a business trip, found it here and booked through hotels.com. The price is very fair for its location - the metro station Ginza-Ichoume is only 200 meters away. Ther personnel is very helpful and educated. The room is pretty small, very small, but I assume that is the case in Tokio anyway, so don't expect a big room. They have nice pijamas waiting for you. Didn't use the restaurant but looked pretty nice. If the price is under $200 go for it.","Stevensville, Michigan","Moises_Norena</div><div class=""userLoc""><strong>Stevensville, Michigan</strong>",15,4.0
148982647,https://www.tripadvisor.com/Hotel_Review-g14129573-d526766-Reviews-Hotel_Monteray_Ginza-Ginza_Chuo_Tokyo_Tokyo_Prefecture_Kanto-or355.html?filterLang=en,Hotel Monteray Ginza,"January 6, 2013","お正月の終わりに宿泊した。ホテル横にコンビニが3件あり便利、また居酒屋も2件あり立地は良いと思う。JR東京駅に近いホテルとして探したので、部屋は少し狭かったが満足できた。朝食はビュッフェスタイルで入場に多少待たされたが美味しかった。他の方も書いてる通りサービスは普通ですが空気清浄機が常備してあったのはうれしかった。(喫煙の部屋に泊まった)特にこだわりがなく銀座に用事がある人には良い選択のホテルの一つかと思う。I stayed at the end of New Year holidays.There is it, and, the hotel convenience that there are three convenience stores aside, two bars think that the location is good again.Because I looked for it as the hotel which was near to JR Tokyo Station, some rooms were narrow, but were able to be satisfied.The breakfast was kept waiting for entrance in buffet-style to some extent, but was delicious.The service was common as I wrote other one, but was glad that an air cleaner was had always ready.(I stayed at the room of the smoking)I think whether it is one of the hotels of the choice that there are not feelings in particular, and is good for Ginza for a person with the business.",福岡,"sakaki_12</div><div class=""userLoc""><strong>福岡</strong>",26,3.0
148556728,https://www.tripadvisor.com/Hotel_Review-g14129573-d526766-Reviews-Hotel_Monteray_Ginza-Ginza_Chuo_Tokyo_Tokyo_Prefecture_Kanto-or355.html?filterLang=en,Hotel Monteray Ginza,"January 1, 2013","I stayed at this hotel twice in late October 2012 at the start and end of my trip to Japan and had a very comfortable and hassle-free stay both times. Its location was a key highlight for me, on a quiet side street in Ginza yet just a couple of minutes by cab (or 10 mins walk) from Tokyo station (which meant excellent access to the Narita Express and the JR Shinkansen lines) as well as being very close to a couple of subway stops (tip - while the Ginza Ichitome station is literally next door to the hotel, I recommend walking a little further to the main Ginza subway stop which has many more lines running through it). The rooms and bathrooms are clean (as usual in Japan) but as many people have pointed out, a little on the small side and hence ideal for a solo traveller or a couple travelling light. It is very quiet which is a plus and the bed is very comfortable. Free wifi is also available in the room, which was welcome as I found this often not to be the case in Japan. There are lots of small restaurants and cafes, as well as western chains such as Starbucks for those missing a taste of home nearby. Given its location, I would consider this hotel to be very good value and recommend it for whom location and convenience is top priority when visiting Tokyo.",Sydney,"Metaxas</div><div class=""userLoc""><strong>Sydney</strong>",22,4.0
147684640,https://www.tripadvisor.com/Hotel_Review-g14129573-d526766-Reviews-Hotel_Monteray_Ginza-Ginza_Chuo_Tokyo_Tokyo_Prefecture_Kanto-or360.html?filterLang=en,Hotel Monteray Ginza,"December 18, 2012","Had a romantic stay at this hotel. The hotel is maybe 5minutes from the Ginza station by foot, however, if you get off at Ginza Ichoume Station it takes maybe 30s from the exit to reach the hotel. Service was great, rooms were clean and really nice. The bed was really big. They were kind enough to fulfill my special request of getting a toy rabbit for my girlfriend before I signed in. I have stayed in numerous hotels in Tokyo and this one is definitely the best. Highly recommended.","Jyvaskyla, Finland","jolaitin</div><div class=""userLoc""><strong>Jyvaskyla, Finland</strong>",2,5.0
147329316,https://www.tripadvisor.com/Hotel_Review-g14129573-d526766-Reviews-Hotel_Monteray_Ginza-Ginza_Chuo_Tokyo_Tokyo_Prefecture_Kanto-or360.html?filterLang=en,Hotel Monteray Ginza,"December 12, 2012","We've stayed in this hotel four or five times and keep coming back because: Location is outstanding and it's a great price for this area. Staff is super nice and really willing to speak English and give recommendations -- we've liked 14/15 places they've suggested to us for meals :) Clean and quiet. Negatives: Rooms are small (as is usual in Japanese cities) -- a room w 2 single beds is better than a room w double bed (careful, in Japan they use different terms for double room). They've been complying w/ government request for power saving after Fukashima, and so aircon has been not-so-cool in summer... and last week in winter it was HOT (we just asked them to open our window, which worked just fine to cool the room :) Breakfast buffet isn't to our taste, but it's not easy to find breakfast in Japan (usually we just go to 24-hr restaurant & have something like oyakodon - chicken & egg on rice - for 500 yen). This last trip was as a family -- and it's not so easy to get connecting rooms here, so if that's important to you, be sure to call the hotel.","Corralitos, California","buddyfriends</div><div class=""userLoc""><strong>Corralitos, California</strong>",32,4.0
147226932,https://www.tripadvisor.com/Hotel_Review-g14129573-d526766-Reviews-Hotel_Monteray_Ginza-Ginza_Chuo_Tokyo_Tokyo_Prefecture_Kanto-or360.html?filterLang=en,Hotel Monteray Ginza,"December 11, 2012",Stayed here for 4 nights and the hotel is nice and in a really convenient location.Staff were really helpful and English speaking and the room although pretty small was nice and clean. Location is great and easy access to the main streets of Ginza (which is very nice) and also the main subway and train lines are less than 5 mins walk. On arrival in Tokyo we walked to the hotel from the main Tokyo station - only about 10-15 mins and also to the Fish Market - about 15 mins. Recommend it,Bristol,"WolfRich</div><div class=""userLoc""><strong>Bristol</strong>",9,4.0
146103479,https://www.tripadvisor.com/Hotel_Review-g14129573-d526766-Reviews-Hotel_Monteray_Ginza-Ginza_Chuo_Tokyo_Tokyo_Prefecture_Kanto-or360.html?filterLang=en,Hotel Monteray Ginza,"November 24, 2012","Just spent a couple nights at this hotel. First of all, let me say that the location is unbeatable. Right in the center of Ginza shopping district and a couple subway stations away from the fish market! The rooms are clean and tidy but VERY small, even by Japanese standards. But the amenities you can find in the room are nice (toiletries, slippers, humidifier, etc...). They even provide a free LAN cable for internet, that worked extremely well. Only issue I had was the AC not properly working. Not sure why that is, but the air does seem to get stuffy and I had to have a window open most of the time. Staff was very helpful and they speak english.All in all, good value hotel to spend a couple nights. Do not plan to stay a whole week there though or you might get claustrophobic.","Fukuoka, Japan","M4fingers</div><div class=""userLoc""><strong>Fukuoka, Japan</strong>",66,4.0
145559074,https://www.tripadvisor.com/Hotel_Review-g14129573-d526766-Reviews-Hotel_Monteray_Ginza-Ginza_Chuo_Tokyo_Tokyo_Prefecture_Kanto-or360.html?filterLang=en,Hotel Monteray Ginza,"November 16, 2012","First of all, the staff were polite and the location is good. Have to say that, but what we were amazed at was the fact that they switched off the air conditioning at a central point for the whole building except for a short time each day! (The temperature dial on the wall was not used so a staff member told us) So during the night the room was very stuffy and we had an unpleasant nights sleep, to say the least. When we rang down to ask about this they said they would come up and unlock a window which they did but this room was 10 floors up and there was no safety bar across the window which was rather scary and of course all the street noise came in as well. Even when we came back after shopping a few hours later we thought it may be on...but no.So even tho we had paid 2 nights we didnt stay and got another hotel via the internet for our 2nd night.","Churchill, Australia","SandraEd</div><div class=""userLoc""><strong>Churchill, Australia</strong>",22,2.0
144713935,https://www.tripadvisor.com/Hotel_Review-g14129573-d526766-Reviews-Hotel_Monteray_Ginza-Ginza_Chuo_Tokyo_Tokyo_Prefecture_Kanto-or365.html?filterLang=en,Hotel Monteray Ginza,"November 5, 2012","The hotel is in Ginza, in the heart of the most famous shopping area of Tokyo. Very convenient position for the subway, Ginza Line and Yurakucho Line are very close. Stayed on 13 (last) floor, the rooms were recently renovated, even if the bathromm shows its age. Good English of the Reception Desk, very kind and helpful as usual in Japan. Indeed a very good price for the area (booking with Expedia and together with the flight); excellent value for money.Good bathroom amenities and wi-fi was working excellently (could use skype easily to call home), despite other non positive reviews.As the hotel is a small one, no Limousine bus stop to/from the airport and they do exchange foreign currency at the Front Desk","Milan, Italy","GIOPIX</div><div class=""userLoc""><strong>Milan, Italy</strong>",193,4.0
143867703,https://www.tripadvisor.com/Hotel_Review-g14129573-d526766-Reviews-Hotel_Monteray_Ginza-Ginza_Chuo_Tokyo_Tokyo_Prefecture_Kanto-or365.html?filterLang=en,Hotel Monteray Ginza,"October 27, 2012","this hotel is only 10 minutes walk from Tokyo station and 3 subway stops away from fish market. a lot of restaurants in this area. The location is excellent. When we arrived, it was too early to check in. People at the front desk helped us to hold our luggage, so we could go out. When we came back, our luggage was already in our room. The room is clean and bed is comfortable. people work at the front desk speak good English and very helpful. check in and check out are very quick.Tokyo is a very expensive city. With this price, I don't think you can find any hotel better than this one in Ginza area. I stayed 5 nights in ANA intercontinental tokyo and 1 night in this hotel. I think I like this hotel better.","London, United Kingdom","April201333</div><div class=""userLoc""><strong>London, United Kingdom</strong>",22,5.0
142395279,https://www.tripadvisor.com/Hotel_Review-g14129573-d526766-Reviews-Hotel_Monteray_Ginza-Ginza_Chuo_Tokyo_Tokyo_Prefecture_Kanto-or365.html?filterLang=en,Hotel Monteray Ginza,"October 9, 2012",Great location between Tsukiji fish market and Ginza shopping. You can walk to market for tuna auction at 4 in the morning! Very close to three subway stations including JR Yamanote which is free if you have Japan Rail Pass. Ginza line goes directly to Asakasa - a 'must see' old Tokyo area.Rooms are small but this is Japan and normal. Bath/shower is great to soak in at the end of the day of sightseeing!,"Bonnells Bay, Australia","StephenS1002</div><div class=""userLoc""><strong>Bonnells Bay, Australia</strong>",4,4.0
142335106,https://www.tripadvisor.com/Hotel_Review-g14129573-d526766-Reviews-Hotel_Monteray_Ginza-Ginza_Chuo_Tokyo_Tokyo_Prefecture_Kanto-or365.html?filterLang=en,Hotel Monteray Ginza,"October 8, 2012","For the money you're paying I don't think that you will find a better hotel in the Ginza area: 3 minutes walk from the main shopping area and10 minutes walk from Tokyo station, the metro is also next door.Service was excellent, the rooms small but clean and comfortable, there are numerous cafes and restaurants close by. I would definitely return.The Monteray chain seemed to cater for mostly Japanese guests, which I preferred, however, English was spoken and the staff were very helpful in recommending restaurant suggestions.","Brussels, Belgium","Clarinda_Vine</div><div class=""userLoc""><strong>Brussels, Belgium</strong>",37,4.0
141093298,https://www.tripadvisor.com/Hotel_Review-g14129573-d526766-Reviews-Hotel_Monteray_Ginza-Ginza_Chuo_Tokyo_Tokyo_Prefecture_Kanto-or365.html?filterLang=en,Hotel Monteray Ginza,"September 24, 2012","You may be shocked if you land here on your first trip to Japan. But to the seasoned traveler, this is a nice little hotel in the best possible location. The rooms are small, but not too small, and very well appointed and cared for. The reception is a bit cramped at times, and English here is really a foreign language; but they try their best and we got our room in no time. Breakfast is a mixed affair, catering to all tastes; so you will find a good continental breakfast as well as a good Japanese one, if you are up to it. I cannot comment on the restaurant: being in the very heart of Ginza, it seemed a little silly to eat at the hotel. Wifi is a hit and miss affair: it seem to be only available in the reception area, and occasionally in the breakfast room. But there is free wifi almost everywhre else in Tokyo, so this is no big deal. Al in all a very good choice for the price.","Sydney, Australia","giorgiosydney</div><div class=""userLoc""><strong>Sydney, Australia</strong>",23,3.0
140482922,https://www.tripadvisor.com/Hotel_Review-g14129573-d526766-Reviews-Hotel_Monteray_Ginza-Ginza_Chuo_Tokyo_Tokyo_Prefecture_Kanto-or370.html?filterLang=en,Hotel Monteray Ginza,"September 17, 2012","We stayed at this hotel for 4 nights and really enjoyed it. It was clean, a nice bathroom and good value and a great location. It is a 10 min walk from Tokyo station and easy to catch the metro to other parts of Tokyo. The staff was very friendly and helpful! Lots of places to shop and eat in the area. We found a fabulous wine bar across the street from the hotel, called Wine at Ginza, absolutely fabulous place to eat and drink! We can really recommed this hotel if you want a perfect location and don´t want to spend a fortune on hotel costs!",Sweden,"expatDubai</div><div class=""userLoc""><strong>Sweden</strong>",69,4.0
140413506,https://www.tripadvisor.com/Hotel_Review-g14129573-d526766-Reviews-Hotel_Monteray_Ginza-Ginza_Chuo_Tokyo_Tokyo_Prefecture_Kanto-or370.html?filterLang=en,Hotel Monteray Ginza,"September 16, 2012","The Hotel Monterey Ginza was an excellent choice. It was clean and neat, and good value compared to other options when we booked. The view from our room wasn't great, but we didn't spend a lot of time there except for sleeping (We're in Tokyo after all). A huge plus is being close to the transit station where you can easily get to many tourist spots.",Tokyo,"Mark T</div><div class=""userLoc""><strong>Tokyo</strong>",0,4.0
140197578,https://www.tripadvisor.com/Hotel_Review-g14129573-d526766-Reviews-Hotel_Monteray_Ginza-Ginza_Chuo_Tokyo_Tokyo_Prefecture_Kanto-or370.html?filterLang=en,Hotel Monteray Ginza,"September 13, 2012",We stayed October 2010 just for the record. The room was quite nice with lovely tiles in the bathroom. I remember the hotel staff were very helpful. The tv was limited with English channels but that was okay. It was well located in Ginza and was quite affordable.Love the faux French style of the outside.,Melbourne,"SusannahPK</div><div class=""userLoc""><strong>Melbourne</strong>",48,4.0
