review_id,url,hotel_name,review_date,review_body,user_location,user_name,helpful_vote,rating
384568279,https://www.tripadvisor.com/Hotel_Review-g1066449-d301686-Reviews-Hotel_East_21_Tokyo-Koto_Tokyo_Tokyo_Prefecture_Kanto-or135.html?filterLang=en,Hotel East 21 Tokyo,"June 21, 2016",Good hotel located close to town. We used to walk down to the station to take the Toyoko train into town or to the subway line. On our last day we found out that there is a shuttle that departs down that direction at various times of the day. The rooms get super cleaned. The cleaning staff literally stay on one floor the whole day. We had a great room overlooking Skytree. The TV doesn't show any english channels so you're best to get out and about. There is a supermarket downstairs and if you walk a little further up there are old guys fishing!,"Auckland Central, New Zealand","Vincent C</div><div class=""userLoc""><strong>Auckland Central, New Zealand</strong>",4,4.0
382172006,https://www.tripadvisor.com/Hotel_Review-g1066449-d301686-Reviews-Hotel_East_21_Tokyo-Koto_Tokyo_Tokyo_Prefecture_Kanto-or140.html?filterLang=en,Hotel East 21 Tokyo,"June 13, 2016","If you are arriving at Haneda airport take the No 5 from outside Arrivals. It takes you to the entrance to the hotel.Check in was quick and we were pleasantly surprised by our room. A large comfortable bed with new linen daily. A sitting area. Tea making facilities. Air con.Each day we had new slippers, new night shirts and new toiletries in the bathroom.These included hair brush, tooth brush and tooth paste, razor and shaving cream plus the usual. The hand soap was so smooth.I must mention the heated toilet seat- next time I will take a longer book!The staff were most helpful although sometimes their English was not too good.Buffet style breakfast was better than good, providing you tried some japanese dishes.We thought that the prices for evening meal were too costly so we ate in the local shopping Mall which was directly outside the hotel. Volks steak house was well priced and the steak excellent.The hotel is some distance from the main attractions but there is a Metro station about 7 minutes walk from the hotel and this gives you access to the underground system.There is a minibus shuttle from the hotel to the Skytree.There is also a minibus shuttle to Tokyo Disneyland.I would recommend this hotel","Cardiff, United Kingdom","williwanderer</div><div class=""userLoc""><strong>Cardiff, United Kingdom</strong>",66,4.0
377320035,https://www.tripadvisor.com/Hotel_Review-g1066449-d301686-Reviews-Hotel_East_21_Tokyo-Koto_Tokyo_Tokyo_Prefecture_Kanto-or140.html?filterLang=en,Hotel East 21 Tokyo,"May 28, 2016","Nice, cosy, cool and calm place. Situated away from the hustle and bustle which is a rarity in Tokyo. Sky Tower was clearly visible from the hotel room. Room with 4 beds was comfortable except that one of the beds was sofa cum bed which was not so comfortable. Upkeep and maintenance was good. Breakfast costed 2300 yen per person which was on the higher side. All in all, a nice experience.","Noida, India","rajshaily</div><div class=""userLoc""><strong>Noida, India</strong>",26,4.0
375343865,https://www.tripadvisor.com/Hotel_Review-g1066449-d301686-Reviews-Hotel_East_21_Tokyo-Koto_Tokyo_Tokyo_Prefecture_Kanto-or140.html?filterLang=en,Hotel East 21 Tokyo,"May 22, 2016","The hotel check in was slow. The room i have was standard. It's such a hot day after check in so i decided to give the pool a go...went to L4 for their indoor pool..to my unpleasant surprise. U have to pay at least 2000 yen to access, then i made my way to L5 for their outdoor pool..another shocking surprise. ..it displayed a closed signed. ..i called up front desk afterwards..they said the pool is open during dry season...i responded to staff..it is 25 degree and sweating..you tell me this pool is not open 24/7, 365 days...to make things worse..you have pay to use it. Seriously what hotel on earth which is classified 4 star hotel and charges pool access. I got FREE access at Marina Bay Sand and they're 5 star hotel..SERIOUSLY NO WONDER YOU DON'T MAKE IT ON 5 STAR...So why bother highlighting the pool sooo glamourously and why soooo misleading that you can't mention on your stupid website that hotel guest would incur a charge.Attached their misleading website...NO RATES AT ALL","Melbourne, Australia","angiefj1984</div><div class=""userLoc""><strong>Melbourne, Australia</strong>",5,2.0
374784501,https://www.tripadvisor.com/Hotel_Review-g1066449-d301686-Reviews-Hotel_East_21_Tokyo-Koto_Tokyo_Tokyo_Prefecture_Kanto-or140.html?filterLang=en,Hotel East 21 Tokyo,"May 20, 2016","Our family of 4 stayed here in May 2016 in a quadruple room for 4. Our view from the 20th floor was amazing with the SkyTree in full view. The attached shopping has dining and shopping options at affordable prices.The staff are very friendly, many of whom speak at least some English. The train station is just a few blocks away so all of Tokyo is within easy reach.","Saskatchewan, Canada","J9957FGmikeb</div><div class=""userLoc""><strong>Saskatchewan, Canada</strong>",22,5.0
371944009,https://www.tripadvisor.com/Hotel_Review-g1066449-d301686-Reviews-Hotel_East_21_Tokyo-Koto_Tokyo_Tokyo_Prefecture_Kanto-or140.html?filterLang=en,Hotel East 21 Tokyo,"May 10, 2016","I stayed 4 nights and I feel comfortable. I took breakfast outside. From Tokyo station it coast 2400 yen by taxi. The nearest tube station is Toyocho ( Tozai line), 10 minutes walk. Next to the hotel, there is supermarket and several restaurants. I think it is good to come in this hotel in summer time because there is a hudge swimming pool. The breakfast buffet coasts 2900 yen ; very expensive and not enough variorities.",saint-denis de la Réunion,"Idriss974Reunion</div><div class=""userLoc""><strong>saint-denis de la Réunion</strong>",26,3.0
371798198,https://www.tripadvisor.com/Hotel_Review-g1066449-d301686-Reviews-Hotel_East_21_Tokyo-Koto_Tokyo_Tokyo_Prefecture_Kanto-or145.html?filterLang=en,Hotel East 21 Tokyo,"May 10, 2016","Deserved every one of its four stars, grade A+ customer service (everyone speaks impeccable English, too!), nice comfortable rooms at a decent (not outrageous) rate right close to the Toyocho station in Koto Ward, Tokyo, accessible for all of Tokyo via metro Tozai line. Certainly somewhere I would seek out and stay again.",,Jeff S,3,5.0
368234321,https://www.tripadvisor.com/Hotel_Review-g1066449-d301686-Reviews-Hotel_East_21_Tokyo-Koto_Tokyo_Tokyo_Prefecture_Kanto-or145.html?filterLang=en,Hotel East 21 Tokyo,"April 27, 2016","Exceptional hotel with every comfort and service. Highly recommended and would have loved to stay on longer.Really good breakfast, comfy room and cleaned to a high soecification.Local facilities vey good in same complex, dont forget to see the carp shop!",,MLSpencer,6,5.0
365863921,https://www.tripadvisor.com/Hotel_Review-g1066449-d301686-Reviews-Hotel_East_21_Tokyo-Koto_Tokyo_Tokyo_Prefecture_Kanto-or145.html?filterLang=en,Hotel East 21 Tokyo,"April 20, 2016","Great hotel! Rooms are comfortable and clean. Breakfast buffet was amazing, full of choices for everyone. The hotel is within walking distance to the metro station (10 to 15 mins) and there are 3 convenience stores (and kind of a big supermarket) in the lower part of the hotel. There are also several restaurants there (pizza one was good!). We really enjoyed our stay there!",Mty,"MacPapita</div><div class=""userLoc""><strong>Mty</strong>",10,5.0
363846963,https://www.tripadvisor.com/Hotel_Review-g1066449-d301686-Reviews-Hotel_East_21_Tokyo-Koto_Tokyo_Tokyo_Prefecture_Kanto-or145.html?filterLang=en,Hotel East 21 Tokyo,"April 13, 2016","Fabulous hotel, clean, safe, good shopping area & not far from the metro. Lovely breakfast with plenty of choice, great views of the Skytree, quiet area so no disturbance at night. Loved the warmed mirror in the bathroom which kept it clear in a steamy atmosphere, a little thing but I thought it was a great idea. Lots of small touches which make a big difference to the overall stay.","King's Lynn, United Kingdom","Charlie1244</div><div class=""userLoc""><strong>King's Lynn, United Kingdom</strong>",29,5.0
361480497,https://www.tripadvisor.com/Hotel_Review-g1066449-d301686-Reviews-Hotel_East_21_Tokyo-Koto_Tokyo_Tokyo_Prefecture_Kanto-or145.html?filterLang=en,Hotel East 21 Tokyo,"April 4, 2016","We stayed at the hotel twice: 3 days prior to a tour and 1 day after. Both our rooms were on the 15th floor. The first one seemed a bit larger, but both were good sized, clean and comfortable with good amenities. The shower was excellent.We really appreciated the front desk's good service. Check in was quick . They were always happy to provide maps and suggestions as to where to go and they went out of their way to provide spa pillows for my daughter who is allergic to feathers. Although not central, there a restaurants, a Seven- Eleven and a market under the hotel and it is an easy 10 minute walk to the metro.",NJ,"DEL67NJ</div><div class=""userLoc""><strong>NJ</strong>",51,5.0
361036733,https://www.tripadvisor.com/Hotel_Review-g1066449-d301686-Reviews-Hotel_East_21_Tokyo-Koto_Tokyo_Tokyo_Prefecture_Kanto-or150.html?filterLang=en,Hotel East 21 Tokyo,"April 2, 2016","Good hotel, still new I guest, lower area they have sushi resto and other, 3 convenience store surrounding hotel. but the problem is the sites of the hotel is 8-10 minutes walk to the nearest Metro station (Toyocho metro-Tozai line). so if you want to explore Tokyo fast you will have a difficulty to move fast, to shibuya it will take 30-45 minutes, to Tokyo station-15min.The hotel is not in the middle, its abit off from Tokyo, but if you look for good view to watch sky tree, its a best spot.","Nemuro, Japan","FHN1968</div><div class=""userLoc""><strong>Nemuro, Japan</strong>",27,3.0
360160134,https://www.tripadvisor.com/Hotel_Review-g1066449-d301686-Reviews-Hotel_East_21_Tokyo-Koto_Tokyo_Tokyo_Prefecture_Kanto-or150.html?filterLang=en,Hotel East 21 Tokyo,"March 30, 2016","Cleanliness is a given in Japan, as is polite service. Most staff speak English which is a help in Japan because it's hard to find English speakers in most places. Higher rooms have great views of the city and if you are on the right side the Sky Tree. Restaurant is excellent although rather pricey for tourists. Food cooked in front of you by excellent chefs it was quite an experience although we only ate there once.","London, United Kingdom","bennytheball27</div><div class=""userLoc""><strong>London, United Kingdom</strong>",21,5.0
358016911,https://www.tripadvisor.com/Hotel_Review-g1066449-d301686-Reviews-Hotel_East_21_Tokyo-Koto_Tokyo_Tokyo_Prefecture_Kanto-or150.html?filterLang=en,Hotel East 21 Tokyo,"March 23, 2016","Check-in was quick and painless, with all staff I encountered being very helpful and polite, as is the custom in this lovely country.My reservation was made a bit 'last minute' and, travelling solo I ended up in one of the smaller rooms, still with a double bed and usual facilities. The room, as with the whole hotel, was spotlessly clean and comfortable. Room size was, I would say, generous for Tokyo. A bit of maneuvering was required in the bathroom to get into the shower, avoiding the door and toilet. Much fun was had, as always, playing with the electronic toilet. The view from my twelfth floor window over this part of Tokyo was spectacular.The hotel had a wide range of excellent facilities, none of which I used. The wi-fi was generally reliable.I avoided using the lobby bar, as it was always devoid of other people, possibly down to high prices. I never quite made it up to the cocktail bar on the 21st floor, preferring to explore the city.Personally I found the location to be convenient enough. It is a little bit 'out East' if Shinjuku or Shibuya is your bag, perhaps 45 mins on the Metro avoiding rush hours (which you would be wise to do). But Shimbashi, Ginza and Tsukiji are all within easy reach. The Tozai line (Toyocho station) is an easy & pleasant five minute walk away. For those quiet nights or if you wish to avoid elbowing your way through central Tokyo, the area around East 21 has plenty of options - places to drink a beer, more choice in restaurants than you could ever need, small shops and good coffee for the morning.I'd happily stay with East 21 again.","Auckland Central, New Zealand","raptorman44</div><div class=""userLoc""><strong>Auckland Central, New Zealand</strong>",17,4.0
357102580,https://www.tripadvisor.com/Hotel_Review-g1066449-d301686-Reviews-Hotel_East_21_Tokyo-Koto_Tokyo_Tokyo_Prefecture_Kanto-or150.html?filterLang=en,Hotel East 21 Tokyo,"March 20, 2016","Hotel is comfortable, room was clean, has everything what it was supposed to have. Breakfast was very good a lot of food to chose. Staff is very polite and helpful. Location is pretty far from almost everywhere, about 10 min walking distance to subway. Small mall by the hotel has some good supermarket and decent amount of restaurants","Fair Lawn, New Jersey","Eugene R</div><div class=""userLoc""><strong>Fair Lawn, New Jersey</strong>",25,4.0
356603317,https://www.tripadvisor.com/Hotel_Review-g1066449-d301686-Reviews-Hotel_East_21_Tokyo-Koto_Tokyo_Tokyo_Prefecture_Kanto-or150.html?filterLang=en,Hotel East 21 Tokyo,"March 18, 2016","This hotel is quite nice, al-be-it a little far from everything. Subways are a must to get from one place to the next in the city. The view (our room at least) was spectacular.) If you don't have a view, go up to the bar on the 21st floor for a 360 look-a-round.","El Cajon, California","koko1212</div><div class=""userLoc""><strong>El Cajon, California</strong>",13,4.0
356443982,https://www.tripadvisor.com/Hotel_Review-g1066449-d301686-Reviews-Hotel_East_21_Tokyo-Koto_Tokyo_Tokyo_Prefecture_Kanto-or155.html?filterLang=en,Hotel East 21 Tokyo,"March 17, 2016","I stayed at this hotel for a whole week in March 16 while on a business trip. This being my first trip to Tokyo, I was expecting small rooms and a crowded locality. However to my pleasant surprise, I found the hotel room most spacious and very well laid out. On a clear day, if you are lucky, you could also catch a glimpse of Mt. Fuji.Japan, known for its perfection and sense of artistry was prominent everywhere in the hotel. Very well decorated, perfectly organised and spotlessly clean. The staff are most polite and courteous. Language is usually not an issue. The breakfast spread was wholesome with a full spread of Japanese as well as western food which even vegetarians would not find difficult.A cool limousine bus ride to the airport, for which you need to buy tickets in advance, is an extra benefit.I must say that I had a memorable stay at this hotel and would strongly recommend it to others. ","Bengaluru, India","RanjanSen</div><div class=""userLoc""><strong>Bengaluru, India</strong>",12,5.0
356044617,https://www.tripadvisor.com/Hotel_Review-g1066449-d301686-Reviews-Hotel_East_21_Tokyo-Koto_Tokyo_Tokyo_Prefecture_Kanto-or155.html?filterLang=en,Hotel East 21 Tokyo,"March 16, 2016","Interiors and cleanlinessThe hotels interiors may be dated but the staff managed to keep the entire place clean. Our room was cleaned, vacuumed (don't ask me how I know, but I know!) and organized daily. As expected they had the famous Japanese toilets with heated seats. Part of the mirror also had heaters to prevent fogging.Hotel StaffThe staff we spoke with all tried to understand our English with the Filipino accent. They would also try to converse with us in English. If it seemed that we didn't understand each other, they would make the effort to explain directions to us to make sure we do not get lost. There were a few things we didn't fully understand but that's totally forgivable given the language barrier.TransportationThe hotel was close to Disney and there was even a free bus from the hotel to the resort. It was also just around 30-40minutes to Haneda airport. However, it was a long 15-20 minute walk to the nearest subway so we ended up taking the taxi a lot. It helped that they have estimated costs and arrival time for all the transportation available. Other transfers and tours are offered at the hotel lobby. Just don't forget to ask if you need to pay for them.ConvenientI think it was very convenient that there was a small commercial area within the hotel's property. We were very close to restaurants allowing me to sneak in sushi while my mom was already in the room. When I was feeling cheap, I could even get sushi or dinner from the supermarket nearby. I was also a daily customer at the convenience store nearby. :)","Paranaque, Philippines","kitchiep</div><div class=""userLoc""><strong>Paranaque, Philippines</strong>",11,4.0
354952391,https://www.tripadvisor.com/Hotel_Review-g1066449-d301686-Reviews-Hotel_East_21_Tokyo-Koto_Tokyo_Tokyo_Prefecture_Kanto-or155.html?filterLang=en,Hotel East 21 Tokyo,"March 13, 2016","The service was excellent, very attentive and friendly staff, room spacious and very comfortable, decor tasteful, location close to sites and local Parks. Lots of choice of foods for breakfast served.",Wales,"Derranl</div><div class=""userLoc""><strong>Wales</strong>",5,5.0
346557026,https://www.tripadvisor.com/Hotel_Review-g1066449-d301686-Reviews-Hotel_East_21_Tokyo-Koto_Tokyo_Tokyo_Prefecture_Kanto-or155.html?filterLang=en,Hotel East 21 Tokyo,"February 10, 2016","Breakfast was great. The room was very spacious and comfortable. I love the stores nearby. The staff where very accommodating. When I emailed them about leaving some clothing behind, they sent it back for me for free.",,Trina L,0,5.0
344145442,https://www.tripadvisor.com/Hotel_Review-g1066449-d301686-Reviews-Hotel_East_21_Tokyo-Koto_Tokyo_Tokyo_Prefecture_Kanto-or155.html?filterLang=en,Hotel East 21 Tokyo,"January 31, 2016",Stayed here only two nights. Our room had a nice view of the area. We took a half day tour of Tokyo and then took the subway to Disneyland. The hotel provided a free shuttle that took us back to the hotel from Disney. The breakfast buffet was great. Love the western and Japanese items served.,"San Gabriel, California","wander2</div><div class=""userLoc""><strong>San Gabriel, California</strong>",109,5.0
343409287,https://www.tripadvisor.com/Hotel_Review-g1066449-d301686-Reviews-Hotel_East_21_Tokyo-Koto_Tokyo_Tokyo_Prefecture_Kanto-or160.html?filterLang=en,Hotel East 21 Tokyo,"January 28, 2016","We stayed for one night. There are quite a few little shops around the hotel area and a few restaurants inside the hotel. We ended up eating at Toen, the Chinese restaurant inside the hotel. The service was excellent as was the food. Everything was expensive though. The hotel rooms were very tiny, which is to be expected in Japan. We had a full size bed that took up the entire room. I almost couldn't get off the bed from one side. The table and chair were super close to the bottom of the bed and no real place to push them out of the way with the desk being on the other side of the table. With two full size luggage pieces and a couple duffle bags, this was a pain. The shower and amenities were good. I appreciate the fact they are trying to cut back on waste by not providing the little shampoo/conditioner bottles that often go half used and tossed away. They provided shampoo and conditioner in large reusable bottles. Be sure to check out the great views of the city from the 21st floor. There is a separate express elevator that will take you directly to the 21st hotel. Also, this was about a less than 10 minute walk from the subway. Although we visited in winter, would love to stay here during the summer. Their 3 pools look amazing. Two are outdoors and one indoors. Very beautifully decorated.","Bel Air, Maryland","TravelKat21</div><div class=""userLoc""><strong>Bel Air, Maryland</strong>",91,4.0
342822371,https://www.tripadvisor.com/Hotel_Review-g1066449-d301686-Reviews-Hotel_East_21_Tokyo-Koto_Tokyo_Tokyo_Prefecture_Kanto-or160.html?filterLang=en,Hotel East 21 Tokyo,"January 26, 2016","Comfortable rooms, a shopping plaza thing outside. The Sushi place in the Plaza was good, compared to american sushi places anyway. The breakfast was better than most in the places we went to. My main complaint is that it was far from most of the stuff we wanted to do.","Baton Rouge, Louisiana","Randall G</div><div class=""userLoc""><strong>Baton Rouge, Louisiana</strong>",15,4.0
341260808,https://www.tripadvisor.com/Hotel_Review-g1066449-d301686-Reviews-Hotel_East_21_Tokyo-Koto_Tokyo_Tokyo_Prefecture_Kanto-or160.html?filterLang=en,Hotel East 21 Tokyo,"January 19, 2016","Nice 3-4 stars hotel with excellent front desk service. The room was comfortable, clean and the bed was good. The decoration details are nice. The internet is good and free.The hotel is a short walk from the Toyocho Metro station, there are many restaurants and commodity stores around.","Hong Kong, China","Bustravel88</div><div class=""userLoc""><strong>Hong Kong, China</strong>",80,4.0
335771996,https://www.tripadvisor.com/Hotel_Review-g1066449-d301686-Reviews-Hotel_East_21_Tokyo-Koto_Tokyo_Tokyo_Prefecture_Kanto-or160.html?filterLang=en,Hotel East 21 Tokyo,"December 29, 2015","very comfortable beds, big rooms for Japanese standard. I got the ""other"" view but it was still nice and impressive from 19th floor. very clean. good sound proofing. smoking rooms in the lobby so no need to go out and be cold. a lot of basic shops and convenience store 24/7 and supermarket nearby, as well as few restaurant. quite close to the metro station, unfortunately need to transfer and takes a while to get to most popular places, shibuya is 30-35 minutes away but it's ok. had a great stay! ","Barcelona, Spain","gataskr</div><div class=""userLoc""><strong>Barcelona, Spain</strong>",18,5.0
334488141,https://www.tripadvisor.com/Hotel_Review-g1066449-d301686-Reviews-Hotel_East_21_Tokyo-Koto_Tokyo_Tokyo_Prefecture_Kanto-or160.html?filterLang=en,Hotel East 21 Tokyo,"December 22, 2015","The hotel is in a tall building located at 7 minutes on foot from the Toyo-cho station of Tozai metro line. As the sidewalk was good, the distance from the station was not issue even with luggage. However if you arrive at the JR Tokyo station and foresee to take the Tozai-line, the nearest station is far from the JR station. In such case, you had better to go to the JR Kinshi-cho station and take a bus bound for the Toyo-cho station, or take a taxi.My double room was on the 17th floor, South side, clean, with good quality furniture, a wide screen TV and a clear view on Tokyo bay area. The hotel offered me discount tickets for cleaning and fitness. The breakfast was western, japanese and chinese viking one. I remarked relatively few items for japanese dishes which I disturbed a little. There are shopping arcades with a supermarket at the foot of the building.","Bagneux, France","nakajimah</div><div class=""userLoc""><strong>Bagneux, France</strong>",171,4.0
333239763,https://www.tripadvisor.com/Hotel_Review-g1066449-d301686-Reviews-Hotel_East_21_Tokyo-Koto_Tokyo_Tokyo_Prefecture_Kanto-or165.html?filterLang=en,Hotel East 21 Tokyo,"December 16, 2015","Access by Toyocho Station is easiest. There is a huge local supermarket and drug store located downstairs in the hotel complex area; the supermarket was fun to explore for local food and fresh produce (cheaper than konbini by far and very interesting). There are some restaurants around the area, otherwise not too much to do overall in the area. The hotel is not the easiest to walk to (about 7-10 min walk from station to hotel), and is a quiet area after business hours.There was a small free shuttle minibus between the hotel and Toyocho Station; you should check the times with hotel as it doesn't run the whole day (I think the first half of the day only).Room was comfortable; size was fair. Double bed size was equivalent to having two pillows immediately beside each other.","Melbourne, Australia","Spliceo</div><div class=""userLoc""><strong>Melbourne, Australia</strong>",30,4.0
330422608,https://www.tripadvisor.com/Hotel_Review-g1066449-d301686-Reviews-Hotel_East_21_Tokyo-Koto_Tokyo_Tokyo_Prefecture_Kanto-or165.html?filterLang=en,Hotel East 21 Tokyo,"December 2, 2015","Opulent it's not, however we thoroughly enjoy this hotel and its amenities. In addition to metro station, there are many eateries, convenient stores and even a large supermarket right in the complex. We did not get the Skytree view but the city view is splendid enough. Concierge is very helpful. We will definitely stay here next time.","Irvine, California","DrAria2015</div><div class=""userLoc""><strong>Irvine, California</strong>",1,5.0
330043109,https://www.tripadvisor.com/Hotel_Review-g1066449-d301686-Reviews-Hotel_East_21_Tokyo-Koto_Tokyo_Tokyo_Prefecture_Kanto-or165.html?filterLang=en,Hotel East 21 Tokyo,"November 30, 2015",The rooms are big from Japanese standard and have everything you need to have. Restaurant is good with big breakfast selection. It is a very Japanese experience. A bit far for metro. I would come back on my next trip ,"Helsingborg, Sweden","henrikr460</div><div class=""userLoc""><strong>Helsingborg, Sweden</strong>",40,4.0
