review_id,url,hotel_name,review_date,review_body,user_location,user_name,helpful_vote,rating
750865531,https://www.tripadvisor.com/Hotel_Review-g14129573-d526766-Reviews-Hotel_Monteray_Ginza-Ginza_Chuo_Tokyo_Tokyo_Prefecture_Kanto-or0.html?filterLang=en,Hotel Monteray Ginza,"March 14, 2020","I contacted the hotel for the refund because of COVID 19 outbreak. The hotel responded promptly through travel agency and made the refund. Even though I booked through travel agency, I still receive dexceptional service. I will definitely return to this hotel ","Bangkok, Thailand","Sawasdeekrab</div><div class=""userLoc""><strong>Bangkok, Thailand</strong>",7,5.0
685765211,https://www.tripadvisor.com/Hotel_Review-g14129573-d526766-Reviews-Hotel_Monteray_Ginza-Ginza_Chuo_Tokyo_Tokyo_Prefecture_Kanto-or0.html?filterLang=en,Hotel Monteray Ginza,"July 1, 2019","I usually like to stay in Ginza during my Tokyo trips as it is a central location and I can enjoy proximity to high street and uncountable number of eating and drinking options..But only challenging part about my choice is that it is difficult to get a decent spacious room at my budget. This time I was fortunate to get Hotel Monterey in my budget and this has been one of my best hotel stay in Ginza.The rooms are spacious (which is rare in Tokyo especially this area).Service is excellent.. The hotel staff is prompt and helpful.Location is good, surrounded by multiple eating outlets, 24 hrs convenience stores.It is a must recommended hotel for everyone wanting to stay in Ginza...","Gurugram (Gurgaon), India","RakshitM_12</div><div class=""userLoc""><strong>Gurugram (Gurgaon), India</strong>",85,5.0
741040552,https://www.tripadvisor.com/Hotel_Review-g14129573-d526766-Reviews-Hotel_Monteray_Ginza-Ginza_Chuo_Tokyo_Tokyo_Prefecture_Kanto-or0.html?filterLang=en,Hotel Monteray Ginza,"January 24, 2020","When I’m in Tokyo for business, I normally stay at a nearby international chain hotel and walk pass Hotel Monteray all the time. This time, I decided to give Hotel Monteray a try as I was intrigued by its decor.It is a pleasant surprise. Beside the excellent location, the room is spacious compare to similar hotels in Tokyo. And the shower is probably the best I have experienced in Tokyo, water is hot and strong.Front desk is efficient and pleasant.Price is excellent for the quality it offers. Highly recommended.","Hong Kong, China","alpaalpa</div><div class=""userLoc""><strong>Hong Kong, China</strong>",22,4.0
737297806,https://www.tripadvisor.com/Hotel_Review-g14129573-d526766-Reviews-Hotel_Monteray_Ginza-Ginza_Chuo_Tokyo_Tokyo_Prefecture_Kanto-or0.html?filterLang=en,Hotel Monteray Ginza,"January 6, 2020","The hotel is located at a great place. Very close to major attractions, and subway station is under the building next to the hotel. The staff is very helpful and kind. The room is good size, very clean, and also with a desk and chair.","Philadelphia, Pennsylvania","O32018</div><div class=""userLoc""><strong>Philadelphia, Pennsylvania</strong>",3,5.0
736234373,https://www.tripadvisor.com/Hotel_Review-g14129573-d526766-Reviews-Hotel_Monteray_Ginza-Ginza_Chuo_Tokyo_Tokyo_Prefecture_Kanto-or0.html?filterLang=en,Hotel Monteray Ginza,"January 2, 2020","Our family of 4 stayed in the connecting rooms for 7 nights The rooms are small, which is pretty normal for Tokyo but it was more the fact that there was only a small cupboard with probably 6 hangers we could not unpack so needed to have the suitcases open and in the way. The furniture is chipped and sad looking and in need of replacement as well as the walls are scuffed and needing a fresh coat of paint, actually the whole of the hotel was in need of being freshened up! Only one rickety chair in the room so people tend to sit on the edge of the bed making it sag on one side, I found this very uncomfortable sleeping on a slope. Requested extra pillows before my arrival which they gladly supplied. The bathroom looks like it’s been renovated and had fantastic toiletries etc. Shower was great and hot water was instantaneous. No room safe. No foyer to speak of or seating area.No one helps with bags. The rooms are stuffy and got very hot, air-con didn’t work properly. Free bottled water daily. Many restaurants and shops around the hotel but are expensive being in Ginza. Strong signal Wi-Fi. Rooms were exceptionally clean. Provided pyjamas, which I would not wear they looked like hospital type. A couple of 24/7 convenience stores opposite the hotel.We booked this hotel at the last minute wanting interconnecting rooms, this hotel was the only one left at a reasonable price for Tokyo in a good area. I will look elsewhere next time unless they renovate.Show less","Hong Kong, China","Terry R</div><div class=""userLoc""><strong>Hong Kong, China</strong>",26,3.0
734684885,https://www.tripadvisor.com/Hotel_Review-g14129573-d526766-Reviews-Hotel_Monteray_Ginza-Ginza_Chuo_Tokyo_Tokyo_Prefecture_Kanto-or5.html?filterLang=en,Hotel Monteray Ginza,"December 26, 2019","My family of 4 stayed in the connecting room and my brother stayed in a nearby room for 4 nights in total. The rooms are small, but normal for Tokyo I think. To put things into perspective, we hardly had room to place 2 large Samsonite suitcases and open them. But small rooms can be cozy and the the sleep was comfortable and quiet. There was a bathtub which is important, and wifi signal was strong. There is pay tv but the climate control was not great and we struggled to get the perfect temperature we liked. Thankfully there is a decent air purifier in each room to freshen up the environment. We never tried the breakfast as there are so many nice eating places around there, including decent coffee shops and a Natural Lawson convenience store right opposite the hotel. The hotel is 2-3 blocks away from the main Ginza shopping area and the nearest train station is Higashi Ginza. I think the price is reasonable for the Ginza area and we didn't have problems with the service. The hotel was busy but didn't give an overcrowded feeling, which I liked.",Bangkok,"AnakinVan</div><div class=""userLoc""><strong>Bangkok</strong>",152,3.0
730745411,https://www.tripadvisor.com/Hotel_Review-g14129573-d526766-Reviews-Hotel_Monteray_Ginza-Ginza_Chuo_Tokyo_Tokyo_Prefecture_Kanto-or5.html?filterLang=en,Hotel Monteray Ginza,"December 4, 2019","This must have been a great hotel when it would've opened and the place to be. But now it isn't as well maintained as it ought to be. If you can look past the little niggles, then it's a okay place to be. The location is to die for though.It's a shame because this place could really be top of the pops in Ginza.","National Capital Territory of Delhi, India","karanpandit</div><div class=""userLoc""><strong>National Capital Territory of Delhi, India</strong>",4,3.0
729574615,https://www.tripadvisor.com/Hotel_Review-g14129573-d526766-Reviews-Hotel_Monteray_Ginza-Ginza_Chuo_Tokyo_Tokyo_Prefecture_Kanto-or5.html?filterLang=en,Hotel Monteray Ginza,"November 29, 2019","The hotel is about 10 minutes walk from the central station.The room was comfortable, and larger than other hotel rooms we had elsewhere.We particularly liked the mobile phone available, so we could use it as sat nav, or to ring family who had another room.There was a good selection at breakfast.","Sittingbourne, United Kingdom","deekay99</div><div class=""userLoc""><strong>Sittingbourne, United Kingdom</strong>",24,4.0
724689978,https://www.tripadvisor.com/Hotel_Review-g14129573-d526766-Reviews-Hotel_Monteray_Ginza-Ginza_Chuo_Tokyo_Tokyo_Prefecture_Kanto-or5.html?filterLang=en,Hotel Monteray Ginza,"November 7, 2019","It takes just one individual to ruin what could have been a good experience in a hotel. The individual in this case was a racist woman working the front desk at about 15:15 pm on Thursday, Nov. 7. My wife and I asked for information on how to get to Narita Airport using the Limousine Bus. The way she brusquely answered my questions and her haughty remark: “Why don’t you and your wife just walk 10 minutes to the bus stop to get the bus to the airport instead of taking a cab?” To which I replied, “I wish we could, unfortunately my wife could barely walk because of a badly sprained ankle.” Her response was to simply give me a bus schedule...She seemed to just want me and my wife to go away - and it occurred to me that she wanted to me move on so she can help a local Japanese guest. I wonder if she would have been more courteous and helpful if my skin color was WHITE??? It was disappointing that the great experience we’ve had thus far in Tokyo would be ruined by this ignorant person! Let me describe her for the readers of this review: she is Japanese, a woman with long black hair tied neatly and is about 5’ 6”. And as I mentioned she was on duty at the front desk at 5:15 pm on Nov. 7, 2019.","Brea, California","Sonnymao</div><div class=""userLoc""><strong>Brea, California</strong>",58,1.0
723375790,https://www.tripadvisor.com/Hotel_Review-g14129573-d526766-Reviews-Hotel_Monteray_Ginza-Ginza_Chuo_Tokyo_Tokyo_Prefecture_Kanto-or5.html?filterLang=en,Hotel Monteray Ginza,"November 2, 2019","Blimey! Booked very last minute and as this hotel was ‘advertised’ as a ‘boutique hotel’ we went for it! Boutique in this sense means no facilities at all! No lobby area, no bar, no concierge, no room service! To be fair the room wasn’t too bad - toiletries etc provided with reasonable towels and slippers. No gown, no safe, very basic tea / coffee making facilities, one uncomfortable pillow and an ok ish mattress. Room was exceptionally clean and a reasonable size (a corner room with 4 windows and a view, the rest look tiny if the fire plan on the back of the door is anything to go by) with minimal storage space. It looks as if the rooms and corridors have been refurbished. Breakfast was ok with an omelette station, yogurt, tinned fruit (what’s that all about! Think 1970’s!) and good bakery items. The hotel is in a great position slap bang in the middle of Ginza. The metro station is only about 30 metres from the front door and about 20 mins walk to Tokyo station. We were only here for 4 nights with hand luggage, and this was not our first trip to Tokyo, so for us this wasn’t a problem. If you are a tourist and needing help and advice (in other words a concierge service) and room for luggage this would be hopeless in all honesty! ","Barlaston, United Kingdom","CazRob</div><div class=""userLoc""><strong>Barlaston, United Kingdom</strong>",88,2.0
719701887,https://www.tripadvisor.com/Hotel_Review-g14129573-d526766-Reviews-Hotel_Monteray_Ginza-Ginza_Chuo_Tokyo_Tokyo_Prefecture_Kanto-or10.html?filterLang=en,Hotel Monteray Ginza,"October 19, 2019","This hotel was lovely inside and out. The staff greeted me warmly. They were friendly and helpful. The room was spacious (by Tokyo standards), well appointed and clean. Robes and slippers were provided. The complimentary smart phone that comes with the room was extremely helpful for navigating Tokyo for my first visit. Very much appreciated! Breakfast was an interesting mix of western and Japanese breakfast with very helpful and attentive staff. It is also centrally located, close to many shops and restaurants. Also very close to the subway and only a 5-10 minute walk to Ginza station with luggage.","Portland, Oregon","MollyTveite</div><div class=""userLoc""><strong>Portland, Oregon</strong>",8,5.0
717179192,https://www.tripadvisor.com/Hotel_Review-g14129573-d526766-Reviews-Hotel_Monteray_Ginza-Ginza_Chuo_Tokyo_Tokyo_Prefecture_Kanto-or10.html?filterLang=en,Hotel Monteray Ginza,"October 10, 2019","We had two adjoining rooms in this lovely hotel. Great location, convenient to transport and lots of great restaurants. Clean and bright, while slightly old-fashioned, we found it charming. The staff was wonderful and helpful.","Sydney, Australia","598KellyH598</div><div class=""userLoc""><strong>Sydney, Australia</strong>",56,5.0
715989832,https://www.tripadvisor.com/Hotel_Review-g14129573-d526766-Reviews-Hotel_Monteray_Ginza-Ginza_Chuo_Tokyo_Tokyo_Prefecture_Kanto-or10.html?filterLang=en,Hotel Monteray Ginza,"October 7, 2019",The hotel was magnificent. The bathroom shower was to die for. The shower and bathtub had plenty of hot water. Really liked the portable phone and gps they gave you to use to find your way around town.,"Chicago, Illinois","davidhenryhall</div><div class=""userLoc""><strong>Chicago, Illinois</strong>",0,5.0
713762805,https://www.tripadvisor.com/Hotel_Review-g14129573-d526766-Reviews-Hotel_Monteray_Ginza-Ginza_Chuo_Tokyo_Tokyo_Prefecture_Kanto-or10.html?filterLang=en,Hotel Monteray Ginza,"September 28, 2019","My wife and I stayed here for 4 nights. Slightly old fashioned hotel but very functional, bright, clean and good room size. We had a bed and breakfast deal and we both enjoyed the buffet breakfasts - very wide selection of English dishes ( they have Japanese options too) so we’ll fed at breakfast. We enjoyed the location which is short taxi ride from Tokyo station and less than 10 minute walk to the nearest JR station - Yamote line. There are closer subway stations in Ginza. We did use these as well as our JR pass but got away with buying single tickets when we needed them. We both loved Tokyo which is very clean, felt really safe and people very helpful. Tourist office does a great Tokyo guide book with maps (free) which I sometimes used to avoid carrying my Lonely Planet guide around. Would certainly recommend the hotel. Staff at reception very helpful and smiley.",Northern Ireland,"Prospector1</div><div class=""userLoc""><strong>Northern Ireland</strong>",197,5.0
702677901,https://www.tripadvisor.com/Hotel_Review-g14129573-d526766-Reviews-Hotel_Monteray_Ginza-Ginza_Chuo_Tokyo_Tokyo_Prefecture_Kanto-or10.html?filterLang=en,Hotel Monteray Ginza,"August 24, 2019","The room is nice, clean and big enough for a couple and some space for large luggage arrangement. The staffs have good hospitality and are able to communicate effectively in English, convenient location.It is a small hotel so nothing much to do. If you just want to find a peaceful reasonably priced hotel to rest in Ginza area, this one will serve your need.",,earthallianceh,3,4.0
699790301,https://www.tripadvisor.com/Hotel_Review-g14129573-d526766-Reviews-Hotel_Monteray_Ginza-Ginza_Chuo_Tokyo_Tokyo_Prefecture_Kanto-or15.html?filterLang=en,Hotel Monteray Ginza,"August 16, 2019","My friend & I shared a twin room on 13th floor. The room was so musty and stale when we walked in so we had them open the window. The A/C gave me terrible allergy probably due to it being old and dusty. The breakfast was ok, weird set-up and no gluten-free options. Over-priced for what it is.","Auckland Central, New Zealand","keepitonehun</div><div class=""userLoc""><strong>Auckland Central, New Zealand</strong>",2,2.0
694536032,https://www.tripadvisor.com/Hotel_Review-g14129573-d526766-Reviews-Hotel_Monteray_Ginza-Ginza_Chuo_Tokyo_Tokyo_Prefecture_Kanto-or15.html?filterLang=en,Hotel Monteray Ginza,"July 31, 2019",Good hotel in the area of Ginza. The room was comfortable and big enough for two. They offered japanese and continental breakfast but not much choice only basically. Close to Ginza-Itchome underground station. There’re many convenient stores in surrounding.,"Bangkok, Thailand","PrisnaP1</div><div class=""userLoc""><strong>Bangkok, Thailand</strong>",14,4.0
693152597,https://www.tripadvisor.com/Hotel_Review-g14129573-d526766-Reviews-Hotel_Monteray_Ginza-Ginza_Chuo_Tokyo_Tokyo_Prefecture_Kanto-or15.html?filterLang=en,Hotel Monteray Ginza,"July 27, 2019","I booked this hotel because I liked my November 2018 stay. However, there are a lot of changes from my previous booking which my Citi Prestige Concierge booked via Hotels.com. The room we stayed was so smelly and the sheets weren’t changed despite my request! My baby had created some stains on the linen and I was surprised to find the same stain on the same spot when I came back. The guy doing the cleaning just flipped the duvet :( So disappointed. I wonder if this was because I was offered a room upgrade for only 5K yen for 5 nights and I refused? Probably this room was really filthy to begin with :( I am very sad about this incident and I will not bringing the issue downstairs at the lobby because they will have a hard time understanding me. Thus, I am writing a review in text.","Pasig, Philippines","Hazel Ann G</div><div class=""userLoc""><strong>Pasig, Philippines</strong>",1,2.0
692286378,https://www.tripadvisor.com/Hotel_Review-g14129573-d526766-Reviews-Hotel_Monteray_Ginza-Ginza_Chuo_Tokyo_Tokyo_Prefecture_Kanto-or15.html?filterLang=en,Hotel Monteray Ginza,"July 24, 2019",From the Qantas booking it looked delightful...elegant old world hotel..however..in reality .our first impression at the front desk was not so good. I have travelled japan and stayed in 6 different hotel chains. from Diaichi to mystay as well as ryokons so I know what good service in Japan looks like. the girls at the front desk when we booked in really could nt be bothered...the one who eventually served me had serious attitude. It was too painful to serve me...it didnt get any better. this hotel is frequented by japanese and asian travellers. other travellers were not welcome.The night staff gentleman when I had to go the red cross at ryponggi was very helpful. my son had broken his leg. other than that we were not given any assistance. We had to leave the hotel 3 nights in advance and I was told very clearly that I wasnt getting a refund even though I hadnt asked. A man behind the desk also told me if I check out I cant come back. then demanded I pay 410yen for the phone call made that morning..(to qantas)...all in all if you are a foreigner try mitsui gardens or my stay.on the up side just across the road two great little convenience stores.super friendly a drug store as well. and some great bars.,"Sydney, Australia","HappyT215</div><div class=""userLoc""><strong>Sydney, Australia</strong>",9,2.0
689062584,https://www.tripadvisor.com/Hotel_Review-g14129573-d526766-Reviews-Hotel_Monteray_Ginza-Ginza_Chuo_Tokyo_Tokyo_Prefecture_Kanto-or15.html?filterLang=en,Hotel Monteray Ginza,"July 12, 2019","This is an older hotel with bigger rooms than the newer hotels in Japan. The check in/out process was quick. The staff members were pleasant and polite as all Japanese are - yes, we encountered the most polite group of people among all groups on our travels. During our ten day trip to Japan, we did not encounter one Japanese person who had an attitude problem. Everyone was calm and amazingly polite. Everyone from hotel staff, clerks at stores, restaurant servers, employees at train stations, etc... were courteous.Back to the hotel...they let you leave your luggage at the front desk for free after check out if you have a later flight. The hotel is a short walk from Tokyo station which makes it convenient to catch the Narita Express to the airport. There are many shops nearby; however, clothing in these shops were extremely pricey. Restaurants in this area were more expensive than in other areas of Tokyo as well. We were lucky to find two reasonably priced restaurants that served excellent sushi in this area.Overall, the hotel is decent for the price we paid.","Vancouver, Canada","washingt0n2009</div><div class=""userLoc""><strong>Vancouver, Canada</strong>",23,4.0
681337015,https://www.tripadvisor.com/Hotel_Review-g14129573-d526766-Reviews-Hotel_Monteray_Ginza-Ginza_Chuo_Tokyo_Tokyo_Prefecture_Kanto-or20.html?filterLang=en,Hotel Monteray Ginza,"June 13, 2019","Located in the CBD, it is an older style, renovated hotel with medium sized rooms. The room temperature was too hot for our liking with the a/c controlled remotely by hotel with no user adjustment. The beds were comfortable, although the pillows were too soft for our liking. A Good breakfast was included with a large variety of both Japanese and Western foods. Free bottled water supplied in room along with free WiFi with a reasonable speed. The shower was over the bath. The bath has high sides which would be an issue for those with mobility or balance issues. A good range of toiletries were included.",Wollongong,"RetireeBob</div><div class=""userLoc""><strong>Wollongong</strong>",118,3.0
679118053,https://www.tripadvisor.com/Hotel_Review-g14129573-d526766-Reviews-Hotel_Monteray_Ginza-Ginza_Chuo_Tokyo_Tokyo_Prefecture_Kanto-or20.html?filterLang=en,Hotel Monteray Ginza,"June 5, 2019","Reasonable value for a Tokyo hotel in a quiet part of Ginza. Shops and restaurants are in the surrounding area. Good shower, comfortable bed, smallish room. Staff held our bags after checkout, which was handy as we had an evening flight. Windows do not open, which would have been nice to let some fresh air in. There is a metro station nearby but the line isn't as useful as the Ginza line which is a little further away and connects to Tokyo station.","Melbourne, Australia","simone_a13</div><div class=""userLoc""><strong>Melbourne, Australia</strong>",82,4.0
676990936,https://www.tripadvisor.com/Hotel_Review-g14129573-d526766-Reviews-Hotel_Monteray_Ginza-Ginza_Chuo_Tokyo_Tokyo_Prefecture_Kanto-or20.html?filterLang=en,Hotel Monteray Ginza,"May 27, 2019","The hotel is located in a small quiet side street in the district of Ginza. Restaurants, bars and shops are just around the corner. The Metro is only 2 minutes away. A good starting position to discover Tokyo. The rooms are sufficiently large and clean. The staff is friendly. But there is no bar. The rooms are a little bit sensitive (Lodness). WLAN and an own ""tablet"" with internet and telephone is freely available in every room. We didn't have breakfast, we rather went to the numerous cafes directly in the surroundings. Good hotel. Gladly again.","Mannheim, Germany","Traveltoasia123</div><div class=""userLoc""><strong>Mannheim, Germany</strong>",45,4.0
674942025,https://www.tripadvisor.com/Hotel_Review-g14129573-d526766-Reviews-Hotel_Monteray_Ginza-Ginza_Chuo_Tokyo_Tokyo_Prefecture_Kanto-or20.html?filterLang=en,Hotel Monteray Ginza,"May 19, 2019","I stayed here while attending a conference in Tokyo at the International Tokyo Forum. I is about 10 minutes walk to the conference centre which is very convenient. Also about 20 minutes walk to the main Tokyo station. The location is a highlight, as its close to the main shopping area of Ginza. The hotel is a bit older but the rooms are bigger and not as cramped as some other hotels I've stayed at in Tokyo. I also realized a lot of people stay here including tour groups, so sometimes it can take a bit of a wait to use the lifts and there may be a wait at breakfast. The buffet breakfast is great though with both western and Japanese options. Also an omelette station where the chefs cook big fluffy omelettes fresh.","Cambridge, Australia","racheyf2015</div><div class=""userLoc""><strong>Cambridge, Australia</strong>",11,4.0
659800047,https://www.tripadvisor.com/Hotel_Review-g14129573-d526766-Reviews-Hotel_Monteray_Ginza-Ginza_Chuo_Tokyo_Tokyo_Prefecture_Kanto-or20.html?filterLang=en,Hotel Monteray Ginza,"March 20, 2019","A typical business style hotel in Tokyo near the Ginza. Clean and accommodating, but not particularly large. The main selling feature is location. It is easy walking distance from Tokyo station and a similar walking distance from the centre of the Ginza. The ability to walk to Tokyo station is a real win on a first night in Tokyo after a trans-Pacific flight. But there are better 'home base' locations to be a tourist.",Varies...,"284Weary_traveller22</div><div class=""userLoc""><strong>Varies...</strong>",38,4.0
659372076,https://www.tripadvisor.com/Hotel_Review-g14129573-d526766-Reviews-Hotel_Monteray_Ginza-Ginza_Chuo_Tokyo_Tokyo_Prefecture_Kanto-or25.html?filterLang=en,Hotel Monteray Ginza,"March 18, 2019","The Hotel Monterey in Ginza is a business hotel that is showing its age. Furniture is chipped, doors hang crooked, and paint is no longer fresh. The lobby area is a pretty somber affair. Like many hotels of this price category, a lot of rooms face a wall immediately opposite the hotel.Internet is unreliable and slow. But the hotel has two redeeming factors: breakfast is a cut above most business hotels in this price category, with lots of variety and fresh produce. And for people looking to stay in Ginza, the location just steps away from all of the shops is hard to beat.","Copenhagen, Denmark","elber2</div><div class=""userLoc""><strong>Copenhagen, Denmark</strong>",68,3.0
657194134,https://www.tripadvisor.com/Hotel_Review-g14129573-d526766-Reviews-Hotel_Monteray_Ginza-Ginza_Chuo_Tokyo_Tokyo_Prefecture_Kanto-or25.html?filterLang=en,Hotel Monteray Ginza,"March 8, 2019","This hotel has a very good location near shopping centres and restaurants. There is a corner shop opposite the hotel.Rooms are small, beds ok. Breakfast was good. The tap water is good, but you also get every day a water bottle from the hotel.","Vantaa, Finland","007Akka</div><div class=""userLoc""><strong>Vantaa, Finland</strong>",16,4.0
