review_id,url,hotel_name,review_date,review_body,user_location,user_name,helpful_vote,rating
750508949,https://www.tripadvisor.com/Hotel_Review-g1066449-d301686-Reviews-Hotel_East_21_Tokyo-Koto_Tokyo_Tokyo_Prefecture_Kanto-or0.html?filterLang=en,Hotel East 21 Tokyo,"March 11, 2020","We loved Hotel East 21 Tokyo! Nightly price was very affordable, the amenities offered in the room was probably the best I've had for the price we paid. The room was always nice and tidy, and they always ended up refilling our shampoo/conditioner/body wash-- which was nice because in the U.S., you usually only just get that one travel size bottle. Some reviews complained that the hotel was too far from a metro station, but the walk really wasn't that bad. A big plus was that it was minutes away from a 711 and also inside a plaza. The staff was welcoming and accommodating. We were a party of 2 so we booked the small double room and I do want to point out that the space is very cozy but sufficient. Our room was also nice to have a city view of Tokyo. The hotel also offers shuttles to/from the airport and to/from Disney Sea/Disneyland for a fee, which was super convenient. ",,darlenechou,0,5.0
682805377,https://www.tripadvisor.com/Hotel_Review-g1066449-d301686-Reviews-Hotel_East_21_Tokyo-Koto_Tokyo_Tokyo_Prefecture_Kanto-or0.html?filterLang=en,Hotel East 21 Tokyo,"June 19, 2019","Location about 10 minute walk to the nearest metro. But lots of eateries nearby, even a supermarket nearby. They provide free shuttle to disney resort and paid shuttle to skytower and odaiba. Staff provided excellent serviceOverall, would stay here again.","Orange County, California","aser2018</div><div class=""userLoc""><strong>Orange County, California</strong>",6,5.0
749268540,https://www.tripadvisor.com/Hotel_Review-g1066449-d301686-Reviews-Hotel_East_21_Tokyo-Koto_Tokyo_Tokyo_Prefecture_Kanto-or0.html?filterLang=en,Hotel East 21 Tokyo,"March 5, 2020","Hotel was lovely, good location with easy access to the subway just a short walk away. However there is a free courtesy bus to the subway they have an airport limo service and there is a bus that takes you straight to Sky Tree for a very small cost. Staff are all friendly and helpful and I was surprised how large the room was compared to other hotels. The best bit was the view from our window, stunning. Nothing was too much trouble and will definitely stay again","Madeley, United Kingdom","Lisa B</div><div class=""userLoc""><strong>Madeley, United Kingdom</strong>",21,5.0
745546961,https://www.tripadvisor.com/Hotel_Review-g1066449-d301686-Reviews-Hotel_East_21_Tokyo-Koto_Tokyo_Tokyo_Prefecture_Kanto-or0.html?filterLang=en,Hotel East 21 Tokyo,"February 16, 2020","The staff at this property are amazing, service for my 2 night stay was outstanding. The room was a fair size for a single room. The breakfast was excellent! The WiFi was superb. Why I am not rating it 5? The location is a bit out but the train station is near enough. The gym is an additional payment and I think this should be included in a hotel stay and finally, only one English tv station which is CNN! In my view a hotel catering for international tourists should have a bit more than this on their television line up!","Sydney, Australia","Oztravels7</div><div class=""userLoc""><strong>Sydney, Australia</strong>",115,4.0
733519302,https://www.tripadvisor.com/Hotel_Review-g1066449-d301686-Reviews-Hotel_East_21_Tokyo-Koto_Tokyo_Tokyo_Prefecture_Kanto-or0.html?filterLang=en,Hotel East 21 Tokyo,"December 18, 2019","The first day in Japan, our 4 days Tokyo with this property was very comfortable from check in to check out, very stylish hotel but except room every other amenities are changeable, however, we were not looking for the same as once we leave hotel returns only by evening, the nearest metro/subway is around 1 kM.The hotel provides free drop off facility on regular interval but till 12 Noon for Metro/subway station.very convenient in term of big supermarket lots of food options (Not for vegetarian) within the property premises.","Dubai, United Arab Emirates","Kaushikdiku</div><div class=""userLoc""><strong>Dubai, United Arab Emirates</strong>",54,4.0
731856561,https://www.tripadvisor.com/Hotel_Review-g1066449-d301686-Reviews-Hotel_East_21_Tokyo-Koto_Tokyo_Tokyo_Prefecture_Kanto-or5.html?filterLang=en,Hotel East 21 Tokyo,"December 10, 2019","it is a great hotel I stayed there for 6 days with my friend a bus picked me up from the airport and brought me to the magnificent hotel it has an indoor pool and outdoor pool it also has a spa, this first impression of Tokyo would make me want to go to Tokyo again",,hoiiiiiiiiiiiiiiiiii,0,5.0
731326009,https://www.tripadvisor.com/Hotel_Review-g1066449-d301686-Reviews-Hotel_East_21_Tokyo-Koto_Tokyo_Tokyo_Prefecture_Kanto-or5.html?filterLang=en,Hotel East 21 Tokyo,"December 8, 2019","My family and I stayed at this hotel as part of an airfare+hotel package. The per night cost of the hotel turned out to be a little over 100 USD a night. This is very affordable for a four-star hotel in Tokyo. The nearest subway station takes you straight to downtown, in about 10 minutes, and is about a 10-minute walk from the hotel. The neighborhood looks quiet but it surprisingly is teeming with a lot of office workers during rush hours. The hotel offers complimentary transfers to the subway station at set times. The hotel itself reminds one of the big urban hotels of the 1990s. Not to worry though, everything is kept spic and span. The hallways always had a faint smell of fragrance, which is perfect. The rooms are made up daily with nothing left untouched (even brochures which had been lying about had been stacked in order). There are a lot of in-room amenities, including a fabric freshener. Most 5-star hotels don't even have the same amount and variety of amenities. If I have to think of a downside, it would be the modest size of the standard rooms (higher categories seem to be on par with hotels of the same class), but such is the norm in Japan.","Luzon, Philippines","horacecima</div><div class=""userLoc""><strong>Luzon, Philippines</strong>",28,5.0
716497337,https://www.tripadvisor.com/Hotel_Review-g1066449-d301686-Reviews-Hotel_East_21_Tokyo-Koto_Tokyo_Tokyo_Prefecture_Kanto-or5.html?filterLang=en,Hotel East 21 Tokyo,"October 8, 2019","Not really located around any attractions but close to subway and I walked to Skytree other places (about an hour I think). Room was clean. Breakfast was good. Service was excellent except for not letting me check in early - I had not pre-booked that so not their fault and they sent my bag up when the room was ready).. Overall would recommend as an option but Tokyo is so big that you may want to plan your hotel based on what you want to do. That being said, close subway made things fairly easy and I would go back here.",phnom penh,"TGDF</div><div class=""userLoc""><strong>phnom penh</strong>",21,4.0
716491780,https://www.tripadvisor.com/Hotel_Review-g1066449-d301686-Reviews-Hotel_East_21_Tokyo-Koto_Tokyo_Tokyo_Prefecture_Kanto-or5.html?filterLang=en,Hotel East 21 Tokyo,"October 8, 2019",Pros Nice staff. The waitress and bar staff who served us in the 21st floor bar were excellent. Lots of staff on hand. Good bathroom size. Not the smallest room I have had in Tokyo. Free bus service to station was helpful. ConsFeels a bit out of the way for exploring Tokyo. The hotel is not kidding when it advertises a “small double”. Smallest double bed I have ever slept in. Breakfast was not the standard I gave come to expect from Japanese hotels. Very standard food and almost no change in offering across the week. ,"Cabarita, Australia","V1110UBpaulm</div><div class=""userLoc""><strong>Cabarita, Australia</strong>",8,3.0
714726328,https://www.tripadvisor.com/Hotel_Review-g1066449-d301686-Reviews-Hotel_East_21_Tokyo-Koto_Tokyo_Tokyo_Prefecture_Kanto-or5.html?filterLang=en,Hotel East 21 Tokyo,"October 2, 2019","The hotel is in Koto-ku, 20 min by subway from Tokyo. You need to walk 15 minutes to the Toyocho station though. The hotel is well maintained, rooms are clean, well lit, bigger than usual room size for Tokyo. Big windows with a view of the city. Room has amenities, kettle, coffee, tea, fridge. Good wifi coverage. Bathroom is clean, with amenities, hair drier.Bed is comfy, all comfortable. Ironing board you can borrow. The hotel has restaurants but you can go around for eating as there is a small commercial center just downstairs with restaurants, cafes and supermarket, very convenient. If you go to Tokyo, maybe the only thing would be walking for 15 min (dragging a heavy bag maybe tough) to the subway station or if you decide to take a bus(challenging for foreigners). There is a bus to the airport and they have shuttle service to the subway station but early in the morning...they have a shuttle bus also for Tokyo Disneyland for the ones interested. The staff is very attentive too, so a nice stay. I recommend.","Singapore, Singapore","williefil13</div><div class=""userLoc""><strong>Singapore, Singapore</strong>",84,4.0
709373218,https://www.tripadvisor.com/Hotel_Review-g1066449-d301686-Reviews-Hotel_East_21_Tokyo-Koto_Tokyo_Tokyo_Prefecture_Kanto-or10.html?filterLang=en,Hotel East 21 Tokyo,"September 13, 2019","We stayed there with my teenage son for 2 nights and at check-in the employee although seeing we got there on foot did not bother to mention that they offered a free shuttle service to the closest metro station (a 12 min walk, that can be unpleasant in the heat when dragging a suitcase) . We learned of it the day of our departure which happened to be the day after typhoon Kazai and public transportation was quite disturbed. Luckily the concierge had reliable info on the metro network status. Still at check-in the employee did not bother to tell us much, maybe because of his poor english (I don’t blame him though but her mgmt). So we also found out by chance that the hotel was on the route of a semi-express bus to Tokyo Skytree and Odaiba, and that the fare could be paid with regular transport cards (e.g Suica) ... these are 2 major attractions that we visited on our own.Lastly the surcharge to access the garden pool: over 30 euros pp on week days and over 55 euros pp on weekends is simply a rip-off considering the room rate! I would not recommend it and certainly won’t go back","Gembloux, Belgium","McU4</div><div class=""userLoc""><strong>Gembloux, Belgium</strong>",40,1.0
706686795,https://www.tripadvisor.com/Hotel_Review-g1066449-d301686-Reviews-Hotel_East_21_Tokyo-Koto_Tokyo_Tokyo_Prefecture_Kanto-or10.html?filterLang=en,Hotel East 21 Tokyo,"September 4, 2019",Rooms are big enough and the view from the room was lovely. There are lots of restaurant and the staffs are really nice and kind. Food was lovely. My wife and I enjoyed our time. Best place in tokyo Recommend to anyone.,"Perth, Australia","castlechri25</div><div class=""userLoc""><strong>Perth, Australia</strong>",0,5.0
703230137,https://www.tripadvisor.com/Hotel_Review-g1066449-d301686-Reviews-Hotel_East_21_Tokyo-Koto_Tokyo_Tokyo_Prefecture_Kanto-or10.html?filterLang=en,Hotel East 21 Tokyo,"August 26, 2019","The rooms are big with nice views, it is very clean and its location is very good with plenty of restaurants and supermarkets around the area.Lovely staff.The nearest tube station is 8 minutes walk and there is a free minibus from the hotel to the station","Milton Keynes, United Kingdom","CARMENAFISA</div><div class=""userLoc""><strong>Milton Keynes, United Kingdom</strong>",0,5.0
699066132,https://www.tripadvisor.com/Hotel_Review-g1066449-d301686-Reviews-Hotel_East_21_Tokyo-Koto_Tokyo_Tokyo_Prefecture_Kanto-or10.html?filterLang=en,Hotel East 21 Tokyo,"August 14, 2019","First I would give 3 but communication takes to a 2, this is so important esp when they site english speaking staff. Website says they have English speaking staff, that is NOT correct. This is 3rd hotel so far in our 3 week trip. This is the 1st hotel we have had communication issues. This has been the most expensive and least accomodating.They charge extra for everything! The room is large,but that is all.The bed has a bottom sheet and a down coverlet that is it with a pillow.If you have to call down stairs or try to talk with anyone at pool spa area you can forget it. I had a translator on my phone and despite that the young lady cocked her head and just kept repeating the same statement, finally i gave up and walked away. Yes it has a kettle, but no tea or coffee bags, yes there is a shuttle to airport, but there is a charge $30 head, Yes there is a pool but that cost for a family of 3 to use ONLY outside pool $ 190.00 for ONE day during week.I would NOT stay here again. Too many other options focused on customer satisfaction.","Bel Air, Maryland","Lisa M</div><div class=""userLoc""><strong>Bel Air, Maryland</strong>",5,2.0
698624916,https://www.tripadvisor.com/Hotel_Review-g1066449-d301686-Reviews-Hotel_East_21_Tokyo-Koto_Tokyo_Tokyo_Prefecture_Kanto-or10.html?filterLang=en,Hotel East 21 Tokyo,"August 13, 2019","ConsYou have to pay extra to watch TV, and I mean just to watch TV, nothing special, never seen this option before. This payment is Daily.You have to pay extra to use the pool, and being a family this charge can be even more expensive than the room itself. I'm talking about week days, because during the weekends the price is even higher!!!!Of course breakfast is additional as well. Is not a nice buffet, just a continental option..Closest metro station (Toyocho) is about 15 minutes walk, not a big deal unless is summer time...these 15 minutes were hell every day..ProsThe hotel is part of small mall/restaurants area, it means just taking the elevator takes you to a good supermarket, drugstore, bakery or restaurant, where you can actually have a good breakfast/meal.OthersThe rooms are small, I had to take 2 rooms to accommodate my familyThe area (once in the metro) is fairly distanced from nice areas like skytree, ginza & shibuya.","Los Angeles, California","carlosb510</div><div class=""userLoc""><strong>Los Angeles, California</strong>",7,3.0
693528040,https://www.tripadvisor.com/Hotel_Review-g1066449-d301686-Reviews-Hotel_East_21_Tokyo-Koto_Tokyo_Tokyo_Prefecture_Kanto-or15.html?filterLang=en,Hotel East 21 Tokyo,"July 28, 2019","we arrived at the hotel yesterday and are here for two weeks, we were unaware of the additional pool fees which are charged daily no matter how long you wish to swim. It will cost my family around £80 a day extra if I wish to go for a dip in my pool on what is already a very expensive trip. At the weekend this is around £110. We intend to do lots of sight seeing of course so there is no option to go for an hour to unwind later. These are all import considerations. The only outdoor space to sit and unwind is the pool garden and you have to pay the fee. If you wish to sit in any lounge area in the hotel you must buy food or drink. There are a couple of seats in the lobby. The rooms are tiny and is the only place we can chill when wanting to rest from sight seeing so it is very claustrophobic for a family. I really would not recommend staying here. There seams to be no consideration for families at all.",manchester,"treechipea</div><div class=""userLoc""><strong>manchester</strong>",10,1.0
693342299,https://www.tripadvisor.com/Hotel_Review-g1066449-d301686-Reviews-Hotel_East_21_Tokyo-Koto_Tokyo_Tokyo_Prefecture_Kanto-or15.html?filterLang=en,Hotel East 21 Tokyo,"July 28, 2019","This is a fine hotel with 600 m to the T-line subway, so what’s the problem? The room WiFi is so bad, that it is effectively out of order. We had the hotel “experts” looking at it twice, but they clearly did not have a clue. Breakfast is seriously overpriced, but there are plenty of alternatives in the complex, so no worries.","Hoersholm, Denmark","Therealjens</div><div class=""userLoc""><strong>Hoersholm, Denmark</strong>",14,2.0
693143119,https://www.tripadvisor.com/Hotel_Review-g1066449-d301686-Reviews-Hotel_East_21_Tokyo-Koto_Tokyo_Tokyo_Prefecture_Kanto-or15.html?filterLang=en,Hotel East 21 Tokyo,"July 27, 2019","Very nice hotel and rooms. Breakfast was excellent, there is a variety for English, Chinese and Japanase cuisine. Staff is friendly and approachable. Stayed with friends and all enjoyed the stay. Very pleased with our choice.Regrettably, it’s not that convenience with heavy luggage, too far away from metro station.","Hong Kong, China","wandererc2014</div><div class=""userLoc""><strong>Hong Kong, China</strong>",18,4.0
687627205,https://www.tripadvisor.com/Hotel_Review-g1066449-d301686-Reviews-Hotel_East_21_Tokyo-Koto_Tokyo_Tokyo_Prefecture_Kanto-or15.html?filterLang=en,Hotel East 21 Tokyo,"July 7, 2019","I appreciate that this hotel doesn’t pretend to be something it’s not—it is not a new or luxury property, and it is priced accordingly. The rooms are very dated and not in the best condition, but certainly fine as you really aren’t paying for a luxury room. I asked for a quiet room on a high floor and was upgraded to a larger room, which was very much appreciated. The view was fantastic and the free wifi was decent. I would stay again.","Waterloo, Iowa, USA","cybertraveler14</div><div class=""userLoc""><strong>Waterloo, Iowa, USA</strong>",102,4.0
686647242,https://www.tripadvisor.com/Hotel_Review-g1066449-d301686-Reviews-Hotel_East_21_Tokyo-Koto_Tokyo_Tokyo_Prefecture_Kanto-or15.html?filterLang=en,Hotel East 21 Tokyo,"July 4, 2019","Having only stayed in 3 star hotels up until this point, this really felt like being spoiled. Housekeeping seemed to go above and beyond for us. Everything was spotless upon returning each day. Some days even pyjamas were folded neatly on the bed. Very close to Toyocho station. Have shuttle buses to airport and station ad Disney resort. For a small fee of course. Lots of restaurants in the area. And grocery store was open until 10:00-11:00 most nights which was perfect. Definitely recommend.",,344jennk,2,5.0
684329638,https://www.tripadvisor.com/Hotel_Review-g1066449-d301686-Reviews-Hotel_East_21_Tokyo-Koto_Tokyo_Tokyo_Prefecture_Kanto-or20.html?filterLang=en,Hotel East 21 Tokyo,"June 25, 2019","Really pleased with the service we received from this hotel during our 10 day stay. Breakfast was of a very good quality (we didn't have any other meals here) and not as busy as we had been led to believe it might have been. I enjoyed my freshly-prepared omelette every morning! Staff, as has been said before, very polite and professional.Room was of a good size (on 16th floor) with 1 comfy chair and a hard chair (would have appreciated 2 comfy chairs!) - very convenient location just 6-7 mins from Toyocho subway station and 12-15 mins away from central Tokyo/Tokyo station. Would happily return when next in Tokyo (we were visiting our son) - not the cheapest, but in this case we got what we paid for.","Whitchurch, United Kingdom","Nigeljameson</div><div class=""userLoc""><strong>Whitchurch, United Kingdom</strong>",68,5.0
674273698,https://www.tripadvisor.com/Hotel_Review-g1066449-d301686-Reviews-Hotel_East_21_Tokyo-Koto_Tokyo_Tokyo_Prefecture_Kanto-or20.html?filterLang=en,Hotel East 21 Tokyo,"May 15, 2019","I would have given the hotel high review score. It's big, clean, nice. Except, for a theft from my room. I fell asleep with my Kindle and it must have fallen between the sheets. Next morning I went on my business. Never saw the Kindle again, gone with many personal documents and being unlocked. I kept calling the hotel over the next 10 days since I am still in Japan. The Kindle was never found (see arched under the bed, etc.). Whoever did my room must have either tossed it away, or appropriated it. Either way, I can't believe this has happened in Japan. I have been coming here for over a decade, and lived here too.",,lubokujira,0,2.0
667361145,https://www.tripadvisor.com/Hotel_Review-g1066449-d301686-Reviews-Hotel_East_21_Tokyo-Koto_Tokyo_Tokyo_Prefecture_Kanto-or20.html?filterLang=en,Hotel East 21 Tokyo,"April 18, 2019",As soon as we arrived we knew it was a wonderful hotel.Rooms elegantly furnished.Staff were amazing. So polite.So professional.A few minutes from Toyocho metro station that whisked us so quickly to anywhere we wanted to go..We were on the 19th floor which gave us stunning views of Tokyo especially Tokyo Sky TreeBreakfast was great.We would very happily return to this lovely hotel..No complaints ,"Santa Cruz de la Palma, Spain","Gazza87</div><div class=""userLoc""><strong>Santa Cruz de la Palma, Spain</strong>",242,5.0
666340495,https://www.tripadvisor.com/Hotel_Review-g1066449-d301686-Reviews-Hotel_East_21_Tokyo-Koto_Tokyo_Tokyo_Prefecture_Kanto-or20.html?filterLang=en,Hotel East 21 Tokyo,"April 14, 2019","East 21 is a very comfortable hotel in a great location, when I booked I asked for a view of the Skytree and was delighted when to find I'd been given one when I arrived !It is very close to the metro and provides transport which is handy if you have luggage. Lots of choice for breakfast, the staff were helpful and the single room was a good size, I would stay here again when in Tokyo","Moate, Ireland","itchyfeetwestmeath</div><div class=""userLoc""><strong>Moate, Ireland</strong>",4,5.0
656915910,https://www.tripadvisor.com/Hotel_Review-g1066449-d301686-Reviews-Hotel_East_21_Tokyo-Koto_Tokyo_Tokyo_Prefecture_Kanto-or20.html?filterLang=en,Hotel East 21 Tokyo,"March 6, 2019","Hotel staff is very kind, breakfast is very good, regular room was too small I expect it to be cleaner but the most disappointing point when I went to the GYM they ask for extra cost per entry because its for members only. 7 min walk from the nearest metro station","Tel Aviv, Israel","liorderry</div><div class=""userLoc""><strong>Tel Aviv, Israel</strong>",12,3.0
654217776,https://www.tripadvisor.com/Hotel_Review-g1066449-d301686-Reviews-Hotel_East_21_Tokyo-Koto_Tokyo_Tokyo_Prefecture_Kanto-or25.html?filterLang=en,Hotel East 21 Tokyo,"February 22, 2019","It is nice and very clean hotel. Staff is very friendly and helpful. The hotel is located close to disney and other attractions, restaurants etc. Hotel provides free transportation to many locations tourists would like to go eg train station, disney","Vadodara, India","Dilip P</div><div class=""userLoc""><strong>Vadodara, India</strong>",111,5.0
653590559,https://www.tripadvisor.com/Hotel_Review-g1066449-d301686-Reviews-Hotel_East_21_Tokyo-Koto_Tokyo_Tokyo_Prefecture_Kanto-or25.html?filterLang=en,Hotel East 21 Tokyo,"February 19, 2019","Never heard of this hotel before, and been to Tokyo 3 or 4 times, always stayed at the Prince at the Minato due to the room size of the hotel and extra luxury for that that hotel. And Hotel East 21 at toyocho surprised me with the service from the staffs and roomy size of the room, walkable distance to the transport. Can’t go wrong with this little piece of luxury.","Adelaide, Australia","S C H</div><div class=""userLoc""><strong>Adelaide, Australia</strong>",3,5.0
649976851,https://www.tripadvisor.com/Hotel_Review-g1066449-d301686-Reviews-Hotel_East_21_Tokyo-Koto_Tokyo_Tokyo_Prefecture_Kanto-or25.html?filterLang=en,Hotel East 21 Tokyo,"February 3, 2019","One of the reasons that I stay in this hotel was the easiness to go to and from Tokyo Disney Resort. They provide you with a shuttle bus, but you have to reserve via their website (it is free). The other thing was a shuttle bus from Narita Airport with a very reasonable cost, so you don't have to use the train to get here (they also provide you a shuttle bus to the nearest train station, isn't that great!). Room and services were excellent. Breakfast was outstanding, an outstanding and fresh selection of fish was available during the time I stay.","Jakarta, Indonesia","Acciokerry</div><div class=""userLoc""><strong>Jakarta, Indonesia</strong>",13,5.0
646719045,https://www.tripadvisor.com/Hotel_Review-g1066449-d301686-Reviews-Hotel_East_21_Tokyo-Koto_Tokyo_Tokyo_Prefecture_Kanto-or25.html?filterLang=en,Hotel East 21 Tokyo,"January 17, 2019","Stayed here for 10 days with my husband and 2 little kids in a twin-with-extra-bed room. The room is quite small for us. We had the pool view and the room was clean and bright. Bathroom is spacious and provides all the necessities required.Being a Disney good neighbor hotel, they provide free shuttle to Disneyland. Be sure to make reservation for this shuttle service to & fro once you have set your date to Disneyland as it could be fully-reserved with no available seats. They provide free shuttle to nearest train stations too. Anyway, we took our morning walk to Toyocho station everyday as it is less than 10mins walk away. We also took the paid shuttle to Odaiba which takes less than 20mins compared to taking train which would take longer. The hotel area has some restaurants and Lawson is just nearby. So this hotel is quite convenient. The only problem for us is that they do not have a laundromat within the hotel building. As ours is a long vacation trip, I already planned to do laundry and you can image how big is my jaw-drop when the hotel told me that they do not have a laundry in the hotel. Anyway, they took out a map and pointed us the way to the nearest laundromat. So my husband walked to the laundromat to do the laundry, carrying a big bag of clothes looking like santa-claus (we were there near Christmas by the way... hohoho...)Overall, I'm still quite happy with my stay here. Price is reasonable and location is convenient for eateries, convenience stores and train station.","Singapore, Singapore","floves</div><div class=""userLoc""><strong>Singapore, Singapore</strong>",30,4.0
