review_id,url,hotel_name,review_date,review_body,user_location,user_name,helpful_vote,rating
613301706,https://www.tripadvisor.com/Hotel_Review-g60763-d93452-Reviews-LUXE_Life_Hotel-New_York_City_New_York-or160.html?filterLang=en,LUXE Life Hotel,"September 2, 2018","I love boutique hotels and I love them in convenient nooks and crannies. The Life Hotel definitely fits into that category. The staff is very helpful. I usually stay in the midtown area, but this was a purely pleasure trip and the easy access to the subway, downtown, or midtown made this very convenient. Located between 5th and Broadway, you are close to everything without being too close to Times Square and the overcrowded tourist spots. Four of us stayed in one room (family) and we made it just fine. The bathroom was large and spacious with marble tile. Bed was comfortable. The downstairs restaurant and bar were excellent as well. ",,Sthrnfoodie,23,4.0
612948930,https://www.tripadvisor.com/Hotel_Review-g60763-d93452-Reviews-LUXE_Life_Hotel-New_York_City_New_York-or160.html?filterLang=en,LUXE Life Hotel,"September 1, 2018","Nice boutique hotel. Decent workout room, free coffee machine, but he elevator is small and slow if you have a upper floor room. Good people working there. The bar makes a good old fashion. My only complaint is that the a/c units are loud, I’m a light sleeper.",,kent c,3,5.0
611466167,https://www.tripadvisor.com/Hotel_Review-g60763-d93452-Reviews-LUXE_Life_Hotel-New_York_City_New_York-or165.html?filterLang=en,LUXE Life Hotel,"August 28, 2018","Life hotel is a lovely hotel: beautiful rooms and bathrooms, great quality for price, well located, newly renovated, nice lobby with bar and all very clean! we'll definitely be back! Complimentary breakfast location (next to gym and elevators) could be improved... why not at the bar in the lobby :) ? ","Paris, France","Car0linette</div><div class=""userLoc""><strong>Paris, France</strong>",3,5.0
610044447,https://www.tripadvisor.com/Hotel_Review-g60763-d93452-Reviews-LUXE_Life_Hotel-New_York_City_New_York-or165.html?filterLang=en,LUXE Life Hotel,"August 24, 2018",The staff was very courteous and accommodating. The incredible view from our balcony room 1007. Stay here every time we visit the city. Scored great tickets at the TKS at the Lincoln Center to see Anastasia.,,Patty T,0,5.0
609723422,https://www.tripadvisor.com/Hotel_Review-g60763-d93452-Reviews-LUXE_Life_Hotel-New_York_City_New_York-or165.html?filterLang=en,LUXE Life Hotel,"August 23, 2018","I had a very good experience at this hotel. The room was clean, restroom was clean, both appeared to be recently renovated, the bed was very comfortable and clean. The room is small, typical for most NYC hotels, but who stays in the room while visiting NYC? Good location, close to the Empire State Building and Madison Square Garden. The front desk staff were very helpful. I would definitely consider staying here again if I ever make it back to the city.","Richmond, Virginia","Jughead76</div><div class=""userLoc""><strong>Richmond, Virginia</strong>",2,4.0
609191887,https://www.tripadvisor.com/Hotel_Review-g60763-d93452-Reviews-LUXE_Life_Hotel-New_York_City_New_York-or165.html?filterLang=en,LUXE Life Hotel,"August 22, 2018",Love the location we could walk to Rockefeller center and the hotel was cleanly and beautiful. There are quiet rooms available in the back of the hotel if you ask for them. We slept peacefully and weren't disturbed at all,"Rochester, New York","Meagan K</div><div class=""userLoc""><strong>Rochester, New York</strong>",1,5.0
608613261,https://www.tripadvisor.com/Hotel_Review-g60763-d93452-Reviews-LUXE_Life_Hotel-New_York_City_New_York-or165.html?filterLang=en,LUXE Life Hotel,"August 20, 2018","Room was always clean, and it was surprisingly large for NYC! Admittedly, we had the king + sofa, but I'm used to smaller king rooms. The bed was super comfy, and the two of us never felt cramped for space. The bathroom was seriously huge. We were located right in the middle of everything and very close to great food and shops with easy access to everything else. I will definitely stay here again. Note: no minibar, if that kind of thing matters to you, but there is a fridge, which came in handy during our 3-night stay.","Portland, Oregon","katypdx</div><div class=""userLoc""><strong>Portland, Oregon</strong>",3,5.0
607135204,https://www.tripadvisor.com/Hotel_Review-g60763-d93452-Reviews-LUXE_Life_Hotel-New_York_City_New_York-or170.html?filterLang=en,LUXE Life Hotel,"August 16, 2018","My room was well designed and cleanIt was a great value for New York.I got a better rate by calling, the website is out of date.The Henry has a new Chef and it was a soft opening.Food was amazing! Great service too!Unfortunately it was not open for breakfast or lunch or Sunday supper.","New York City, New York","Kbindall</div><div class=""userLoc""><strong>New York City, New York</strong>",0,4.0
606415705,https://www.tripadvisor.com/Hotel_Review-g60763-d93452-Reviews-LUXE_Life_Hotel-New_York_City_New_York-or170.html?filterLang=en,LUXE Life Hotel,"August 14, 2018","29 years old, traveling with a friend, want to be close to the center of the city but not pay crazy prices, still wanting a nice hotel. That was my criteria and Life Hotel was perfect. Incredibly friendly staff, easy check in experience, very clean rooms, modern yet old school vibe...classy throughout. I recommend this place and will be back. It’s in the heart of K-Town which makes it even that much more fun. And 24/7 hot coffee was a huge plus!","Beverly Hills, California","StephenW73-13</div><div class=""userLoc""><strong>Beverly Hills, California</strong>",3,5.0
605490624,https://www.tripadvisor.com/Hotel_Review-g60763-d93452-Reviews-LUXE_Life_Hotel-New_York_City_New_York-or170.html?filterLang=en,LUXE Life Hotel,"August 11, 2018","Super comfortable bed and friendly staff. Excellent base for experiencing all NYC has to offer! Walking distance to Empire State, Rockefeller Place and Times Square - train station close by for all others attractions. Would stay again, thank you Life. ",,Tourist326888,1,5.0
605388459,https://www.tripadvisor.com/Hotel_Review-g60763-d93452-Reviews-LUXE_Life_Hotel-New_York_City_New_York-or170.html?filterLang=en,LUXE Life Hotel,"August 11, 2018","We stayed for 4 nights at Life Hotel. We had received a room upgrade thanks to being an Expedia Gold member which was a very nice surprise. We had been delayed on our way to the hotel so didn’t check in until nearly midnight. I emailed them in advance and they got back to me very quickly to let me know that it wouldn’t be an issue. The room was large by any hotel’s standards and had the largest and most comfortable bed I’ve ever slept on. To be honest it was so comfy there were times I considered spending the entire 4 days in it. The bathroom was small but quite frankly I’ve never seen the point in a huge bathroom or understood the need for one. It did have a bath which was much needed after a day of walking around NYC in the heatwave. Morning coffee and pastries were good and it’s a nice touch. The hotel is conveniently located a couple of blocks south of the Empire State and a couple of blocks East of Penn station for your trip back to the airport. At worst it felt a bit impersonal but it’s New York, what do you expect. ","Buckminster, United Kingdom","danielgrimwoodbird</div><div class=""userLoc""><strong>Buckminster, United Kingdom</strong>",34,4.0
605140504,https://www.tripadvisor.com/Hotel_Review-g60763-d93452-Reviews-LUXE_Life_Hotel-New_York_City_New_York-or170.html?filterLang=en,LUXE Life Hotel,"August 10, 2018",Room 1003 was spacey and bright. Loved the natural light and minimalist feel. Had enough space to put our suitcases. Bed was more on the softer side but very comfy and felt bigger than a usual king size bed. Bathroom was good. Well lit! Plenty of towels and washcloths too which is s very nice touch. Best of all was the great functioning A/C since it was warm & humid outside and we were dying to cool off. ,"Scottsdale, Arizona","seekAdventures</div><div class=""userLoc""><strong>Scottsdale, Arizona</strong>",80,4.0
605044846,https://www.tripadvisor.com/Hotel_Review-g60763-d93452-Reviews-LUXE_Life_Hotel-New_York_City_New_York-or175.html?filterLang=en,LUXE Life Hotel,"August 10, 2018","This was a great, centrally located nook, close to Penn station location to spend a weekend in! Comfy beds, and vintage feel. Everything was ready upon our arrival, offered baggage storage too after checkout.",,SHANDI C,3,5.0
604077360,https://www.tripadvisor.com/Hotel_Review-g60763-d93452-Reviews-LUXE_Life_Hotel-New_York_City_New_York-or175.html?filterLang=en,LUXE Life Hotel,"August 7, 2018","The Good - Wonderful hotel right bang in the center with easy access to all tourist sites, variety of restaurants, and evening entertainment. The hotel has a relaxed atmosphere with staff who are always willing and ready to offer help. Staff here are very very friendly. The beds are amazing with the most soft sheeting that I have ever experienced in any hotel including top 5 stars, a complete wonderful pleasure to sleep in, Quality amenities, which include a shower cap which in the USA hotels is rare. Loved the added touch of providing a Life water bottle, useful when traveling as we did in July's hot weather. A large flat screen 50' TV with netflix kept everyone happy after a long days sightseeing. The Bad - You are not told of the hefty resort fee daily charge per room of $25, when booking, or on departure. The hotel also failed to make us aware of this charge on departure, as no check out invoice was provided. I only became aware of the charge when my bank statement was checked. The hotel takes the charge without notification, which reduced the value and pleasure of our stay at the hotel.","London, United Kingdom","bellkat2018</div><div class=""userLoc""><strong>London, United Kingdom</strong>",0,4.0
603638877,https://www.tripadvisor.com/Hotel_Review-g60763-d93452-Reviews-LUXE_Life_Hotel-New_York_City_New_York-or175.html?filterLang=en,LUXE Life Hotel,"August 6, 2018","Enjoyed the boutique hotel, large rooms, great air conditioning considering 90 plus temps, extremely comfortable huge bed, huge TV, great to have coffee and tea and a quick bagel in the morning. Offer filtered water from a dispenser. Easy acces to subway, walk to Times Square. Not much for bar scene and restaurant was in transition, so not open. One right next store though and a few down the street with happy hours, etc. Could use some room decor, but overall it was great.","Rockford, Illinois","HenLi</div><div class=""userLoc""><strong>Rockford, Illinois</strong>",20,4.0
602898071,https://www.tripadvisor.com/Hotel_Review-g60763-d93452-Reviews-LUXE_Life_Hotel-New_York_City_New_York-or175.html?filterLang=en,LUXE Life Hotel,"August 5, 2018","Small room but very clean and comfortable. Bed was a1 and linen was clean and crisp. The hotel is in a great area close to penn station and Madison square. Close to everything really. Was very happy for the price, which for mid-town New York, was very reasonable. It will not disappoint. Nice bar downstairs and great- looking intimate restaurant that was not open when we were there. ",,Damhanoz,13,5.0
602305147,https://www.tripadvisor.com/Hotel_Review-g60763-d93452-Reviews-LUXE_Life_Hotel-New_York_City_New_York-or175.html?filterLang=en,LUXE Life Hotel,"August 3, 2018","What a disappointment. Pictures are a lot better than the reality. Don't be fooled by it. Stay away!Plus:Location if you like the busy tourist areas. And little Korea or Nomad area. Outside of the building. Very beautiful and charmingMinus:Rooms are very very small :( No space to move around, certainly not if you take the double queen rooms!Website promises welcome cocktails for the guests but when we arrived there wasn't even a bar in the hotel... And no other form of extra was offered. No breakfast in hotel possible. Coupons for restaurants in the area..No porter service. Wifi did not work. Room had a very small window. No day light. Beds are way too soft. old matresses. Service is not that special. Evening staff was very unfirendly. Morning staff was friendly. Way to expensive for what you get in returnIn short: stay away if you can!!","Bruges, Belgium","Chris B</div><div class=""userLoc""><strong>Bruges, Belgium</strong>",15,2.0
601963741,https://www.tripadvisor.com/Hotel_Review-g60763-d93452-Reviews-LUXE_Life_Hotel-New_York_City_New_York-or180.html?filterLang=en,LUXE Life Hotel,"August 1, 2018","My mom and I stayed at Life for 3 nights. We checked a couple of rooms of the type that I booked, and heaters weren't working, unfortunately. However, the staff was very accommodating, especially Kevin!! He tried fixing the heaters, brought us the space heater to use in the meantime, and even some hot delicious tea. Kevin really made our stay, and his friendly personality is a big asset to Life Hotel. Thank you very much!",,566lidias,0,4.0
601879977,https://www.tripadvisor.com/Hotel_Review-g60763-d93452-Reviews-LUXE_Life_Hotel-New_York_City_New_York-or180.html?filterLang=en,LUXE Life Hotel,"August 1, 2018","I stayed at the Life Hotel for a week in July for business and was impressed. The customer service was great, Monica assisted me when I arrived from my redeye flight and was very cordial and welcoming. My room was clean and cool, I used the gym to get a nice sweat and enjoyed the complementary 24-hr coffee a couple of times. I would highly recommend for business or personal travel.",,Jared S,1,5.0
601833810,https://www.tripadvisor.com/Hotel_Review-g60763-d93452-Reviews-LUXE_Life_Hotel-New_York_City_New_York-or180.html?filterLang=en,LUXE Life Hotel,"August 1, 2018","Loved this hotel for our quick stay in New York. It was in a great location, close to the subway and Penn Station. The rooms were small, but clean, stylish and very comfortable. I would recommend this hotel and will gladly stay here again.","Loganville, Georgia","KatherineS38</div><div class=""userLoc""><strong>Loganville, Georgia</strong>",16,5.0
600298709,https://www.tripadvisor.com/Hotel_Review-g60763-d93452-Reviews-LUXE_Life_Hotel-New_York_City_New_York-or180.html?filterLang=en,LUXE Life Hotel,"July 27, 2018","Everything was good. Bed, insulation, price, location, parking, position to metro and things to see. All perfect. Nice little extras like pure water, small breakfast and coffee for free and nice little gym. ","Breda, The Netherlands","Erwin_Rietbroek</div><div class=""userLoc""><strong>Breda, The Netherlands</strong>",3,5.0
598992103,https://www.tripadvisor.com/Hotel_Review-g60763-d93452-Reviews-LUXE_Life_Hotel-New_York_City_New_York-or180.html?filterLang=en,LUXE Life Hotel,"July 23, 2018","The hotel was beautiful, well appointed and expertly designed. My only complaint is that the AC wasn't strong enough. I highly recommend staying here. Koreatown and NoMad make this one of the most interesting areas in NYC for tourists and non-tourists alike. I wish I spent more time exploring the hotel. I left a pair of earrings in the room, so when I go back to pick them up I'll be sure to check out the bar. <3<3<3",,Eric S,1,4.0
595968608,https://www.tripadvisor.com/Hotel_Review-g60763-d93452-Reviews-LUXE_Life_Hotel-New_York_City_New_York-or185.html?filterLang=en,LUXE Life Hotel,"July 13, 2018","It’s well located. The staff at front desk were really nice!! The rooms are clean and more spacious than we thought, enough to accommodate luggage without feeling cramped. Our phone didn’t work the first days but other that that, our stay was great. Beds are confortable and great size. Appreciate the absence of rugs and the air conditioner. Overall experience was very good. Henry’s restaurant with very good pizzas. Good relation cost-benefit!",,LaughLiveLoveNow,0,4.0
594506513,https://www.tripadvisor.com/Hotel_Review-g60763-d93452-Reviews-LUXE_Life_Hotel-New_York_City_New_York-or185.html?filterLang=en,LUXE Life Hotel,"July 9, 2018","Room was very nice,clean and comfortable. Great location. Staff very friendly and accommodating. Check in and out was a breeze. Upon checking we were given metal reusable water containers with hotels logo. Interesting hotel as it is in the headquarters of the old Life Magazine.",ohio,"rxtravel</div><div class=""userLoc""><strong>ohio</strong>",3,5.0
594312165,https://www.tripadvisor.com/Hotel_Review-g60763-d93452-Reviews-LUXE_Life_Hotel-New_York_City_New_York-or185.html?filterLang=en,LUXE Life Hotel,"July 9, 2018","We arrived and the concierge had given us a free upgrade- and 2 free tin water bottles! Our new room was perfectly set up with 2 queen beds and a terrace all to ourselves- with a view of the Empire State Building! The bed was supremely comfy, shower was luxurious, and the staff and everything else about our visit was perfect. Be sure to set up some sort of parking before you arrive though, we only parked for 12 hours in a garage but it was $60. Would stay again.",,Brianna H,3,5.0
594127612,https://www.tripadvisor.com/Hotel_Review-g60763-d93452-Reviews-LUXE_Life_Hotel-New_York_City_New_York-or185.html?filterLang=en,LUXE Life Hotel,"July 8, 2018","Stayed here for a night. The price was right, the room smallish but delightfully quirky. Very clean , bed was very comfy and the room was appointed with some really cool features like an odd ceiling light and a 48"" TV. Our room was quiet (6th floor) The hotelis around the block from koreatown which is a pretty cool place to walk around on a Saturday night. But it is in a really great location in Manhattan. I highly recommend staying here if what your looking for is comfort clean and withing reasonable walking distance of a lot of attractions.",New Jersey,"allamerican1</div><div class=""userLoc""><strong>New Jersey</strong>",14,5.0
592308874,https://www.tripadvisor.com/Hotel_Review-g60763-d93452-Reviews-LUXE_Life_Hotel-New_York_City_New_York-or185.html?filterLang=en,LUXE Life Hotel,"July 1, 2018","Not only was our room—four (4) girls—elegant and clean, the staff was super helpful and very friendly. For a hotel in NYC, the setup still accommodated four girls getting ready at once—which isn't easy. The location was also convenient and definitely safe.",,stai0066,0,5.0
591699881,https://www.tripadvisor.com/Hotel_Review-g60763-d93452-Reviews-LUXE_Life_Hotel-New_York_City_New_York-or190.html?filterLang=en,LUXE Life Hotel,"June 29, 2018","I stayed at the Life Hotel in March 2018 with my wife and teen daughter. The location was excellent - an easy walk from Penn Station and the whole city very walkable if you choose.We checked in quite late in the evening and while it went smoothly enough it took longer than I would have expected. We arrived in our room ready for a good night's sleep so we could hit the city full on the next day and just as we were settling in, a horrendous noise erupted from a pipe in the room. Apparently this is the heating system/ radiators, is a known issue, and absolutely disturbed our sleep each of the three nights we stayed.Compounding this concern was the fact, though we had been promised an upgrade via email earlier in the week, we did not receive one upon arrival.The first morning I spoke with Monica at the front desk. She was nice enough, and had obviously heard both of my concerns from other customers because though she dealt with my complaint quite professionally, it was obvious from her face this was not the first time this had come up for both issues. She'd promised to look into moving our room for us while we were out that day but by the time I had reached my room five minutes later, called me to tell me no other rooms were available that would provide a different experience. She then asked me to hold so I could speak to the manager, Denise (I think), who is apparently a really nice lady. I wouldn't know because after listening to muzak for six minutes I hung up. No-one called me back.In the end, the room was good enough for our needs. It's not spacious, but we know better than to expect that in NYC. It was clean and quiet enough outside of the heating system. I can't stress enough how loud it is. It actually became quite laughable and we play a video of it for our friends from time to time, who are astonished listening to it.All in all, a hotel with a lot of possibilities, but customer service, misleading emails and in-room solitude were found wanting.","Ottawa, Canada","Dominic T</div><div class=""userLoc""><strong>Ottawa, Canada</strong>",6,3.0
591281772,https://www.tripadvisor.com/Hotel_Review-g60763-d93452-Reviews-LUXE_Life_Hotel-New_York_City_New_York-or190.html?filterLang=en,LUXE Life Hotel,"June 27, 2018","In the past 10 years 10-15 turn of the century buildings have been converted into boutique hotels in a 3 block square area - 30 to 33 street, 6th Ave to Madison Ave. Life Hotel is one of the newest renos. They cleaned the beaux art facade of this former Life Magazine building. And they built out a small handsome restaurant next door and another off the lobby. They did not create a breakfast space - just a coffee machine in the 2nd floor corridor. The beds are super comfy and the bathrooms are stylishly finished in old NYC black and white tiles. But the rooms are small - only good for sleeping. The reception desk can fit in a closet. But we dont stay in hotels to look at facades or reception desks. We want sleep - and that is the problem. The traffic noise on 31st Street goes all night because 1) 2 other westbound streets are closed at 7th avenue - 27th and 31 Sts. And westbound traffic cannot turn from 34th St. So the trucks, the fire engines, and the police cars all take 31st St. They blow their horns, turn on their sirens, and blast their loudspeakers. At 2 am I found a solution. Turn the air conditioner fan to high. The roar drowns out the car/truck cacophony. Check out all the hotel offerings in this Nomad area","Sydney, Australia","kathmandu91</div><div class=""userLoc""><strong>Sydney, Australia</strong>",57,3.0
589660447,https://www.tripadvisor.com/Hotel_Review-g60763-d93452-Reviews-LUXE_Life_Hotel-New_York_City_New_York-or190.html?filterLang=en,LUXE Life Hotel,"June 22, 2018","Just back from 9 nights on a business trip. The hotel exceeded my expectations. Bed was very comfy and the room was an oasis - as in the photos. My room was long and skinny, it felt huge by NY standards. I needed to work in my room for a few days so this is why I chose the hotel, the room didn't feel cramped when I needed to stay in. I don't think I had any interaction with hotel staff aside from check in and check out, for me this was fine! The bar is a great place to hang out and restaurant looked very nice. I saw how difficult managing a hotel can be when checking out - a woman wearing flip flops was aggressively complaining over lack of light coming in from her window. Really? The buildings are tall, its noisy and its expensive for little space. Why would you come if you weren't expecting these things?The other thing is the great location - steps from Macys (didn't go) and other stores and many food options. I frequented Koreatown to have dinner - the hotel is in the middle of it.One thing I would suggest is stepping up the environmental policy - the usual stuff of giving the option to keep the same towels etc. The water filtration and water bottle was an excellent idea. The other thing is keeping a folder in the room as finding the hotel info was a bit fiddly - and not mentioned on check in. ",,L M,7,5.0
588134705,https://www.tripadvisor.com/Hotel_Review-g60763-d93452-Reviews-LUXE_Life_Hotel-New_York_City_New_York-or190.html?filterLang=en,LUXE Life Hotel,"June 17, 2018","Absolutely adore this little hotel. Bohemian and luxurious at once. The bed was incredibly comfy! Breakfast was very good too. Clean, comfortable room with characterful details like the luxury toiletries. Speakeasy in the basement, nice warm friendly restaurant. Koreatown just around the corner which is great. So convenient for mid-town. Friendly and helpful staff. I loved my stay here and it would be my choice again if I'm ever in Manhattan again.","London, United Kingdom","x_Chris_D_x</div><div class=""userLoc""><strong>London, United Kingdom</strong>",6,5.0
583623096,https://www.tripadvisor.com/Hotel_Review-g60763-d93452-Reviews-LUXE_Life_Hotel-New_York_City_New_York-or190.html?filterLang=en,LUXE Life Hotel,"May 29, 2018","Our stay at the Life Hotel was truly a First class,enjoyable experience from start to finish. We visit NYC 2x a year and have stayed in several hotels, but Life Hotel was by far the most amazing!! From the moment we entered to check in, we were treated with respect. The front desk staff was MORE than welcoming and accommodating in addition to being informative of what to expect with our stay with them. I would like to give an extra special ","Dublin, Ohio","melissa121565</div><div class=""userLoc""><strong>Dublin, Ohio</strong>",2,5.0
582798966,https://www.tripadvisor.com/Hotel_Review-g60763-d93452-Reviews-LUXE_Life_Hotel-New_York_City_New_York-or195.html?filterLang=en,LUXE Life Hotel,"May 26, 2018","We got in late in the evening and were met by Matthewwho was extremely friendly and helpful. He told us we had the best room in the hotel and I’m sure he was telling the truth. We had two large, very comfortable beds and an amazing terrace! It was very quiet too. This was the best hotel I have ever stayed in, in NY. I will be back!","Saint Cloud, Minnesota","MARYTACKER</div><div class=""userLoc""><strong>Saint Cloud, Minnesota</strong>",2,5.0
