review_id,url,hotel_name,review_date,review_body,user_location,user_name,helpful_vote,rating
750590295,https://www.tripadvisor.com/Hotel_Review-g60763-d93452-Reviews-LUXE_Life_Hotel-New_York_City_New_York-or0.html?filterLang=en,LUXE Life Hotel,"March 12, 2020","Great hotel, very old building with strange noises and slow elevators.Easy to get lost trying to find your roomWould be great if they added hot breakfast instead of the $12 Continental offeringThe service fee should include the Continental breakfast","Coram, New York","Mark S</div><div class=""userLoc""><strong>Coram, New York</strong>",0,4.0
747787930,https://www.tripadvisor.com/Hotel_Review-g60763-d93452-Reviews-LUXE_Life_Hotel-New_York_City_New_York-or0.html?filterLang=en,LUXE Life Hotel,"February 26, 2020",The location and rooms were nice. The amenities were lacking and a few of the front desk staff were not necessarily very friendly. The room was fairly quiet although there were some weird noises coming from the pipes that would wake us up.,,Katherinemcvey,1,3.0
747785192,https://www.tripadvisor.com/Hotel_Review-g60763-d93452-Reviews-LUXE_Life_Hotel-New_York_City_New_York-or0.html?filterLang=en,LUXE Life Hotel,"February 26, 2020","Perfectly situated, super friendly & helpful staff. Beautiful rooms & very clean. Brilliant service. Will visit again & refer everyone I know.The friendly staff & eagerness to make my holiday memorable was the highlight of my stay there.",,mogamadg,0,5.0
746562757,https://www.tripadvisor.com/Hotel_Review-g60763-d93452-Reviews-LUXE_Life_Hotel-New_York_City_New_York-or0.html?filterLang=en,LUXE Life Hotel,"February 21, 2020","I was a little worried at first from photos online, but was pleasantly surprised when I stayed at Luxe Life. Our room was clean, quiet and a very comfortable bed. I didn’t hear one city street noise at all. The only downside is if you’re lookin for a room with a view or even lookout, this is not it. But we didn’t mind as we were out all day in the city. It was nice to have a quiet, darker room. The bathroom is pretty nice, but small. But, things in NY tend to be that way. Again, cannot say enough about how comfortable the bed was. This spot was a great location as well. It’s so close to Herald Square and perfect midtown location. We scored free parking (on weekend) on the same street just a few blocks down. For the price, location and overall enjoyment, this is one of the places to stay. Also, with the resort fee, they give you Voss water bottles each day. Very pleased with accommodations and communication with the staff.",,Leftmyheartinthecity,0,4.0
745067068,https://www.tripadvisor.com/Hotel_Review-g60763-d93452-Reviews-LUXE_Life_Hotel-New_York_City_New_York-or0.html?filterLang=en,LUXE Life Hotel,"February 14, 2020","The Luxe Life Hotel is a great place to stay right in the heart of NYC. Easily assessible to tourist as well as business destinations. The hotel has nicely appointed rooms with new marble bathrooms and hardwood floors. They offer a great breakfast buffet in the morning and were just opening their new restaurant and lounge. It is definitely worth giving this hotel a try, you will Love It!!!","Los Angeles, California","WJCLA</div><div class=""userLoc""><strong>Los Angeles, California</strong>",2,5.0
745066913,https://www.tripadvisor.com/Hotel_Review-g60763-d93452-Reviews-LUXE_Life_Hotel-New_York_City_New_York-or5.html?filterLang=en,LUXE Life Hotel,"February 14, 2020","My boyfriend and i have a date night in manhattan once and week and enjoy staying at the different hotels NYC has to offer. This was our first time staying at a LIFE hotel and needless to say, we were impressed. The decor was luxe, yet comforting. Simple and contemporary yet classic in its design. The staff was very friendly and the accommodations were to our standards. We even ordered room service for breakfast! (we dont usually do this) The menu was perfect and affordable. The food came quickly and tasted great! (I had the California breakfast sandwich) We love this hotel and hope to stay again soon!",,janisev2020,0,5.0
745056622,https://www.tripadvisor.com/Hotel_Review-g60763-d93452-Reviews-LUXE_Life_Hotel-New_York_City_New_York-or5.html?filterLang=en,LUXE Life Hotel,"February 14, 2020","This is the only hotel I stay at in NYC. It’s clean, fun, luxurious, and in a fantastic location. The staff are friendly and know the area and will make suggestions for entertainment, shopping and more!Lots of history in this building. Craft cocktail anyone? You bet!Most comfortable beds!","Cincinnati, Ohio","Diana B</div><div class=""userLoc""><strong>Cincinnati, Ohio</strong>",3,5.0
744591090,https://www.tripadvisor.com/Hotel_Review-g60763-d93452-Reviews-LUXE_Life_Hotel-New_York_City_New_York-or5.html?filterLang=en,LUXE Life Hotel,"February 12, 2020","If you value a comfortable bed, this is most definitely not the hotel for you. The beds are made frommetal so you’ll hear chinking and clanking with every move you make, and the mattresses are so so soft you can barely move for sinking. They are deeply uncomfortable and my back is ACHING!The staff are so-so - when I called to ask for a different room (and a different bed!) I was dismissed... “oh, yes, some complain they’re too hard, some say too soft, but they’re all the same, so....”. The hallways need updating and feel a bit sad. Rooms are small, bathroom are fine but don’t expect them to restock shampoo or toilet paper everyday. All in all this is a 5/10.",,223huwd,0,2.0
741957892,https://www.tripadvisor.com/Hotel_Review-g60763-d93452-Reviews-LUXE_Life_Hotel-New_York_City_New_York-or5.html?filterLang=en,LUXE Life Hotel,"January 29, 2020","Warm kind staff, amazing location, clean hotel with fabulous stylish features. We would definitely stay here again. Bathroom was tiny but very pretty. Bed was comfortable and the lighting was very pretty.","Springfield, Virginia","SpringfieldVA1</div><div class=""userLoc""><strong>Springfield, Virginia</strong>",1,5.0
741935877,https://www.tripadvisor.com/Hotel_Review-g60763-d93452-Reviews-LUXE_Life_Hotel-New_York_City_New_York-or5.html?filterLang=en,LUXE Life Hotel,"January 29, 2020","I was very pleasantly surprised at the size of the bathroom especially (in these old quirky buildings, that can be tough to do) I stayed on the 9th floor and it was very quiet and comfortable. I do wish the lighting was better in the building itself - lobby and hallways. The lighting in the rooms was great though.","Hoboken, New Jersey","CBT0626</div><div class=""userLoc""><strong>Hoboken, New Jersey</strong>",2,4.0
739495592,https://www.tripadvisor.com/Hotel_Review-g60763-d93452-Reviews-LUXE_Life_Hotel-New_York_City_New_York-or10.html?filterLang=en,LUXE Life Hotel,"January 16, 2020","Our room was cute BUT we had issues with 1) the toilet running all night of our first night there and 2) first the shower only ran frigid water and the second night, the water was literally scalding. If we turned it down, the water again became ice cold; there was no in between. Also, the water filters inside tje ice closets were filthy.",,guymelchan,0,3.0
739179153,https://www.tripadvisor.com/Hotel_Review-g60763-d93452-Reviews-LUXE_Life_Hotel-New_York_City_New_York-or10.html?filterLang=en,LUXE Life Hotel,"January 14, 2020","Beautiful classy and affordable lodgings in a historic New York building. Friendly, helpful staff. Free 24 hour coffee, and breakfast. Just a great value. A much needed respite during a stressful trip. Can’t recommend higher.","Los Angeles, California","GrantByronGordon</div><div class=""userLoc""><strong>Los Angeles, California</strong>",0,5.0
737305900,https://www.tripadvisor.com/Hotel_Review-g60763-d93452-Reviews-LUXE_Life_Hotel-New_York_City_New_York-or10.html?filterLang=en,LUXE Life Hotel,"January 6, 2020","This small hotel, with very caring Receptionists and a wonderful cold breakfast, is on the edge of the Theatre District between Broadway and 5th Avenue. A ""Boutique"" hotel with small rooms and a large bathroom. Every light switch has a dimmer switch!","Ottawa, Canada","parkfed</div><div class=""userLoc""><strong>Ottawa, Canada</strong>",2,4.0
735567668,https://www.tripadvisor.com/Hotel_Review-g60763-d93452-Reviews-LUXE_Life_Hotel-New_York_City_New_York-or10.html?filterLang=en,LUXE Life Hotel,"December 30, 2019","Fanstastic: location, breakfast, staff courtesy, room, clean, service and all were incredible.Price very good if you book in advance.Room for 3 with my little doughter (4).Close to the metro station, literally few steps fromThe 5ft avenue and the Empire State Building","Fiume Veneto, Italy","domenico-malox</div><div class=""userLoc""><strong>Fiume Veneto, Italy</strong>",4,5.0
734810564,https://www.tripadvisor.com/Hotel_Review-g60763-d93452-Reviews-LUXE_Life_Hotel-New_York_City_New_York-or10.html?filterLang=en,LUXE Life Hotel,"December 26, 2019",Wonderful service from a small staff that really made every effort to please. Our room was very comfortable & well equipped with everything you might need. Excellent lighting in the updated rooms & a lovely light breakfast buffet.,"Los Angeles, California","Judy R</div><div class=""userLoc""><strong>Los Angeles, California</strong>",0,5.0
734616362,https://www.tripadvisor.com/Hotel_Review-g60763-d93452-Reviews-LUXE_Life_Hotel-New_York_City_New_York-or15.html?filterLang=en,LUXE Life Hotel,"December 25, 2019",Awesome hotel in good locationStaff are all angels and beds are divine Hotel is beautifully restored Will recommend it time and again to all my business and personal friends Can’t wait to go back soon,,Trek688730,0,5.0
733567684,https://www.tripadvisor.com/Hotel_Review-g60763-d93452-Reviews-LUXE_Life_Hotel-New_York_City_New_York-or15.html?filterLang=en,LUXE Life Hotel,"December 19, 2019","I am really sorry to come to this,and I even understand that debit problems can happen during transactions but I stayed at this hotel more than one month ago, my credit card was debited twice, and after several calls and e-mails I havo NO ANSWER regarding this problem.Extremely disappointed.",,611lucreziam,1,1.0
733214423,https://www.tripadvisor.com/Hotel_Review-g60763-d93452-Reviews-LUXE_Life_Hotel-New_York_City_New_York-or15.html?filterLang=en,LUXE Life Hotel,"December 17, 2019","The reason I am giving this hotel a 3 is because it was really average but not terrible. The positives of this hotel is of course the price, very affordable. The bed is definitely comfortable as well and the bathrooms are larger than one would expect in NY. The bed is what would lead us to return again if ever necessary. When we went, there was also a free breakfast provided which is definitely a plus. They provided croissants, fresh fruit, coffee and juices. On the second floor is a small gym and a little area for coffee and tea whenever you like as well as a computer and printer. The negatives include the front desk customer service which is lacking. I am not confident that they are trained adequately to provide the best service as check in was lack luster. A call to the front desk started with “What?” which left me quite shocked that some time has passed before I responded. The hotel itself is also rather dark, there are only 2 elevators that are quite small. The hallways themselves are also small and especially if you are on the top floors. The room’s decor is played up in the website’s pictures but walking in was somewhat disappointing. I understand that they have an aesthetic they are trying to do but the execution just made the room look dirty (ie. The “vintage” looking mirrors and side tables). Another reviewer from before mentioned the floors looking dirty which I quite agree but it is only due to the style of the flooring. A rug in some areas could ameliorate this. It was not comfortable walking on those floors without slippers (which they didn’t have). The balcony offering was also quite odd but that is a room we got and it did have a nice view- if you look up. The furniture placed outside just seemed like an after thought. Overall it was an average stay that could use improvements in order to enhance guest experience. This hotel has a lot of potential that they have yet to tap into. ",Maryland,"gabz648</div><div class=""userLoc""><strong>Maryland</strong>",17,3.0
732520384,https://www.tripadvisor.com/Hotel_Review-g60763-d93452-Reviews-LUXE_Life_Hotel-New_York_City_New_York-or15.html?filterLang=en,LUXE Life Hotel,"December 13, 2019","This hotel has a decent location, and the first floor is eclectic in decor. The rooms lack dressers and the bathrooms lack any drawers or counters or places to put your toiletries. The bed was incredibly soft, almost like a cushion. The water was impossible to get warm - it was either cold or burning hot. The breakfast was convenient and acceptable. The room was extremely small and poorly laid out, with odd little pieces of furniture.","Davie, Florida","Egglady</div><div class=""userLoc""><strong>Davie, Florida</strong>",51,2.0
732073784,https://www.tripadvisor.com/Hotel_Review-g60763-d93452-Reviews-LUXE_Life_Hotel-New_York_City_New_York-or15.html?filterLang=en,LUXE Life Hotel,"December 11, 2019","Very good location.The staff is friendly.The room is small, and the bathroom is too small.The heating system is not good, not sufficient for very cold days. Moreover, it is noisy.The hotel is overpriced for what it offers.","Lisbon, Portugal","Luis Otavio C</div><div class=""userLoc""><strong>Lisbon, Portugal</strong>",1,3.0
731576165,https://www.tripadvisor.com/Hotel_Review-g60763-d93452-Reviews-LUXE_Life_Hotel-New_York_City_New_York-or20.html?filterLang=en,LUXE Life Hotel,"December 9, 2019","This is a cute boutique hotel in the heart of midtown with easy access to the Empire State Building , Macy's, Penn Station. The staff is amazing and my room was very very quiet. The heating and cooling systems make some noise but you hear no traffic noise at all. Missed having the restaurant/bar in the hotel. Hopefully they will at least get a bar soon.",,Experience755893,0,4.0
731031779,https://www.tripadvisor.com/Hotel_Review-g60763-d93452-Reviews-LUXE_Life_Hotel-New_York_City_New_York-or20.html?filterLang=en,LUXE Life Hotel,"December 6, 2019","I have been to NY city several times over the years. Each time with a varying degree of success in locating a hotel that meets our needs. Hands down, the Life Hotel was the best NY experience I have had. The property is beautiful, rooms well appointed and decorated on point. Loved the character of the building and the thoughtfulness of the interior decorations and amenities. Highly recommend this property!","New Orleans, Louisiana","74brian2018</div><div class=""userLoc""><strong>New Orleans, Louisiana</strong>",0,5.0
729880838,https://www.tripadvisor.com/Hotel_Review-g60763-d93452-Reviews-LUXE_Life_Hotel-New_York_City_New_York-or20.html?filterLang=en,LUXE Life Hotel,"November 30, 2019","The hotel is located on 31st street, which is central and close to Penn station. Check-in was fast and front desk gave me access to my room 1 hour earlier from my check-in time. Breakfast fast was reasonable and they have 24 hour free coffee station on the 1st floor. The staff was friendly and cooperative. The room was clean and tidy but a little small for my expectation, this forced me to stay out and explore NY city. Bathroom was reasonably spacious and clean with hot water. Check-out was also very fast.",,89saeedi,0,3.0
729276528,https://www.tripadvisor.com/Hotel_Review-g60763-d93452-Reviews-LUXE_Life_Hotel-New_York_City_New_York-or20.html?filterLang=en,LUXE Life Hotel,"November 27, 2019","I took a chance. Which I don't like to do on hotels. The price was $138 / night on Hotels.com. I was in NYC for business and trying to sneak in on the cheap... Well this hotel was ADORABLE. Room was SO quiet, I slept like a baby. Beds so comfy and rooms well done and styled. Staff were above and beyond. Free breakfast!? And drink coupons I forgot to use at the wine bar next door. They even have a decent gym with new equipment! And blocks from flatiron building, subway & Penn station. Great experience and location. Thank you!","New York City, New York","constantadventurer</div><div class=""userLoc""><strong>New York City, New York</strong>",73,4.0
727346814,https://www.tripadvisor.com/Hotel_Review-g60763-d93452-Reviews-LUXE_Life_Hotel-New_York_City_New_York-or20.html?filterLang=en,LUXE Life Hotel,"November 18, 2019","I went to NY for work and loved my stay at the property. The location is amazing, walking distance to great restaurants, nightlife and attractions if you are going for fun. The rooms are very spacious (contrary to the norm in NY) and beautifully decorated. They have a small but well appointed complimentary breakfast at the lobby which came really handy with my tight schedule. The small hotel feel definitely convinced me to book again next time I'm in the city.",,BiancaB210183,2,5.0
726414953,https://www.tripadvisor.com/Hotel_Review-g60763-d93452-Reviews-LUXE_Life_Hotel-New_York_City_New_York-or25.html?filterLang=en,LUXE Life Hotel,"November 14, 2019","I stayed at the Life Hotel for 1 week and I must say that I absolutely loved it. The employees are just amazing- from Mayra, Bryant, Istiria, Rich, Francisco, Agouda, Brandon, to EVERY single housekeeper I came into contact with. The service was warm and inviting and everyone was accommodating.My room was so clean. The bed was very comfortable and I was able to open a window for some clean air. The ceilings are high and the floors are cool with its concrete and original wood design. The bathrooms were bright with a great design and proper water pressure. The hotel has an old-world charm, really beautiful architecture, a cozy atmosphere with beautiful wood design in lobby juxtaposed with original steel beams and Edison bar lighting. I must note that the wifi is excellent too.Morning breakfast was served in the lobby and it was easy to have a quick morning bite before heading out into the streets of NY.There is a pizza place called- Little Italy Pizza around the corner from the hotel on 33rd off of 5th and the next door restaurant- Ayza was just awesome, serving wine and different chocolate martinis. There are 3 CVS drugstore in walking distance that are open 24 hours so it is very convenient if you forgot to pack somethings- like I did.I was able to walk to EAtaly for incredible food and chocolate, the Empire state Building, flower market and all the little stores so close to the neighborhood. The subway is very close and you can get around all over town very efficiently.Last but not least- the hotel manager, Ferran, provided excellence in hospitality, welcoming guests to the hotel and making sure they had everything they needed to make their stay comfortable and memorable.If you need a great hotel centrally located in New York with incredible service- Life Hotel is my suggestion.","Los Angeles, California","Isabella822</div><div class=""userLoc""><strong>Los Angeles, California</strong>",0,5.0
726202482,https://www.tripadvisor.com/Hotel_Review-g60763-d93452-Reviews-LUXE_Life_Hotel-New_York_City_New_York-or25.html?filterLang=en,LUXE Life Hotel,"November 13, 2019","The personal and the amenities are perfect. De manager great person, the front desk people are very kind, always to our service, The room perfect, the rate was fear. Good breakfast . I resume We enjoy the stay in he hotel",,MikeiBru14,0,5.0
724670236,https://www.tripadvisor.com/Hotel_Review-g60763-d93452-Reviews-LUXE_Life_Hotel-New_York_City_New_York-or25.html?filterLang=en,LUXE Life Hotel,"November 7, 2019","After the numerous negative reviews I read on Google I was very happy with our stay at Life Hotel. Our check-in with Mira was extremely pleasant and she was fantastic to deal with, as were all the other staff we spoke to or were assisted by.The hotel had a small selection of breakfast which is new and I really appreciated having this available each day, especially on the morning of the marathon. Maybe some warm food or more continental offerings as a suggestion and slightly better coffee? The hotel is a bit dark in the lobby, but I assume that is part of the ambience they have gone for.Our room, 411, was great but a bit dark as it was at the back of the building. However, it was a welcome break from the busy and noisy NYC streets. Overall was a great stay and I am glad we booked here and didn't book elsewhere based on the negative reviews we had read. It is very central and a great based to have to explore NYC and the surrounding Boroughs.","London, United Kingdom","nmladenovic</div><div class=""userLoc""><strong>London, United Kingdom</strong>",11,5.0
724590923,https://www.tripadvisor.com/Hotel_Review-g60763-d93452-Reviews-LUXE_Life_Hotel-New_York_City_New_York-or25.html?filterLang=en,LUXE Life Hotel,"November 6, 2019","Great hotel and service.. Even with such small room, it was very comfortable.. The shower is REALLY hot, and it was a bit stressful to adjust.. Water and ice on the floor. Location is good as well :-)","Campinas, SP","alizbcas</div><div class=""userLoc""><strong>Campinas, SP</strong>",5,4.0
723892607,https://www.tripadvisor.com/Hotel_Review-g60763-d93452-Reviews-LUXE_Life_Hotel-New_York_City_New_York-or25.html?filterLang=en,LUXE Life Hotel,"November 4, 2019","Great location - right in the center of it all. LOVED my room and the industrial look! The team really went over and beyond. Upon checking out, I was running late and getting worried about missing my flight... BUT a Life Hotel team member (sorry cant remember his name) got out on the street and helped me hail a taxi. Thank you - I will be back!",,EANDERSON1213,0,5.0
723691424,https://www.tripadvisor.com/Hotel_Review-g60763-d93452-Reviews-LUXE_Life_Hotel-New_York_City_New_York-or30.html?filterLang=en,LUXE Life Hotel,"November 3, 2019","I havent written reviews for a while but felt compelled in this instance to leave one.I read a lot of not-so-good reviews beforehand and was not sure what i was in for.Well i was pleasantly surprised!Check-in was easy, Mira was lovely and called to make sure my room was ok soon after.The room and ensuite were tiny as expected but nicely appointed, clean and quiet. The bed was heavenly, big tv, ac unit worked fine, hot water with ok pressure, no clogs etc.I failed to see what other travellers were complaining about the lobby looking abandoned and what not, might have just been addressed before my stay. To one side-the bar, to the other- nicely decorated booths/lounges. The vibe was cozy, warm & quaint, especially at night. Always looked inviting through the windows as i returned every night.Yes lifts were slow but expected for the age of the building. The tv remote wasn't the most responsive - minor gripes really.For the price point I had a perfectly nice stay!(on one hand I've stayed at worse for dearer but on the other I've also stayed at the Plaza).Thumbs up.","Rouse Hill, Australia","Lauchg</div><div class=""userLoc""><strong>Rouse Hill, Australia</strong>",11,4.0
723581008,https://www.tripadvisor.com/Hotel_Review-g60763-d93452-Reviews-LUXE_Life_Hotel-New_York_City_New_York-or30.html?filterLang=en,LUXE Life Hotel,"November 3, 2019","Thank you to the Life Team for welcoming me into your home. I found the staff to be friendly and always willing to assist. A few names to mention are Aziz, Mariya, Bryant, Nicole, William, Brandon, and more... I believe in top down management so it starts at the top. Big kudos to Ferran for his dedication, drive, and genuine hospitality. Bravo to the team and I look forward to my next visit.Sincerely,Adrienne","Beverly Hills, California","GeneralManagerLuxeBH</div><div class=""userLoc""><strong>Beverly Hills, California</strong>",0,5.0
723101809,https://www.tripadvisor.com/Hotel_Review-g60763-d93452-Reviews-LUXE_Life_Hotel-New_York_City_New_York-or30.html?filterLang=en,LUXE Life Hotel,"November 1, 2019","This is such a lovely hotel with a fascinating history. Every staff member was gracious and helpful. I adore staying in boutique hotels and travel extensively. This hotel did not disappoint. If you are looking for a beautiful room, excellent service, and a great location this is the place for you!",,Stephanie S,0,5.0
721799465,https://www.tripadvisor.com/Hotel_Review-g60763-d93452-Reviews-LUXE_Life_Hotel-New_York_City_New_York-or30.html?filterLang=en,LUXE Life Hotel,"October 27, 2019","The location is good. The rooms are clean and the price is reasonable. This could become one of my new favorites. I stayed here for business in July and liked the location and the room was clean, not huge but it had everything you need. The lobby was a little disorganized as they had closed down their restaurant and bar so it just looked a little bereft. Now they have put lobby furniture in and they had a nice little breakfast buffet in the bar in the morning. The room was nice and the bed was comfortable. It was very nice and a great deal for NYC.","Boston, Massachusetts","649hillaryc</div><div class=""userLoc""><strong>Boston, Massachusetts</strong>",2,4.0
