review_id,url,hotel_name,review_date,review_body,user_location,user_name,helpful_vote,rating
642207372,https://www.tripadvisor.com/Hotel_Review-g60763-d93452-Reviews-LUXE_Life_Hotel-New_York_City_New_York-or105.html?filterLang=en,LUXE Life Hotel,"December 29, 2018","As mentioned in many other reviews, Reception is at the rear of the restaurant and wasn’t immediately obvious to us as the place was pretty busy. Things got off to a shaky start with us being asked to move out of the way as we checked in. This was in case any of the restaurantguests wanted to get past in order to use the toilets. (We were spending nearly $3000.00 here and I wasn’t overly impressed with the attitude of this member of staff). Check in was otherwise uneventful and we set off upstairs to check out the rooms. We had a double Queen and a single queen room. Both rooms were big enough for our needs with super comfy beds and large screen TVs. The rooms were clean and comfortable. There was no carpet in the single queen room which we thought was a bit odd - just a painted concrete floor. It doesn’t feel very clean to walk on and if I owned the hotel it would be the first thing I would do. We found the staff to be generally on the surly side which surprised us as they are widely praised on here. The lady that checked us out was definitely the exception as she was lovely. When we checked in we were given vouchers for free cocktails in with our room keys to welcome us, however, we weren’t told that they were there and didn’t find them until the day we were checking out. My personal feeling is that a welcome gesture like this really can set the tone for an entire stay so to not tell guests that the vouchers are there is massively missing a trick. The lovely lady on Reception explained that we could still use them after check out and saved the day again!Our experience here overall was very positive but more because of the hotel and its superb location rather than the staff. We cant comment on food here as we didn’t eat here - again, if the staff gave a more welcoming vibe then we may have chosen to do so. The coffee machine on the second floor is fine - hot chocolate was very good. There is a small gym which looked decent enough. They were accommodating with looking after our suitcases after checkout while we went shopping and we had our welcome cocktails before we left. I also had a couple of G&Ts which were incredibly expensive - its not a cheap bar but it does have a great atmosphere. ","Chatham, United Kingdom","Davidbaker8130</div><div class=""userLoc""><strong>Chatham, United Kingdom</strong>",70,4.0
642089519,https://www.tripadvisor.com/Hotel_Review-g60763-d93452-Reviews-LUXE_Life_Hotel-New_York_City_New_York-or110.html?filterLang=en,LUXE Life Hotel,"December 28, 2018","I hate to write a disappointing review, as I really liked the staff here, but I have to be honest and say that this wasn't the experience I hoped for. I stayed for 4 nights during a business trip. The location is great - super central; close to several subway lines and easy to walk to many things both uptown and downtown. The font desk and staff in general were lovely - so friendly and wanting to help. That's where the fun stops. The room itself is minuscule and very poorly designed. I asked to moved to a larger room, and they did help me do so on my second night, but the ""upgrade"" was negligible - hardly worth the trouble. The issue is that the designer made poor furniture choices of shoving giant king size beds inside a small space, and in my ""bigger"" room, they decided to add a couch at the foot of the bed. So where there was finally a few extra feet of space, it was a waste to put additional furniture there! Fine linens and a big bed don't make up for a room you can barely walk in. The bed takes up the ENTIRE room, and I'm not exaggerating. My suite case sat in front of the door which has a few inches of space between it and the bed, and when I had to go out, I'd put it in the bathroom! The bathroom has ZERO counter space. For real - ZERO. They have a cheap mesh staking shelf under the sink that you can use to hold toiletries, but who wants to put their toothbrush on a bathroom floor - even if it is on a baby shelf - that's gross. The heater/AC unit is a window unit that is SOOOO loud, I chose to turn it off to sleep and froze to death. Luckily there was a Nordstrom Rack nearby where I bought sweats and socks to sleep in. The closet holds about 3 outfits. If you are there for more than a couple of nights, definitely don't stay here. Lastly, on top of the window unit, I had a front facing room when they moved me and OMG - the noise was crazy. I didn't sleep a wink! Trucks and people and honking horns, oh my. Plus, you hear everyone in every room that is near you and in the hallways. I also had a room near the elevator which is never fun, but especially loud here. Also, as noted in other reviews - no lobby at all - you walk into a loud restaurant. Overall, it's just not a great design, and it's obvious they worked hard to make it ""hip and cool"", but it misses the mark. For the price, given it's NYC, it's ""okay"", but you can spend a little more (e.g. $50 or so per night) and get an exponentially better hotel.","Los Angeles, California","GlobeRoamer005</div><div class=""userLoc""><strong>Los Angeles, California</strong>",37,3.0
641815935,https://www.tripadvisor.com/Hotel_Review-g60763-d93452-Reviews-LUXE_Life_Hotel-New_York_City_New_York-or110.html?filterLang=en,LUXE Life Hotel,"December 27, 2018","I arrived at the Life hotel only to find out that my confirmed reservation from @Expedia was not in their system and they were fully booked. I was not notified of this by Expedia prior to my travels otherwise I could have made my own alternative accommodations before arriving. Immediately contacted Expedia lodgings number and was redirected to the travel relocation agent. The Expedia agent was unprofessional, incompetent, incoherent, and disrespectful of my time. The agent offered to book me an alternate hotel room but after 2.5 hours, was unable provide me with anything but empty promises.The resolution was only achieved between the Life hotel and myself without the assistance of the Expedia agent. The hotel had one of the guests cancel during the 2.5 hours of my wait time on the phone with Expedia, and graciously offered the room to us.The hotel staff were a holiday life-saver and was gracious, positive, accommodating, welcoming, and very helpful (even while we were waiting, they were gracious hosts). I am very thankful that things worked out in the end. The hotel is very central and convenient to many tourist locations in the city. Only a few minutes walk to Macy’s, Madison Square Garden, Penn Station, Empire State Building, Korea town, etc. It was clean, modernized and the room was a good size for a downtown location. The beds were soft, had a huge in-room TV, a safe, and the washroom was in good shape. The staff were friendly, full of smiles, professional and very understanding. Thanks for letting us stay with you and happy holidays. ","Toronto, Canada","MsFebs</div><div class=""userLoc""><strong>Toronto, Canada</strong>",13,4.0
641419847,https://www.tripadvisor.com/Hotel_Review-g60763-d93452-Reviews-LUXE_Life_Hotel-New_York_City_New_York-or110.html?filterLang=en,LUXE Life Hotel,"December 25, 2018","I liked a lot about the hotel. The decor, position & friendly and helpful staff. The rooms were super small and we had 3 big bags which took over the room. Super comfy beds and great bath and shower though!!!","London, United Kingdom","TJG_11</div><div class=""userLoc""><strong>London, United Kingdom</strong>",11,4.0
641057076,https://www.tripadvisor.com/Hotel_Review-g60763-d93452-Reviews-LUXE_Life_Hotel-New_York_City_New_York-or110.html?filterLang=en,LUXE Life Hotel,"December 22, 2018","Just spent 2 nights at this hotel. Wonderful place, close to sightseeing hot spots. Very pleasant and helpful staff. Rooms were terrific, the bed comfy and the bathroom very spacious. Love our stay and would definitely come back here.",,Moniereg,0,5.0
641008627,https://www.tripadvisor.com/Hotel_Review-g60763-d93452-Reviews-LUXE_Life_Hotel-New_York_City_New_York-or110.html?filterLang=en,LUXE Life Hotel,"December 22, 2018","Great clean hotel near everything! We really liked the Life hotel very convenient location, the room was small but typical for NYC. Staff was very friendly and we liked the vibe. Would definitely return on our next visit to the Big Apple.","Sonoma County, California","barrientosgirl</div><div class=""userLoc""><strong>Sonoma County, California</strong>",17,5.0
640401130,https://www.tripadvisor.com/Hotel_Review-g60763-d93452-Reviews-LUXE_Life_Hotel-New_York_City_New_York-or115.html?filterLang=en,LUXE Life Hotel,"December 18, 2018","We recently returned from a three night stay at the Life Hotel. We couldn’t have loved it more. Yes, it isn’t the quietest hotel in the world but given the location - right around the corner from Penn Station, MSG and the Empire State - you expect that there will be some outside noise. If visiting for touristy reasons, the location will be a huge benefit to you. Subway station a minute round the corner that will take you downtown and the the Lower East side. Open top bus stop essentially at the end of the street. 5 or so avenues up from the port where you can get a New York ferry over to Brooklyn. We stayed in room 602 which was a really good size with plenty of space for cases, a sofa and a huge comfy bed. The rooms are simple and stylish but equipped with all the things I want when staying in a hotel that I don’t expect to be spending a lot of time in (ie. in a place like NYC) such as a great bed, a hot shower and a decent TV. The rooms have all of these things. My only slight wish would have been for tea/coffee making facilities in the room. There is a machine on the second floor though and the coffee from it was actually really nice. I’ve also read some poor comments about customer service but my experience with the front desk was fantastic. We also received a couple of drinks tokens for a free cocktail when we checked in (the bar is excellent - not usually a lover of a Tom Collins but the ones we had were fantastic) Everyone we encountered was lovely and very helpful in terms of advice and directions. We really enjoyed our stay and have already decided that when we return to NYC in the summer that this will be our base. Give it a try, you won’t be disappointed.","Warrington, United Kingdom","jaydeedenlove</div><div class=""userLoc""><strong>Warrington, United Kingdom</strong>",12,5.0
640306972,https://www.tripadvisor.com/Hotel_Review-g60763-d93452-Reviews-LUXE_Life_Hotel-New_York_City_New_York-or115.html?filterLang=en,LUXE Life Hotel,"December 18, 2018","Loved our stay at The Life Hotel, the rooms were stylish, the shower was hot and the bed was huge and very comfortable. We opted for the King with sofa room and there was plenty of space. No pretentions, low key, amazing food served downstairs in the restaurant, busy fun bar, perfect location. No room service or tea making facilities were the only minus point, otherwise all fantastic, would definitely stay here again.","Steyning, England, United Kingdom","Chloe B</div><div class=""userLoc""><strong>Steyning, England, United Kingdom</strong>",12,4.0
640256043,https://www.tripadvisor.com/Hotel_Review-g60763-d93452-Reviews-LUXE_Life_Hotel-New_York_City_New_York-or115.html?filterLang=en,LUXE Life Hotel,"December 17, 2018",Good location as near to train station (Penn station). Room condition can be better at least lays carpet on the floor instead of cement finishing. Coffee machine with hot chocolate options but not working. Nice and Big smart TV in the room. Air conditioner quite noisy when operating.,,Soon K,0,4.0
640105221,https://www.tripadvisor.com/Hotel_Review-g60763-d93452-Reviews-LUXE_Life_Hotel-New_York_City_New_York-or115.html?filterLang=en,LUXE Life Hotel,"December 17, 2018","This is probably one of the worst hotels at this price range. I don't even know where to start! 1) Sewer smell the moment we walk in the room 2) No windows. Very dark. 3) SO loud throughout the day and even worse at night. I'm a very heavy sleeper, but even I woke up at least 6 times during the night. It's not the average motor/HVAC noise that's coming from right outside the blocked off window. I felt like I was staying at a car manufacturing factory. It gets very high pitched from 12am - 4am. The worst. 4) The doors are so thin and I was able to hear everyone's conversation in the hallway. 5) There is no lobby. You enter the building, and you're in middle of a restaurant. You go to the very back of it and you see a tiny reception desk. Very loud too. 6) Tiny. Hallways are narrow, elevators are small, the room is tiny. Suffocating overall. And I've been to numerous hotels in NYC so no, this isn't just a NY thing. 7) This hotel is like a poorly flipped house with a 10k budget. Only cosmestic work done. Worst $700 spent on two nights. Not even cheap!!!","Boston, Massachusetts","Leah P</div><div class=""userLoc""><strong>Boston, Massachusetts</strong>",7,1.0
639723914,https://www.tripadvisor.com/Hotel_Review-g60763-d93452-Reviews-LUXE_Life_Hotel-New_York_City_New_York-or115.html?filterLang=en,LUXE Life Hotel,"December 15, 2018","I am so disappointed of all the places we stayed in NYC it was this one! Deceived by beautiful website and reviews. There is NO service— you can’t even book a cab with the receptionist. No room service, no coffee. The Christmas decorations look like they ran down to a Wal-Greens and just threw up everywhere. $549 for a room that was decorated like the dollar general for Christmas. Not kid friendly! So disappointed — price per room should be under $300!!! Don’t overpay like we did ",Texas,"Tck6373</div><div class=""userLoc""><strong>Texas</strong>",21,3.0
639439275,https://www.tripadvisor.com/Hotel_Review-g60763-d93452-Reviews-LUXE_Life_Hotel-New_York_City_New_York-or120.html?filterLang=en,LUXE Life Hotel,"December 13, 2018","Stayed for one night and loved the hotel. The room was comfortable, bathroom was spacious and the staff were so friendly and helpful. The restaurant in the lobby is great too. The only minus is the lack of tea/coffee in the bedroom as I really wanted one first thing! But they provide free bottles of water, which a lot of NY hotels do not...","Dublin, Ireland","Nicbb</div><div class=""userLoc""><strong>Dublin, Ireland</strong>",1,4.0
639264383,https://www.tripadvisor.com/Hotel_Review-g60763-d93452-Reviews-LUXE_Life_Hotel-New_York_City_New_York-or120.html?filterLang=en,LUXE Life Hotel,"December 12, 2018","I have never been more betrayed by other people’s reviews before, and I regularly travel for business all around the world. I can only assume the 2-3 staff they have spend all their downtime writing reviews for the hotel. The location is interesting - close to MSG and a few doors down from what must be a trash processing plant. There are good bars and restaurant very close. There is no lobby, it’s a restaurant. We waited for 20 minutes to checkin when there were only 2 people ahead of us (all the time being bumped and jostled by bar patrons trying to get to the bathroom).Our room was on the ground floor just past the public bathroom, with a window that looked at ducts (see photo) - I can’t believe they have the gall to rent out that room. It did give me nostalgia for my old rent controlled apartment on the upper west side - large heavy old doors, a good sized bathroom and a comfortable bed (that made so much noise when you moved you could hear everything your neighbor was doing). You couldn’t control the heat and it was sweltering - we had to plug in and use the very loud in wall AC unit (in December). The front desk staff was completely rude and couldn’t be bothered. They banged loudly on our door 10 minutes after hotel checkout time - rude and strange for a hotel in the US. The free coffee on the second floor is in a hallway and is just a machine with no milk or cream for coffee. Gym is tiny.Extremely disappointed and would never consider returning. ",,N2726YLnicolep,1,1.0
639026849,https://www.tripadvisor.com/Hotel_Review-g60763-d93452-Reviews-LUXE_Life_Hotel-New_York_City_New_York-or120.html?filterLang=en,LUXE Life Hotel,"December 11, 2018","Very Nice Hotel, is super clean en the bar downstairs is also Great, nearby the hotspots of New York, bathroom is very small we went here with familie and we had 2 rooms. For 4 days iT is fine to stay",,Maarten-zm,0,5.0
638678668,https://www.tripadvisor.com/Hotel_Review-g60763-d93452-Reviews-LUXE_Life_Hotel-New_York_City_New_York-or120.html?filterLang=en,LUXE Life Hotel,"December 10, 2018","Love the history behind this hotel - would definitely recommend reading up about it ahead of your stay as it makes it all the more special. The rooms are stunning with cute little fixtures and accents, beds are very comfortable and the bathrooms are great too. The price given the location and quality is good as well. Would definitely stay here again.","Auckland, New Zealand","natasha476</div><div class=""userLoc""><strong>Auckland, New Zealand</strong>",3,4.0
637906241,https://www.tripadvisor.com/Hotel_Review-g60763-d93452-Reviews-LUXE_Life_Hotel-New_York_City_New_York-or120.html?filterLang=en,LUXE Life Hotel,"December 6, 2018","I spent 3 nights at LIFE Hotel (room 507).It was a very nice hotel experience in the center of New York. The hotel is fresh renovated and everything looks nice. The room was small, but really cosy and very well clean!Internet connection was good and the location just PERFECT, near to subway, restaurants, bars etc.The service provided at reception (checkin) during the week was extraordinary kind and professional. However, the service at reception during night and on Saturday for checkout was kind of insufficient, i.e. impersonal approach, not professional and no smile! Generally speaking a very nice and clean hotel in the centre of Manhattan!",Lugano,"Cliente_esigente</div><div class=""userLoc""><strong>Lugano</strong>",114,4.0
636978307,https://www.tripadvisor.com/Hotel_Review-g60763-d93452-Reviews-LUXE_Life_Hotel-New_York_City_New_York-or125.html?filterLang=en,LUXE Life Hotel,"December 2, 2018","This hotel has been a favourite of mine when I’m in NYC for work. It’s also been visited by a number of my colleagues on my recommendation. My latest visit was terrible however, and I will not be going back. Ever. Reception charged me twice for the hotel, sent me over my credit card limit and my cards got blocked by my UK bank. I couldn’t access any money the Sunday I was in New York. Which was extremely stressful, time consuming and expensive to sort out. On the Monday I stayed, the hotel had no water, so I wasn’t able to shower before a very long and important day at work.I understand that both of these things are unfortunate and can happen, but the service I have received since has been awful.I have been given $100 off my total bill and that doesn’t even cover a fraction of the inconvenience they caused me and definitely doesn’t cover the phone calls I had to make to my bank back home. The staff just don’t care. The assistant GM Jaymes was fairly helpful the day I had no money but I was passed on to another manager called Kathleen when he was off and the emails I have sent since are being ignored by her. She was extremely rude during my stay and made me feel very small and my calls since are never answered. I’m so disappointed.","London, United Kingdom","coko1112</div><div class=""userLoc""><strong>London, United Kingdom</strong>",1,2.0
636194680,https://www.tripadvisor.com/Hotel_Review-g60763-d93452-Reviews-LUXE_Life_Hotel-New_York_City_New_York-or125.html?filterLang=en,LUXE Life Hotel,"November 27, 2018","I stayed in the Life Hotel with my daughter and her friend. We had a queen twin bed room. Beds were super comfy. The room ( on the 7 th floor) was quiet with very little traffic noise. It was spotlessly clean. The location was suburb. Away from the crowds and noise in Times square but still very central. Two blocks from the Empire State Building and a 3 minute walk to the subway. It felt very safe to walk around , even later in the evening. Staff were friendly and helpful both in the hotel and the bar/ restaurant. We would definitely return and found it to be good value for money. The only downside was a noisy heater/cooling unit which we turned off overnight and a tiny closet - definitely not enough room for 3 girls! But really these things were just minor. ",Brisbane,"AndyC0108</div><div class=""userLoc""><strong>Brisbane</strong>",8,5.0
635447804,https://www.tripadvisor.com/Hotel_Review-g60763-d93452-Reviews-LUXE_Life_Hotel-New_York_City_New_York-or125.html?filterLang=en,LUXE Life Hotel,"November 24, 2018","This is the only hotel I stay at NYCGreat service, housekeeping and staffVery quiet on my floor anywayVery chicGreat vibe in bar and restaurant tooLocation is near everything and in a developing area as wellI’ll be back again!","Cincinnati, Ohio","Diana B</div><div class=""userLoc""><strong>Cincinnati, Ohio</strong>",3,5.0
634414196,https://www.tripadvisor.com/Hotel_Review-g60763-d93452-Reviews-LUXE_Life_Hotel-New_York_City_New_York-or125.html?filterLang=en,LUXE Life Hotel,"November 19, 2018","The hotel is located perfectly for those who want to get around lower Manhattan without necessarily having to use public transport or taxi. The hotel itself was very nice, the premium king room was spacious for New York standards. The bed was huuuge and so comfortable! We did find the bed sheets a bit annoying though, as it wasn’t a duvet cover but simply a sheet, a duvet, and another sheet on top. We got a bit tangled up while sleeping but not a major issue.We stayed 4 nights and when the cleaners did our room they didn’t always refill the shower gel or the water bottles, which is minor but was a bit annoying when showering or when really thirsty (and tangled up) in the middle of the night. Advice for those who have cold feet: take warm slippers, the floor is really cold! Also there was a plumbing issue on the last day which made showering very difficult (cold water and very low pressure). We understand it was a problem with the whole building, but it was a bit annoying on the morning of our departure. Would have appreciated a kind gesture from management, which sadly didn’t happen!Overall we really enjoyed our stay and we would definitely recommend and book again for our next NY trip!",,Michelea O,0,4.0
633967201,https://www.tripadvisor.com/Hotel_Review-g60763-d93452-Reviews-LUXE_Life_Hotel-New_York_City_New_York-or125.html?filterLang=en,LUXE Life Hotel,"November 17, 2018","Stayed for the night while in the city. Hotel was very accommodating, check in and out was very quick and flawless. Hotel is on the older side since it was the old Life Magazine building, but that only adds to the charm. Room was on the smaller side but they all are in the city. Plenty of room for two people for the night. Bed was extremely comfortable Large flat screen TV at the foot of the bed with plenty of channel choices. Room was quiet except for an occasional siren going by, not a big deal. Bar & restaurant downstairs were always busy and an added plus while staying here. You do get a complimentary drink voucher per guest when you check in and they have free Wi-Fi as well.",United States,"sunny45</div><div class=""userLoc""><strong>United States</strong>",93,5.0
633137364,https://www.tripadvisor.com/Hotel_Review-g60763-d93452-Reviews-LUXE_Life_Hotel-New_York_City_New_York-or130.html?filterLang=en,LUXE Life Hotel,"November 13, 2018","The hotel was great! The rooms were clean & well equipped. I LOVED the quotes above the beds! Only downside I is the restaurant menu. Didn't like a thing on it, therefore I didn't eat one meal there. Might try to include items most folks would like",,Fearless517515,0,5.0
632315800,https://www.tripadvisor.com/Hotel_Review-g60763-d93452-Reviews-LUXE_Life_Hotel-New_York_City_New_York-or130.html?filterLang=en,LUXE Life Hotel,"November 10, 2018","This hotel is in a great location just around the corner from Penn Station. The hotel itself looks good and the rooms are large a comfortable with great beds, a small fridge, table and very small cupboard. The WiFi in the building is also quick and reliable. The staff are friendly and helpful. Negatively the surrounding area is unbelievably noisy and the thin windows (the one is our room didn’t actually close right because it was slightly broken) do little to block out the street and constant construction noise. We also had an issue with the plumbing in our room with our toilet not filling properly, the sink not draining and the hot water in the shower sometimes being pretty patchy. Overall we had a good stay at the hotel but for the price I would have expected a few more of the small imperfections to have been addressed. That being said were I to stay again on a similar budget I would look again at this place. ","Christchurch, New Zealand","danigross88</div><div class=""userLoc""><strong>Christchurch, New Zealand</strong>",168,3.0
