review_id,url,hotel_name,review_date,review_body,user_location,user_name,helpful_vote,rating
677863760,https://www.tripadvisor.com/Hotel_Review-g60763-d14095381-Reviews-Moxy_NYC_Downtown-New_York_City_New_York-or215.html?filterLang=en,Moxy NYC Downtown,"May 31, 2019","I stayed 4 nights in this trendy and contemporary hotel. Rooms are very compact, modular and functional which I liked. The cork floor and the interior is great and Adds some warmth to the room. I did miss a kettle there as it was very cold and it would have been nice to make a cup of tea. ....rather than ordering one 10 floors down in the lobby area and bring it back to the room and only and to find out that the cup had lipstick marks on it. Other than that lobby- bar area is a really nice hub and great for having food, chilling or working and the bar staff was friendly there. The customer service overall was a big let down, I had to change rooms as I found lots of hair in my bed from the previous guest . I found that the staff had a bit of an attitude and didnt say sorry for the incident and making me move in my night gown ready to go the bed after long travel. Trendy, good location, but lacks cleanliness and customer service. ","London, United Kingdom","miamara</div><div class=""userLoc""><strong>London, United Kingdom</strong>",12,3.0
675475100,https://www.tripadvisor.com/Hotel_Review-g60763-d14095381-Reviews-Moxy_NYC_Downtown-New_York_City_New_York-or215.html?filterLang=en,Moxy NYC Downtown,"May 21, 2019","I am a frequent traveler to NYC and this was by far the worst customer service I've experienced in any city hotel. It was an across the board indifference from everyone we spoke with. There is no coffee in the hotel room, so one day I went down to the lobby, got a coffee and then went to the bar to pay for it (cost twice what they charge at the Starbucks BTW). The bartender grumbled at me and said ""next time get coffee there"", he pointed across the room and walked away. I never saw another place to get coffee and still have no idea what he was pointing at. Literally I could detail 5 different experiences that were just like that. I wish I could say there was one person who was kind or hospitable, but from the check in process to them storing our bags on the way out it was one cranky person after another. Add that to the cramped, excessively minimalist rooms and it definitely isn't a hotel I'd go back to.","Fort Myers, FL","LynnSunshine</div><div class=""userLoc""><strong>Fort Myers, FL</strong>",51,3.0
675311469,https://www.tripadvisor.com/Hotel_Review-g60763-d14095381-Reviews-Moxy_NYC_Downtown-New_York_City_New_York-or215.html?filterLang=en,Moxy NYC Downtown,"May 20, 2019",My husband and I stayed at the Moxy downtown last week (May 14- May 17th). I must say that it is a great hotel. The room was immaculate and we received service daily. The housekeeping staff was very attentive and friendly. Upon going to my next vaca I will definitely check to see if there is a Moxy hotel available to stay at wherever I go. Thanks for everything!,,Vicki8668,1,5.0
675219797,https://www.tripadvisor.com/Hotel_Review-g60763-d14095381-Reviews-Moxy_NYC_Downtown-New_York_City_New_York-or215.html?filterLang=en,Moxy NYC Downtown,"May 20, 2019","It’s in a cool location in the financial district and has a low key reception with self service check in. This is fine but does mean you miss out on the opportunity to ask questions as there was always a queue at the tiny reception desk.The bar is great with a retro look, lots of fun games and a programme of DJs and move nights. The room we had was small but comfortable (very comfortable bed) and was perfect for a city break. It was also nice to be able to access Netflix etc in the room. There was confusion over the breakfast being included in the room rate - they still haven’t refunded us for the breakfasts we had been told would be included but were charged to the credit card.I would stay there again definitely, it’s not hugely cheap for the extras (breakfast and drinks), and there’s no room service, but with the excellent Joe’s Pizza round the corner we didn’t need it!",london,"londongirl895</div><div class=""userLoc""><strong>london</strong>",5,4.0
675164444,https://www.tripadvisor.com/Hotel_Review-g60763-d14095381-Reviews-Moxy_NYC_Downtown-New_York_City_New_York-or215.html?filterLang=en,Moxy NYC Downtown,"May 20, 2019","tldr; They charged my account 270 euros extra and have been ignoring my emails.While the hotel is good in terms of conditions, and the staff is really nice, the management of this hotel seems to be a mess.I booked directly via the Marriott Bonvoy system as I has enough points to have 2 out of 3 nights free. They charged me for those two nights even though it's stated that I was supposed to pay $380 as per the bill they emailed me in advance.The hotel hasn't been responding to my emails. I also started a claim via Marriott Bonvoy and that seems to be ignored as well.So maybe if you really have to stay here make sure that you pay in cash or something as they seem to either have bad intent and charge you extra on purpose or not aware of the mess they're in in terms of their management which is crazy considering it's part of a big chain.","County Dublin, Ireland","DuruA</div><div class=""userLoc""><strong>County Dublin, Ireland</strong>",9,2.0
674472579,https://www.tripadvisor.com/Hotel_Review-g60763-d14095381-Reviews-Moxy_NYC_Downtown-New_York_City_New_York-or220.html?filterLang=en,Moxy NYC Downtown,"May 16, 2019","We were staying at Moxy Downtown for 6 days and enjoyed every minute of it. The location is perfect for exploring the city. And the room was perfect to recover the strength -very comfortable beds, sparkling clean throughout. Very friendly and helpful staff. Next time we are in the city surely will be coming back.","Far Hills, New Jersey","Antonina F</div><div class=""userLoc""><strong>Far Hills, New Jersey</strong>",0,5.0
674426431,https://www.tripadvisor.com/Hotel_Review-g60763-d14095381-Reviews-Moxy_NYC_Downtown-New_York_City_New_York-or220.html?filterLang=en,Moxy NYC Downtown,"May 16, 2019","Recently my husband and I traveled to New York (NY). It was my husband's first time in NY. When we checked into the Moxy, the hotel associate who checked us in was Yasmin. She was very friendly, outgoing and offered several suggestions on what to do and where to eat. She said that she wanted our stay to be memorable so she ensured that we had an outstanding room with an excellent view. We had a blast in New York and Yasmin ensured that we started our trip on the right track.","Carlsbad, California","TeriJuy</div><div class=""userLoc""><strong>Carlsbad, California</strong>",0,5.0
674403799,https://www.tripadvisor.com/Hotel_Review-g60763-d14095381-Reviews-Moxy_NYC_Downtown-New_York_City_New_York-or220.html?filterLang=en,Moxy NYC Downtown,"May 16, 2019","I’m a native New Yorker and stopped by your hotel to check on some family visiting from Texas and their stay. Updated my arrival I had some trouble locating their room. The front desk was extremely helpful and directed my to the 3rd floor through the Recreation space. To my surprise, I stumbled upon an event mixer and I’m glad it happened. There were so many interesting people there amazing conversation, great drinks and really cute bites. I really enjoyed the 4 cheese flat bread and your server Laura was absolutely pleasant sweet & quite charming. The basketball area was awesome and extremely fun. These type of events are a great way of networking in the downtown area where people can meet, exchange ideas, share a great time and I’m looking forward to coming back very soon and I’m definitely bringing some friends along. Although I’m recovering from the night I had to write to you guys and say job well done Moxy!",,DinarBanks,0,5.0
674271108,https://www.tripadvisor.com/Hotel_Review-g60763-d14095381-Reviews-Moxy_NYC_Downtown-New_York_City_New_York-or220.html?filterLang=en,Moxy NYC Downtown,"May 15, 2019","Be careful with your credit card for incidentals here. Someone tried to use mine for over $2900 at Rite Aid down the street after I left. Other than that, location was great. Tiny room didn’t matter. The bar area is a cool place to hangout ","Farmington, New Mexico","jasoneG8510QW</div><div class=""userLoc""><strong>Farmington, New Mexico</strong>",0,3.0
673565614,https://www.tripadvisor.com/Hotel_Review-g60763-d14095381-Reviews-Moxy_NYC_Downtown-New_York_City_New_York-or220.html?filterLang=en,Moxy NYC Downtown,"May 12, 2019","Really painful elevators. Just way too noisy for me. DO NOT like NOT having a desk to work on in my room. Just too tight a room for my comfort, Much prefer a traditional comfort 4 star experience . Hip hop for the 24s","Australian Capital Territory, Australia","BrisbaneNewDad</div><div class=""userLoc""><strong>Australian Capital Territory, Australia</strong>",232,3.0
672943423,https://www.tripadvisor.com/Hotel_Review-g60763-d14095381-Reviews-Moxy_NYC_Downtown-New_York_City_New_York-or225.html?filterLang=en,Moxy NYC Downtown,"May 10, 2019","Stayed at this place for 5 nights. Our rooms were sparkling clean and fresh. Housekeeping service was great, they change bed sheets and towels every day. Location is extremely good, after couple of minutes walking you can reach to many attractions and the metro is near too. The room is tiny but well equipped. (USB port, smart TV, wifi etc). Everything is clear and fresh. The lounge is friendly, and spacious. Easy check in and flawless check out. Wonderful location. I highly recommend this hotel to all types of travelers.","Istanbul, Turkey","Adyavuz</div><div class=""userLoc""><strong>Istanbul, Turkey</strong>",39,4.0
672352854,https://www.tripadvisor.com/Hotel_Review-g60763-d14095381-Reviews-Moxy_NYC_Downtown-New_York_City_New_York-or225.html?filterLang=en,Moxy NYC Downtown,"May 7, 2019","great location and super service, but too pricy for the size of the room and lack of amenities. Expected a microwave, fridge, and jacuzzi, but they did not have any of these! The service made up for it though! Front desk attendants were helpful and friendly. A perfect hotel for young people, and those young-at-heart!",,Susannnnnnn,1,4.0
672194306,https://www.tripadvisor.com/Hotel_Review-g60763-d14095381-Reviews-Moxy_NYC_Downtown-New_York_City_New_York-or225.html?filterLang=en,Moxy NYC Downtown,"May 7, 2019","Stayed at this place for three nights with family friends. Our rooms were sparkling clean, fresh and spacious. Housekeeping service was great, they changes bed sheets and towels every day. Easy check in and flawless check out. Wonderful location. I highly recommend this hotel to all types of travelers.","Brooklyn, New York","Oxana V</div><div class=""userLoc""><strong>Brooklyn, New York</strong>",2,5.0
672174936,https://www.tripadvisor.com/Hotel_Review-g60763-d14095381-Reviews-Moxy_NYC_Downtown-New_York_City_New_York-or225.html?filterLang=en,Moxy NYC Downtown,"May 7, 2019",Great hotel. Excellent room service. Very clean and comfortable room. Every staff member we came across had a smile and was very helpful and friendly. Everything from entering the hotel until leaving was great. Highly recommended.,,Veronica M,0,5.0
671443754,https://www.tripadvisor.com/Hotel_Review-g60763-d14095381-Reviews-Moxy_NYC_Downtown-New_York_City_New_York-or225.html?filterLang=en,Moxy NYC Downtown,"May 4, 2019","The hotel has s great location in a pleasant but busy area 3 or 4 mins walk from ground zero. Small lobby off the street and then a short lift to the bar. The bar is great but bar prices are sky high (but so is everything in this neighbourhood).You then get a lift to your room from the bar.The rooms are very small but it is New York. Staff are great but here are my issues.1. Room noise facing the street was unbelievable. So got a room move. This was arranged easily but executed poorly.2. The lifts are busy, especially in the morning. Allow 10 mins to get down.3. Lift key cards temperamental and only allow access to your floor so tricky in a group (use the stairs)4. Not a single vegan item in the hotel. Odd for somewhere trying to be cool.On the whole it's ok but do not expect to be wowed.","Stokesley, United Kingdom","308robertj</div><div class=""userLoc""><strong>Stokesley, United Kingdom</strong>",47,3.0
671160008,https://www.tripadvisor.com/Hotel_Review-g60763-d14095381-Reviews-Moxy_NYC_Downtown-New_York_City_New_York-or230.html?filterLang=en,Moxy NYC Downtown,"May 3, 2019","I had posted a 1 star rating due to poor customer service from a double-booking mixup, but Jeff at the Moxy was kind enough to call me and make things right. I look forward to staying at the Moxy sometime soon!","Oakland, California","Carla F</div><div class=""userLoc""><strong>Oakland, California</strong>",2,5.0
671052944,https://www.tripadvisor.com/Hotel_Review-g60763-d14095381-Reviews-Moxy_NYC_Downtown-New_York_City_New_York-or230.html?filterLang=en,Moxy NYC Downtown,"May 2, 2019","Location is extremly good, after couple of minutes walking you can reach 911 Memorial, Wall street etc and the metro is near too. The room is tiny but well equiped. (USB port, smart TV, wifi etc). Everything is clear and fresh. What i really missed is a closet, but it has no place to have. The lounge is friendly, and spacious. Good place to work (USB port, and electricity has been built in the table), but you can chill to.","Budapest, Hungary","heyZsuzs</div><div class=""userLoc""><strong>Budapest, Hungary</strong>",3,4.0
671004519,https://www.tripadvisor.com/Hotel_Review-g60763-d14095381-Reviews-Moxy_NYC_Downtown-New_York_City_New_York-or230.html?filterLang=en,Moxy NYC Downtown,"May 2, 2019","Best for its location as its just walking distance to Wall Street, 911 Memorial, One World Trade Center, Subways, and several grocery stores. The room setup is smart design furniture which is typical nowadays in NYC due to lack of space and average room size getting smaller. Our room on 8th floor was super clean as if we were the first guests staying there, however smaller than expected. Though it had all the needed facilities one can expect from a budget hotel in a prime location except for the coffee maker! The queen bed was one of the smallest I have seen with only 2 Pillows.The staff at the front desk was very hospitable and first introduced herself before explaining all the booking details including the incidental charges authorization.The check-in and check-out experience was seamless. We will definitely stay here again on our next visit.","New Delhi, India","akhilpwalia</div><div class=""userLoc""><strong>New Delhi, India</strong>",85,4.0
670452638,https://www.tripadvisor.com/Hotel_Review-g60763-d14095381-Reviews-Moxy_NYC_Downtown-New_York_City_New_York-or230.html?filterLang=en,Moxy NYC Downtown,"April 30, 2019","What I liked about the Moxy downtown:• Clean room, bigger than many in this price range (though still on the small side).• Well appointed room, sleek and sexy.• Bigger bathroom than most. In fact, a great bathroom.• Quiet. Virtually no street noise from my room (13th floor)• Multiple lighting options in both bedroom and bathroom -- from ambient to bright.• Attentive, pleasant staff (Especially Stephanie and Rafael)• Incredible locationWhat I didn't like about the Moxy downtown:• The noxious, subway-like stench in the tiny check-in area you have to walk through before heading up to your room -- which, oddly, happened only at night (probably because in the two nights I was there, a sewage vacuum truck was right outside on the street, doing God-knows-what. Happily, though, that odor went away the moment I entered the first elevator on my way upstairs.• No safe in my room.• No dresser or closet in my room. Just a few hooks on a wall and small, retractable table to place your suitcase on.• The ear-splitting, horrible DJ music blasting on the third floor both nights I was there. Not a huge distraction though, as that noise was completely inaudible as I went up to my room. Just a minor, have-to-pass-by-it annoyance to get to the second set of elevators that lead to the guest rooms.","Richmond, Virginia","Michael0909</div><div class=""userLoc""><strong>Richmond, Virginia</strong>",24,4.0
669924347,https://www.tripadvisor.com/Hotel_Review-g60763-d14095381-Reviews-Moxy_NYC_Downtown-New_York_City_New_York-or230.html?filterLang=en,Moxy NYC Downtown,"April 28, 2019","The staff were amazing at this hotel even though I bothered them several times a day about travel adaptors, hotel amenities, General room issues (I couldn’t get the tv to work), housing keeping requests etc. If they could not help me they offered to help me find a solution about even where to find a grocery store or the like. This hotel rooms are small (although I am accustomed to large Australian rooms) the room was super clean, stylish and I loved all the little features like the old style telephone, beats audio through the tv. Make up mirror light. Muk products. I loved this hotel and service so much I booked to stay at the Times Square one a week later. Thanks so much for a great stay!","Melbourne, Australia","Courtney S</div><div class=""userLoc""><strong>Melbourne, Australia</strong>",3,5.0
669394786,https://www.tripadvisor.com/Hotel_Review-g60763-d14095381-Reviews-Moxy_NYC_Downtown-New_York_City_New_York-or235.html?filterLang=en,Moxy NYC Downtown,"April 26, 2019","Organization for checking in and out was disappointing. Disorganized booking system. The hotel did not have the booking confirmation I made through Booking.com even though I had received a confirmation by email. Staff was accommodating but the whole process took a long time and I had to be on the phone with Booking.com. Ended up missing a major train ride due to the process. I'm also a Marriott Rewards member and was told upon arrival the first night that they lost my preferred customer room as it was given to someone else. Had to wait over 1.5 hours at around 6PM (promised guaranteed check in time 3PM) to just get a regular room, low floor, no view, no perks of rewards membership. They didn't make up the room or service at all during this 2 night stay.",,Cynthia Q,1,2.0
668912164,https://www.tripadvisor.com/Hotel_Review-g60763-d14095381-Reviews-Moxy_NYC_Downtown-New_York_City_New_York-or235.html?filterLang=en,Moxy NYC Downtown,"April 24, 2019",What an amazing hotel. Staff is so friendly. If you’re in the area - the flatbreads OMGZ amazing. The basketball room on the floor with the bar is a ton of fun. There is also skeeball! Definitely coming again soon. What a great fun vibe. ,"Bronx, New York","ashleynicole987</div><div class=""userLoc""><strong>Bronx, New York</strong>",1,5.0
668499718,https://www.tripadvisor.com/Hotel_Review-g60763-d14095381-Reviews-Moxy_NYC_Downtown-New_York_City_New_York-or235.html?filterLang=en,Moxy NYC Downtown,"April 22, 2019","This is my first time stay @ Moxy NYC Downtownme and my son spend spring brake April 18th-21st, we love the location easy to get around Manhattan,GREAT SHOPPING@21 century Store,Nice Bar for great cocktail and music.Friendly staff so helpful with big smile,special Thank you to Miss Yasmin at the front for the King room with View.also my 15 years old son love the B S ball court.we will go back and stay there again.akom joe wilailuck",,akomsalon,0,4.0
667519945,https://www.tripadvisor.com/Hotel_Review-g60763-d14095381-Reviews-Moxy_NYC_Downtown-New_York_City_New_York-or235.html?filterLang=en,Moxy NYC Downtown,"April 18, 2019","Came here for a long weekend celebrating my birthday (and, as it turned out, my engagement). I'm Gold Elite with Marriott, but unfortunately, there were no upgrades available when we checked in. All good, the staff was very kind every time we spoke. We used the drink chips they gave us at check-in on our last night. My prosecco was covered; my fiancé's cider was not. The games were fun. We came in after dinner on Friday night and the DJ was blasting Backstreet Boys. I loved it, my fiancé said in the elevator, ""I am officially too old for this hotel.""Room is small, but I knew what we were signing up for. I LOVED the media system on the TV and how you can either manually sign out of all your services or you'll be signed out at checkout. I mean, loved. I could connect my Spotify to the TV via Bluetooth, watch my Hulu, Netflix, all of it. Well done, Moxy.Loved the location. Easy to catch the subway to everything. There was a Shake Shack just around the corner, along with a Zara. Ubers and Lyfts had a pretty hard time finding us because their GPS kept wanting to drop us off on the opposite side of the block from the hotel entrance (there's only one, on Ann St., but GPS wanted to drop us off on Fulton St.), but I figured out the best way to direct drivers by the 3rd or 4th pickup. It was COOOOLD and windy, but that's to be expected in early February. Loved Brookfield Place a few blocks away!The shower had fine water pressure. Water didn't get nearly hot enough for me, but I also take boiling lava-temperature showers, so few hotels meet this standard. Didn't mind the hooks instead of a closet, was just kind of tough to find places to set our luggage that wasn't the floor. Loved the cool cage chair. Would have liked a nightstand on both sides of the bed, there was only one. I took that one so I could use my CPAP machine.I was so excited to listen to the bedtime stories, but our phone did not work! Couldn't even reach the front desk. Totally dead. But it was never pressing enough to mention to the front desk once we got down there.All in all, my criticisms wouldn't keep me from staying there again if the price was right. Had a wonderful time and probably will stay there again next time I'm in NYC.","Atlanta, Georgia","593pattyms</div><div class=""userLoc""><strong>Atlanta, Georgia</strong>",0,4.0
667298213,https://www.tripadvisor.com/Hotel_Review-g60763-d14095381-Reviews-Moxy_NYC_Downtown-New_York_City_New_York-or235.html?filterLang=en,Moxy NYC Downtown,"April 17, 2019","Besides a great location Downtown, it was perfect for my kids and I. It was nice that I was able to sit in the lobby with a drink listening to the DJ after a long day walking the city while my kids had a great time playing all of the old school games they had to offer. I will definitely be coming g back! ","Yardley, Pennsylvania","JenniferM343</div><div class=""userLoc""><strong>Yardley, Pennsylvania</strong>",19,5.0
666801721,https://www.tripadvisor.com/Hotel_Review-g60763-d14095381-Reviews-Moxy_NYC_Downtown-New_York_City_New_York-or240.html?filterLang=en,Moxy NYC Downtown,"April 15, 2019","We loved staying at the Moxy NYC Downtown! It's in a great location in the Financial District and within walking distance to many amazing lower Manhattan sites. The hotel is clean and modern - perfect for our 2 teenage daughters who we had with us. The staff is very helpful and friendly, they held our luggage when we arrived early in the morning of our first day and on our last day too, always there to answer our questions and open the door for us (thank you Rafael!). Our room was small, but that is what you get in NYC, and we had 2 queen beds which is a rare find. The beds were comfortable and the room and bathroom were clean. We stayed on the 28th floor and had amazing views of the city. The Fulton subway station is right around the corner and can take you almost anywhere you want to go in the city. We rode the subway in from JFK and it was easy. There is a CVS right around the corner which was super convenient. We always felt safe. We would highly recommend this hotel!","Pleasant View, Utah","jennifer4777</div><div class=""userLoc""><strong>Pleasant View, Utah</strong>",0,4.0
665551263,https://www.tripadvisor.com/Hotel_Review-g60763-d14095381-Reviews-Moxy_NYC_Downtown-New_York_City_New_York-or240.html?filterLang=en,Moxy NYC Downtown,"April 11, 2019","This was our first time to stay at a Moxy property. Though we are older than the average consumer at MOXY, we had a delightful time. We liked the concept of the ""lobby/bar"" with many activities. The rooms were very small, but efficient. (And, when in NYC, not much time is spent in the hotel!). The hotel was clean and comfortable and in a safe area. We don't normally stay in the FIDI, but this time it was convenient to our plans. It is very near a subway station, so even if you will be uptown, it is a good location.If you've not stayed at a Moxy, please note that space is well-appointed. Your clothes, chair and tables will hang on the wall. It just works at the Moxy!","Germantown, Tennessee","GermanPearl</div><div class=""userLoc""><strong>Germantown, Tennessee</strong>",13,4.0
665331313,https://www.tripadvisor.com/Hotel_Review-g60763-d14095381-Reviews-Moxy_NYC_Downtown-New_York_City_New_York-or240.html?filterLang=en,Moxy NYC Downtown,"April 10, 2019","I stayed here over the weekend and really enjoyed it. We got to the city early and although there wasn't a room ready, the front desk was able to hold on to our bags so we could start our day. Upon check in we were given 2 drink tokens for their signature drink in the bar. The room was small but it still felt like we had enough space. The bathroom is bigger and bright. The bed was comfortable but if you like pillows, I would request more upon your arrival. The bar are seemed to be a nice hangout and was always full with people. The location of this hotel is great and is safe. Walking distance to Starbucks, WTC and subway. There is also a CVS nearby.","Waukesha, Wisconsin","LizbethW14</div><div class=""userLoc""><strong>Waukesha, Wisconsin</strong>",7,4.0
