review_id,url,hotel_name,review_date,review_body,user_location,user_name,helpful_vote,rating
752475677,https://www.tripadvisor.com/Hotel_Review-g60763-d14149815-Reviews-Moxy_NYC_Chelsea-New_York_City_New_York-or0.html?filterLang=en,Moxy NYC Chelsea,"April 10, 2020","I stayed at the Moxy NYC Chelsea for a trip to NYC from California for work in early March. I was always curious about the Moxy brand also working at Marriott and the hotel lived up to my expectations of it being aimed towards Millenials (like myself) but also fitting the budget. The hotel itself was in the perfect location as it was a close walk to the subway stations and felt like a safe area. There's even a flower shop next door which is nice to walk out to in the morning. I absolutely loved the aesthetic of the hotel, and even the staff's uniform was so stylish! All the staff I encountered at the front desk were super friendly, including Maria and a few others I forgot the names of.The rooms are small but what do you expect in New York? You should also be minimally in the room and exploring anyhow! I stayed in a King room the first night and it was the first time I've seen a sink in the same area as the bedroom; I could see this as an issue if you are staying with someone and need to blowdry your hair while someone else is sleeping. However, this is not an issue in the double-bedded rooms so keep that in mind (the whole bathroom area is behind a closed-door versus in same room as the bedroom). Other than that, I loved the aesthetic and also loved how there was a steamer in the room. Another heads up, walls seem thin and I could constantly hear the neighbors talking or doors slamming in the hallway. The rooftop bar was also lovely! I went on a Saturday night and it was packed; expect long lines for the bar and pricey beverages. However, you can't beat the atmosphere and those views. I also visited the Moxy Times Square bar but I preferred how this one was much more classy.Overall, I really loved my stay at the Moxy NYC Chelsea and will absolutely recommend to anyone traveling to NYC. I'm dreaming about the next time I can return and stay there again!","San Jose, California","Cris-annL</div><div class=""userLoc""><strong>San Jose, California</strong>",3,5.0
751143560,https://www.tripadvisor.com/Hotel_Review-g60763-d14149815-Reviews-Moxy_NYC_Chelsea-New_York_City_New_York-or0.html?filterLang=en,Moxy NYC Chelsea,"March 16, 2020","The rooms are simple, but new and open with a lot of sunlight. The location is decent and centrally located. However, what made my stay enjoyable were the employees. Every single one of them was great and they always had smiles on their faces. Great customer service and they certainly ensured that my days got off to a good start. I will definitely be staying here again.","Evanston, Illinois, United States","W8780ODmaxb</div><div class=""userLoc""><strong>Evanston, Illinois, United States</strong>",2,5.0
750818110,https://www.tripadvisor.com/Hotel_Review-g60763-d14149815-Reviews-Moxy_NYC_Chelsea-New_York_City_New_York-or0.html?filterLang=en,Moxy NYC Chelsea,"March 14, 2020","I’m no stranger to New York and I was really looking forward to this visit. I booked the Moxy Chelsea having read it was recommended for its fantastic views of the city and rooftop bar. Well it didn’t disappoint! We had a great view downtown from the 30th floor which we enjoyed waking up to and watching the city go by at night. The rooftop bar - Fleur Room was a nice treat too with some great views. The rooms were small, but just about the right size. Everything worked and we didn’t miss the extra space - very high quality. The location was good for getting around by subway with the 1-2-3 line stopping at 28th on the corner. The street is known as the flower district which was great to walk through on a sunny morning. I couldn’t recommend this hotel and it’s friendly staff more. ",,Breffni G,1,5.0
750569885,https://www.tripadvisor.com/Hotel_Review-g60763-d14149815-Reviews-Moxy_NYC_Chelsea-New_York_City_New_York-or0.html?filterLang=en,Moxy NYC Chelsea,"March 12, 2020",We enjoyed our stay at the Moxy Chelsea! We were visiting for my daughter’s 21st birthday and the hotel provided a great room on the 29th floor with a wonderful view of the Empire State Building. They left balloons and decorated our window. All of the staff we encountered were very friendly and accommodating. We ate at Feroce and it was delicious. We also went up to The Fleur Room for a great view of the city. We liked that the hotel was centrally located between Uptown and Downtown because we went all over. We also used the subway and the stop was just a block. ,North Carolina,"NCTravelMouse</div><div class=""userLoc""><strong>North Carolina</strong>",13,5.0
750117602,https://www.tripadvisor.com/Hotel_Review-g60763-d14149815-Reviews-Moxy_NYC_Chelsea-New_York_City_New_York-or0.html?filterLang=en,Moxy NYC Chelsea,"March 9, 2020","The location is great. The rooms are small, but are good for a quick stay. The lounges are really nice and the cocktails at happy hour were delicious!Mini fridge if you ask for one! Staff is super friendly and helpful. Will stay again!","Long Island, New York","ctness88</div><div class=""userLoc""><strong>Long Island, New York</strong>",3,4.0
750054340,https://www.tripadvisor.com/Hotel_Review-g60763-d14149815-Reviews-Moxy_NYC_Chelsea-New_York_City_New_York-or5.html?filterLang=en,Moxy NYC Chelsea,"March 9, 2020","Top notch experience start to finish. 3 college friends took a 3night 4 day trip to NYC. Starting with the reservations. We each booked separately using different methods and all got excellent rates and rooms ( booking.com, Amex travel, and hotels.com) . Before arriving, as I was somewhat hosting this get together, I inquired about getting an early checkin. I also requested a mini refrigerator,. There is no charge for that. You just have to request. They explained to me what to do to increase the likelihood of getting early check in. We had a very early morning flight and wished to change clothes and clean up a bit before heading out sightseeing. They made a note on each of our rooms that we would like early check in. I was told to call a number they gave me when we were in route from the airport. We did that and 2 of our rooms were ready early ( like 10:30 ish). There was a 3rd room available provided she switch from a king bed to 2 doubles which she did. The staff at the front desk was fantastic and check in was a breeze. When we were leaving they gave us clear concise information about our request related to taking the subway to the Brooklyn Bridge, including information on how to we could now use Apple Pay for the subway instead of needing a metro card. ( not all stations can do that yet). Our rooms..small and tight ( fine for 1 -2people)with amazing views. The design was really different than anyplace I’d been, but very efficiently laid out for use of space. My room had a king bed and the mini refrigerator arrived about 5 minutes after I got to the room. As you enter the bathroom is on yours right in a divided space with sliders like you might see on a double closet. One half has the commode and the other side is the shower. On the left as you enter is a full length mirror followed by a very modern sleek sink /vanity area with mirror above and open wrought shelving below that was stocked with towels and a blow dryer AND garment steamer. Ample plugs in the area for small appliances &/or phone. So probably the biggest difference from a typical hotel room was no closet or dressers or tables ( except 2 small night tables on both sides of bed). Attached the the wall was a pull down table/desk. Pretty cool. When you opened it on the back we’re fabric pockets for stuff like pens, phone , note pad , maybe even a tablet, and the table top is a good size. Plenty of room for a laptop and working papers beside, and again several outlets. A folding chair is hanging flush on one of the MANY pegs around the room. The pegs and provided hangers replaced a need for a closet. I actually loved this. I could put my outfits for the week including accessories on the pegs and visibly see them all laid out. I didn’t even bother with the hangers as the pegs were big enough ( subtle time saver hanging/unhanging ) . Not a big deal for most but I have a handicap with one hand and hanging clothes isn’t always simple for me. Under the bed are built ins that replace the need for dresser. Hanging on the peg is a foldout luggage table or you can store your luggage under the bed. I loved the efficient room features, including the many outlets and overall design. Easily worked for me. Now the food and drinks... every morning (7am-11am)free coffee on the 2nd floor ( no coffee maker in room). There is also a coffee shop at entrance to hotel with delicious coffee. Food looked good but I didn’t get to try any. There is a happy hour 5-7 with certain drinks being half price which is still expensive for this Florida girl. But this is NYC and I fully expected this. The drinks I tried each time were delicious and unique. I believe the Peroni beer was the happy hour beer the day we were there. The service was excellent. One night after a day of sightseeing we were to tired and just ate the tapas type food at the bar which was absolutely delicious, some chicken tenders type thing, an amazing grilled cheese type thing, truffle popcorn and these were not your normal versions of this stuff . I just can’t recall the other ingredients or sauce. We didn’t eat at the restaurant since we had dinner plans the other nights. It sure smelled good though whenever we were nearby. The rooftop bar was a lot of fun. Terrific views of the city all around, including getting to see the Empire State Building light show . It is an enclosed ( not open air garden type) bar. Monday not crowded at all. Tuesday night was rainy so it was definitely busier, but not bad. The crowd seemed to primarily be young to middle age professionals. The music was good but not so loud to make conversations difficult. We loved that we could just be at our hotel for after dinner socializing and just go to our room downstairs when we were ready to call it a night. A big reason for selecting this hotel. The other reason we selected this hotel is that we wanted to be in a different area of the city. In this case in the Chelsea area not far from Chelsea market and the High line. Walking distance to a lot of things and easy access to the subways. It is in the flower district and the flowers in the shops by the hotel are breathtaking. Location was perfect for us.","Apollo Beach, Florida","Kimkrankin</div><div class=""userLoc""><strong>Apollo Beach, Florida</strong>",4,5.0
749670268,https://www.tripadvisor.com/Hotel_Review-g60763-d14149815-Reviews-Moxy_NYC_Chelsea-New_York_City_New_York-or5.html?filterLang=en,Moxy NYC Chelsea,"March 7, 2020",This was my second stay and both exceptionally pleasant from check in to the comfort of the rooms.I had the please of being welcomed by the amazing Danielle at the Front Desk who is just amazing and consistent with her high level of professionalism and genuine Customer Service.Look forward to another stay very soon.,"Jersey City, New Jersey","destin2travel</div><div class=""userLoc""><strong>Jersey City, New Jersey</strong>",2,5.0
749435472,https://www.tripadvisor.com/Hotel_Review-g60763-d14149815-Reviews-Moxy_NYC_Chelsea-New_York_City_New_York-or5.html?filterLang=en,Moxy NYC Chelsea,"March 5, 2020","We spent one week of blissful holidays with my wife in the 22nd floor of this awesome design gem in midtown Manhattan with an amazing view of the Empire State Building, extremely helpful staff and great facilities.","Athens, Greece","andonis33t</div><div class=""userLoc""><strong>Athens, Greece</strong>",0,5.0
749377363,https://www.tripadvisor.com/Hotel_Review-g60763-d14149815-Reviews-Moxy_NYC_Chelsea-New_York_City_New_York-or5.html?filterLang=en,Moxy NYC Chelsea,"March 5, 2020","I travel to New York for work almost every month, and despite the fact that the rooms are a bit spartan, I keep coming back to the Moxy (and recommend it to colleagues and friends) because of Feroce bar and restaurant. Overall a great hotel for business travelers, groups of friends, young couples. Probably not a good fit for families with young children.","San Francisco, California","roccosann</div><div class=""userLoc""><strong>San Francisco, California</strong>",2,4.0
748948396,https://www.tripadvisor.com/Hotel_Review-g60763-d14149815-Reviews-Moxy_NYC_Chelsea-New_York_City_New_York-or5.html?filterLang=en,Moxy NYC Chelsea,"March 3, 2020","I absolutely love, love, love this hotel! The location is absolutely perfect, about a 4 block walk to subways connecting east and west. It's a small hotel but super clean and the service was just amazing, everyone was very friendly and responsive. The rooms are small, but that is to be expected in NYC, but what I love about this hotel is that every room seems to have natural sunlight and this is really important to me to have. Many NYC hotels you get stuck in a room looking at the side of another building. The rooftop bar has a great view of the Empire State Building. All in all, I love this hotel, I've stayed here twice and it will be my go-to from now on!","Santa Monica, California","jkcsekhar</div><div class=""userLoc""><strong>Santa Monica, California</strong>",10,5.0
748929162,https://www.tripadvisor.com/Hotel_Review-g60763-d14149815-Reviews-Moxy_NYC_Chelsea-New_York_City_New_York-or10.html?filterLang=en,Moxy NYC Chelsea,"March 3, 2020","I usually stay at The Nomad, Edition Clocktower, or Soho House. This was a better stay than all three. Rooms have great natural light and comfortable beds.The hotel has great staff and amenities.If this hotel is available, BOOK IT.",,CliftonTony,1,5.0
748412476,https://www.tripadvisor.com/Hotel_Review-g60763-d14149815-Reviews-Moxy_NYC_Chelsea-New_York_City_New_York-or10.html?filterLang=en,Moxy NYC Chelsea,"February 29, 2020","So, I picked this hotel because location. Perfect. This hotel seemed to offer a lot as well and just seemed to fit the bill for the area. Upon check in, I was expecting a complimentary cocktail since they advertised (and still do) that it’s an amenity. We were told it was discontinued and didn’t bother to grandfather us into the rule. Ok. Then I had them my bags after they said our room was not ready, they don’t take our luggage! I had to go down to the basement, where it smelled of curry to take my luggage and store it myself. Finally got our room and omg. It was SMALL! It’s seriously goes from lobby: ok, decor kinda fun but strange. Then the hallways look like an industrial bowling ally. Then you get to your room that looks like it’s from a small cottage in northern Michigan. Camp for adults it felt. Yuck. And the staff pretty much make sure they have very little to no interaction as possible with you. Never again. ","Orlando, Florida","Tdocteur</div><div class=""userLoc""><strong>Orlando, Florida</strong>",5,2.0
747149111,https://www.tripadvisor.com/Hotel_Review-g60763-d14149815-Reviews-Moxy_NYC_Chelsea-New_York_City_New_York-or10.html?filterLang=en,Moxy NYC Chelsea,"February 23, 2020","The room was ""NYC Sized"", but we were expecting that and it came with a spectacular view. Lots of funky little touches (vintage phone, interesting art) made the room feel fun. The bed was comfy. I wasn't a huge fan of the hook system in place of a closet and dresser.... where do you put things that don't go on hangers? Like underwear? We were staying for a few days so, a few drawers would have been nice.I unfortunately was under the weather, so I can tell you the channel selection on the TV is awesome. I watched a bunch of Showtime.The entrance seemed to always be under construction in one way or another but the lobby was efficient other than that. They don't seem to do early check in and the lounge area was PACKED with folks waiting for their rooms to be ready, At 4pm people started getting texts to check in. But the Lounge is lovely with natural light and fake plants.My Husband took advantage of roof top yoga and loved it.We both took advantage of the rooftop bar and it was fantastic. Fun spot, not too noisy or crowded. Very stylish.The restaurant next door does a great quick breakfast.",,Diz8i8,2,4.0
747036775,https://www.tripadvisor.com/Hotel_Review-g60763-d14149815-Reviews-Moxy_NYC_Chelsea-New_York_City_New_York-or10.html?filterLang=en,Moxy NYC Chelsea,"February 23, 2020","Normally a shower alone wouldn’t warrant a great review but the shower at Moxy Chelsea was next level, fully immersive, relaxing. While the room is on the smaller side (hello NYC), it’s well designed with spaces under the bed for storage, floor to ceiling windows to allow for brightness and a perception of space, and a beautiful ceramic full length sink that doubles as a shelf for your things. The hotels cool design and great location in the center of the city was a nice touch. But it’s the shower that really made the room standout. From the full coverage of the rainforest shower head to the large walk in tiled flooring to the fully enclosed space with an almost closet style sliding door, the shower turns into a steam room of sorts that allows for the experience to be fully immersive and relaxing. It was a great way to end a long day and kick start a new one. ",USA,"foureyes18</div><div class=""userLoc""><strong>USA</strong>",78,5.0
746688086,https://www.tripadvisor.com/Hotel_Review-g60763-d14149815-Reviews-Moxy_NYC_Chelsea-New_York_City_New_York-or10.html?filterLang=en,Moxy NYC Chelsea,"February 22, 2020","My husband and I recently stayed at Moxy NYC Chelsea for a spontaneous overnight trip the the city. While the rooms are very small, the design of the space is perfect! It is modern, beautifully decorated and thoughtfully designed. We had everything we needed in our room including a great view! The hotel staff were all super friendly and helpful. Unfortunately, the rooftop bar was closed on the evening we stayed (Sunday) so we missed out on that, but we had a couple glasses of wine in the bar on the 2nd floor which was a very cool space and nice place to relax. The location of the hotel is also great for walking to local attractions like Chelsea Market, The Highline, Hudson Yards etc. We will definitely plan to stay at this hotel again on a future visit.","Malta, New York","Nicole R</div><div class=""userLoc""><strong>Malta, New York</strong>",45,5.0
746416394,https://www.tripadvisor.com/Hotel_Review-g60763-d14149815-Reviews-Moxy_NYC_Chelsea-New_York_City_New_York-or15.html?filterLang=en,Moxy NYC Chelsea,"February 20, 2020","This hotel is on the gorgeous 28th St filled with flower shops. The shower is the best in Manhattan. All of the public spaces are great to satisfy any need whether it be a coffee, a quiet cozy corner, or a swanky cocktail with a view. The staff always goes above and beyond.",,mattmK2317SM,2,5.0
745918971,https://www.tripadvisor.com/Hotel_Review-g60763-d14149815-Reviews-Moxy_NYC_Chelsea-New_York_City_New_York-or15.html?filterLang=en,Moxy NYC Chelsea,"February 18, 2020","Our stay was incredible! Upon booking I called to request an early check in and the Empire State Building side of the hotel for our view. This trip to nyc was to celebrate a birthday, anniversary and Valentine’s Day.. when we checked in we were placed on the 33rd floor with a direct view of the Empire State Building. Our flight landed around 9:40am and we were able to check in by 12pm. The staff, atmosphere, and location of this hotel was unmatched for the area. We will be back and have already suggested Moxy of Chelsea to family for future NYC stays. Thank you for making this a trip to remember!",,Moore0620,0,5.0
745903081,https://www.tripadvisor.com/Hotel_Review-g60763-d14149815-Reviews-Moxy_NYC_Chelsea-New_York_City_New_York-or15.html?filterLang=en,Moxy NYC Chelsea,"February 18, 2020","Our stay at Moxy NYC could have not been more perfect. The location is right off the Subway, walking distance to most key locations, and fully equipped to meet all of your needs. The rooms are small yet trendy, besides who is staying in the room anyway?! Hotel rooftop and lower level bars were amazing and the free coffee was also a hit. ",,Evelyn C,1,5.0
745880432,https://www.tripadvisor.com/Hotel_Review-g60763-d14149815-Reviews-Moxy_NYC_Chelsea-New_York_City_New_York-or15.html?filterLang=en,Moxy NYC Chelsea,"February 18, 2020","I have now visited all of the Nyc Moxy locations. While we had a great time at the Time Square Moxy, and the East Village Moxy is convenient for visiting my family, the Chelsea Moxy was my first and continues to be my favorite. In chilly February, a doorway full of flowers greets me, as well as the happy and casual staff. No fuss, quick to settle in. My rooms view of the Empire State Building was glorious. I will stay here again and again.","Newburyport, Massachusetts","cherylina62</div><div class=""userLoc""><strong>Newburyport, Massachusetts</strong>",4,4.0
745739318,https://www.tripadvisor.com/Hotel_Review-g60763-d14149815-Reviews-Moxy_NYC_Chelsea-New_York_City_New_York-or15.html?filterLang=en,Moxy NYC Chelsea,"February 17, 2020","Location in the flower district was very convenient to my meetings on 7th Avenue. Room was small but not cramped at all. No closet, but creative use of space in the room. The view from my window was outstanding!","Atlanta, Georgia","jenglish2020</div><div class=""userLoc""><strong>Atlanta, Georgia</strong>",1,5.0
745708901,https://www.tripadvisor.com/Hotel_Review-g60763-d14149815-Reviews-Moxy_NYC_Chelsea-New_York_City_New_York-or20.html?filterLang=en,Moxy NYC Chelsea,"February 17, 2020","My stay was outstanding!! Linda went out of her way to make sure I was given a room on the 33rd floor 3307 as I requested, I had a gorgeous view of the Empire State Building from my bed loved the beds and shower. Every turn you made staff had smiles and greeted me. This property is extremely well run, I had the pleasure of speaking with Anthony Reyes about his wonderful staff. I’d love to come back and try the Mondo Suite!! Thank you for an excellent first impression.",,F8391TTnickf,1,5.0
744826992,https://www.tripadvisor.com/Hotel_Review-g60763-d14149815-Reviews-Moxy_NYC_Chelsea-New_York_City_New_York-or20.html?filterLang=en,Moxy NYC Chelsea,"February 13, 2020","I was guest of this hotel for a full week.It's well positioned and just 10 min walking far from Madison Square Garder, Penn Station and 15 minutes from Time Square.My room was at 31th floor and I had an amazing view on Manhattan and Empire State Building from there.Very nice stay.",,L1848GVrobertov,2,5.0
744364465,https://www.tripadvisor.com/Hotel_Review-g60763-d14149815-Reviews-Moxy_NYC_Chelsea-New_York_City_New_York-or20.html?filterLang=en,Moxy NYC Chelsea,"February 11, 2020",We stayed at the Moxy for a girls weekend in NYC. We had an early flight in from Florida and the staff was accommodating and got us into our room early. The food and cocktails in both the restaurant and bar were delish! The roof top bar is beautiful and the view is AMAZING!,,Dawne P,1,5.0
744127633,https://www.tripadvisor.com/Hotel_Review-g60763-d14149815-Reviews-Moxy_NYC_Chelsea-New_York_City_New_York-or20.html?filterLang=en,Moxy NYC Chelsea,"February 10, 2020",This is a great place that doesn’t feel like a big cold NYC hotel. We stayed for a weekend and wished we could’ve stayed longer. The staff were friendly and helpful. The bar was fun and lively. And the location is perfect for something that’s not too touristy. ,"Rockville, Maryland","markrives20852</div><div class=""userLoc""><strong>Rockville, Maryland</strong>",0,5.0
743436559,https://www.tripadvisor.com/Hotel_Review-g60763-d14149815-Reviews-Moxy_NYC_Chelsea-New_York_City_New_York-or20.html?filterLang=en,Moxy NYC Chelsea,"February 6, 2020",Nice modern and compact hotel bedroom. Very comfy and the view from it to NYC was awesome. Go up to the Fleur Room at the rooftop for great drinks and a crazy beautiful view of the Empire State Building. ,"Bogota, Colombia","Maximusk19</div><div class=""userLoc""><strong>Bogota, Colombia</strong>",3,5.0
742826751,https://www.tripadvisor.com/Hotel_Review-g60763-d14149815-Reviews-Moxy_NYC_Chelsea-New_York_City_New_York-or25.html?filterLang=en,Moxy NYC Chelsea,"February 3, 2020","Very good, clean and comfortable hotel in a central location - perfect for walking or metro. Had a slight issue which was unfortunately unresolved or managed with a client focused attitude. Having booked two ""King View"" rooms on a high floor with a request they were next to each other we were given one ""King View"" and one ""King"" - when questioned about this I was told rather bluntly they were the same room and the same size which they clearly were not, I questioned the answer and was told once again they were the same room - The photos on the Moxy Chelsea website clearly show the difference between the King and the King View including the size and layout of the rooms. The booking was made and paid through Hotel.com - not really sure what to do next? Other than this experience of dismissive bad attitude from 1 staff member, we had a great stay at the Moxy Chelsea New York.","Bedfordshire, United Kingdom","wrightIan</div><div class=""userLoc""><strong>Bedfordshire, United Kingdom</strong>",15,4.0
742422782,https://www.tripadvisor.com/Hotel_Review-g60763-d14149815-Reviews-Moxy_NYC_Chelsea-New_York_City_New_York-or25.html?filterLang=en,Moxy NYC Chelsea,"February 1, 2020",Firs time staying at this property. Absolutely amazing and great atmosphere. The staff is super friendly and the food was delicious. Something for everyone. Went to the rooftop bar on Thursday night and the DJ was amazing!!! Plenty of room for dancing. Drinks were a little pricey. ,,Derek N,1,5.0
