review_id,url,hotel_name,review_date,review_body,user_location,user_name,helpful_vote,rating
692682451,https://www.tripadvisor.com/Hotel_Review-g60763-d14095381-Reviews-Moxy_NYC_Downtown-New_York_City_New_York-or170.html?filterLang=en,Moxy NYC Downtown,"July 25, 2019","Great location and fabulous hotel! Walking distance to trains, WTC memorial and shopping.For the average traveler, hotel rooms don’t need to be that big; as long as we have the essentials in them. That’s what I found at the Moxy NYC Downtown. The furniture choice, absolutely a good idea in a small space. For instance, convertible furniture for seating and table use. The hardware use for hanging clothes, etc. Loved it! The simple modern decor helped the room feel more spacious. Also, I appreciated the level of security- the guest key allowed access to the floor checked on.The only thing I missed was a clock","Cincinnati, Ohio","cincytraveller68</div><div class=""userLoc""><strong>Cincinnati, Ohio</strong>",0,5.0
692436683,https://www.tripadvisor.com/Hotel_Review-g60763-d14095381-Reviews-Moxy_NYC_Downtown-New_York_City_New_York-or175.html?filterLang=en,Moxy NYC Downtown,"July 24, 2019","Once we actually located the Moxie The Uber driveer tried to drop us off in Fulton St its actually on the other side which is Ann st. Check in was very fast no trouble at all. You take the Elevator to the third level where you would find a Funky bar and lounge along with Basketball court and other amenities. You then change Elevators to find your Floor and Room. The music is pumping on a Sat and Sun night with a DJ. The room was immaculate. Small but we had three suitcases and we never tripped over them once. The bathroom is tiled in grey which is more pleasing to the eye with lovely modern sink glass shower doors shelves a large up closs well lit Mirror and a Hairdryer that actually blows. The bed was very comfortable. Wifi extremely fast and free and alot of usb plugs for everyone. automatic shutter button. We were on the 28th floor and had a great view of the Brooklyn harbour bridge. The hand soap lovely as was the shower and Conditioner in the shower from ""MUK"" There is a dressing gown that you can use as well as a Tote bag, you can also buy these. A great Location walking distance to Brooklyn Bridge, Subways, World trade centre, Ground Zero. Loved this hotel all time fav ",New Zealand,"LynetteM393</div><div class=""userLoc""><strong>New Zealand</strong>",2,5.0
691987646,https://www.tripadvisor.com/Hotel_Review-g60763-d14095381-Reviews-Moxy_NYC_Downtown-New_York_City_New_York-or175.html?filterLang=en,Moxy NYC Downtown,"July 23, 2019","When I booked this, I wasn't sure about the location as the financial district always felt kind of dead on the weekends but things have changed since I lived in NYC! Lots of places to eat nearby and best of all, almost every subway line accessible within about a 2 block radius.Hotel has the lounge on the 3rd floor so you check-in on ground and go up to 3. The bar there gets hopping in the evening (there's a DJ) but we stayed on the 22nd floor so we were not disturbed by any noise. Rooms were thoughtfully designed as they were small but still had everything (e.g. the desk was a pull out from the wall so it was available if you wanted it but didn't take up any room if you didn't intend to use it).Staff uniformly great across the board. Shoutout to Kevin for his help trying to get us into our room early when my son turned up sick...so very kind and helpful (it didn't happen but the effort and cheery attitude was appreciated).If you stay, head around the corner to Pisillo for a panino (they are huge with the freshest bread) or an espresso...real Italians!","Boston, Massachusetts","32adriannec</div><div class=""userLoc""><strong>Boston, Massachusetts</strong>",10,5.0
691705975,https://www.tripadvisor.com/Hotel_Review-g60763-d14095381-Reviews-Moxy_NYC_Downtown-New_York_City_New_York-or175.html?filterLang=en,Moxy NYC Downtown,"July 22, 2019","What a pleasent surprise. A friend recommended Moxy so I brought my boyfriend for his birthday. What a cool hotel! The bar space, the cool fun rooms,the lighting the views. Moxy is thw future. Noelle helped me check in. He was super helpful and made me feel welcomed.",,Emahn E,1,5.0
691435624,https://www.tripadvisor.com/Hotel_Review-g60763-d14095381-Reviews-Moxy_NYC_Downtown-New_York_City_New_York-or175.html?filterLang=en,Moxy NYC Downtown,"July 21, 2019","I flew solo on this trip & was a little nervous, but The Moxy eased my mind. It offers a great location... near WTC, municipal buildings, Fulton St. subway station. It was a brief 10 walk to the seaport, which I highly recommend. It's close to Wall Street & shopping... I walked to Trinity Church for some great photographs. It was cool & inviting. Great cocktails & night life! I cannot say enough good things. It you ate travelling alone, it's a safe place with easy access to so many things.","Tyler, Texas","babblueoasis</div><div class=""userLoc""><strong>Tyler, Texas</strong>",7,5.0
690995168,https://www.tripadvisor.com/Hotel_Review-g60763-d14095381-Reviews-Moxy_NYC_Downtown-New_York_City_New_York-or175.html?filterLang=en,Moxy NYC Downtown,"July 19, 2019",My stay at the Moxy downtown was great special shout out to Kevin for taking care of us during our stay!! We loved the bar and dj was amazing we will definitely come back and recommend this hotel to others. ,,travelmood18,2,5.0
689474354,https://www.tripadvisor.com/Hotel_Review-g60763-d14095381-Reviews-Moxy_NYC_Downtown-New_York_City_New_York-or180.html?filterLang=en,Moxy NYC Downtown,"July 14, 2019",I wasn’t sure we picked the right place to stay when we entered the lobby and checked in. It was very a very small check in area. We got in the first set of elevators up to the 3rd floor where we would transition to another elevator. The 3rd floor lobby isn’t great. A nice open bar area with free skee ball and other activities. In the evenings there was a DJ playing great music. There is even a half court for basketball. Our room was pretty big for NYC standards and had a great view. Granted we were on the 1st floor. Overall we were very pleased with our stay.,"Lenox Dale, Massachusetts","Mike K</div><div class=""userLoc""><strong>Lenox Dale, Massachusetts</strong>",79,5.0
689034376,https://www.tripadvisor.com/Hotel_Review-g60763-d14095381-Reviews-Moxy_NYC_Downtown-New_York_City_New_York-or180.html?filterLang=en,Moxy NYC Downtown,"July 12, 2019","Spending the night at the Moxy. Headed to lounge until my room ready. The bartender was super friendly and offered suggestions as to what drinks I should try. He has been attentive But not too obtrusive. The lounge area is clean and set up with private tables or long tables for community sitting. There is an old PacMan game, skew ball and table hockey. The drink: margarita was good, could have been a little spicier for my taste. I ordered size garden salad which was OK, not great.The front staff were very friendly, offering suggestion on places to eat. Always said hello upon entering. Room was small but comfortable. Design elements were both functional and looked aesthetically pleasing. For example, there was a folding stool that hung on the wall, it could be used as seating but also as a nightstand. Rooms clean, products in bathroom high quality. Great view of the Brooklyn Bridge only wish my room was up a few floors!",cooperstown,"fourfaires</div><div class=""userLoc""><strong>cooperstown</strong>",3,4.0
689010514,https://www.tripadvisor.com/Hotel_Review-g60763-d14095381-Reviews-Moxy_NYC_Downtown-New_York_City_New_York-or180.html?filterLang=en,Moxy NYC Downtown,"July 12, 2019","We had trouble at check-in, they didn't know which rooms were ready due to a housekeeping computer glitch. It was after 3pm and we had to wait around, with NO help for over 30 minutes. We had tickets to a baseball game, so needed to get into the room. There wasn't even an offer of a free drink while we waited. The woman that ""checked"" us in, never came to tell us our room was ready-BAD start. No acknowledgement of titanium status at all. It is also in an alley which was full of trash, but the hotel is nice inside. The room was VERY SMALL, the smallest I've ever stayed in, ever. We only stayed one night- not sure we could have fit a suitcase in the room. They use the space well, it was very quirky and nice, bed was comfy and it was clean. I would not recommend the queen room for two people for more than one night, you cannot even get around the bed. We did get a great deal ($108), so it was worth being cramped. It is also very close to the 9/11 museum & subway station- so it made our trip easy, and affordable.","Coal Township, PA","Tracy N</div><div class=""userLoc""><strong>Coal Township, PA</strong>",33,4.0
688569306,https://www.tripadvisor.com/Hotel_Review-g60763-d14095381-Reviews-Moxy_NYC_Downtown-New_York_City_New_York-or180.html?filterLang=en,Moxy NYC Downtown,"July 10, 2019","The room was clean, well organized and comfortable. Many reviews complain about the size, it is small but the pictures are accurate. The bathroom is a good size. The halls were warm & dark. I am not sure if the halls are air-conditioned. I know that they are going for a nightclub vibe type hotel but (IMO) it's weird and they should light the hallways for safety purposes. The biggest reason for the Poor review is that the air conditioning unit was EXTREMELY LOUD. So loud that I had to turn it off for my daughter to fall asleep but then I had to turn it back on because it's July in NYC & you need air conditioning! Even when the one in your room turns off you can hear the noise for ones in other rooms. Ridiculous! I called the front desk around midnight asking for earplug & got them about 45 minutes later. That was disappointing. They helped some. They need to address the air conditioning issue. Also, the lobby smelled. I could not figure out if it was just from cleaning products & no AC in the lobby or what the smell was but it smelled. Gross. The internet & TV were out for our 24-hour stay & a previous poster said the same. I have never stayed in a hotel that cable was not working. I called and asked & they said that it was being worked on all night & said it should be working but then called & said ...no it's not working yet. It could have helped w tuning out the AC noise or the noise from the street. I know its NYC but on the 22nd floor you don't expect much noise but there was night construction going on & when the AC turned off I had to hear the construction. I asked for a quiet room. If you are looking for a modern chic hotel & are not noise sensitive ...it's clean.",New Jersey,"BACNJ</div><div class=""userLoc""><strong>New Jersey</strong>",18,2.0
688468946,https://www.tripadvisor.com/Hotel_Review-g60763-d14095381-Reviews-Moxy_NYC_Downtown-New_York_City_New_York-or180.html?filterLang=en,Moxy NYC Downtown,"July 10, 2019","Before I booked I read lots (good & bad) about the hotel & I'm so glad I booked it. Check-in: warm welcome, no queue & a room on the 27th floor (perfect!). The view as you step out of the elevator is amazing. The Room: I knew it would be small but the use of space was clever. No wardrobes & not much shelf space, but had loads of hooks so I took bags to put stuff in to hang (shoes, accessories, etc). I packed our toiletries in a big tub so we could keep it on a shelf & rummage when we needed to! The beds are memory foam, there is space underneath for a case & a drawer with safe in it. The room was very clean. There is a sign to say if you want the room serviced and this was done each time. Only down side was that the controls for the lighting and shade seemed to have a mind of their own.The young staff bring energy, we found them welcoming and helpful. They held doors open and made casual conversation with ease (the only person we found less than helpful was an older bar tender who was abrupt in telling us we could help ourselves to tap water even though we were buying beers too). Coffee is free from 6.30-9.30am at the end of the bar. I had read that you got drinks on arrival - this now only applies to members - but when I inquired, the girl on reception gave us 2 as a courtesy, which was a nice touch!The location is perfect for downtown and anywhere else for that matter if you use the subway.We would return in a heartbeat! Well done Moxy Downtown, we miss you already!",,nettibrown,0,5.0
688421359,https://www.tripadvisor.com/Hotel_Review-g60763-d14095381-Reviews-Moxy_NYC_Downtown-New_York_City_New_York-or185.html?filterLang=en,Moxy NYC Downtown,"July 10, 2019","PROS: new, good location, walk-in showers and hip and trendy feel and vibe. CONS: TV and internet was out the majority of the second day of our stay, absolutely no communication or contact from the staff and of course no offer of any compensation of any sort. Tiny rooms, mostly with little to no view. In addition to all of the other disastrous Marriott changes and they are gutting of Starwood programs and benefits, they're moving completely away from bottled water at any of their locations and during our two-day stay I asked for different people and got four different answers about whether or not the water in the hotel was filtered or not. There are no signs nor communication in any way shape or form. Sometimes elevators are very slow, the food selection is scant at best and cocktails incredibly overpriced. I can't say enough bad things about Marriott's takeover of Starwood despite the expanded brand selection but none of it will ever make up for Marriott's gutting of the Starwood privileges that built the brand.","San Jose del Cabo, Mexico","ehmwww11</div><div class=""userLoc""><strong>San Jose del Cabo, Mexico</strong>",82,1.0
687636020,https://www.tripadvisor.com/Hotel_Review-g60763-d14095381-Reviews-Moxy_NYC_Downtown-New_York_City_New_York-or185.html?filterLang=en,Moxy NYC Downtown,"July 7, 2019","First of all, big thanks to Team Kevin and Michelle!! They checked in me and my family very quickly and patiently shared the amenities that Moxy provided and they were spot on. We loved every minute of our stay there. Short but amazing with all the amenities mentioned games, music with DJ, lounge setting and great food.. Trust me, I will be back. The vibe and culture was awesome.","New York City, New York","TweetyAdventure</div><div class=""userLoc""><strong>New York City, New York</strong>",2,5.0
687345387,https://www.tripadvisor.com/Hotel_Review-g60763-d14095381-Reviews-Moxy_NYC_Downtown-New_York_City_New_York-or185.html?filterLang=en,Moxy NYC Downtown,"July 6, 2019","Lowlights: Bad customer experience and lack of organisation/cleanliness. Don’t think/believe in this 4 stars hotel. Let me share my unlucky experience by naming few events: allowing a drunk guy sleeping in front of your door (security?), cleaning without schedule (do your housekeeping by yourself?), promises to contact you to provide any feedback/customer service (none, they don’t care about customers). Overall experience in this hotel: miserable! Go and find another hotel with proper experience on how to attend guests.Highlights: location, lounge, games, food and drinks.","New York City, New York","sega7723</div><div class=""userLoc""><strong>New York City, New York</strong>",0,1.0
687100990,https://www.tripadvisor.com/Hotel_Review-g60763-d14095381-Reviews-Moxy_NYC_Downtown-New_York_City_New_York-or185.html?filterLang=en,Moxy NYC Downtown,"July 5, 2019","Great hotel near FiDi, with a very cool bar setup. The bar even has an indoor basketball court. The rooms are small (as to be expected in the area), however they are clean and very modern. I found the bluetooth speaker to be a great plus. The staff overall was very friendly. A special thanks to Kevin who checked me in and provided stellar customer service!","New York City, New York","twilliams232</div><div class=""userLoc""><strong>New York City, New York</strong>",0,4.0
686798651,https://www.tripadvisor.com/Hotel_Review-g60763-d14095381-Reviews-Moxy_NYC_Downtown-New_York_City_New_York-or185.html?filterLang=en,Moxy NYC Downtown,"July 4, 2019","This hotel boasts about its air conditioning, but its AC can't keep up with a relatively mild 88 degree day. I'd hate to see it on a real sweltering summer day. Tried to get the front desk to help, but apparently they can't hear callers using in-room phones. If you're looking for a room in the financial district, skip this hotel and head to the Doubletree Financial District instead.",Texas,"MeenaKT</div><div class=""userLoc""><strong>Texas</strong>",0,2.0
686584054,https://www.tripadvisor.com/Hotel_Review-g60763-d14095381-Reviews-Moxy_NYC_Downtown-New_York_City_New_York-or190.html?filterLang=en,Moxy NYC Downtown,"July 3, 2019","First off, the hotel was all the things a hotel should be: clean, safe, and reasonably furnished for sleep. Perhaps the Moxy concept just isn’t for me? I found the rooms to be like glorified college dorm rooms, or a fancy hostel masquerading as a hotel. There’s self check in, which I started to use only because both front desk staff were busy. But then I wasn’t making any progress, a desk agent became available, and instead of offering to check me in, she just shouted instructions to me from across the lobby. The room is small, which is no surprise because it’s New York, but it’s not super functional - corners are cut where they don’t need to be. For example, there is a a wall full of hooks upon entering, and chairs and a luggage holder are hanging from them. There are empty hooks, but no ironing board. The ironing board is under the bed, folded in half. Oh, and it’s a tabletop ironing board, which I’ve not used since college. The table hangs on the walls, you pick it up, and a kickstand drops to hold the tabletop up. It’s a little complicated when an ironing board would fit in the room. Noise in the hallways was a mild issue depending on volume of traffic. There’s no carpet to dampen noise. The city was performing some sort of sewer maintenance until 1 or 2am each night, which for a street-facing room was unacceptable. It felt like I was inside a subwoofer. None of the items I plugged in at night charged, either by USB or regular AC plug. That was a huge inconvenience, but since I wasn’t sleeping well due to street noise, I didn’t oversleep. After one night, I changed rooms. There’s no alarm clock, no apparent guide to the area or the hotel amenities (if they even exist). Nobody said if there was a gym where it was.I’ve never stayed in a hostel, but this is what I’d imagine. The room decor will not age well. The water pressure in the shower was too low, but in the sink it was too high. I won’t be back to another Moxy. ","Chicago, Illinois","KW1011</div><div class=""userLoc""><strong>Chicago, Illinois</strong>",69,3.0
686125482,https://www.tripadvisor.com/Hotel_Review-g60763-d14095381-Reviews-Moxy_NYC_Downtown-New_York_City_New_York-or190.html?filterLang=en,Moxy NYC Downtown,"July 2, 2019","This review is mostly for the front desk management team—Kevin is absolutely fabulous and will go above and beyond to make you feel at home and ensure that your stay is amazing. I mentioned that I am taking a bar exam the next morning and he immediately ensured I was moved to a quieter room. Couldn’t ask for more. Exactly the service you would expect from a high-end hotel. Thank you so much, Kevin!!!",,500SweetB,1,5.0
685765551,https://www.tripadvisor.com/Hotel_Review-g60763-d14095381-Reviews-Moxy_NYC_Downtown-New_York_City_New_York-or190.html?filterLang=en,Moxy NYC Downtown,"July 1, 2019","Location of hotel downtown is great, 1 block from Fulton St. Subway station, offering easy connections uptown and over to Brooklyn. The shared space lobby with their bar and restaurant is an ideal working space within the hotel. Lobby also has a 'convenience corner' of drinks and prepackaged food, which can be purchased at the bar. Rooms are small, but nicely furnished, but don't have some of the amenities you'd see in other hotels (no iron, or ironing board, no fridge, no closet) Closet is set as an open wall plan as you walk in. Some items located in room (robe, reusable bag) have price tags on them so you know the charge ahead of leaving if you choose to take it with you!Floor to ceiling windows, with electronically controlled shade. Cool artwork located in rooms and through lobby. USB ports located in outlets throughout the hotel are a nice modern touch. My only real issue here was the water pressure on the 18th floor. It was not great. Bathroom was in line with room. Basic amenities available. Shower would have been much nicer with better water pressure. Staff can occasionally seem a little slow, but overall have been good and are responsive to guests requests and queries.",,Josh C,1,4.0
685250641,https://www.tripadvisor.com/Hotel_Review-g60763-d14095381-Reviews-Moxy_NYC_Downtown-New_York_City_New_York-or190.html?filterLang=en,Moxy NYC Downtown,"June 29, 2019","After staying at Moxy Chelsea, I decided to try this hotel for our anniversary with my wife. Amazing location and again unorthodox but thoughtfully designed rooms. Even though it is very casual establishment but the quality and helpfulness level of the staff is top notch (Staff makes everything in their power to help guests) Special thanks to Kevin and other team members to made this anniversary unforgettable for us. I can't wait to go back and stay here again.","Los Angeles, California","anlkya</div><div class=""userLoc""><strong>Los Angeles, California</strong>",1,5.0
685193043,https://www.tripadvisor.com/Hotel_Review-g60763-d14095381-Reviews-Moxy_NYC_Downtown-New_York_City_New_York-or190.html?filterLang=en,Moxy NYC Downtown,"June 29, 2019","We were excited to check out Moxy Downtown on a rare night to ourselves in NYC, but were disappointed to learn that the hotel and its staff were not prepared to deliver on what the brand promises online as far as guest experience. We were off to a rough start when we arrived at 3:15pm for a 3pm check-in to learn that our room was not ready. 2 hours later, we were finally in a room....we were given extra chips for drinks at the bar and a breakfast coupon for our inconvenience. At that point, we had plans and were off to a late start, but figured we would be able to use the drink tickets and enjoy the common areas/games when we returned to the hotel after our show. Nope.We returned to the hotel before midnight and went to the bar to learn it was closed. The game rooms and common areas were also no longer available for use. This was a surprise since the website outright says that guests can expect ""the bar is always open and the crew is always on"". There was no manager to speak with onsite and the crew was definitely not on. At this point, we had no choice but to retreat to our room and use a room key adorned with the phrase ""Play On"" to reinforce the disconnect in our experience and how this hotel is marketed/branded.","Arlington, Virginia, United States","EB20134</div><div class=""userLoc""><strong>Arlington, Virginia, United States</strong>",3,2.0
685061993,https://www.tripadvisor.com/Hotel_Review-g60763-d14095381-Reviews-Moxy_NYC_Downtown-New_York_City_New_York-or195.html?filterLang=en,Moxy NYC Downtown,"June 28, 2019","Very small room, even for NYC. (I think if you book through a discount site they give you a small room.) But the room was clean and had nice big windows for good light. Perfect for one adult, or an adult and a child. Two adults that are not claustrophobic may be ok... The furniture is all space-saving... stools on the wall, tables that fold away, small sink, no closet. Good use of the small space. My teenage daughter thought it was cute. There was no mini fridge, which was a shame. Self check in did not work. (Again, I believe this is because I booked through a discount site.) There were only two pillows in the room. It was hard to get someone to answer the phone, but when I got hold of the crew they brought a ton of pillows. Overall it was a good stay. Most things went smoothly and the location was perfect for our needs. The Recreation restaurant/bar played ultra-hip music. Great place for the young, single professional crowd. ","Annapolis, Maryland","adbaccala</div><div class=""userLoc""><strong>Annapolis, Maryland</strong>",9,4.0
685045378,https://www.tripadvisor.com/Hotel_Review-g60763-d14095381-Reviews-Moxy_NYC_Downtown-New_York_City_New_York-or195.html?filterLang=en,Moxy NYC Downtown,"June 28, 2019","I never review hotels and I have been in a lot of them. This was the best experience I have had in a very long time. Everything about my stay was perfect, from the excellent service at the front desk, to all the amazing amenities and the room, oh my god so adorable and the view was amazing!! Around the corner from just about everything, like Stone St the oldest street in NYC, Seaport, the Brooklyn Bridge, and Joes Pizza! The train is right around the corner also! Perfect!! Kevin and Rafael were awesome, very helpful and right on it with my bags, thank you!",,sweetlybroken76,0,5.0
685011750,https://www.tripadvisor.com/Hotel_Review-g60763-d14095381-Reviews-Moxy_NYC_Downtown-New_York_City_New_York-or195.html?filterLang=en,Moxy NYC Downtown,"June 28, 2019",The Moxy was a great experience. The staff were very welcoming and the bed was so comfy! It looks very modern and location was great as well. Parking is the only thing that sucks about it but I love the space!,,Nana B,29,4.0
