review_id,url,hotel_name,review_date,review_body,user_location,user_name,helpful_vote,rating
726030659,https://www.tripadvisor.com/Hotel_Review-g60763-d14149815-Reviews-Moxy_NYC_Chelsea-New_York_City_New_York-or80.html?filterLang=en,Moxy NYC Chelsea,"November 12, 2019","AMAZING, TRENDY HOTEL! A large group of us recently stayed at the MOXY Chelsea for a work trip. Safe to say everyone really enjoyed their stay and the hotel definitely surpassed our expectations. Most of our rooms all had amazing views of the Empire State Building. So cool seeing it all lit up at night!! The rooms are very well designed & the amenities outside the rooms are NEXT LEVEL. The rooftop bar is probably the most trendy bar in NYC right now. Amazing views & even better atmosphere & drinks! There are also so many great & collaborative work spaces for both small & large groups. Or if you're flying solo, the second floor is a great spot to plug-in and get your work done. We partnered with Christian P. who was absolutely amazing to work with and very accommodating with our groups needs. He made the entire booking process so easy for a large group and was always quick to respond when we needed to make changes. We will definitely be back to NYC next year and can confidently say we'll be staying at the MOXY Chelsea again. Highly recommend this spot to anyone looking for a cool place to stay in NYC. They're also very accommodating for any families traveling with kids.",,SavvyTravelerKD,1,5.0
725729622,https://www.tripadvisor.com/Hotel_Review-g60763-d14149815-Reviews-Moxy_NYC_Chelsea-New_York_City_New_York-or80.html?filterLang=en,Moxy NYC Chelsea,"November 11, 2019",Overall great hotel. Every thing is brand new and the team is awesome. Danny was able to answer questions about the area and make a reservation for me. The rooms were small but they were modern and fun. The bar is awesome! I would stay here again!,"Orlando, Florida","JTravel0891</div><div class=""userLoc""><strong>Orlando, Florida</strong>",0,5.0
725056866,https://www.tripadvisor.com/Hotel_Review-g60763-d14149815-Reviews-Moxy_NYC_Chelsea-New_York_City_New_York-or85.html?filterLang=en,Moxy NYC Chelsea,"November 8, 2019","This hotel is in a great location to get to MSG, Chelsea, Flatiron, etc., great spaces to work, grab complimentary coffee in the morning and they have meditation every Wednesday. Rooms are cozy but well appointed with decor and modern touches. Definitely will stay again!",,bac587,0,5.0
724554558,https://www.tripadvisor.com/Hotel_Review-g60763-d14149815-Reviews-Moxy_NYC_Chelsea-New_York_City_New_York-or85.html?filterLang=en,Moxy NYC Chelsea,"November 6, 2019",Overpriced small rooms with lousy service coffee was terrible pizza was overpriced rooftop bar was cool but workers not friendly asked for ice 3 times Finally gave up and just left will not be returning,"Sarasota, Florida","clubeaster</div><div class=""userLoc""><strong>Sarasota, Florida</strong>",3,3.0
724262139,https://www.tripadvisor.com/Hotel_Review-g60763-d14149815-Reviews-Moxy_NYC_Chelsea-New_York_City_New_York-or85.html?filterLang=en,Moxy NYC Chelsea,"November 5, 2019",This hotel is a real hidden gem! Super cute and modern with excellent friendly service. The view of the New York skyline from my room on the 31st floor was outstanding. They also have some great little touches like a free glass of Prosecco at the hotel’s trendy bar for guests. Really close to the subway and Penn Station/Madison Square Garden which was super handy. Would definitely stay again! ,Melbourne,"ez0203</div><div class=""userLoc""><strong>Melbourne</strong>",2,5.0
724205386,https://www.tripadvisor.com/Hotel_Review-g60763-d14149815-Reviews-Moxy_NYC_Chelsea-New_York_City_New_York-or85.html?filterLang=en,Moxy NYC Chelsea,"November 5, 2019","Our stay at the Moxy Chelsea was wonderful! The location was perfect and convenient to get around town easily. The view of the Empire State Building from our room was spectacular! The rooms were very nice, clean and hotel staff was extremely helpful. We would highly recommend this hotel to anyone visiting New York City and plan to return again ourselves!",,Kim B,0,5.0
724155353,https://www.tripadvisor.com/Hotel_Review-g60763-d14149815-Reviews-Moxy_NYC_Chelsea-New_York_City_New_York-or85.html?filterLang=en,Moxy NYC Chelsea,"November 5, 2019",Everything about the hotel was terrific and completely different than any hotel I have stayed in. Bed was great showers top notch and the view of The Empire State building looked as if I could touch it. The bar was hip and the bocce ball was alot of fun. The staff made us feel very welcome and look forward to coming back and staying again.,,cowboy1787,0,5.0
724093507,https://www.tripadvisor.com/Hotel_Review-g60763-d14149815-Reviews-Moxy_NYC_Chelsea-New_York_City_New_York-or90.html?filterLang=en,Moxy NYC Chelsea,"November 5, 2019","We had drinks and pizza in the restaurant. Drinks were well made and the pizza was awesome! Friendly staff and a ""brick pizza oven"". After snacks we went upstairs to the rooftop bar. The views are AWESOME! Very urban feel and comfortable. You can sit at the bar or find a private place in comfy chairs.","Elizabethtown, Kentucky","Bobbie021</div><div class=""userLoc""><strong>Elizabethtown, Kentucky</strong>",28,5.0
723616240,https://www.tripadvisor.com/Hotel_Review-g60763-d14149815-Reviews-Moxy_NYC_Chelsea-New_York_City_New_York-or90.html?filterLang=en,Moxy NYC Chelsea,"November 3, 2019",Small room but well appointed and had everything you need. Layout worked and was good for two people. Nice bar areas and a small pizza restaurant on site. Convenient too many local attractions and set in the flower district.,"Boca Raton, Florida","528deanb</div><div class=""userLoc""><strong>Boca Raton, Florida</strong>",34,4.0
723474741,https://www.tripadvisor.com/Hotel_Review-g60763-d14149815-Reviews-Moxy_NYC_Chelsea-New_York_City_New_York-or90.html?filterLang=en,Moxy NYC Chelsea,"November 3, 2019","Very good location in Chelsea, perfect room, small but well equipped and astonishing views. Very helpful staff in the hotel and in the restaurant. Very easy check-in and check-out. Will come back another time no doubts.",,cedricfest,0,5.0
723063937,https://www.tripadvisor.com/Hotel_Review-g60763-d14149815-Reviews-Moxy_NYC_Chelsea-New_York_City_New_York-or90.html?filterLang=en,Moxy NYC Chelsea,"November 1, 2019","This was my second visit to Moxy Chelsea--- the staff was SUPER friendly from the ""welcome"" - Genuinely Friendly! The room was once again SUPER clean / neat / convenient. I had a great dinner in the second floor restaurant (great menu and drink selections). I love the creativity of the room layout / technology access as well. Also i visited the gym and it had all I needed for a short trip...You guys go this right !!! I will be back for business and personal travel to NYC!",,savytravelerexpert,0,5.0
722864892,https://www.tripadvisor.com/Hotel_Review-g60763-d14149815-Reviews-Moxy_NYC_Chelsea-New_York_City_New_York-or90.html?filterLang=en,Moxy NYC Chelsea,"October 31, 2019","I travel every week, and I think they nailed it for price, atmosphere, and community space. The rooms are small, but they made sure to have the two most important elements, a good shower and a comfortable bed. It forces you to work outside your room, which is nice, as you get the full NY vibe, versus staying locked up in some dingy hotel room. I love their look and feel. If you are traveling w/ more than 1, it may be tough b/c of space, but as 1 person, it is perfect!!!","Manhattan Beach, California","Sondra W</div><div class=""userLoc""><strong>Manhattan Beach, California</strong>",295,5.0
722509719,https://www.tripadvisor.com/Hotel_Review-g60763-d14149815-Reviews-Moxy_NYC_Chelsea-New_York_City_New_York-or95.html?filterLang=en,Moxy NYC Chelsea,"October 30, 2019","I stayed with my 13 year old daughter for 5 nights. The bed was huge and really comfortable. Powerful shower with plentiful hot water. Our room was on 18th floor with excellent views of the Empire State Building. Very convenient situation, metro stop at the end of the road and walkable to most places. Because we don’t really travel light I took a number of hangers with us, this was useful as only 4 are provided. No iron but a great little hand held steamer that did the job, no problem. Free morning coffee on 2nd Floor and a convenient luggage storage area. The lifts were quick, just a bit difficult to read the floor numbers as the lifts are quite dark (probably to do with the ambiance of the hotel!) Enjoyed our stay, thank you Moxy!",Buckinghamshire,"Morethansatisfied</div><div class=""userLoc""><strong>Buckinghamshire</strong>",2,4.0
722049656,https://www.tripadvisor.com/Hotel_Review-g60763-d14149815-Reviews-Moxy_NYC_Chelsea-New_York_City_New_York-or95.html?filterLang=en,Moxy NYC Chelsea,"October 28, 2019","My wife and I had an amazing stay at the Moxy Chelsea last weekend. Really cool hotel with a great location, service and views! I'd recommend a drink on the rooftop during sunset. We will definitely be back.",,mjlam20,0,5.0
721965325,https://www.tripadvisor.com/Hotel_Review-g60763-d14149815-Reviews-Moxy_NYC_Chelsea-New_York_City_New_York-or95.html?filterLang=en,Moxy NYC Chelsea,"October 28, 2019","The moxy Chelsea is in a wonderful location, the hotel is beautifully decorated and while rooms are small the layout is optimal. We were in a double double and there was more than enough room for 2 people to move around! The WiFi was fast, free coffee on 2nd floor was an added bonus. The service was flawless!",,Renee F,0,5.0
721927494,https://www.tripadvisor.com/Hotel_Review-g60763-d14149815-Reviews-Moxy_NYC_Chelsea-New_York_City_New_York-or95.html?filterLang=en,Moxy NYC Chelsea,"October 28, 2019","The view is gorgeous, but the room is tiny and lacks certain facilities (such as wardrobes, room service, ...). We enjoyed the view, but wouldn't recommend this for a long stay. The rooftop bar is indoors only unfortunately. The staff was very friendly and professional.",,olegat,0,4.0
721243647,https://www.tripadvisor.com/Hotel_Review-g60763-d14149815-Reviews-Moxy_NYC_Chelsea-New_York_City_New_York-or95.html?filterLang=en,Moxy NYC Chelsea,"October 25, 2019",This hotel was a great option--close to my office when visiting from out of town but not compromising on experience & design. I am a designer and I loved discovering new details and spaces throughout the property. One of my favorite Moxy locations by far!,,ab0223,0,5.0
721064945,https://www.tripadvisor.com/Hotel_Review-g60763-d14149815-Reviews-Moxy_NYC_Chelsea-New_York_City_New_York-or100.html?filterLang=en,Moxy NYC Chelsea,"October 24, 2019","It was my first time visiting NYC and I chose this hotel for its location. I found it very easy to either bike or walk almost everywhere. From Times Square to the Brooklyn Bridge. The hotel is on a street that is lined with flowers. There are wholesale floral shops along the street. The room was very clean and efficient. There was only two of us, I personally can’t image 4 in the room. There are no bureaus at all just some pegs on the wall and 2 drawers under the bed. The bathroom is small as well but very clean. It worked perfect for us. There is free coffee on the second floor which is a bar later in the day. There is also a roof top bar. ","Lynnfield, Massachusetts","mommagibbs</div><div class=""userLoc""><strong>Lynnfield, Massachusetts</strong>",19,5.0
720972795,https://www.tripadvisor.com/Hotel_Review-g60763-d14149815-Reviews-Moxy_NYC_Chelsea-New_York_City_New_York-or100.html?filterLang=en,Moxy NYC Chelsea,"October 24, 2019","The location in the garden district gives you the opportunity to visit all the famous spots in New York. Walking distance from Penn station, so you can use the subway from te airport to get to your hotel.The hotel is new and has a modern twist. The small ""Manhattan"" rooms are designed in a way that you have plenty of room.great breakfast and pretty affordable for a Manhattan hotel.The hotel is situated in the garden district, a lovely area with some nice restaurants.",,Rick v,10,5.0
720483875,https://www.tripadvisor.com/Hotel_Review-g60763-d14149815-Reviews-Moxy_NYC_Chelsea-New_York_City_New_York-or100.html?filterLang=en,Moxy NYC Chelsea,"October 22, 2019","I stayed here for the weekend with some friends and we were pleasantly surprised with the quality and style of the hotel for the price we paid. The rooms are small, expected for Manhattan, but make the most of the space. It’s a great central location if you’re using Penn Station and there are plenty of subway stops nearby. We only visited the cafe on the first floor to get coffee and croissants- overpriced but fine for breakfast on the go. The lobby is lovely with the flower shop right in front. I’d definitely stay here again. ",New Jersey,"laurenpc123</div><div class=""userLoc""><strong>New Jersey</strong>",21,5.0
720171994,https://www.tripadvisor.com/Hotel_Review-g60763-d14149815-Reviews-Moxy_NYC_Chelsea-New_York_City_New_York-or100.html?filterLang=en,Moxy NYC Chelsea,"October 21, 2019",This is such a beautiful hotel with the perfect location. Being in the flower district is so lovely! Loved the room - beautifully designed and super comfortable. The hotel is a great spot for hanging with friends too. Highly recommend. ,"Fort Lauderdale, Florida","katerina7TA</div><div class=""userLoc""><strong>Fort Lauderdale, Florida</strong>",2,5.0
720024420,https://www.tripadvisor.com/Hotel_Review-g60763-d14149815-Reviews-Moxy_NYC_Chelsea-New_York_City_New_York-or100.html?filterLang=en,Moxy NYC Chelsea,"October 20, 2019","Good location, clean and stylish room. I didn’t appreciate the pressure at check out to give 5 starts on TripAdvisor.Why does this review have to be 200 characters minimum? Ridiculous sjehdnnehsbnsnsjsjsj","Honolulu, Hawaii","Y1326UEsara</div><div class=""userLoc""><strong>Honolulu, Hawaii</strong>",1,4.0
720014092,https://www.tripadvisor.com/Hotel_Review-g60763-d14149815-Reviews-Moxy_NYC_Chelsea-New_York_City_New_York-or105.html?filterLang=en,Moxy NYC Chelsea,"October 20, 2019","This is our second time staying at a Moxy property. First property was in Paris. Paris property had a very young, trendy vide. Which is what I expected for the Chelsea location. I have to say this property exceeded my expectations, definitely different from the Paris location. The decor, the rooms, the vibe, the service was exceptional! We were fortunate enough to experience all the perks that this property offer, such as coffee on the second floor bar. Drinks/food at the second floor bar, the pizza bar was excellent! We were seated right away and service was phenomenal. The Fleur bar upstairs on the 35th floor with it's amazing view of the empire State building.As someone who travels to NYC occasionally, we definitely plan to stay here again! Officially one of my favorite property!",,wynmar04,0,5.0
719723135,https://www.tripadvisor.com/Hotel_Review-g60763-d14149815-Reviews-Moxy_NYC_Chelsea-New_York_City_New_York-or105.html?filterLang=en,Moxy NYC Chelsea,"October 19, 2019",Well located and well appointed spot in Chelsea. Comfortable room with the basics. Great bar that is convenient for for a pre- or post-dinner cocktail. Will be happy to stay again the next time we travel to NYC.,"San Francisco, California","Kris H</div><div class=""userLoc""><strong>San Francisco, California</strong>",4,5.0
719632098,https://www.tripadvisor.com/Hotel_Review-g60763-d14149815-Reviews-Moxy_NYC_Chelsea-New_York_City_New_York-or105.html?filterLang=en,Moxy NYC Chelsea,"October 19, 2019","I stayed at the Moxy hotel for a week. This hotel is very different to your usual Marriott, you like something cool and funky, this is it. You won’t be wowed by the small rooms or tight spaces, but if you like something fun, then stay here. Check-in was easy, they are very polite and a different way to greet you, such as howdy and what’s going on! The hotel only has 4 lifts covering all 30+ floors which can be troublesome if you are on a high floor. The rooms are very clean, TV, no alarm clocks, sink in the bedroom, shower and toilet is just a glass cubicle and no wardrobe (hangers on the wall) and nowhere to store luggage case, no desk, just a small fold away round table big enough for one and a small foldaway chair. I was by myself so it was just about ok, for two? No way. All very off putting when you first stay here, until you get used to the space, it grows on you, but not the wardrobe. Breakfast can be bought next door, in a cool place, however very pricey for what it is, drinks and free morning coffee at the bar on the second floor which is a great area to meet and greet but staff are grumpy. Head to the roof top bar, friendly staff, great vibe, well worth a visit and free entry for hotel guests although it isn’t part of the hotel. So overall, if you want to stay in Chelsea for pleasure and your by yourself for close to the person you’re staying with (literally) then worth it, if you are hear on business or if you like space, stay somewhere else.","London, United Kingdom","509keegand</div><div class=""userLoc""><strong>London, United Kingdom</strong>",131,4.0
719407536,https://www.tripadvisor.com/Hotel_Review-g60763-d14149815-Reviews-Moxy_NYC_Chelsea-New_York_City_New_York-or105.html?filterLang=en,Moxy NYC Chelsea,"October 18, 2019","Hotel offers cute tiny rooms, ideal for one person. Two people will struggle. The design is spectacular, the architects/decor team thought about every single detail, from the color of the old fashioned telephone matching the sink to the unique hook system in lieu of having a closet. The shelves and safe location (below the bed) was super uncomfortable. The water pressure was great and the quality of the mattress superb, we rested well. There was no fridge in the room but the hotel provided one, which turned out to be the only item in the room that didn't match the decor. Now that's the design part. Let's talk about function. The shower and toilet are housed separately in two tiny, compact adjacent spaces. Only a sliding door with a frosted glass separates them from the room. That means, if you're traveling with a partner or friend, you better ask them (or be asked) to ""go take a walk"" so the other ""can do their thing"" because there is no privacy at all. Next, water spills from the shower into the room! We had to use several towels to stop the water pouring into the room. Maintenance installed a tape to prevent the outflow but as you can see in the pic the solution does not work well because the tape hit the adjacent toilet wall (the same sliding door structure opens both spaces) and ripped. The sink is tiny and does not collect water making it difficult to shave. There are no vents in the toilet room so any unpleasant smell propagates into the room. We also experienced problems with the electrical wiring as the same switch on the table lamps turns on the sink area fluorescent light making it uncomfortable for a companion if he/she is sleeping.","Seattle, Washington","boolz</div><div class=""userLoc""><strong>Seattle, Washington</strong>",60,3.0
719188910,https://www.tripadvisor.com/Hotel_Review-g60763-d14149815-Reviews-Moxy_NYC_Chelsea-New_York_City_New_York-or105.html?filterLang=en,Moxy NYC Chelsea,"October 17, 2019","The staff was very friendly from check-in to check-out and rooms were very cool and functional. Great location in Chelsea in walking distance to great restaurants and nightlife. Cool bar, very fun vibe overall.",,Jodi C,0,5.0
718422633,https://www.tripadvisor.com/Hotel_Review-g60763-d14149815-Reviews-Moxy_NYC_Chelsea-New_York_City_New_York-or110.html?filterLang=en,Moxy NYC Chelsea,"October 14, 2019","Fun weekend getaway. Surrounded by lots of cool tourist attractions like the chelasa market. Great restaurants, clean rooms,amazing shopping. Close to Madison square garden and Times Square. Friendly staff. Will come back. ",,lindsaylittle1,4,4.0
717688756,https://www.tripadvisor.com/Hotel_Review-g60763-d14149815-Reviews-Moxy_NYC_Chelsea-New_York_City_New_York-or110.html?filterLang=en,Moxy NYC Chelsea,"October 12, 2019","Moxy has done a great job creating a unique, consistent customer experience. Front desk staff is upbeat, friendly and willing to go the extra mile. There was a cleaning person whom I asked if I could get an extra water for my room and she brought me - and everyone else waiting at the elevator - a bottle to go. Rooms are small, but with a fun and unique style and very well appointed -- many with awesome views of the city. We stayed for 3 nights and were perfectly comfortable.It's in a great location (the area looks a little suspect at night, but bright and lively during the day) with easy access to everything.We'll definitely stay here again on our next trip to the city!",,TravelingBoltz,0,5.0
716883699,https://www.tripadvisor.com/Hotel_Review-g60763-d14149815-Reviews-Moxy_NYC_Chelsea-New_York_City_New_York-or110.html?filterLang=en,Moxy NYC Chelsea,"October 9, 2019","I loved this place!! We spent just one night there before Christmas and they even gave us Christmas ornaments!!Cool and funky room. Just loved the great use of space. Friendly staff, good location and very clean room! May not be great if traveling with kids or seniors, definitely a younger crowd hotel....though the bigger rooms may work.","Fort Mill, South Carolina","Cathrab28</div><div class=""userLoc""><strong>Fort Mill, South Carolina</strong>",63,5.0
716740136,https://www.tripadvisor.com/Hotel_Review-g60763-d14149815-Reviews-Moxy_NYC_Chelsea-New_York_City_New_York-or110.html?filterLang=en,Moxy NYC Chelsea,"October 9, 2019",In the Heart of the Flower district! Nice to walk on the sidewalks and be surrounded by plants and flowers. Plenty of food options nearby. Room was spacious enough for 1 person. Staff is friendly and nice rooftop bar.,"Los Angeles, California","rayr276</div><div class=""userLoc""><strong>Los Angeles, California</strong>",0,5.0
716725323,https://www.tripadvisor.com/Hotel_Review-g60763-d14149815-Reviews-Moxy_NYC_Chelsea-New_York_City_New_York-or110.html?filterLang=en,Moxy NYC Chelsea,"October 9, 2019",WE had so much fun at this property! Our room was so cool and what a view! The location is great and the on property restaurants are wonderful! Will recommend this place for sure! It was nice to be in a more neighborhood type setting with access to many restaurants and attractions.,"Raleigh, North Carolina","chaas316</div><div class=""userLoc""><strong>Raleigh, North Carolina</strong>",0,5.0
716609589,https://www.tripadvisor.com/Hotel_Review-g60763-d14149815-Reviews-Moxy_NYC_Chelsea-New_York_City_New_York-or115.html?filterLang=en,Moxy NYC Chelsea,"October 9, 2019","I recently stayed four nights here and while the location was stellar, I won't be back. I called the front desk at 1230 am my first night looking for a feather pillow and the staff informed me they only had foam. On day 2 I went and spent 50 bucks on a pillow that was feather only to find out at check out they did, allegedly, have feather pillows. The standard pillows are 5"" foam and possibly the worst most uncomfortable hotel pillows I've experienced in 20 years of business travel. Awful.The room at conditioning couldn't be set below 68 and I like to sleep below 65 so that stunk. It was down into the 50s at night, arguably cool enough to open a window at night, problem is you're letting the sounds of NYC in with you. The floor to ceiling windows were amazing but I didn't get one good night's sleep between the pillows and the hard bed. I stayed alone but the shower toilet setup is odd with sliding doors and the sink out in the main sleeping area - I didn't hate it but even in my international travel haven't ever seen a room setup like this. No room for a desk or even a table so ordering in dinner was eaten in bed.The hotel sits on 28th Street and several floral wholesalers are established there so walking to the subway was really beautiful. And the 1 train is only a block away. As a titanium Marriott guest, I was given a slip of 'perks' with my room key like free in room water, but there wasn't even a bottle of water to pay for in my room. Mobile key check in didn't work though I requested it through the app 10 hours before check in. Overall just a lot of hassle and effort to get what I felt were the basics, when I could even get that. The pillows and AC alone was a deal breaker for any future stay.","Charlotte, North Carolina","Blake B</div><div class=""userLoc""><strong>Charlotte, North Carolina</strong>",17,2.0
716546176,https://www.tripadvisor.com/Hotel_Review-g60763-d14149815-Reviews-Moxy_NYC_Chelsea-New_York_City_New_York-or115.html?filterLang=en,Moxy NYC Chelsea,"October 8, 2019","The hotel was nice, the room was very small for two people. Its a place to sleep and shower but it’s hard to move around in the room. It’s a unique concept where everything you need in hanged on the wall. There was no safe deposit in the room. The is a an amazing rooftop bar with a view on the top floor. The cafe of the hotel is nice with a fresh baked products. The hotel is located in Chelsea and it seems that each hotel brand is represented in the area. It is in the heart of the flower district of NY and there are plenty of eating options in the area within walking distance though nothing that I could write home about . It feels relatively safe to walk at night .","Jerusalem, Israel","Aric A</div><div class=""userLoc""><strong>Jerusalem, Israel</strong>",3,4.0
