review_id,url,hotel_name,review_date,review_body,user_location,user_name,helpful_vote,rating
669697133,https://www.tripadvisor.com/Hotel_Review-g60763-d14149815-Reviews-Moxy_NYC_Chelsea-New_York_City_New_York-or290.html?filterLang=en,Moxy NYC Chelsea,"April 27, 2019","Started staying here for business as new home office location is in NoMad and could not be happier with location, staff, and amenities. Staff is a standout all around (friendliness, service, etc), bartender on second floor is an ace, and gym has all the necessities. This is an energetic and vibrant hotel so set your expectations appropriately! ","Peachtree City, Georgia","murphymwm2016</div><div class=""userLoc""><strong>Peachtree City, Georgia</strong>",11,5.0
669532275,https://www.tripadvisor.com/Hotel_Review-g60763-d14149815-Reviews-Moxy_NYC_Chelsea-New_York_City_New_York-or295.html?filterLang=en,Moxy NYC Chelsea,"April 26, 2019","I stayed in 2107 and had a sensational view of the Empire State Building from my room — great at night. The hotel is nestled in the Garden District with easy access to Madison Avenue, Broadway and the Flatiron District. ","Chattanooga, Tennessee","Safari02237654532</div><div class=""userLoc""><strong>Chattanooga, Tennessee</strong>",0,5.0
669502554,https://www.tripadvisor.com/Hotel_Review-g60763-d14149815-Reviews-Moxy_NYC_Chelsea-New_York_City_New_York-or295.html?filterLang=en,Moxy NYC Chelsea,"April 26, 2019","The hotel is in a great location that is very convenient to get around. Unfortunately, the room was so hot that sleep was impossible. I also struggled with the sink. There was a fold out table and small ""stool"" but I had to work a bit in the room and that was difficult. I was there for business but the size of the sink wouldn't work for my wife if we were traveling for pleasure.What really sucked was the service after I left. My fault, yes, but I left my prescription sunglasses in the room and called back that same day. I was dumped into the housekeeping manager's VM and he didn't call me back - TWICE. On my third call, after spending a lot of time on hold, I was asked to provide an email address so they could send me the form. This has been frustrating as I know for a fact they were in the room. I would not trust this property or its' management. Not a Marriott experience at all.","Douglass Hills, Kentucky","LiveWellDineWell</div><div class=""userLoc""><strong>Douglass Hills, Kentucky</strong>",59,2.0
669291053,https://www.tripadvisor.com/Hotel_Review-g60763-d14149815-Reviews-Moxy_NYC_Chelsea-New_York_City_New_York-or295.html?filterLang=en,Moxy NYC Chelsea,"April 25, 2019","Firstly, I picked this location in the Flower District of the Chelsea neighborhood because it was within a 10-minute walk from my event venue in the Flat Iron District. If you like flowers, you'll enjoy walking around the block of the hotel as all the wholesale flower shops line the sidewalks with their colorful sweet smelling living beauties. There are many other hotels on the same block but I'm a Marriott brand loyalty member so I chose to stay at my first Moxy hotel. There is a 1 local train stop on the other side of the block and a R W local stop one block over the other way which was convenient when I wasn't walking or car share riding. I drove into Manhattan with my own car and lucked out finding free street parking not in a hotel loading zone after 7 pm on the block of the hotel which is metered M-F for commercial vehicles only . Despite arriving after 7 o'clock in the evening, my room was not ready. But I chose to accept tokens for a couple free glasses of prosecco and $30 towards food at Bar Feroce on the second floor. When the room was ready, thankfully it was very clean. I stayed in a room with 2 beds on the 22nd floor (no view of the Empire State Building) but pleasantly way from both the rooftop lounge and street noise. There really is not a lot of space in the room. I did assemble the table hanging from one of the hooks on the wall to rest my suitcase and I could still get by it to get to the side of the bed nearest the window. There are bedside nightstands to rest your phone, curtains to block the sun, full length mirror, storage under the beds for shoes, big screen tv, telephone, laptop tray. The bathroom was a comfortable size and it has a sliding door. I found the beds comfortable and slept well. Only 2 of the elevators in the lobby go down to the gym level and parking garage so there were lines for the elevators at busy times. It was also another small annoyance there was no door man at all times because the front doors to the hotel weren't motion-sensor opening. It was a nice perk to have a caffe to grab my morning coffee/tea, a bar (DJ unitl 1 am on Saturdays), a lounge (before 9 pm), a restaurant, and a flower stall all right there in the same building. In addition, the hotel/bar/cafe staff were friendly and provide great service. If you're looking for a trendy new hotel in this area of Manhattan at a reasonable (For NYC standards) price for limited space, check it out.","Pittsburgh, Pennsylvania","Talk2Elle</div><div class=""userLoc""><strong>Pittsburgh, Pennsylvania</strong>",33,3.0
669278272,https://www.tripadvisor.com/Hotel_Review-g60763-d14149815-Reviews-Moxy_NYC_Chelsea-New_York_City_New_York-or295.html?filterLang=en,Moxy NYC Chelsea,"April 25, 2019","Beautiful hotel in the heart of the flower district. Amazing rooftop bar with floral decor.Modern, comfortable rooms. Everything new and staff extremely friendly. Thank you Sean Johnson for all your help in making our stay so special!","Buffalo, New York","carol l</div><div class=""userLoc""><strong>Buffalo, New York</strong>",1,5.0
669168606,https://www.tripadvisor.com/Hotel_Review-g60763-d14149815-Reviews-Moxy_NYC_Chelsea-New_York_City_New_York-or295.html?filterLang=en,Moxy NYC Chelsea,"April 25, 2019","As soon as you walk through the doors of this hotel, you feel like you've stumbled into an exclusive underground lair. Once you're greeted by the friendly staff and realize that you don't have to ""know someone"" to get inside, you embrace the cool.The rooms were a cozy size but the details were perfect and every square inch was well-utilized. You won't want to spend much time in the room though, because the 5-star coffee shop and mega-hip rooftop bar are calling your name.It was a pleasure staying here in one of its first months of being open, and I know it's only getting better and better!","Santa Monica, California","daneeric</div><div class=""userLoc""><strong>Santa Monica, California</strong>",0,5.0
668931110,https://www.tripadvisor.com/Hotel_Review-g60763-d14149815-Reviews-Moxy_NYC_Chelsea-New_York_City_New_York-or300.html?filterLang=en,Moxy NYC Chelsea,"April 24, 2019","Wow, what an experience. From the service when I checked in late at night, to the amenities and the room itself, everything was top notch. The design of the rooms is beautiful and we had an amazing view of the city. The beds were very comfortable, the water pressure in the shower was great, and the rooms were very spacious.I felt like a movie star staying there. It probably didn't hurt that there seemed to be a huge group of fashion models staying there at the same time I was, maybe it was for fashion week. Not surprised this is their go-to spot.The location of the hotel is perfect - it makes the best parts of the city so accessible, whether you are a seasoned NYC veteran or it is your first time in the city. This is a great neighborhood for food, bars, sightseeing, and puts you in a good spot to access the best of the city.I was there for part business, part pleasure, and the hotel was well-suited for both. I am always concerned with NYC hotels that they will be too loud, but my room was very quiet and peaceful.",,cphernand,0,5.0
668927604,https://www.tripadvisor.com/Hotel_Review-g60763-d14149815-Reviews-Moxy_NYC_Chelsea-New_York_City_New_York-or300.html?filterLang=en,Moxy NYC Chelsea,"April 24, 2019","I really wanted to like this hotel But I couldn’t wait to leave. I have been coming to New York for over 30 years and this was by far the smallest room I ever had. Not only that, but the room smelled terrible which is surprising that since it is only a few months old. It already smells moldy from having the bathroom in the same room and poor ventilation. I had to go out and buy a candle to make the room smell better. On top of that when the air-conditioner kicks in it makes this long humming noise for about three or four minutes. I asked about the noise and the engineer came up and said that there is nothing they can do about it that all the rooms air-conditioners make this noise and that it’s some type of issue that can’t be fixed. I asked for ear plugs and of course I never got those either. Unfortunately there’s no room service either and don’t expect moisturizer because the toiletries are very limited. I’ve requested moisturizer but they don’t have any so I had to go out and buy some as well. I have been traveling for 40 years and have never seen a hotel without toiletries that includes moisturizer. I understand that this brand “” Moxy” Is trying to appeal to millennial’s but It just felt cheap to me. I didn’t appreciate calling the front desk and every time they answer they say “hey . what’s going on” I felt like it I was “hostel chic” themed hotel. The worst part is this hotel is expensive and not worth the price. For the same price I could have stayed at much better hotels. It’s a good thing I was in the hotel alone. I can’t imagine having to share that small space with anybody else. There is no closet so everything is hanging on the wall when you walk in to your room. Awful.",San Francisco,"JABSanFrancisco</div><div class=""userLoc""><strong>San Francisco</strong>",11,2.0
668453666,https://www.tripadvisor.com/Hotel_Review-g60763-d14149815-Reviews-Moxy_NYC_Chelsea-New_York_City_New_York-or300.html?filterLang=en,Moxy NYC Chelsea,"April 22, 2019","The rooms are cool, the location is great and the cost is very economical (I used points -- which are also at the low end of the spectrum). The rooms are small, but the floor-to-ceiling windows make it feel more spacious than a bigger room with average-sized windows. And you can be in the room and still feel like you are experiencing the city by taking in the amazing view. The small space is really well thought out -- again not making it feel so small. Location is walking distance to so much, with subway and bike share a block away to get to everything else.","Boulder, Colorado","Carol K</div><div class=""userLoc""><strong>Boulder, Colorado</strong>",10,5.0
668423374,https://www.tripadvisor.com/Hotel_Review-g60763-d14149815-Reviews-Moxy_NYC_Chelsea-New_York_City_New_York-or300.html?filterLang=en,Moxy NYC Chelsea,"April 22, 2019","The hotel is as good as it looks! Rooms are practic, despite the fact that there is no trash can besides the bathroom one, and beds confortable The rooftop bar has an amazing view of New York skyline. ","Buenos Aires, Argentina","Federico A</div><div class=""userLoc""><strong>Buenos Aires, Argentina</strong>",0,4.0
668329220,https://www.tripadvisor.com/Hotel_Review-g60763-d14149815-Reviews-Moxy_NYC_Chelsea-New_York_City_New_York-or300.html?filterLang=en,Moxy NYC Chelsea,"April 22, 2019","All I can say is WOW! Spent a few extra bucks to get the city view and it was stunning and well worth the extra money! The staff are super nice and friendly and everything about the hotel feels fresh, new, luxurious and just amazing! I am hard pressed to find anything negative! The hotel café breakfast was very expensive but that's about the only negative I can say! I had a two queen size bedroom shared with my two teenage kids and it was perfect! I guess if you are there to party, which obviously we weren't, it's even more amazing with the DJ's in the bar and the rooftop bar. Thank you Moxy Chelsea for a lovely week and I'm sure we'll meet again! /Richard and the kids.",,RichWilGbg,0,5.0
668124155,https://www.tripadvisor.com/Hotel_Review-g60763-d14149815-Reviews-Moxy_NYC_Chelsea-New_York_City_New_York-or305.html?filterLang=en,Moxy NYC Chelsea,"April 21, 2019","Although I didn't stay at the Moxy Chelsea, my family took me to its newly opened (March 2019) Feroce Italian restaurant for my birthday. Let me start by saying, WOW -- this place really puts the ""special"" in ""special occasion."" For those who appreciate authentic and inventive Italian food, this is the place to go. I wanted the evening to last forever. All of our dishes were amazing from beginning to end, despite each of us ordering very different items. Everything was extremely fresh, masterfully seasoned and cooked, and nicely presented. Our waiter was exceptionally attentive and courteous, and his recommendations were 100% on target. We also got a friendly visit from the manager. The ambiance was lovely, and even at full capacity, the restaurant managed not to be deafening (as many in NYC are). I even encountered a wine on the menu that I hadn't seen anywhere since my trip to Tuscany. Many of the various meal components were imported from Italy and/or were the product of apprenticeships with a prominent Italian culinary family who spent time in New York mentoring the restaurant staff. Additionally, the hotel had a beautiful view of the skyline from its swanky rooftop bar, supposedly one of the highest rooftop bars in Manhattan. A very memorable experience all around! Highly recommended, especially for Italian expats and Italian visitors to New York. My husband and I are considering staying at the hotel for our anniversary.","New York City, New York","silverlining_nyc</div><div class=""userLoc""><strong>New York City, New York</strong>",30,5.0
667758703,https://www.tripadvisor.com/Hotel_Review-g60763-d14149815-Reviews-Moxy_NYC_Chelsea-New_York_City_New_York-or305.html?filterLang=en,Moxy NYC Chelsea,"April 19, 2019","The Moxy Chelsea is located super central in the relatively unknown district of Chelsea, more or less directly on Broadway, which runs through the lower parts of Manhattan. Between Midtown with Times Square and some tourist highlights, the Empire State Building or the Flat Iron Building, Noho where the shopping paradise begins, and the hip Meatpacking District.  The rooms are modern, clean, functional and with a Super Manhattan view - even if you don't have a room with a view on the Empire State Building. It goes without saying that the rooms are comparatively small in NYC ;-)Bar and restaurant on the 2nd floor as well as the café on the ground floor are great, super atmospheric and invite you to stay. Unfortunately we didn't manage the super Rooftop-Bar. But it must be a blast. There are yoga classes, a flower shop and the hosted a book release party for Bella Thorne.  Staff is top. When we had difficulties with the elevator on one day (3 out of 4 were cancelled), everyone was really busy and there was generous compensation - which we didn't expect.  Every day there was fresh water and even if there were only clothes hooks with hangers the room was super practical, the beds were really comfortable and the shower had plenty of power - which is not always the case in the USA. We would book it again at any time and recommend it to everyone.  The only drawback: there is no offer for a more environmentally friendly towel change. But this is perhaps the case in the USA.","Hamburg, Germany","N8954VPjans</div><div class=""userLoc""><strong>Hamburg, Germany</strong>",0,5.0
667695266,https://www.tripadvisor.com/Hotel_Review-g60763-d14149815-Reviews-Moxy_NYC_Chelsea-New_York_City_New_York-or305.html?filterLang=en,Moxy NYC Chelsea,"April 19, 2019","Moxy Chelsea Team: Paul, Nicole, Jasmine, Danny!- You covered all the bases for any business traveler! Central location, fabulous caffè and co-working space, great Italian restaurant, trendy rooftop cocktail bar, cozy rooms with floor to ceiling widows offering panoramic views of NYC and superb service! During my stay I needed to strategize and conservatory is a calm yet social space with vibriant yellow chairs and green plants that helped my creativity. I had marvelous stay. Looking forward to revisit, dine, work, strategize and play!",,LitJX,0,5.0
667304109,https://www.tripadvisor.com/Hotel_Review-g60763-d14149815-Reviews-Moxy_NYC_Chelsea-New_York_City_New_York-or305.html?filterLang=en,Moxy NYC Chelsea,"April 17, 2019","Visiting my daughter at college, Moxy NYC Chelsea is in a fantastic location walking distance to Penn Station, Flat Iron district and 12 minute subway ride to Parsons/NYU via 28 St. Broadway. Best thing is walking out of the hotel and in the middle of flowers and greenery in the urban landscape since it's in the Flower District.As far as the hotel is concerned, Danny at the front desk was very helpful and nice making checkin and checkout process pleasant. The second floor bar are is great to meet for drinks or hanging out with friends. Rooms are expectedly small but new and clean and the view of The Empire State building is fantastic. Slight inconvenience due to the grand opening which closed off the roof deck bar and had a different line entrance for hotel guests.Few niggles, the shower door, which is a double sliding door to the toilet, leaks onto the floor and I for-see issues in the near future. Gap in the room door allowed sound to travel from the halls which also opens right into the side of the sink making it awkward to roll in with bags. Mind you there is no closet space but hooks along the side of the room sufficed for a single traveler. The only desk/workspace is a foldable chair and table that are hung on the fore-mentioned hooks. If you need to do any type of work, you may need to go to the bar area. The bag check, unfortunately is in the basement and the only way to get down a floor is the elevators which seemed to take awhile to get down and back up again. ","Los Angeles, California","DeValCo</div><div class=""userLoc""><strong>Los Angeles, California</strong>",11,4.0
667262798,https://www.tripadvisor.com/Hotel_Review-g60763-d14149815-Reviews-Moxy_NYC_Chelsea-New_York_City_New_York-or305.html?filterLang=en,Moxy NYC Chelsea,"April 17, 2019","We stayed at the Moxy NYC Chelsea for 7 nights, our first time visiting New York.Check in was simple and efficient - staff reasonably helpful and we were given a fantastic room high up on the 25th floor with views of the Empire State Building. Great start to the trip!The room was very small but we knew this before based on the website and reviews in Tripadvisor. Very clean and tidy on arrival and a welcome retreat after a long journey. The soundproofing was adequate considering the bustle of the city below us.Housekeeping throughout the week was sporadic at best. Beds made, but bed linen not changed frequently and even the water glasses (plastic jars) weren’t replaced with fresh ones in a daily basis.The rooftop bar has amazing views of the city, but it’s enclosed and the drinks menu limited. Seems to be a place to be seen more than anything else - style over substance. The bar on the 2nd floor was excellent - great service and good selection of drinks and bites to eat - we really liked this space.The adjacent coffee shop - Ferocce is worth going to. Great, but pricey coffee and lovely breakfast items and pastries. The boys on the coffee bar were cracking and their chat excellent.Staying here for a week allowed us to see the good and bad of the hotel. Staff were a hit or a miss - quality of service dependant in who you spoke to (Claudia was the standout and most helpful and customer focussed out of them all - she just gets it). The elevators were very frustrating especially at the weekends where non-residents are going to the rooftop bar - very long waits and poorly managed. The hotel staff seemed to want to cater more for the bar customers needs and wants as opposed to paying hotel guests...The hotels opening party was on the during our last night at the hotel. We weren’t informed of this on booking nor at check in. We had a letter slid under the door the morning of the party to advise us of potential disruption. Needless to say, the staff were more focussed on the party than the guests. Getting entry to the hotel was cumbersome and took ages - got to look after the b list celebrities it would appear!!Overall, it’s a shiny new hotel with lots of plus points. The rooms, although new, have a few design flaws - shower leaks into floor of room and adjacent toilet for example. Bed too close to the wall and limited space to walk past it. The WiFi is solid and very fast, so this was another plus point.The location is amazing though with easy access to the subway and so many of NYC’s main attractions are within walking distance. 5 mins and you are at Maddison Square Gardens for the basketball for example.Marketed and designed clearly for Millenials - it’s worth a stay but I’d only come back if my trip was for up to 3 nights maximum.","West Calder, United Kingdom","SteveM6113</div><div class=""userLoc""><strong>West Calder, United Kingdom</strong>",12,4.0
667202270,https://www.tripadvisor.com/Hotel_Review-g60763-d14149815-Reviews-Moxy_NYC_Chelsea-New_York_City_New_York-or310.html?filterLang=en,Moxy NYC Chelsea,"April 17, 2019","I had a meeting in NYC and booked at Moxy Chelsea. My expectations were average knowing it is a city, part of Marriott distinctive select hotels.Checked in on my way to NYC. By the time I arrived I got the electronic keys on my phone.The location is prime close to Penn Station. On the same street there are multiple hotels making it a relatively busy location.The entrance is nicely done, staff cheerful and helpful. Room was on higher floor, accessible by mobile, not large room (convenient for short stays), the design is modern and funky.I would stay there again for sure.","Bethesda, Maryland","shadiabo</div><div class=""userLoc""><strong>Bethesda, Maryland</strong>",47,5.0
667176049,https://www.tripadvisor.com/Hotel_Review-g60763-d14149815-Reviews-Moxy_NYC_Chelsea-New_York_City_New_York-or310.html?filterLang=en,Moxy NYC Chelsea,"April 17, 2019","We had an amazing stay! The staff was very friendly upon arrival, check-in quick and easy. Our room on the 19th floor had the most amazing view of the Empire State Building. The room itself is small but had everything you need, very clean and an overall cool New York interieur style.The top floor of the hotel houses a spacious rooftop bar, great views all around! All this in the flower district, fresh flowers in the streets when you walk in and out. Thank you Moxy, we had a great week in New York, hope to stay with you again soon!",,Esther L,0,5.0
667173738,https://www.tripadvisor.com/Hotel_Review-g60763-d14149815-Reviews-Moxy_NYC_Chelsea-New_York_City_New_York-or310.html?filterLang=en,Moxy NYC Chelsea,"April 17, 2019","This was my first stay at the Moxie brand, I expected it to be dark, cool, and catering towards a crowd with less gray hear than me and indeed it was. I can live with that but there are some significant detractors from the stay quality. The room is tiny, there is a pop out table and compact chair that is best suited for a dorm room. They have these folded and on the wall so you may not even notice it. Theres barely any place to put them and its not comfortable. So if you intend to do some work while staying there its a challenge. The sink is also in the bed room which further cramps things. The hvac system was off during my stay- meaning it was putting warm humid air in while I wanted the AC on. No bath towels were in the room when I checked in. Last, a serious issue for hotel with 35 stories is the lack of working elevators, there were just two available the night I checked in. One was giving access to the night club rather than guests so that was unavailable. Another elevator was on and off use and staff use them as well so be prepared to wait a while. I found the staff to be friendly and helpful. I didnt make much use of the common area on the second floor. Gym was decent but too warm, it is a challenge to get to the gym because there was only one working elevator that went to the basement during much of my stay.I wish I liked the hotel more, it be fine to just sleep in but given the rates (and yes IM aware this is Manhattan) I expected more value and the ability to comfortably get some work done in my room. Also not much value for Marriott elites, no upgrade and a token which is good for 10 dollars at the bar- that doesnt get you much at the prices they charge there.","New York City, New York","flipper95</div><div class=""userLoc""><strong>New York City, New York</strong>",134,3.0
667145022,https://www.tripadvisor.com/Hotel_Review-g60763-d14149815-Reviews-Moxy_NYC_Chelsea-New_York_City_New_York-or310.html?filterLang=en,Moxy NYC Chelsea,"April 17, 2019","attention, this is not a classic hotel but a nigthclub and 2 restaurantsas it is open for all public hotelguests are a minority and thus neglectedrestaurants and nigthclub are always crowded elevators are occupiedservice by inexperient staff mostly very young people",,carlo c,1,2.0
667008476,https://www.tripadvisor.com/Hotel_Review-g60763-d14149815-Reviews-Moxy_NYC_Chelsea-New_York_City_New_York-or310.html?filterLang=en,Moxy NYC Chelsea,"April 16, 2019","We had a great week-long stay at Moxy NYC Chelsea. Nothing was too much trouble for the staff; they went out of their way to make sure we had a great stay and everyone we met was so friendly. The rooms are fantastic, the views great and the rooftop bar is amazing!",,K2569MZemmag,2,5.0
