review_id,url,hotel_name,review_date,review_body,user_location,user_name,helpful_vote,rating
696574367,https://www.tripadvisor.com/Hotel_Review-g60763-d14149815-Reviews-Moxy_NYC_Chelsea-New_York_City_New_York-or175.html?filterLang=en,Moxy NYC Chelsea,"August 7, 2019","Great location with many amenities. All the rooms were clean and very quaint. The hotel entryway was so inviting and the staff was extremely friendly. If you are looking for a different type of hotel stay, this is worth a try.",,Kriss10C,0,5.0
696571149,https://www.tripadvisor.com/Hotel_Review-g60763-d14149815-Reviews-Moxy_NYC_Chelsea-New_York_City_New_York-or180.html?filterLang=en,Moxy NYC Chelsea,"August 7, 2019",What a great time at an adorable boutique hotel. Great location! Beautiful views. Clean rooms. Friendly staff. Delicious cafe. Walking distance to Chelsea market. Would definitely go back. Won’t be disappointed.,"Pompton Plains, New Jersey, United States","Donna D</div><div class=""userLoc""><strong>Pompton Plains, New Jersey, United States</strong>",1,5.0
695751383,https://www.tripadvisor.com/Hotel_Review-g60763-d14149815-Reviews-Moxy_NYC_Chelsea-New_York_City_New_York-or180.html?filterLang=en,Moxy NYC Chelsea,"August 5, 2019",Everyone here was great! Especially Danny at check in. Lots to don hotel but also many things in neighborhood. Restaurant in hotel had good options- staff attentive! Hotel centrally located for our needs! Will he back!,,Peter A,0,5.0
695423249,https://www.tripadvisor.com/Hotel_Review-g60763-d14149815-Reviews-Moxy_NYC_Chelsea-New_York_City_New_York-or180.html?filterLang=en,Moxy NYC Chelsea,"August 4, 2019","This was a combo business and pleasure trip. EVERYTHING at Moxy Chelsea is spot on. Brand new hotel, friendly and attentive staff, cool atmosphere. Hope it stays as pristine as it is now. Only (minor) criticism would be to have the staff throttle back on their overblown and contrived “hipster cool speak”. You’ll know what I mean when you call them from outside or inside. But nothing more than a slight distraction. I will definitely be returning soon. ","North Andover, Massachusetts","davidleibo63</div><div class=""userLoc""><strong>North Andover, Massachusetts</strong>",0,5.0
695364238,https://www.tripadvisor.com/Hotel_Review-g60763-d14149815-Reviews-Moxy_NYC_Chelsea-New_York_City_New_York-or180.html?filterLang=en,Moxy NYC Chelsea,"August 4, 2019","Great location, love the flower shop entrance, and the service...everyone from the front desk to the bar was fantastic. It was my 8-year-old's first time to NYC and the receptionist got us a room with a view of the Empire State Building. It made our trip!! The bartender also made her a mocktail after learning what she liked. It's also near subway lines and restaurants. Keep in mind that the toilet and shower doors open directly into the bedroom (it's like a studio), but it was no problem for my daughter and me. And while it's got a clubby atmosphere, there were also a few other families with young children there.","San Francisco, California","travel4ever2015</div><div class=""userLoc""><strong>San Francisco, California</strong>",5,5.0
695199685,https://www.tripadvisor.com/Hotel_Review-g60763-d14149815-Reviews-Moxy_NYC_Chelsea-New_York_City_New_York-or180.html?filterLang=en,Moxy NYC Chelsea,"August 3, 2019","This is sort a hipster hotel in the vicinity of Penn Station. I stayed 1 night with wife; room was small though comfortable but definitely not a place I would recommend for more than a night or 2 since there is basically no dressers or closets to put your clothing so you end up living out of the suitcase (there is a draw or 2 underneath the bed and hooks on the wall to hang things, but it is not as convenient as conventional room. The rooftop bar is a fun place to have a drink. On second floor, brick oven, thin crust pizza is very good.","New York City, New York","markfR8930FV</div><div class=""userLoc""><strong>New York City, New York</strong>",4,5.0
695062291,https://www.tripadvisor.com/Hotel_Review-g60763-d14149815-Reviews-Moxy_NYC_Chelsea-New_York_City_New_York-or185.html?filterLang=en,Moxy NYC Chelsea,"August 2, 2019","Our stay at Moxy was wonderful! I love to find good quality boutique hotels that are unique and The Moxie is definitely that. We loved the garden district. It was like a botanical neighborhood within NYC. The connecting restaurant, Feroce, is excellent!! The location is perfect to go anywhere in the city. Walk one block, the subway uptown or downtown takes you anywhere in the city. So, conveniently located to many attractions. Finally, all of the staff were very polite and service friendly. This was our 35th Anniversary and the entire staff made this a special occasion for us. Thanks for the attention to details. We will return.","Marietta, Georgia","jwb227</div><div class=""userLoc""><strong>Marietta, Georgia</strong>",2,5.0
694993903,https://www.tripadvisor.com/Hotel_Review-g60763-d14149815-Reviews-Moxy_NYC_Chelsea-New_York_City_New_York-or185.html?filterLang=en,Moxy NYC Chelsea,"August 2, 2019","Used my 1 night free Marriott bonvoy stay with my 3 teens, it was quite a tight space for 4 of us ,lucky enough it was only for a night . I couldn’t say any fault at all . Love the room . Also the kids are underage so we’re not allowed to go up the rooftop to look at the view ( from what I heard it’s beautiful there at night )","Baltimore, Maryland","mtsiembra</div><div class=""userLoc""><strong>Baltimore, Maryland</strong>",1,4.0
694956572,https://www.tripadvisor.com/Hotel_Review-g60763-d14149815-Reviews-Moxy_NYC_Chelsea-New_York_City_New_York-or185.html?filterLang=en,Moxy NYC Chelsea,"August 2, 2019","The beauty of the Moxy isnt a huge room. The rooms are small but perfectly done to make use of the space. In return you get great location, Really great team members on hand, cool bars and lounge areas. Pro tip: great rain shower! ","Washington DC, District of Columbia","David O</div><div class=""userLoc""><strong>Washington DC, District of Columbia</strong>",3,5.0
694709138,https://www.tripadvisor.com/Hotel_Review-g60763-d14149815-Reviews-Moxy_NYC_Chelsea-New_York_City_New_York-or185.html?filterLang=en,Moxy NYC Chelsea,"August 1, 2019",Good Boutique Hotel in the heart of the Flower District. It was a girls trip and we had a blast. The location is easily accessible to all the major tourist sites. Service was excellent. The rooms are a little small but great views. There are 4 bars and the atmosphere is cool with a young crowd occupying most of the time. Very modern upbeat hotel with the beautiful people.......,"Las Vegas, Nevada","ttaylor95677</div><div class=""userLoc""><strong>Las Vegas, Nevada</strong>",0,5.0
694701750,https://www.tripadvisor.com/Hotel_Review-g60763-d14149815-Reviews-Moxy_NYC_Chelsea-New_York_City_New_York-or185.html?filterLang=en,Moxy NYC Chelsea,"August 1, 2019",Great location in Chelsea. Short walk from Penn Station. All of the staff were very welcoming starting with Claudia at Reception and continuing with elevator personnel and in both bar areas! I will be back!,"Barcelona, Spain","KFinn77</div><div class=""userLoc""><strong>Barcelona, Spain</strong>",5,5.0
694673601,https://www.tripadvisor.com/Hotel_Review-g60763-d14149815-Reviews-Moxy_NYC_Chelsea-New_York_City_New_York-or190.html?filterLang=en,Moxy NYC Chelsea,"August 1, 2019","I have been staying at this hotel 3-4 times a month since it opened. Staff has always been great and the rooms have been super clean. If looking for a gym, the Moxy Chelsea has one of the best in Mid-Town. Not only does is have all the basics, but it also has plenty of open space for doing your own workouts.",,Gerry M,0,5.0
694530428,https://www.tripadvisor.com/Hotel_Review-g60763-d14149815-Reviews-Moxy_NYC_Chelsea-New_York_City_New_York-or190.html?filterLang=en,Moxy NYC Chelsea,"July 31, 2019",After a horrible experience at a nearby sister property we decided to stay this visit at The Moxy. The rooms are not big but the king size bed is so comfortable and we love the shower! The team there is very accommodating and personable. We highly recommend this property and will be staying there again.,"New York City, New York","robertcolannino</div><div class=""userLoc""><strong>New York City, New York</strong>",0,5.0
694440318,https://www.tripadvisor.com/Hotel_Review-g60763-d14149815-Reviews-Moxy_NYC_Chelsea-New_York_City_New_York-or190.html?filterLang=en,Moxy NYC Chelsea,"July 31, 2019","The room is compact and perfectly comfortable. No wasted space, exactly what you need after a long hot day in the city. Staff are very warm and welcoming. Room was spotless and bed was comfortable. Nice view of the Empire State Building. ","Minneapolis, Minnesota","Rebecca G</div><div class=""userLoc""><strong>Minneapolis, Minnesota</strong>",0,5.0
693534362,https://www.tripadvisor.com/Hotel_Review-g60763-d14149815-Reviews-Moxy_NYC_Chelsea-New_York_City_New_York-or190.html?filterLang=en,Moxy NYC Chelsea,"July 28, 2019","The Moxy Chelsea is brand new. The shower is awesome especially the water pressure. The workout center has everything, weights, cardio, pull up bars and plenty of room. The hotel room is small by New York standards but perfect for one. Or two if they don’t mind being cozy. The hotel is located in flower district, so it’s a fragrant walk to the subway a block or so away. I will go back there next time in NYC.",,kent c,3,5.0
693423352,https://www.tripadvisor.com/Hotel_Review-g60763-d14149815-Reviews-Moxy_NYC_Chelsea-New_York_City_New_York-or190.html?filterLang=en,Moxy NYC Chelsea,"July 28, 2019","This hotel is in a great location which is why we chose it. We travelled as a family of 4- two adults, a 12 year old and a 14 year old. The staff was friendly and helpful. However we will not be staying here again. There is absolutely no bathroom privacy. The bathroom walls are thin frosted glass and you can see and hear everything. This may be ok for some travelers but not for us. ","Corning, New York","apzimm</div><div class=""userLoc""><strong>Corning, New York</strong>",24,3.0
693019472,https://www.tripadvisor.com/Hotel_Review-g60763-d14149815-Reviews-Moxy_NYC_Chelsea-New_York_City_New_York-or195.html?filterLang=en,Moxy NYC Chelsea,"July 26, 2019","One of the most unique hotels to stay in! From the beautiful floral lobby, the super friendly staff, to the small, but comfortable rooms! Loved the views from our room and the rooftop bar. Needed extra towels and housekeeping was there in minutes!! Looking forward to staying again",Pompton Plains,"maryjot429</div><div class=""userLoc""><strong>Pompton Plains</strong>",1,5.0
692196024,https://www.tripadvisor.com/Hotel_Review-g60763-d14149815-Reviews-Moxy_NYC_Chelsea-New_York_City_New_York-or195.html?filterLang=en,Moxy NYC Chelsea,"July 23, 2019",This hotel is well located easy access to everywhere. The staffs are professionals . Rooms very trendy for a younger crowd but rather small . This is the Moxy style . Upon check in we had presented three different credit cards . Check in time was around 8pm . A few hour later at 1am all of these cards were hacked and fraudulent used for on line purchases an toll paid . At 5am when I noticed these charges through the messages received on the phone I went down and advised the front desk and told of my concerns but the response was cold and indifferent . I had written to my ambassador about the incident who in turn transmitted the message to the hotel but no further response .So this is a very unpleasant thing to happen as I had to report to my credit cards issuance bank and cancelled all the credit cards to prevent further fraudulent use .,"Macau, China","fedtnt</div><div class=""userLoc""><strong>Macau, China</strong>",30,3.0
692108794,https://www.tripadvisor.com/Hotel_Review-g60763-d14149815-Reviews-Moxy_NYC_Chelsea-New_York_City_New_York-or195.html?filterLang=en,Moxy NYC Chelsea,"July 23, 2019",I stayed here with my wife and we really enjoyed it. The location was central so it was very easy for us to get around the city. The staff was always friendly and always put us in a good mood. The hotel itself is chic and has a lounge and nice rooftop bar. Room was clean and comfortable. There's also a small deli nearby that's open 24/7 if you needed to grab any snacks/drinks. Would definitely come back!,,Randy L,2,5.0
691756243,https://www.tripadvisor.com/Hotel_Review-g60763-d14149815-Reviews-Moxy_NYC_Chelsea-New_York_City_New_York-or195.html?filterLang=en,Moxy NYC Chelsea,"July 22, 2019","At first sight Moxy looks like any other boutique hotel, however that is where the similarities stop. Rooms are quite, comfortable with some great view. The second floor has plugs for 100’s of computers and busy travelers. Staff was friendly, accommodating and respectful. Big Props to Moxy","Dallas, Texas","764kurtr</div><div class=""userLoc""><strong>Dallas, Texas</strong>",0,5.0
691467962,https://www.tripadvisor.com/Hotel_Review-g60763-d14149815-Reviews-Moxy_NYC_Chelsea-New_York_City_New_York-or195.html?filterLang=en,Moxy NYC Chelsea,"July 21, 2019",We had a view of the Empire State Building from our room. The staff were very accommodating and friendly. The rooms are compact and don't expect a wardrobe - but the whole of the one wall is fitted with hooks on which to hang your stuff. Shower is big and luxurious. Don't forget to visit the 'Fleur' roof top bar with more amazing views of the the New York sky-line. Wouldn't hesitate to stay here again.,"Nantwich, United Kingdom","Elmo2902</div><div class=""userLoc""><strong>Nantwich, United Kingdom</strong>",5,5.0
691091121,https://www.tripadvisor.com/Hotel_Review-g60763-d14149815-Reviews-Moxy_NYC_Chelsea-New_York_City_New_York-or200.html?filterLang=en,Moxy NYC Chelsea,"July 20, 2019","Honestly I can go on and on about the food at ferocce, the rooftop bar, floor to ceiling windows but it’s all about the staff. I stay there once a month and they treat me like gold. From the minute I walk in I get greeted by name which is always nice. They always give me some extra drink chips and if I need anything they are there for me. ","Montreal, Canada","bram a</div><div class=""userLoc""><strong>Montreal, Canada</strong>",0,5.0
690733991,https://www.tripadvisor.com/Hotel_Review-g60763-d14149815-Reviews-Moxy_NYC_Chelsea-New_York_City_New_York-or200.html?filterLang=en,Moxy NYC Chelsea,"July 18, 2019","I had a reservation at another hotel but stumbled upon Moxy and thought I would give it a try. I LOVE the Chelsea area and I frequent NYC alot for work so I have been everywhere. Chelsea is quieter than some of the other areas of NYC and I love the flower district. This hotel is within walking distance of Penn Station/MSG, Macy's, etc. There are plenty of restaurant and bar options in the area. So, the room:Pros:comfortable bed, great shower/water pressure, it was quiet! No street noise. I didn't hear my neighbors. Staff were super friendly and helpful. This hotel opened Feb 2019 so everything was fresh/new. My room 1708 - had a great view of the ESB.Cons:No refrigerator and no ice machines - you have to request ice. The room is SMALL. If I had someone with me - it would have been very tight. We would have been competing for space and if you have a large suitcase - yeah - that would take up a lot of space in the room. One garbage can in the toilet stall - and that's literally what it is. A stall with a toilet and sliding door . Fine for just me (weird though if you leave the door open you have a full view of yourself in the full length mirror across from you). Shower - same - shower stall - nice products to use (shampoo/shower gel and conditioner). but the door slides - which was fine. Fire alarm at 1:45 - I was so disoriented I didn't know what was going on at first. I inquired the next morning about it and they said that sometimes the ""steam"" from the shower sets them off - that's not good. Oh and the bar in the hotel apparently gets a lot of business from outside customers. It had a night club feel - i wasn't comfortable going in there alone so I forfeited my wooden coin for free champagne that . you get upon check-in. Roof top bar was closed for a private event which was fine with me because I wouldn't have gone anyway. oh and lastly the room was clean overall, but there were multiple ""hairs"" that were not mine on the floor, shower, bed, and toilet. It was a little icky. I would stay here again, but it wouldn't be my choice if my husband was with me. It was too tight.",Albany,"cab1002</div><div class=""userLoc""><strong>Albany</strong>",66,4.0
690647708,https://www.tripadvisor.com/Hotel_Review-g60763-d14149815-Reviews-Moxy_NYC_Chelsea-New_York_City_New_York-or200.html?filterLang=en,Moxy NYC Chelsea,"July 18, 2019","Awesome New Hotel, Clean Modern Rooms, Great Location in the Chelsea District, Easy Walking Distance to all Sights, Sounds and Attractions of NYC, Friendly Outgoing Staff and Great Value for Mid-Manhattan!","Calgary, Canada","mcpherbj</div><div class=""userLoc""><strong>Calgary, Canada</strong>",0,5.0
690384417,https://www.tripadvisor.com/Hotel_Review-g60763-d14149815-Reviews-Moxy_NYC_Chelsea-New_York_City_New_York-or200.html?filterLang=en,Moxy NYC Chelsea,"July 17, 2019","Stayed here with my family for four nights in July.The location is a couple of blocks from Penn Station in Manhattan. Lobby is small, with florist shop and cafe in same area.Rooms are compact, however they have been designed quite cleverly with a lot of hooks to hand things up.We had two rooms, one with great views of Empire State Building and the bunk bed room which slept four, ideal for our teenagers. Both were spotless.We enjoyed the comp drinks we were awarded upon check in, and the comp coffee in the morning was also a nice touch.Will return here for sure next time I am in NY.",Belfast,"BelfastMartyMc</div><div class=""userLoc""><strong>Belfast</strong>",1,5.0
690152675,https://www.tripadvisor.com/Hotel_Review-g60763-d14149815-Reviews-Moxy_NYC_Chelsea-New_York_City_New_York-or200.html?filterLang=en,Moxy NYC Chelsea,"July 16, 2019","Been staying in NY regularly for 20+ years and have had a number of favorites through that time period. As of early 2019 Moxy in Chelsea is my new favorite. Great, central location half block from the 1-line subway. Small but beautiful front lobby bordering a boutique flower shop that you walk through to gain entry. Great 2nd floor bar and 1st floor cafe for breakfast. The free Sparkling wine chips to use at the 2nd floor bar and given upon check-in is a nice bonus. The rooftop bar which is managed by a seperate company, while not open air, has one of the best 360 views in the city. Bedrooms are flawless though extremely small so be prepared. If your not familiar with the Moxy concept, no closet exist so you hang your clothes on the wall. Small cubbies exist under the bed for folded clothes. Amazingly well designed and comfortable bed directly across a huge flat panel TV in every room. I'm a fan of the clean and warm colored fake wood floors and well designed furnishings, not the bare bones Ikea look used at similar minimalist hotels. The Moxy splurges with its bathroom finish outs which include products that are almost as good as what you would expect at W Hotels. Front desk staff is pleasant and helpful with zero attitude. Elevators can be a bit on the slow side at times, but not a deal killer. Looking forward too many more stays.",,jimpeterson2000,0,5.0
689923577,https://www.tripadvisor.com/Hotel_Review-g60763-d14149815-Reviews-Moxy_NYC_Chelsea-New_York_City_New_York-or205.html?filterLang=en,Moxy NYC Chelsea,"July 15, 2019","I’ve never stayed in a smaller hotel room, I’m here with the wife and baby, yet there is no room for the crib, especially once the luggage and stroller fit in. Had to ask for a fridge, which is laughable, even more so when there is no thought as to where it should go in the room, other than between the two beds and in front of the telephone and small desk. Feel like I’m in the YMCA or at worst, I’ve been punished and held captive. $400 a night...shaking my head!!!","Baltimore, Maryland","921nika</div><div class=""userLoc""><strong>Baltimore, Maryland</strong>",8,2.0
689901157,https://www.tripadvisor.com/Hotel_Review-g60763-d14149815-Reviews-Moxy_NYC_Chelsea-New_York_City_New_York-or205.html?filterLang=en,Moxy NYC Chelsea,"July 15, 2019","Our little Big City getaway was amazing because of Moxy Chelsea. The views of the city were gorgeous both day and night, the curtains were never closed. We soaked up every moment of the breathtaking scenery surrounding us. The room was a perfect size, from the king sized bed to the rain fall shower. The staff at your location were fast, friendly, and extremely accommodating. Thank you for making our stay unforgettable.",,Adventure_explore31,0,5.0
689643076,https://www.tripadvisor.com/Hotel_Review-g60763-d14149815-Reviews-Moxy_NYC_Chelsea-New_York_City_New_York-or205.html?filterLang=en,Moxy NYC Chelsea,"July 14, 2019",The rooms are small but comfortable and clean. The staff is Amazing . Bed super comfortable. Overall very cute hotel and ambiance. Beautiful bar with good coffee. Great location to explore Chelsea. I would highly recommend,"Miami Beach, Florida","Alex R</div><div class=""userLoc""><strong>Miami Beach, Florida</strong>",0,5.0
688726146,https://www.tripadvisor.com/Hotel_Review-g60763-d14149815-Reviews-Moxy_NYC_Chelsea-New_York_City_New_York-or205.html?filterLang=en,Moxy NYC Chelsea,"July 11, 2019","I truly enjoyed my last stay at Moxy NYC Chelsea. Staff is well trained and it shows. Cleanliness is outstanding. I would defintely return and recommend this hotel. Danny the front desk staff was amazing and truly never made us feel as just another customer. This young man deserves a 5+One advice I would offer is to try to find a way to settle account at departure, I feel I had to check my account too many times to understand the money charged, the pre $20 / day, then rest but still waiting for adjustments 2 days later",,IsabellaFasulo,0,5.0
688497153,https://www.tripadvisor.com/Hotel_Review-g60763-d14149815-Reviews-Moxy_NYC_Chelsea-New_York_City_New_York-or205.html?filterLang=en,Moxy NYC Chelsea,"July 10, 2019","I spent 5 nights at the Moxy Chelsea in late June with my partner (at the end of a long trip across the USA, our 15th hotel in 4 weeks). Loved it, perfect end to a great trip.Location of the hotel is excellent, easy to get everywhere. Only 5 min walk from Penn Station which was handy for us arriving by Amtrak, then leaving to airports. Easy to get everywhere.Room - stayed in a king bed city view room. It was a great room and tastefully decorated. I had an accessible room so I think it may have been slightly bigger than normal. Views were amazing. Bed super comfy. Excellently kitted out. We had a few minor issues with housekeeping forgetting to service the room but the helpful staff managed this efficiently so there really wasn't an issue.The hotel itself is great - staff very friendly and helpful. Free coffee on 2nd floor each day in the very nicely set up Bar Feroce. You can buy espresso coffee and pastries etc from the ground floor cafe which is not bad (the cafe itself isn't amazing though for breakfast). Pret and Starbucks only a few minutes away too. The fitness room is v well decked out.I'd stay here again for sure. ","Melbourne, Australia","stewartmck77</div><div class=""userLoc""><strong>Melbourne, Australia</strong>",6,5.0
688263541,https://www.tripadvisor.com/Hotel_Review-g60763-d14149815-Reviews-Moxy_NYC_Chelsea-New_York_City_New_York-or210.html?filterLang=en,Moxy NYC Chelsea,"July 9, 2019","I absolutely loved my stay at the Moxy! It was small, but extremely comfortable. It gave me everything I needed, without the extra fluff that hot rooms charge you hundreds more for. The view was spectacular, the bed was so so comfey, and I loved how quirky yet adorable the room was. The service at the front desk was always nice, they were always smiling, and so helpful when we asked questions. The location is close to Chelsea Market. Hudson Yards, Madison Square park, and some cool places, all within walking distance. I would 100% book here again when I come to the city. I love this place!","Detroit, Michigan","hiyaamy2018</div><div class=""userLoc""><strong>Detroit, Michigan</strong>",0,5.0
688208275,https://www.tripadvisor.com/Hotel_Review-g60763-d14149815-Reviews-Moxy_NYC_Chelsea-New_York_City_New_York-or210.html?filterLang=en,Moxy NYC Chelsea,"July 9, 2019","We had a blast staying at The Moxy Chelsea for my 30th birthday weekend! The rooms were so clean and had even more style and character. All the of staff was great, especially Danny. He gave us great recommendations throughout the weekend and was a great help in booking us another night when we just were having too much fun to leave. I would definitely recommend to anyone staying in NYC.","Washington DC, District of Columbia","kiarao709</div><div class=""userLoc""><strong>Washington DC, District of Columbia</strong>",0,5.0
688201289,https://www.tripadvisor.com/Hotel_Review-g60763-d14149815-Reviews-Moxy_NYC_Chelsea-New_York_City_New_York-or210.html?filterLang=en,Moxy NYC Chelsea,"July 9, 2019","My second week in New York and I choose the Moxy hotel as it was closer to some events on my schedule. The Hotel turned out to be the best I've stayed at in my 6 years of visiting NYC.. Say goodbye to the tourististy volume properties and say hello to faboulous service, stunning food and epic cocktails.. all topped of with stylish rooms and fantastic team.... I will be back.","Brisbane, Australia","drewcoogan</div><div class=""userLoc""><strong>Brisbane, Australia</strong>",4,5.0
