review_id,url,hotel_name,review_date,review_body,user_location,user_name,helpful_vote,rating
749846426,https://www.tripadvisor.com/Hotel_Review-g1066457-d12123803-Reviews-Nine_hours_Shinjuku_North-Shinjuku_Tokyo_Tokyo_Prefecture_Kanto-or0.html?filterLang=en,nine hours Shinjuku-North,"March 8, 2020","To be honest the first time I did the capsule hotel thing I was a bit nervous. I did it because you have to try it once in Tokyo. However, after the 1st time I booked the Nine Hours in Shinjuku I booked another night. Now, two years later I'm back and this place hasn't changed it's awesome. Super efficient just what a solo traveler wants. I want my time spent out exploring Tokyo. When I come back to my accommodation I don't need a room, the locker holds my backpack and they can store your larger luggage, no extra charge. The solid shower before heading to the airport is worth the stay. Large bathroom with an awesome clean shower and everything you need to get your day started. I came here for the experience and left as a lifetime customer.","Soldotna, Alaska","KenaiDriftAnglers</div><div class=""userLoc""><strong>Soldotna, Alaska</strong>",4,5.0
747890686,https://www.tripadvisor.com/Hotel_Review-g1066457-d12123803-Reviews-Nine_hours_Shinjuku_North-Shinjuku_Tokyo_Tokyo_Prefecture_Kanto-or0.html?filterLang=en,nine hours Shinjuku-North,"February 27, 2020","I stayed at 9hours for 2 nights. The hotel is really modern and clean. The checkin checkout process went quickly and the staff is very friendly!The room : capsules are clean and comfortable, there is a light and plug to charge your phone. The capsules are not isolated, you can hear everything thats happening in the room, if you’re unlucky and have to sleep with noisy people it could be a bit annoying. But most of people are very respectfull. Keep in mind it’s a hostel you can’t require full silence.The bathroom: is very modern, there are a lot of toilets and showers, no need to wait for your turn!Maybe they should put some music in the bathrooms. I understand the bedrooms should be quiet but the Silent Vibe in the bathroom is a bit creepy.. ( but that’s just my vibe, I put music everywhere I go)Breakfast: If you add I think 3 euros you have breakfast included in your stay. Breakfast is not at the hostel it’s in a restaurant 1 min from the hostel. I would not recommend it. It’s not the best breakfast and I think the area offers so much more food to discover than to go to this place.Lobby: it’s a comfortable place to chill/work/chat. I think it’s a good hotel for 1 or 2 nights but not for a long time because you can not unpack. Your luggage stays in the lockers so you have to be a bit organized (preparing your clothes for the next day, your bathroom amenities to go shower,..). The hotel provides towels , a pijama slippers and toothbrush, soap etc which is really cool!Overall very nice experience , I would totally recommend! ",,Clarahdb,5,5.0
744403186,https://www.tripadvisor.com/Hotel_Review-g1066457-d12123803-Reviews-Nine_hours_Shinjuku_North-Shinjuku_Tokyo_Tokyo_Prefecture_Kanto-or0.html?filterLang=en,nine hours Shinjuku-North,"February 11, 2020","Very nice capsule hotel.Location is nice and easily reachable if you are flying from Haneda or Narita.Low price. Capsule are large enough.Really clean.Staff great.Only negative point: the mattress are thin.Don’t expect comfort. But definitely not big deal.I would go back, no doubt.","Montreal, Canada","luckypaulG</div><div class=""userLoc""><strong>Montreal, Canada</strong>",21,5.0
737715713,https://www.tripadvisor.com/Hotel_Review-g1066457-d12123803-Reviews-Nine_hours_Shinjuku_North-Shinjuku_Tokyo_Tokyo_Prefecture_Kanto-or0.html?filterLang=en,nine hours Shinjuku-North,"January 7, 2020","Nine Hours was recommended to me and as my visit to Robot Restaurant was late, I wanted somewhere simple to stay. Nine Hours certainly accommodated that. From the very entrance, this place oozes simplicity, futuristic styling and good service. Elevator takes you to the 8th floor where you check-in with staff who have a reasonable grasp of the English language. They explain how Nine Hours works e.g. if you're staying more than one night you check out at 10 and check back in later. The 'all women' capsules are on the 6th floor however, the showers are on another level (I didn't need them). As soon as you get out of the elevator on the 6th floor, there are lockers for your gear, toilets and handbasins. The capsules are through another door that indicates ""quiet"". If you have trouble climbing up a few stairs, ask for a capsule on the floor level. There are slipon slippers for each capsule which you dispose of before you leave. I crawled into mine, pulled the blind down to give me some privacy and just soaked up the peace. First thing I noticed was how clean it was and no odours or smells. Nice. There are two small shelves moulded into the capsule which are useful for putting your devices while they charge (note that the plug is a little tricky - put your plug in a small way, then turn sideways 90 degrees and push). If found the mattress a little hard but the pillow just fine. Unfortunately for me being tall, the doona (duvet) was a little short. There is very little outside noise, really the only sound is the airconditioning maintaining a constant temperature. Once people started arriving to bed down for the night it got noisy. Consider it a funky dormitory. You can hear people coming and going, snoring, coughing etc. but there is the privacy of your capsule that makes it interesting. It also feels very safe being amongst just women. Check out was quick and simple. There is a large space on the 8th floor where you can look at views of Shinjuku from the floor to ceiling windows both north and south. That, along with a massive table, benches and chairs, there is plenty of time to catch up on work if you need to. It's modern and sparse but somewhat inviting. Located within the Korean District and not from the Robot Restaurant, there is plenty to see and do in and around Nine Hours. I would highly recommend a visit. ","Melbourne, Australia","urbandrifter</div><div class=""userLoc""><strong>Melbourne, Australia</strong>",4029,5.0
736910138,https://www.tripadvisor.com/Hotel_Review-g1066457-d12123803-Reviews-Nine_hours_Shinjuku_North-Shinjuku_Tokyo_Tokyo_Prefecture_Kanto-or0.html?filterLang=en,nine hours Shinjuku-North,"January 4, 2020","This place is fantastic for short stays. It accommodates for anything you might need in transit, it is very clean and everything is considered in detail. Also, the staff are super friendly and helpful :)Just remember, it is called 9h because it is only open for 9. You still have to check out at 10am and can check back in at 1pm, if you are staying longer than one night.",,VlastaJ4,0,5.0
736632151,https://www.tripadvisor.com/Hotel_Review-g1066457-d12123803-Reviews-Nine_hours_Shinjuku_North-Shinjuku_Tokyo_Tokyo_Prefecture_Kanto-or5.html?filterLang=en,nine hours Shinjuku-North,"January 3, 2020","My friend and I visited Shinjuku on yesterday and we stayed at this location! It’s location is the middle of all the action yet once you’re inside it’s a great break. The staff were friendly and spoke a little English which was helpful with directions etc. The showers are on another floor which was a bit of a task, and there weren’t outlets at each mirror. I enjoyed my stay and it was perfect for my short stay in Shinjuku. ","Atlanta, Georgia","353starj</div><div class=""userLoc""><strong>Atlanta, Georgia</strong>",4,4.0
736122946,https://www.tripadvisor.com/Hotel_Review-g1066457-d12123803-Reviews-Nine_hours_Shinjuku_North-Shinjuku_Tokyo_Tokyo_Prefecture_Kanto-or5.html?filterLang=en,nine hours Shinjuku-North,"January 1, 2020","I was curious to stay for one night of my solo trip to Tokyo in a capsule, and this was kept surfacing as a good option. I'm so glad I chose to stay here! It was so clean, so quiet and I honestly slept so much better than I'd anticipated. This was perfect for a one-night capsule experience, and I would recommend to anyone looking to do the same.","Los Angeles, California","theadventuresofamy</div><div class=""userLoc""><strong>Los Angeles, California</strong>",3,5.0
730976232,https://www.tripadvisor.com/Hotel_Review-g1066457-d12123803-Reviews-Nine_hours_Shinjuku_North-Shinjuku_Tokyo_Tokyo_Prefecture_Kanto-or5.html?filterLang=en,nine hours Shinjuku-North,"December 6, 2019","if you're a bit organized for capsule hotel, for 1-2 nights is very nice. the hotel is young, cheap and clean. the showers are quite big. there is no air conditioned in the capsule. check in and out are very fast","Sendai, Japan","Dalila B</div><div class=""userLoc""><strong>Sendai, Japan</strong>",10,4.0
729667807,https://www.tripadvisor.com/Hotel_Review-g1066457-d12123803-Reviews-Nine_hours_Shinjuku_North-Shinjuku_Tokyo_Tokyo_Prefecture_Kanto-or5.html?filterLang=en,nine hours Shinjuku-North,"November 29, 2019","I was always curious to try a capsule hotel and it was much more comfortable than what I was thinking. Also, I was amazed by how clean and organized the shared facilities was! There are plenty of shower rooms and toilets and all are very clean and comfortable to use. This may look like a bag packer choice but has very high standards. The neighborhood is Korean town, full of restaurants and Korean-pop shops and lots of teenagers hanging around.","Geneva, Switzerland","I30sh</div><div class=""userLoc""><strong>Geneva, Switzerland</strong>",26,5.0
727526621,https://www.tripadvisor.com/Hotel_Review-g1066457-d12123803-Reviews-Nine_hours_Shinjuku_North-Shinjuku_Tokyo_Tokyo_Prefecture_Kanto-or5.html?filterLang=en,nine hours Shinjuku-North,"November 19, 2019","Everything is kept immaculately clean, the bathrooms are in top shape, and the pods are incredibly comfortable and clean. The staff and friendly, helpful and speak good English. The location is great. Each day you receive a “starter pack with toothbrush, towel, slippers and Pajamas. My only comment would be to ask guests if they’d like slippers and a toothbrush as people are becoming increasingly conscious about waste. Thank you for an incredible stay 9 hours! ",,globalexplorerr,8,5.0
726383404,https://www.tripadvisor.com/Hotel_Review-g1066457-d12123803-Reviews-Nine_hours_Shinjuku_North-Shinjuku_Tokyo_Tokyo_Prefecture_Kanto-or10.html?filterLang=en,nine hours Shinjuku-North,"November 14, 2019","I visited Tokyo for 7 nights and I decided to try the famous capsule hotel (it was a must). The concept is great and very easy to check-in and out. The capsule is very big for one person and it does not feel claustrophobic at all. This specific hotel is a very short walk to the main area of Shinjuku. If you get breakfast included, the cafe is few seconds walk, down the main road. The only thing I didn't like is the fact that you have to change where the lockers are, there is no changing room. You can always change inside the shower room but, it is a bit hot and not very comfortable to do so there.","London, United Kingdom","Alessandrolnd</div><div class=""userLoc""><strong>London, United Kingdom</strong>",16,4.0
720460829,https://www.tripadvisor.com/Hotel_Review-g1066457-d12123803-Reviews-Nine_hours_Shinjuku_North-Shinjuku_Tokyo_Tokyo_Prefecture_Kanto-or10.html?filterLang=en,nine hours Shinjuku-North,"October 22, 2019","Everything (sleeping pod, mattress, pillow, shower, pajamas, towels) was pretty good except there was only one power socket which is pretty bad because I needed to charge a lot of things (phone, power bank, camera's battery, laptop) and you have to checkout (before 10:00 until 13:00) every day so you can't leave anything charging at that time. I left before 10am and returned back only around midnight so no charging but at least can check in that late.","Riga, Latvia","davispuh</div><div class=""userLoc""><strong>Riga, Latvia</strong>",1,4.0
720263850,https://www.tripadvisor.com/Hotel_Review-g1066457-d12123803-Reviews-Nine_hours_Shinjuku_North-Shinjuku_Tokyo_Tokyo_Prefecture_Kanto-or10.html?filterLang=en,nine hours Shinjuku-North,"October 21, 2019",Stayed one night just to say “I did it.” The capsule was nice and cozy. Very clean and very quiet. Staff was great and provided adequate information about the hotel. Would recommend as part of the complete Japan experience at least once. ,"New York City, New York","BakaNoBaka</div><div class=""userLoc""><strong>New York City, New York</strong>",0,5.0
718927841,https://www.tripadvisor.com/Hotel_Review-g1066457-d12123803-Reviews-Nine_hours_Shinjuku_North-Shinjuku_Tokyo_Tokyo_Prefecture_Kanto-or10.html?filterLang=en,nine hours Shinjuku-North,"October 16, 2019",This capsule hotel offers something fun and exciting for guests who are not used to this type of accommodation. It’s like staying in a hostel but with added privacy and convenience. I’d definitely recommend this for someone in the area. ,,287camdenh,0,5.0
717278027,https://www.tripadvisor.com/Hotel_Review-g1066457-d12123803-Reviews-Nine_hours_Shinjuku_North-Shinjuku_Tokyo_Tokyo_Prefecture_Kanto-or10.html?filterLang=en,nine hours Shinjuku-North,"October 11, 2019","The fault is really mine as I thought for some reason I needed to experience a capsule hotel thinking it was somehow different from any other accommodation I'd stayed. I have actually stayed in something similar before - it's called a hostel. That's really what it is so if you're like me thinking you need to try a capsule hotel to complement your Japan experience, don't. It's not really the hostel's fault - it's the idiot/inconsiderate guests who stay there; wheeling in their bags at all hours of the night making noise when you're meant to make use of the space and lockers outside the sleeping area, alarms going off in the morning etc. you just have a thin blind to close your pod so you hear EVERYTHING with at least 20 other pods in the sleeping area. The pod was a bit hot (I need to sleep with a window open or a fan blowing or air con etc. so this was a bit stressful initially). I appreciate I might be sounding a bit like a diva but I've done my hostel time and coming off an 8 hour flight it was really not my best idea. Luckily I was checking into a proper hotel for the rest of my stay so I was out like a flash the next morning. If you're young and travelling around and budgeting with hostels - then go for gold, but if you're like me - give it a miss. Seriously.","Sydney, Australia","HolidayDaydreamer</div><div class=""userLoc""><strong>Sydney, Australia</strong>",44,2.0
717243719,https://www.tripadvisor.com/Hotel_Review-g1066457-d12123803-Reviews-Nine_hours_Shinjuku_North-Shinjuku_Tokyo_Tokyo_Prefecture_Kanto-or15.html?filterLang=en,nine hours Shinjuku-North,"October 11, 2019","It was a great experience. It is really near to the subway. The capsules are unbelievable beautiful and all the facilities are nice. The restroom, bathroom and capsules are very clean and the breakfast although is not in the same place is very close and tasty. If you will stay longer than one day, it is a little boring that you need to checkout (and checkin) each day and leave the place until 1PM but besides that, it is a lovely experience. I totaly recommend.","Sao Paulo, SP","146brunab</div><div class=""userLoc""><strong>Sao Paulo, SP</strong>",0,5.0
717141996,https://www.tripadvisor.com/Hotel_Review-g1066457-d12123803-Reviews-Nine_hours_Shinjuku_North-Shinjuku_Tokyo_Tokyo_Prefecture_Kanto-or15.html?filterLang=en,nine hours Shinjuku-North,"October 10, 2019","Sparse but surprisingly comfortable. Would definitely stay here again! One thing I would say is to be sure you’re ok with shared facilities. Some people may not enjoy that. Other Th an that, it was a nice sleep and the other guests were courteous.","Los Angeles, California","Menkamus</div><div class=""userLoc""><strong>Los Angeles, California</strong>",0,5.0
713856034,https://www.tripadvisor.com/Hotel_Review-g1066457-d12123803-Reviews-Nine_hours_Shinjuku_North-Shinjuku_Tokyo_Tokyo_Prefecture_Kanto-or15.html?filterLang=en,nine hours Shinjuku-North,"September 29, 2019","Clean, stylish design and near station, however there is no elevator nor escalator at the nearest station (新大久保 Shin Okubo), people with heavy luggage please note. Check in and common area are too crowded. Pillow is very flat and hard, the cabin is quite hot. There is one elevator from ground to lobby, another one to ladies floor and one to mens' floor, have to wait for a long time. Provide amenities, towels and sleep wears. Lockers are big and good but there is no space for you to open your luggage for packing!You have to check out every morning at 10am even if you stay for more than one night. You cannot access your capsule and bathroom before check in time!There is no drinking water, no pantry at the hostel!Its pricey, double the price of other hostels.","Hong Kong, China","Theresa W</div><div class=""userLoc""><strong>Hong Kong, China</strong>",7,1.0
713491807,https://www.tripadvisor.com/Hotel_Review-g1066457-d12123803-Reviews-Nine_hours_Shinjuku_North-Shinjuku_Tokyo_Tokyo_Prefecture_Kanto-or15.html?filterLang=en,nine hours Shinjuku-North,"September 27, 2019","The staff was very helpful and the place was very clean, will visit here again! The pod was more spacious then I thought and the view from the 8th floor was a very nice extra, enough places to load your phone, must do for alone travelers","Ghent, Belgium","Simon V</div><div class=""userLoc""><strong>Ghent, Belgium</strong>",0,5.0
711789580,https://www.tripadvisor.com/Hotel_Review-g1066457-d12123803-Reviews-Nine_hours_Shinjuku_North-Shinjuku_Tokyo_Tokyo_Prefecture_Kanto-or15.html?filterLang=en,nine hours Shinjuku-North,"September 21, 2019","Excellent facilities. Very fun futuristic clean looking capsules.Nice staff. (Seemed to listened to good music, sonic youth, etc).Found the location outside is a bit overcrowded for the little sidewalk and annoying to walk through.... but very close to JR station and line that loops around the city, as well as some fun neighbourhoods / areas.You have to check out every morning for cleaning (pretty standard), but can leave stuff in the locker. You receive slippers/toothbrush/paste/towel/pjs every night.",BC,"putnikprice</div><div class=""userLoc""><strong>BC</strong>",2,5.0
709797620,https://www.tripadvisor.com/Hotel_Review-g1066457-d12123803-Reviews-Nine_hours_Shinjuku_North-Shinjuku_Tokyo_Tokyo_Prefecture_Kanto-or20.html?filterLang=en,nine hours Shinjuku-North,"September 14, 2019","During my visit to Japan, I stayed in two nine hrs hostels - Shinjuku Tokyo and Namba Osaka. Decided to stay in Osaka after having enjoyed my stay at Shinjuku.Both the places were very centrally located, just few minutes walk from metro. What strikes you first is the spotlessly clean place. They provide 2 towels and night wear. Spacious locker is part of the deal. I was early in Osaka and could leave my luggage at the place.The check in was very prompt and professional.When I visit Japan again, I will be happy to stay at 9 hours.","Woodbridge, Canada","Jose M</div><div class=""userLoc""><strong>Woodbridge, Canada</strong>",55,5.0
708939368,https://www.tripadvisor.com/Hotel_Review-g1066457-d12123803-Reviews-Nine_hours_Shinjuku_North-Shinjuku_Tokyo_Tokyo_Prefecture_Kanto-or20.html?filterLang=en,nine hours Shinjuku-North,"September 11, 2019",Reasonable for a solo short stay. Provided with towel slippers PJs and toothbrush.Spacious and comfortable capsule.Clean. Location one stop from Shinjuku on Yamanote line - To Shin Okubu.Korean townCons : Alarms early morning can be disturbing,Bentleigh East,"Stephanie J S</div><div class=""userLoc""><strong>Bentleigh East</strong>",2,3.0
708776347,https://www.tripadvisor.com/Hotel_Review-g1066457-d12123803-Reviews-Nine_hours_Shinjuku_North-Shinjuku_Tokyo_Tokyo_Prefecture_Kanto-or20.html?filterLang=en,nine hours Shinjuku-North,"September 11, 2019","It was my first time in Japan and I came alone. I could have not chose a better place to stay.Right in the middle of Shinjuku district, with a lot of supermarkets, cafes, restaurants, souvenirs shops and metro/train stations.Inside the hotel, very good environment. Everything, and I mean everything, is super clean! For me, cleanliness is my main concern regarding a hotel. The capsules/pods are bigger than they look. And very comfortable too. We have towels (a big and a small one), slippers and a pijama. We don't need to worry with that. So, if one day I return to Tokyo, I will definitely stay here again! ","Braga, Portugal","RLeite_0</div><div class=""userLoc""><strong>Braga, Portugal</strong>",0,5.0
708314672,https://www.tripadvisor.com/Hotel_Review-g1066457-d12123803-Reviews-Nine_hours_Shinjuku_North-Shinjuku_Tokyo_Tokyo_Prefecture_Kanto-or20.html?filterLang=en,nine hours Shinjuku-North,"September 9, 2019","9hours hotel is a beautiful capsule hotel. Large common room for sitting, talking, and figuring out your next move in the vast city. Very quiet which is what you would like especially when tired and traveling solo. They accepted a reservation for me to come in at 1am which was amazing as I was super stressed and tired. Capsules are spacious. I'm 6'2"" and had no problem climbing up into the capsule, sitting up when I needed to, and shifting around whilst sleeping. Only one plug for charging devices but if you manage your stuff well you'll be fine. Last but not least the hotel staff are very curtious and amazing. I left something in the locker and they let me go get into locker twice after I checked out. I'm kind of a forgetful person. Will stay again if ever I need a place.Arigato!",,JashinsJudgement,0,5.0
708082680,https://www.tripadvisor.com/Hotel_Review-g1066457-d12123803-Reviews-Nine_hours_Shinjuku_North-Shinjuku_Tokyo_Tokyo_Prefecture_Kanto-or20.html?filterLang=en,nine hours Shinjuku-North,"September 9, 2019","We had to stay there for the experience and it was worth it.Extremely clean facilities very well run, fantastic pricePods are quite spaciousLocation is very goodToilets, showers and locker rooms are clean and modern Wouldn’t recommend staying there for more than a couple of nights it becomes tiresome having your luggage stored away from the sleeping quarters so it’s a bit tricky organizing things. But over all we really really enjoyed it, it was a fun experience ","Auckland Central, New Zealand","emshi512</div><div class=""userLoc""><strong>Auckland Central, New Zealand</strong>",5,5.0
707968271,https://www.tripadvisor.com/Hotel_Review-g1066457-d12123803-Reviews-Nine_hours_Shinjuku_North-Shinjuku_Tokyo_Tokyo_Prefecture_Kanto-or25.html?filterLang=en,nine hours Shinjuku-North,"September 8, 2019","It was everything great. Good room, good shower, good attendants. Well located in the city, good restaurants nearby. Metro is nearby.すべてが素晴らしかった。 良い部屋、良いシャワー、良いアテンダント。 市内にあり、近くに良いレストランがあります。 地下鉄が近くにあります。",,castilhoatv,0,5.0
707946686,https://www.tripadvisor.com/Hotel_Review-g1066457-d12123803-Reviews-Nine_hours_Shinjuku_North-Shinjuku_Tokyo_Tokyo_Prefecture_Kanto-or25.html?filterLang=en,nine hours Shinjuku-North,"September 8, 2019","The capsules are large and comfy, and they give you a cute pack of pajamas, toothbrush and slippers to wear. The only negative is that the lockers are too small for my luggage to fit, but they have luggage storage anyway","Sydney, Australia","ash_skywalker10</div><div class=""userLoc""><strong>Sydney, Australia</strong>",162,5.0
707625325,https://www.tripadvisor.com/Hotel_Review-g1066457-d12123803-Reviews-Nine_hours_Shinjuku_North-Shinjuku_Tokyo_Tokyo_Prefecture_Kanto-or25.html?filterLang=en,nine hours Shinjuku-North,"September 7, 2019","A really nice and modern capsule hotel. Capsules much more spacious than expected, and very comfortable. All amenities provided, including pyjamas and towels. If you want to rent more of these there is a cheap price for it. Nice staff on the desk!","Sheffield, United Kingdom","laramiriam</div><div class=""userLoc""><strong>Sheffield, United Kingdom</strong>",0,5.0
707491616,https://www.tripadvisor.com/Hotel_Review-g1066457-d12123803-Reviews-Nine_hours_Shinjuku_North-Shinjuku_Tokyo_Tokyo_Prefecture_Kanto-or25.html?filterLang=en,nine hours Shinjuku-North,"September 7, 2019","Easy check in by friendly staff who straight away provide you with a bag containing towel, slippers, toothbrush and pyjamas. Capsules are extremely modern and spacious and more comfortable than expected! View from rest area onto Shinjuku is an added bonus on top of the central location.","London, United Kingdom","FranchiT97</div><div class=""userLoc""><strong>London, United Kingdom</strong>",0,5.0
