review_id,url,hotel_name,review_date,review_body,user_location,user_name,helpful_vote,rating
689083375,https://www.tripadvisor.com/Hotel_Review-g1066457-d12123803-Reviews-Nine_hours_Shinjuku_North-Shinjuku_Tokyo_Tokyo_Prefecture_Kanto-or65.html?filterLang=en,nine hours Shinjuku-North,"July 12, 2019","Very clean, simple and chic capsule hotel. Smack in the middle of Shinjuku North for shops, Korean restaurants and close to the train station (100m). We enjoyed our stay. Other guests were also very courteous re use of showers, common areas and pod area. Great view of Tokyo too!",Kuala Lumpur,"psychedelicme</div><div class=""userLoc""><strong>Kuala Lumpur</strong>",2,5.0
688728890,https://www.tripadvisor.com/Hotel_Review-g1066457-d12123803-Reviews-Nine_hours_Shinjuku_North-Shinjuku_Tokyo_Tokyo_Prefecture_Kanto-or65.html?filterLang=en,nine hours Shinjuku-North,"July 11, 2019","The pods have plenty of space, the showers and bathrooms are top notch, beautiful lobby with a wonderful view and workplaces, and the best part; it's located in the heart of Shinjuku! The tram station is a block away and is very convenient if you wanna go for sightseeing!By the time I arrived here I made plenty of new contacts from all around the world! If you like being social and meeting people and travel, this is definetly the place!PS; They hand you out uniform-looking pajamas, giving you a serious Maze Runner feel to the place! Especially with all the modern and minimalistic interior! ",,Benjamin J,0,5.0
688575132,https://www.tripadvisor.com/Hotel_Review-g1066457-d12123803-Reviews-Nine_hours_Shinjuku_North-Shinjuku_Tokyo_Tokyo_Prefecture_Kanto-or65.html?filterLang=en,nine hours Shinjuku-North,"July 10, 2019","As someone who was new to the idea of a ""capsule hotel,"" 9 Hours turns the mystique of the capsule hotel and turns it into a real experience. The minute you step foot into the atrium, you are transported to the future. The staff are incredibly friendly, the space supremely clean, and the accommodations hyper futuristic. The capsules themselves are like little space ships and are spacious and comfortable. The daily check in/check out requirements make multi-day stays a bit annoying, and the pods could use more than 1 outlet which is the only reason this review is a 4 instead of a 5. Highly recommend.","Washington DC, District of Columbia","nblackley</div><div class=""userLoc""><strong>Washington DC, District of Columbia</strong>",0,4.0
687957185,https://www.tripadvisor.com/Hotel_Review-g1066457-d12123803-Reviews-Nine_hours_Shinjuku_North-Shinjuku_Tokyo_Tokyo_Prefecture_Kanto-or65.html?filterLang=en,nine hours Shinjuku-North,"July 8, 2019","The people who work in the reception need to be able to communicate the rules properly. We went to the reception before 10am and asked several times if it was ok to come back after breakfast to take a shower and use our lockers. This was not going to be a problem. When we got back 10.30 we were told that we could neither use our lockers or the showers. Confusing. After a discussion with another person who worked there, we finally got to take a shower. ",,JakobM541,0,2.0
687615448,https://www.tripadvisor.com/Hotel_Review-g1066457-d12123803-Reviews-Nine_hours_Shinjuku_North-Shinjuku_Tokyo_Tokyo_Prefecture_Kanto-or70.html?filterLang=en,nine hours Shinjuku-North,"July 7, 2019","Best hostel experience I've had. Simple place but modern and they supply you with what you need: towels, pyjamas and a locker. The ambience is set at a level which keeps everyone quiet and respectful of others. Free Wi-Fi and power socket and covers in your pod. The only downside is you have to check in and check out each day (but you can keep your stuff in your locker), having to pay each day and get new pyjamas and towels. This means leaving the rooms/locker area/washrooms between 10am and 1pm.",,BlobC2394,0,4.0
687553994,https://www.tripadvisor.com/Hotel_Review-g1066457-d12123803-Reviews-Nine_hours_Shinjuku_North-Shinjuku_Tokyo_Tokyo_Prefecture_Kanto-or70.html?filterLang=en,nine hours Shinjuku-North,"July 7, 2019",You need to get used to the system. It is a clean place and bathroom facilities are clean and comfortable but you need to plan how to make use of themConsidering that you need to go up and down the floors and have the luggage not comfortable to reach,"Tirana, Albania","Luaj99</div><div class=""userLoc""><strong>Tirana, Albania</strong>",28,3.0
687329854,https://www.tripadvisor.com/Hotel_Review-g1066457-d12123803-Reviews-Nine_hours_Shinjuku_North-Shinjuku_Tokyo_Tokyo_Prefecture_Kanto-or70.html?filterLang=en,nine hours Shinjuku-North,"July 6, 2019","This is a must do for Tokyo. The whole facility, from the incredible 8th floor view, to the otherworldly toilets, was extremely slick. The capsles themselves were cozy and well temperature control led.",,cadajohnson,0,5.0
687037960,https://www.tripadvisor.com/Hotel_Review-g1066457-d12123803-Reviews-Nine_hours_Shinjuku_North-Shinjuku_Tokyo_Tokyo_Prefecture_Kanto-or70.html?filterLang=en,nine hours Shinjuku-North,"July 5, 2019","Nine Hours Shinjuku-North is conveniently located a few meters away from the Shin-Okubo Metro Station (no elevator/escalator). The area around Nine Hours can get really busy during the day but it was peaceful inside the hotel. The front desk and common area is at the 8th floor. The Women's lockers/sleeping pods/toilets are on the 5th to 6th floor while shower rooms and other toilet cubicles are on the 7th floor. I stayed for 3 nights to try it out. Check in is at 1PM and required daily check out at 10AM. Although daily check out before 10AM is required, luggage can be left stored in the same locker when staying for more than 1 night. The front desk officer will give you another card with QR everyday when you check in and a mesh bag of amenities: pajama, slippers, towels, and toothbrush. Shampoo, conditioner, and body wash are available inside each shower cubicle. Hair dryer and hand/facial tissues available near the sink in the middle. Sleeping pods are in another room. The sleeping pod is roomy with one electrical outlet inside. I felt hot inside but I had a handheld fan with me so it was all good.Overall, it was a good experience. ","Manila, Philippines","MissKellyG</div><div class=""userLoc""><strong>Manila, Philippines</strong>",26,4.0
686849668,https://www.tripadvisor.com/Hotel_Review-g1066457-d12123803-Reviews-Nine_hours_Shinjuku_North-Shinjuku_Tokyo_Tokyo_Prefecture_Kanto-or70.html?filterLang=en,nine hours Shinjuku-North,"July 4, 2019","Unique and unforgettable experience. The staff is very polite and friendly. The cleanliness of the washrooms, bathrooms and pod is extremely good. A must have experience when in Tokyo. Location - centrally located near to a public transport hub and easily accessible to reach all Tokyo attractions. ",,tutonn,0,5.0
685873572,https://www.tripadvisor.com/Hotel_Review-g1066457-d12123803-Reviews-Nine_hours_Shinjuku_North-Shinjuku_Tokyo_Tokyo_Prefecture_Kanto-or75.html?filterLang=en,nine hours Shinjuku-North,"July 1, 2019","9 Hours is conceptually brilliant! it's the future of hotels w/ its minimalist aesthetic and super-friendly staff. You'll feel as if you're part of the Starship Enterprise in your pyjamas (daily you'll be given fresh pyjamas, towels, toothbrush/paste). The pods are very comfy and minutes away from the Yamanote Line. Highly recommended.","Canberra, Australia","jeanpaullorenzen</div><div class=""userLoc""><strong>Canberra, Australia</strong>",0,5.0
685115145,https://www.tripadvisor.com/Hotel_Review-g1066457-d12123803-Reviews-Nine_hours_Shinjuku_North-Shinjuku_Tokyo_Tokyo_Prefecture_Kanto-or75.html?filterLang=en,nine hours Shinjuku-North,"June 28, 2019","Had a great stay, very clean and spacious. We felt very safe here. We really loved the pods, they where perfect for what we needed. The view from the sitting area is fantastic and you are close to many restaurants and karaoke bars. ",Davistown,"Alli M</div><div class=""userLoc""><strong>Davistown</strong>",9,5.0
685072307,https://www.tripadvisor.com/Hotel_Review-g1066457-d12123803-Reviews-Nine_hours_Shinjuku_North-Shinjuku_Tokyo_Tokyo_Prefecture_Kanto-or75.html?filterLang=en,nine hours Shinjuku-North,"June 28, 2019","My stay at this capsule hotel was beyond my expectations. The simplistic and minimalistic aesthetic is breathtaking. Service is top knotch with easy check in and check out. The way the capsule hotel operates is very efficient and effective. The living quarters was also bigger and more comfortable than imagined. Air conditioning was sufficiently cooled throughout the building and in the capsule being on the bottom capsule. The locker system is very smart and effective. Washrooms are also mind blowing and very clean. The toilets are amazing. From the lounge to the shower floor to the living quarters every detail is clean, refined, and well thought out. Early luggage drop off before check in is also very convenient. I would definitely stay again another time. Thank you so much Nine hours for a wonderful stay!",,Mlatosa,0,5.0
685072182,https://www.tripadvisor.com/Hotel_Review-g1066457-d12123803-Reviews-Nine_hours_Shinjuku_North-Shinjuku_Tokyo_Tokyo_Prefecture_Kanto-or75.html?filterLang=en,nine hours Shinjuku-North,"June 28, 2019","The stay was amazing. The staff was very accommodating and it was an awesome experience. Upon check in you receive a bag with amenities for your stay such as towels, toothbrush, slippers and pyjamas. The sleeping pods were very futuristic and quite spacious. I recommend it for the experience and for excellent value for the money.","Toronto, Canada","Sharmaine A</div><div class=""userLoc""><strong>Toronto, Canada</strong>",0,5.0
685072088,https://www.tripadvisor.com/Hotel_Review-g1066457-d12123803-Reviews-Nine_hours_Shinjuku_North-Shinjuku_Tokyo_Tokyo_Prefecture_Kanto-or75.html?filterLang=en,nine hours Shinjuku-North,"June 28, 2019",The stay at the place is amazing with the cool bedding area and overall clean and relaxing interior decoration. Many amenities were provided to me for a very relax and easy stay. It was a wonderful experience and I will definitely come back again in future visit to Japan.,,Picajames,0,5.0
685071692,https://www.tripadvisor.com/Hotel_Review-g1066457-d12123803-Reviews-Nine_hours_Shinjuku_North-Shinjuku_Tokyo_Tokyo_Prefecture_Kanto-or80.html?filterLang=en,nine hours Shinjuku-North,"June 28, 2019","Staying at this capsule hotel was an amazing experience! I was scared the sleeping pod would be tight and make me feel claustrophobic, but there was plenty of space and looked so nice! It was a little bit hot in the pod for my liking, but once I fell asleep it was no problem. I also noticed that the walls were not sound proof, but it didn't bother me. Everything was so clean and aesthetically pleasing. The toilet seats automatically flip open when you enter the washroom which amazed me. The service was wonderful as well. There is a lounge area which is very spacious and also very relaxing. I would definitely recommend.","Oshawa, Canada","AJ S</div><div class=""userLoc""><strong>Oshawa, Canada</strong>",0,5.0
685071218,https://www.tripadvisor.com/Hotel_Review-g1066457-d12123803-Reviews-Nine_hours_Shinjuku_North-Shinjuku_Tokyo_Tokyo_Prefecture_Kanto-or80.html?filterLang=en,nine hours Shinjuku-North,"June 28, 2019","9 Hours in Shinjuku was a one of a kind experience. It feels very futuristic in its simplistic look and decor, yet still relaxing and comfortable. The staff is very friendly and the hotel provides you with a small bag of amenities should you be too lazy to unpack your own after putting it away in your own QR code locker. As for my rest, I found the sleeping pods were very comfortable and spacious, so no claustrophobia from me. I came with a group of 3 women and 2 men, and although floor arrangements are separated into genders, the reception floor also doubles as a lounge which was great for us to meet up. Not to mention the view from the 8th floor of the northern Shinjuku area was stunning. Overall I had a charming experience and I would highly recommend for a one night stay.","Toronto, Canada","FloonTrips4Days</div><div class=""userLoc""><strong>Toronto, Canada</strong>",0,5.0
684438454,https://www.tripadvisor.com/Hotel_Review-g1066457-d12123803-Reviews-Nine_hours_Shinjuku_North-Shinjuku_Tokyo_Tokyo_Prefecture_Kanto-or80.html?filterLang=en,nine hours Shinjuku-North,"June 26, 2019","So first off, the capsule hotel is really a unique experience. When you first step in it looks really cool, however for myself I wish I’d have left after the first 5 minutes. The capsules seem to amplify the noise by there shape and position, also the fact that they are plastic probably doesn’t help. It honestly felt like staying in a dormitory with 100 roommates. For some reason the floor got really busy around midnight with somebody coming in or leaving every 5 minutes. I’m not sure if it’s the fact that you can hear everything so well or that I was particularly unlucky with my roommates for the night, but at 2 am I had to ask someone to turn to sound of on their phone as they were playing a game. Of course the hotel is not at fault for the behavior of its guests, but it seems to me that they attract certain behavior by allowing 24h check in and by not making the capsules noise proof. Other than the pair of pajamas you get and the capsule itself the hotel offers nothing special, the capsules are not equipped with anything special and the common space has nothing that makes you want to hang out there (which is probably why people are playing games in their pods) breakfast is at a nearby diner. All in all the experience is cool but I’ll definitely never stay at 9h again.O they also give a gift to anyone who shows them they leave a review on TripAdvisor, so expect reviews to be biased. ","Amsterdam, The Netherlands","chloe_bos</div><div class=""userLoc""><strong>Amsterdam, The Netherlands</strong>",4,1.0
684388049,https://www.tripadvisor.com/Hotel_Review-g1066457-d12123803-Reviews-Nine_hours_Shinjuku_North-Shinjuku_Tokyo_Tokyo_Prefecture_Kanto-or80.html?filterLang=en,nine hours Shinjuku-North,"June 25, 2019","This is a good place to sleep. If you are by yourself, this place is good. It's not sound proof. If you're a big snorer or there are other people that snore, you can hear everything. One thing I did not like is that you need to check out every day by 10am. You can go back to your capsule at 1pm. I guess they don't want you to be in there while they clean up. You can keep your things in the locker that they provide you with if you're staying for multiple nights. Hotel is located in Korean Town. So good food is all around. ",,amenfire,0,4.0
683540239,https://www.tripadvisor.com/Hotel_Review-g1066457-d12123803-Reviews-Nine_hours_Shinjuku_North-Shinjuku_Tokyo_Tokyo_Prefecture_Kanto-or80.html?filterLang=en,nine hours Shinjuku-North,"June 22, 2019","Amazing stay! will come back always. it was so clean and so futuristic, literally instagram worthy and worth every penny. We stayed for one night and wanted to immediately stay for longer! the experience is a MUST if in Japan. ","Shinjuku, Japan","951tiffanyn</div><div class=""userLoc""><strong>Shinjuku, Japan</strong>",0,5.0
683018136,https://www.tripadvisor.com/Hotel_Review-g1066457-d12123803-Reviews-Nine_hours_Shinjuku_North-Shinjuku_Tokyo_Tokyo_Prefecture_Kanto-or85.html?filterLang=en,nine hours Shinjuku-North,"June 20, 2019","Overall a great experience, showers and locker area are very clean and sleeping room was cool and quiet. Closest station is a short 200m walk away and a supermarket is located also just a block away. Free fast wi-fi available throughout the building. Highly recommended.",,Aaron2019-1,0,5.0
682294359,https://www.tripadvisor.com/Hotel_Review-g1066457-d12123803-Reviews-Nine_hours_Shinjuku_North-Shinjuku_Tokyo_Tokyo_Prefecture_Kanto-or85.html?filterLang=en,nine hours Shinjuku-North,"June 17, 2019","I stayed at the capsule just to try it (when in Japan!!!) and i was not disappointed! really amazing experience, really clean facilities and nice people who work there. i slept so well, bed was so comfy and for the price i will 1000% be staying here again!!! what an experience!!!",,Gabby G,0,5.0
681556232,https://www.tripadvisor.com/Hotel_Review-g1066457-d12123803-Reviews-Nine_hours_Shinjuku_North-Shinjuku_Tokyo_Tokyo_Prefecture_Kanto-or85.html?filterLang=en,nine hours Shinjuku-North,"June 14, 2019","This 9hours capsule hotel in Shinjuku-North is modern, clean and gives you a smooth, no-nonsense travel experience. Great value for money. You just gotto love the capsule concept, consider it an upscale hostel with more privacy ;)","Brussels, Belgium","810rubenl</div><div class=""userLoc""><strong>Brussels, Belgium</strong>",5,4.0
681186677,https://www.tripadvisor.com/Hotel_Review-g1066457-d12123803-Reviews-Nine_hours_Shinjuku_North-Shinjuku_Tokyo_Tokyo_Prefecture_Kanto-or85.html?filterLang=en,nine hours Shinjuku-North,"June 13, 2019","Have stayed at this hotel twice and will be back. I looked everywhere for cheap accommodation in the Shinjuku area and this was the best. Has all amenities, secure luggage storage, friendly staff and is only a two minute walk from the train station. There’s always plenty of hot water and room for my luggage. Will be back.","Greater Sydney, Australia","allyssa j</div><div class=""userLoc""><strong>Greater Sydney, Australia</strong>",0,4.0
680896360,https://www.tripadvisor.com/Hotel_Review-g1066457-d12123803-Reviews-Nine_hours_Shinjuku_North-Shinjuku_Tokyo_Tokyo_Prefecture_Kanto-or85.html?filterLang=en,nine hours Shinjuku-North,"June 11, 2019","Facility is clean and very near the shopping area and major train stations. Whats best is very near Don Quijote, Ichiran, Ramen Nagi and the famous Gracery Hotel with Godzilla Head. Totally Instagramable!! Highly recommended!",,Wanderwoman06,0,5.0
680895431,https://www.tripadvisor.com/Hotel_Review-g1066457-d12123803-Reviews-Nine_hours_Shinjuku_North-Shinjuku_Tokyo_Tokyo_Prefecture_Kanto-or90.html?filterLang=en,nine hours Shinjuku-North,"June 11, 2019","Nice place and convenient we will come back and return to this place, we will recommend this place to our friends in manila philippines.worth value and worth money for travellers like us, please try this place in shinjuku",,Roam457075,0,5.0
680851781,https://www.tripadvisor.com/Hotel_Review-g1066457-d12123803-Reviews-Nine_hours_Shinjuku_North-Shinjuku_Tokyo_Tokyo_Prefecture_Kanto-or90.html?filterLang=en,nine hours Shinjuku-North,"June 11, 2019","This is the least but best you can get from a hotel: a perfect bed and shower. Most comfortable bed and best shower I have ever experienced in hotels, although the downsides are no door for your spacious capsule so people might not be the most considerate at all times. Also I missed my partner who was staying in male dormitory :)) also I personally prefer to sleep in a place where there is a small window BUT this is capsule hotel and it’s really good for what it is. Reasonable pricing and good access around.","Edinburgh, United Kingdom","Pantea A</div><div class=""userLoc""><strong>Edinburgh, United Kingdom</strong>",0,4.0
680635238,https://www.tripadvisor.com/Hotel_Review-g1066457-d12123803-Reviews-Nine_hours_Shinjuku_North-Shinjuku_Tokyo_Tokyo_Prefecture_Kanto-or90.html?filterLang=en,nine hours Shinjuku-North,"June 10, 2019","This is my second trip to Japan and I did try quite a few different capsule hotels. This one is still my favourite! The super stylish concept of the 9 hours brand is great, the place always clean and the check-in/check-out is smooth. I tried the Akasaka branch too, but Shinjuku North is way better: more space, bigger lockers, more showers and a beautiful lobby with amazing Skyline views of Tokyo. I love to work in the little cubicles, that also double as a sort of coworking space.Can totally recommend!",,tim-11-1986,2,5.0
680623501,https://www.tripadvisor.com/Hotel_Review-g1066457-d12123803-Reviews-Nine_hours_Shinjuku_North-Shinjuku_Tokyo_Tokyo_Prefecture_Kanto-or90.html?filterLang=en,nine hours Shinjuku-North,"June 10, 2019","This was my first time at a capsule-style hotel,would definitely stay here again. The hotel included everything you need for a night: toothbrush and paste, plush towels, slippers, even pajamas. The entire place is very clean and updated. There is a common area with floor to ceiling windows where you can eat or just look at the city scape. Capsule sleeping pods provide a decent amount of privacy. My only complaint is that the airflow in the capsule is minimal. In the middle of the night the air felt sort of stale. I had to open up the privacy shade and sleep with my pod open for ventilation. ","Provo, Utah","kfisher07</div><div class=""userLoc""><strong>Provo, Utah</strong>",0,5.0
680171773,https://www.tripadvisor.com/Hotel_Review-g1066457-d12123803-Reviews-Nine_hours_Shinjuku_North-Shinjuku_Tokyo_Tokyo_Prefecture_Kanto-or90.html?filterLang=en,nine hours Shinjuku-North,"June 9, 2019","I would recommend this hotel to people who are traveling to Tokyo on a budget. It is affordable and very clean. The hotel provides pjs and slippers for you to wear. They also provide towels, tooth brush and soap, shampoo, and conditioner for the shower. The showers are large and private. They're clean too. The sleeping room is dark and quiet. There are no doors on the pods though - only a curtain that comes down to cover your pod door so you have privacy. I suggest bringing ear plugs because sometimes guests bring their large roll on suitcases into the sleeping quarters which can wake you up. There are lockers that you can keep your stuff in though. The pod has a light and plug to charge your phone in it. The bed is very comfortable and the blanket is warm. I think it is a cool experience to stay at a hotel like this and suggest you try it out when in Japan! The front desk staff were friendly and spoke some English. The hotel is located a block from the JR train station.","New York City, New York","maurandmaur</div><div class=""userLoc""><strong>New York City, New York</strong>",25,4.0
674882451,https://www.tripadvisor.com/Hotel_Review-g1066457-d12123803-Reviews-Nine_hours_Shinjuku_North-Shinjuku_Tokyo_Tokyo_Prefecture_Kanto-or95.html?filterLang=en,nine hours Shinjuku-North,"May 18, 2019","My wife and I stayed here for one night more for the experience than for any other reason. The ""hotel"" is extremely clean and well organised and gave a good first impression. On arrival you are issued a card for access to your locker which houses a bag containing pyjamas, slippers, towel, tooth brush and tooth paste (everything you could need). The lockers are massive and easily fit 2 large backpacks with space to spare (This was one of our concerns before arriving). The common room is clean and tidy and has space for you to charge electronics or work on a laptop, it also has a nice view of Shinjuku. From the reception / common area you go down either the male or female lift to get to the segregated sleeping and washing areas. The washing areas have around (and this is a guess) 12 showers and 10 toilets with basins and mirrors down the center, and at no point were there any queues with what looked like a full house. The sleeping area is very space age and looked great in my eyes. The beds are large enough that you can easily sit up and move around and they have charging points a couple of small shelves and a pull down blind. I got a good night's sleep but was awoken early morning by someone nearby having a bad dream and making some strange noises, but other than that it was reasonably quiet to say how many people were in the room together. Overall it was a good experience and at a good price so i would recommend it to anyone who is used to sleeping in hostels / refuges / bunk rooms etc. ","Leeds, United Kingdom","Blyth D</div><div class=""userLoc""><strong>Leeds, United Kingdom</strong>",9,5.0
674047638,https://www.tripadvisor.com/Hotel_Review-g1066457-d12123803-Reviews-Nine_hours_Shinjuku_North-Shinjuku_Tokyo_Tokyo_Prefecture_Kanto-or95.html?filterLang=en,nine hours Shinjuku-North,"May 14, 2019","It was in my list for Japan to experience while here.Reception in 8th floorSeparate elevators to male and female floors. Keycard to locker, which holds a bag with towels, slippers, PJ’s and toothbrush. Shower clean and large enough to put your stuff out and get changed.Location: great near stationJoined area: great views, sit area you can relax.Breakfast is not in same location but a 5’ walkIf you stay more than 1 night you will daily have to check out and in","Bergen op Zoom, The Netherlands","NL_DINKS</div><div class=""userLoc""><strong>Bergen op Zoom, The Netherlands</strong>",41,4.0
673567539,https://www.tripadvisor.com/Hotel_Review-g1066457-d12123803-Reviews-Nine_hours_Shinjuku_North-Shinjuku_Tokyo_Tokyo_Prefecture_Kanto-or95.html?filterLang=en,nine hours Shinjuku-North,"May 12, 2019","Spent two nights at the this capsule hotel. Immaculately clean. Friendly helpful staff. Excellent location 5 minutes from the JR Yamanote line, easy transfer from Haneda airport and great for Shinjuku and Shibuya.Capsule was bigger than it looks in pictures, mattress firm partner thought it was too warm I was happy with the temperature. Would I stay again yes , however for no more than.2 nights as there is no natural light until you go to reception area, which is large and airy. ","Wisbech, United Kingdom","annie1961955</div><div class=""userLoc""><strong>Wisbech, United Kingdom</strong>",6,4.0
