review_id,url,hotel_name,review_date,review_body,user_location,user_name,helpful_vote,rating
606183775,https://www.tripadvisor.com/Hotel_Review-g60982-d87097-Reviews-Royal_Grove_Waikiki-Honolulu_Oahu_Hawaii-or60.html?filterLang=en,Royal Grove Waikiki,"August 13, 2018","Stayed 7 8 nights in June, our first time here but not the last. Spent most mornings at the Waikiki beach and explored by bus in the afternoon. The bus is 50 metres and the beach 5minutes. We had a room above the Korean BBQ, small kitchen spare bed no balcony or a/con. Great value booked direct on hotel website , good discount for 7 days or more. Nice pool, friendly people from all over the world.","Cape Paterson, Australia","John L</div><div class=""userLoc""><strong>Cape Paterson, Australia</strong>",85,5.0
601359098,https://www.tripadvisor.com/Hotel_Review-g60982-d87097-Reviews-Royal_Grove_Waikiki-Honolulu_Oahu_Hawaii-or60.html?filterLang=en,Royal Grove Waikiki,"July 31, 2018",The royal grove is an awesome old school hotel tucked away surrounded by modern plastic apartment buildings and hotels. If you want the real Waikiki of days gone past oozing with aloha spirit and genuinely friendly staff - this is the place for you!Just one block back from the beach with its own fresh water pool and clean yet simple family rooms with multiple bedrooms for parents and kids to all have their own space and full kitchen facilities and huge fridge - it’s awesome!Very highly recommended for people wanting to experience the genuine Hawaii of times gone past! And you won’t beat the awesome value either! Mahalo!,"Wellington, New Zealand","Kiwi_iwiK</div><div class=""userLoc""><strong>Wellington, New Zealand</strong>",32,5.0
590108134,https://www.tripadvisor.com/Hotel_Review-g60982-d87097-Reviews-Royal_Grove_Waikiki-Honolulu_Oahu_Hawaii-or60.html?filterLang=en,Royal Grove Waikiki,"June 23, 2018","I stayed at this cozy hotel for the 3rd time last April 2018.I really enjoy its Hawaiian atmosphere !It is old but well maintained and clean. Just 1 1/2 block walk to Waikiki Beach.Walking distance to many restaurants, stores, food trucks, Market, malls. You name it !My room was really large with 2 lanais (balconies), one double bed and one single bed. The kitchen has everything one needs to prepare meals.The bathroom is good with a nice shower.No wi-fi in the room, only at the Front Desk area where the living room is. That´s where you mingle with other guests !!! I love it !There is a laundry for guests to use for a minimal fee. Very convenient.The Front Desk staff is absolutely wonderful, friendly, smiling, helpful (they do go beyond the limit) Thank you Debbie, Donna and Karen !If you stay a minimum of 7 nights there is a special rate. You can only book your room through its website.Most guests keep coming for decades !!! For me, it is a home away from home, indeed !Once a week the owner gives an evening party for the guests. He has a band and some hula dancers perform and teach the guests how to dance.it. I never miss it ! Thanks Caroline !If you want to stay in a nice place but not paying a fortune, that´s the place for you.Location and rates are unbeatable.I will definitely be back !!",Brazil,"Alohanuiloa</div><div class=""userLoc""><strong>Brazil</strong>",78,5.0
582297222,https://www.tripadvisor.com/Hotel_Review-g60982-d87097-Reviews-Royal_Grove_Waikiki-Honolulu_Oahu_Hawaii-or60.html?filterLang=en,Royal Grove Waikiki,"May 23, 2018","As everyone knows,I love the Waikiki Prince, but eith them still not reopen,I stayed at the royal grove this year.I hate to not be loyal but I liked this one just a bit better. Full size appliances in kitchen,full size coffeemaker,laundry more convient. The only draw back was no WiFi in arms. Also 24/7 front desk. Same price.","houston,tx","yugogirlr</div><div class=""userLoc""><strong>houston,tx</strong>",10,4.0
581513789,https://www.tripadvisor.com/Hotel_Review-g60982-d87097-Reviews-Royal_Grove_Waikiki-Honolulu_Oahu_Hawaii-or60.html?filterLang=en,Royal Grove Waikiki,"May 20, 2018","Love this hotel. Four wonderful factors:a) Fun, family-oriented and authentic (Monday nights are such fun!)b) Location to Kuhio Beach -- just two blocks/five minutesc) Amenities -- comes with kitchenette and refrigerator, which is great since the only grocery store in all of Waikiki is only about a 7-minute walk from the hotel and we love to purchase fresh pineapple, breakfast foods, and salads to enjoy at our convenienced) Fantastic rates, particularly when you stay for a week or longer.Plus they have beach chairs, umbrellas and such you can borrow. We often pick up dinner to go at the delicious take-out place next door and bring it back up to the room/patio to enjoy. There's internet in the main lobby (but honestly I enjoy mostly being away from that when on vacation). Finally, with the great location it's a short walk to many wonderful places in Waikiki Beach, including the Starbucks Reserve (maybe 10 strolling minutes away)!Love coming here!",,JeanetteN264,4,5.0
578833111,https://www.tripadvisor.com/Hotel_Review-g60982-d87097-Reviews-Royal_Grove_Waikiki-Honolulu_Oahu_Hawaii-or65.html?filterLang=en,Royal Grove Waikiki,"May 8, 2018","I rented a class 3 room as I figured I would only be there for sleeping. Good room, the rates are a bonus and the bed were comfortable. I did spend more time in the room in the evenings \, very nice experience. I will be going back this August for 10 days in the class 3 rooms. Easy access to the Bus and all of the good places to eat. I had a late evening flight and they allowed me to check out late with no extra cost. The staff is great. I really loved the 60's feel",,Glenn B,6,4.0
578423039,https://www.tripadvisor.com/Hotel_Review-g60982-d87097-Reviews-Royal_Grove_Waikiki-Honolulu_Oahu_Hawaii-or65.html?filterLang=en,Royal Grove Waikiki,"May 6, 2018",My wife and I have travelled widely for a great many years and shortly will be staying for the 5th or 6th time at our Pink Palace  It is and has been over the years the hi light of our travels——the whole experience is a delight.Thank you Royal Grove and staff——also fellow guests  Allen Moore,Newcastle,"Destination809638</div><div class=""userLoc""><strong>Newcastle</strong>",7,5.0
576662795,https://www.tripadvisor.com/Hotel_Review-g60982-d87097-Reviews-Royal_Grove_Waikiki-Honolulu_Oahu_Hawaii-or65.html?filterLang=en,Royal Grove Waikiki,"April 29, 2018","We last stayed at the Royal Grove in April, 2016 (reviewed it at the time). Returning earlier this month (for one week) was like coming home. The Royal Grove, in our view, is still the best deal in Honolulu--the prices haven't changed since we were last there and the rooms are just as clean and neat as we left them two years ago.Part of that is has to do with their clientele, who tend to be older and not inclined to partying. And part of it is because of the exceptional housekeeping service by people like Besita, who, like everything else at the Royal Grove, is reliable, dependable, and always courteous to guests who need an extra bar of soap or roll of toilet paper! We were lucky to have the same room we had during our original visit in 2016--Room 506--and it was just as neat and clean this time around. The lanai (patio) still provides both great tropical bird sightings and views of Waikiki (both street side and ocean). Now for a reality check re: amenities: There are few. And the bathroom is small--very small. There is no fan, so the humidity tends to build-up and leave clothing hung in the adjacent closet a bit damp. The bathroom fixtures are small--do not expect a huge shower (although since we were last there, they have installed a handheld shower head which is convenient for those want to shampoo their hair or just rinse off sand) or sink area. Water pressure leaves a bit to be desired--but given there are probably close to 100,000 people showering every morning in the hotels that line Waikiki, that may be more typical than specific to the Royal Grove. The beds were basic, but comfortable And the kitchenette is great for dining in after shopping at the nearby Farmer's Market (M-W-F-Sat, 4-9 p.m.) or grabbing carry-out from one of the many neighborhood eateries.The air conditioner tended to shut off automatically, which was a bit of a problem because noisy garbage trucks roll down Waikiki around 6:30 a.m., and without any white noise to block out the trucks--well, consider the garbage caravan your alarm clock and make the most of the day! For whatever amenities it may lack,The Royal Grove more than makes up with vintage charm, a quirky personality, and extremely budget-friendly prices.","Nashville, Tennessee","tennesseetraveler58</div><div class=""userLoc""><strong>Nashville, Tennessee</strong>",50,4.0
576360980,https://www.tripadvisor.com/Hotel_Review-g60982-d87097-Reviews-Royal_Grove_Waikiki-Honolulu_Oahu_Hawaii-or65.html?filterLang=en,Royal Grove Waikiki,"April 28, 2018","We stayed at the Royal Grove for the first time in April 2018.There were no surprises, and we knew what we were signing up for before booking a room there.As others have said, it is vintage 60's/70's in decor, and we were okay about that.The location is excellent, 2 blocks to the beach, with many dining and shopping options close by. We had a street facing room on the 5th floor with an L shaped balcony that had a large table and 2 chairs. We used it every day to have coffee in the morning and a cold drink at night to review our day. It had a view all the way down to the beach. We are city people, and live downtown, so street noise is not a big deal for us. The air conditioner was loud though. It did keep the room comfortable for sleeping.There was a kitchenette, with large fridge and utensils that we used several times. The pool area is convenient, and even the pool itself was perfect to cool off as you sun yourself in one of the many seats around the pool.Wi-fi is available, but only in the lobby/pool area. I do wish it was usable in the room.The only real negative is no room safe. They use an archaic bank safety deposit box which doesn't hold much. So I had to take my expensive camera with me most of the time, even when I didn't want to.The staff were very friendly, and helpful. Other hotels could learn a great deal from them about customer service.Best of all, no resort fees.We would stay at the Royal Grove when we return to Waikiki without any hesitation.","Vancouver, Canada","trevanorak</div><div class=""userLoc""><strong>Vancouver, Canada</strong>",4,4.0
570268765,https://www.tripadvisor.com/Hotel_Review-g60982-d87097-Reviews-Royal_Grove_Waikiki-Honolulu_Oahu_Hawaii-or65.html?filterLang=en,Royal Grove Waikiki,"April 1, 2018","We didn't want generic, tower block, I could be anywhere in the world accommodation. We wanted Waikiki or what's left of it and here it is. The salmon pink building is straight out of the 50s/60s. The hotel lobby is cluttered with artefacts from another era, like my old Nan's sitting room. The welcome's personal, we're treated like old friends although it's our first time there. The room's a good size with a kitchenette, oversized fridge and a slightly cramped bathroom. It's 70s/80s decoration. We've got a balcony (lannai) with a table and 2 chairs. It's looks down on the pool and other guests sunning it. The bed's a bit small but comfortable. It's a 50 metre walk to Waikiki beach. There's a Mexican cantina on the corner, a Japanese eat-in/ takeaway opposite, a Korean next door and a Poke place on the corner. The Bus can be caught 50 metres away on Kuhio St. All this and it's about A$100 a night. Oh and the Monday night performance including hula dancing is a bonus.",Adelaide,"MrThrill</div><div class=""userLoc""><strong>Adelaide</strong>",56,5.0
