review_id,url,hotel_name,review_date,review_body,user_location,user_name,helpful_vote,rating
716485392,https://www.tripadvisor.com/Hotel_Review-g60982-d87097-Reviews-Royal_Grove_Waikiki-Honolulu_Oahu_Hawaii-or30.html?filterLang=en,Royal Grove Waikiki,"October 8, 2019","I recommend this reasonable priced hotel, to customers looking for a great location, with kitchens, air conditioning, and a lovely Hawaiian musical program. Staff was great, room was clean, and it was reasonably priced. Mr. Fong, the owner, & his son were also in attendance at the Hawaiian program. I'll return again. ",,Daydream698717,0,5.0
713686038,https://www.tripadvisor.com/Hotel_Review-g60982-d87097-Reviews-Royal_Grove_Waikiki-Honolulu_Oahu_Hawaii-or30.html?filterLang=en,Royal Grove Waikiki,"September 28, 2019","The hotel changed price after I arrived. Also, I only could use wifi at the front. I expected that I can use wifi from room. I didn't get any bad experiences besides those two. I'm not sure that I'm going to use this hotel next time though.",,ushiro3123,0,2.0
712930641,https://www.tripadvisor.com/Hotel_Review-g60982-d87097-Reviews-Royal_Grove_Waikiki-Honolulu_Oahu_Hawaii-or30.html?filterLang=en,Royal Grove Waikiki,"September 25, 2019","We only stayed one night due to a special event in Honolulu. The room met our needs - a place to sleep and an effective air conditioner. It is definitely an older property, and paint and bathroom grout could use a freshening. Still for the price, it was OK.",,McTamara,40,3.0
712768937,https://www.tripadvisor.com/Hotel_Review-g60982-d87097-Reviews-Royal_Grove_Waikiki-Honolulu_Oahu_Hawaii-or35.html?filterLang=en,Royal Grove Waikiki,"September 24, 2019",everything was fine it served our purpose for our stay it seamed to be close to everything the room was all it needed to be slept fine was quiet internet worked fine as good as at home maybe even faster thank you ,,johnklinker2,0,3.0
712699376,https://www.tripadvisor.com/Hotel_Review-g60982-d87097-Reviews-Royal_Grove_Waikiki-Honolulu_Oahu_Hawaii-or35.html?filterLang=en,Royal Grove Waikiki,"September 24, 2019","Rooms aren’t amazing and a lot is in the original state, which is cute. But it’s much cheaper than other hotels so you get what you pay for. It’s clean just a bit run down. We would recommend staying for sure though if your not worried about old/dated rooms as the position and price is great. The pool is an oval simple one and missing tiles but they have boogie boards, chairs, balls etc to use for the pool/beach",,Guide558960,0,4.0
706942251,https://www.tripadvisor.com/Hotel_Review-g60982-d87097-Reviews-Royal_Grove_Waikiki-Honolulu_Oahu_Hawaii-or35.html?filterLang=en,Royal Grove Waikiki,"September 5, 2019","This is a 2-star hotel, so don't except too much in the way of service or amenities, but it is good value for money and in a great location. For example there is no restaurant but there are plenty nearby in a wide range of levels.","Auckland, New Zealand","jlawle872199</div><div class=""userLoc""><strong>Auckland, New Zealand</strong>",0,4.0
706921200,https://www.tripadvisor.com/Hotel_Review-g60982-d87097-Reviews-Royal_Grove_Waikiki-Honolulu_Oahu_Hawaii-or35.html?filterLang=en,Royal Grove Waikiki,"September 5, 2019",This Hotel should be shut down as it is completely dirty and run down. Everything in the room was dirty including linen on beds. Hairs in beds. Mildew in bathroom. Kitchen area dirty and cupboards broken. Carpets and floors dirty. Old Bra hanging in closet. So bad that we did not even stay at all. ,"Vancouver, Canada","aprann</div><div class=""userLoc""><strong>Vancouver, Canada</strong>",2,1.0
704629393,https://www.tripadvisor.com/Hotel_Review-g60982-d87097-Reviews-Royal_Grove_Waikiki-Honolulu_Oahu_Hawaii-or35.html?filterLang=en,Royal Grove Waikiki,"August 30, 2019","It is right in the heart of waikiki! Very convenient. Everyone that works at the front desk, especially Brigetta, were super helpful... they would advise you in the best way possible to have a great time on the island. Good price. Value for money. I would definitely book the same place if I would visited waikiki again.. ","Athens, Greece","pennuk2015</div><div class=""userLoc""><strong>Athens, Greece</strong>",34,5.0
704405596,https://www.tripadvisor.com/Hotel_Review-g60982-d87097-Reviews-Royal_Grove_Waikiki-Honolulu_Oahu_Hawaii-or40.html?filterLang=en,Royal Grove Waikiki,"August 29, 2019","While older than some hotels, the amenities were perfectly acceptable. The staff was friendly and responsive. The ability to cook our own meals was a God send! Check with your air carrier about bringing an ice chest (I wish I had known!) because food even at the grocery on the island is more expensive than you'll find at home!","Costa Mesa, California","AuntDiggie</div><div class=""userLoc""><strong>Costa Mesa, California</strong>",8,5.0
704070726,https://www.tripadvisor.com/Hotel_Review-g60982-d87097-Reviews-Royal_Grove_Waikiki-Honolulu_Oahu_Hawaii-or40.html?filterLang=en,Royal Grove Waikiki,"August 28, 2019",Don't expect too much but you will be rewarded for staying. Clean tidy rooms furnishing maybe outdated but comfortable.A great little gem in the middle of Waikiki's towering apartment buildingsLocation perfect walking distance to all Waikiki attractions.,"Newcastle, Australia","clob_16</div><div class=""userLoc""><strong>Newcastle, Australia</strong>",11,4.0
703764474,https://www.tripadvisor.com/Hotel_Review-g60982-d87097-Reviews-Royal_Grove_Waikiki-Honolulu_Oahu_Hawaii-or40.html?filterLang=en,Royal Grove Waikiki,"August 27, 2019","We saw the pictures and reviews before booking this place. We understood it was a lower end hotel. But, upon arriving, it was much worse. First, the room had rust colored mold along the electrical wiring covers (see photos). Second, the locks on the door were a issue. We were handed a physical brass key and the room had three locks on the inside. We had a chain lock, a door knob lock, and a door stopper that we felt the need to secure on the backside. There was two signs in our room, one near the door and one above the bathroom that read ""DO NOT LEAVE ANY VALUABLES IN ROOM SAFE DEPOSIT BOXES AT FRONT DESK"". Which is not inspiring to safety. The bathroom was tiny, without a vanity and a broken toilet. After one use the toilet would not flush and the chain was still attached inside the tank. We then sat down and started looking for a new hotel. When we went downstairs to cancel our reservation, the staff was not phased at all. Which leads me to assume, this happens all the time. Please save your money and book a place that has better accommodations with a key card locking system. Good Luck.",Concord,"RomanOtter</div><div class=""userLoc""><strong>Concord</strong>",1,1.0
699792453,https://www.tripadvisor.com/Hotel_Review-g60982-d87097-Reviews-Royal_Grove_Waikiki-Honolulu_Oahu_Hawaii-or40.html?filterLang=en,Royal Grove Waikiki,"August 16, 2019","If you are looking for new and flash, this is not the hotel. If you are open to the old Hawaii of the 50's and 60's then this place is super cool. Unpretentious and helpful staff. Location is a 2 minute walk to Waikiki Beach. Lots of shops, restaurants within steps. Rooms are not perfect, but they are clean and neat. Overall, for the price this place is Excellent.","Phu Quoc Island, Vietnam","CMiles8</div><div class=""userLoc""><strong>Phu Quoc Island, Vietnam</strong>",3,5.0
696664487,https://www.tripadvisor.com/Hotel_Review-g60982-d87097-Reviews-Royal_Grove_Waikiki-Honolulu_Oahu_Hawaii-or40.html?filterLang=en,Royal Grove Waikiki,"August 7, 2019","The good days of this place are long gone. The rooms are old and disgruntled, you even need a broom stick to secure the window closing. At all times they are warning you to leave nothing even medianly valuable in the room, which is made us feel really unsafe. There is no wifi in the rooms, need to go down to reception to connect. The infrastructure is old, cracks in the wall, cockroaches, etc. It does not have parking facilities, so if you have a car you must spend $30 per day on the parking lot across the street. Beach towels are sparse, VERY slow in coming (mid morning), and at times incomplete (""sorry we just have two, not three""). On the good side, the place is very well located, a block from Waikiki beach, have plenty of beach toys left by other guests (boards, umbrellas, etc.).","Barcelona, Spain","geronimostilton2015</div><div class=""userLoc""><strong>Barcelona, Spain</strong>",6,2.0
694796678,https://www.tripadvisor.com/Hotel_Review-g60982-d87097-Reviews-Royal_Grove_Waikiki-Honolulu_Oahu_Hawaii-or45.html?filterLang=en,Royal Grove Waikiki,"August 1, 2019","Do you want to go to Hawaii and see old vintage Hawaii? This is the place. They have a music night and it isn't paid musicians, it is locals jamming to Hawaiian music. I didn't know any of the music, but it was definitely obvious that they were doing it for the love of their music. You could go anywhere in town and see a paid performance, but it would NOT be the same. I chose to stay here because I was solo traveling so trying to keep costs as low as possible. I chose it for the location. I knew it would NOT be fancy. With that said, it was a place that had a lot of charm. The location is VERY close to the beach. Not just any beach, THE BEACH of beaches. There are restaurants and shopping to cater to all budgets within very close proximity. The place was clean and had charm. The hotel wifi is in the lobby.","Beaverton, Oregon","plezzka L</div><div class=""userLoc""><strong>Beaverton, Oregon</strong>",37,4.0
692256547,https://www.tripadvisor.com/Hotel_Review-g60982-d87097-Reviews-Royal_Grove_Waikiki-Honolulu_Oahu_Hawaii-or45.html?filterLang=en,Royal Grove Waikiki,"July 24, 2019","This is an older building, but the room was very clean and all the utilities worked well. All the staff were very friendly and helpful at any time. Construction works across the road was noisy during the day, but completely outside the hotel’s control - all the more reason to tour the island!","Honolulu, Hawaii","Chris M</div><div class=""userLoc""><strong>Honolulu, Hawaii</strong>",1,3.0
674050113,https://www.tripadvisor.com/Hotel_Review-g60982-d87097-Reviews-Royal_Grove_Waikiki-Honolulu_Oahu_Hawaii-or45.html?filterLang=en,Royal Grove Waikiki,"May 14, 2019","We stayed for 5 nights before our cruise.Barely 5min walk to the beach. ABC on every corner. TRY the BBQ next door. Delicious! Huge shareable portions. Bus on the corner.Everything close by!Small TV in room. Hot water was hit or miss.This is a very dated hotel in need of TLC, but clean, friendly staff.Construction going on in front so bring ear plugs!Bed pretty comfy. Thin sheets and towels.Our room had a new heat/air conditioning which worked very well and no noise.Room had new carpet. Had fridge, microwave, dishes. No dish soap. Housekeeping doesnt do the dishes.No blow dryer.Wifi only at front desk area so a pain as you always have to go down if you just want something quick.Pool missing a lot of tiles, but the water was perfectly clear.Toilet was noisy. Room was cleaned every day.Monday night local musicians play in the foyer. No elevator to our room.We got a ridiculous price for 5 nights so we put up with the quirks!","Quispamsis, Canada","maritimeramman</div><div class=""userLoc""><strong>Quispamsis, Canada</strong>",83,4.0
672183930,https://www.tripadvisor.com/Hotel_Review-g60982-d87097-Reviews-Royal_Grove_Waikiki-Honolulu_Oahu_Hawaii-or45.html?filterLang=en,Royal Grove Waikiki,"May 7, 2019","This place is awesome Inexpensive, 2 block walk to beach, beach chairs available, and awesome entertainment on Monday. Second yr of staying here Can't beat it. Kitchenettes are fully equipped. Ac works well. Flat screen with good amount of channels. All electronics work in room but have to be in lobby for wifi to work.","houston,tx","yugogirlr</div><div class=""userLoc""><strong>houston,tx</strong>",10,5.0
658349602,https://www.tripadvisor.com/Hotel_Review-g60982-d87097-Reviews-Royal_Grove_Waikiki-Honolulu_Oahu_Hawaii-or45.html?filterLang=en,Royal Grove Waikiki,"March 13, 2019","We enjoyed our studio with two beds and kitchenette. Our first room was a corner with a wonderful ocean view, but my travel partner was bothered by the noise of the street construction out front (now completed) so we moved to the back, overlooking the pool. No view, and no direct sun, if that is important to you.We used the in suite kitchen daily - there is the Food Pantry a block away to purchase meal fixings, and the pineapple chop shop is just around the corner. Lots of fresh papaya and pineapple, so the fridge and kitchen were valued. Morning coffee on the balcony was a great start to our days.Easy walking to the shopping mecca, and lots of restaurants are 5 to 10 minutes away. The Bus is right at the corner.The pool noodles and beach towels are available on the main floor for beach use, as are surf and boogie boards.The hula night filled the library area with both traditional and modern hula and songs. A friendly and welcoming atmosphere. The Royal Grove is looking a bit dowdy, but our room was clean and overall the cleanliness of the interior was acceptable. We arrived just as the new management team was taking charge. We have booked our stay for this fall, and will update our review.","Vancouver, Canada","vancouvermuffy2016</div><div class=""userLoc""><strong>Vancouver, Canada</strong>",45,4.0
655684313,https://www.tripadvisor.com/Hotel_Review-g60982-d87097-Reviews-Royal_Grove_Waikiki-Honolulu_Oahu_Hawaii-or50.html?filterLang=en,Royal Grove Waikiki,"March 1, 2019","We booked the hotel online as there was no resort fee and it was a cheaper place to stay before our flight home.The hotel is small and only 5 storeys high, so instantly you are given a warm homely feeling. The staff are very welcoming and helpful. They helped us find the cheapest way to keep our room for the following day before our midnight flight (Turns out booking another night on expedia was cheaper than the day rate.)The room was very clean, and had a small kitchenette. No view from the room, but the wonderful pool and patio area made up for this. There are beach (boogie boards, buckets and spades, folding chairs and parasols) available to take with you to the beach, at no extra cost.I would definitely stay here again should we return to Honolulu, you are only a block from the beach and a couple of blocks from the international mall (if shopping is your thing).It's definitely not as swanky as some of the hotels, but has a way better atmosphere for this.",,neverstoproamin,1,5.0
654804789,https://www.tripadvisor.com/Hotel_Review-g60982-d87097-Reviews-Royal_Grove_Waikiki-Honolulu_Oahu_Hawaii-or50.html?filterLang=en,Royal Grove Waikiki,"February 25, 2019",As a long time guest for many years I've found Royal Grove a comfort and place of the familiar. Recent NEW Management has made changes and attempted to spiff up the lobby. Removing weekly rates and increasing prices too which is making it no longer a good value for the price. Location is now the only selling point. Short timers seem to be their target audience these days. I miss seeing many of the snow birds that called RG home for many years. Its always a clean with KIND staff. The vent from the restaurant on the ground floor vibrates along the wall to the roof making it an automatic alarm clock at 530am with NO snooze button. Its still a great place if they'll review room rates or tell price themselves out of the market...it's just an old worn out hotel with lots of character and good memories for me!Robert,"Dallas, Texas","solosojourner123</div><div class=""userLoc""><strong>Dallas, Texas</strong>",6,2.0
652200329,https://www.tripadvisor.com/Hotel_Review-g60982-d87097-Reviews-Royal_Grove_Waikiki-Honolulu_Oahu_Hawaii-or50.html?filterLang=en,Royal Grove Waikiki,"February 13, 2019",This is the place for fun. It cost us less than $100 a night. The tiles were falling off the wall of the pool but the rooms were clean and they made sure everything worked. We walked to Waikiki and spent long wonderful days there in the sun. We also used our senior bus passes to travel throughout Oahu day after day. This was a dream vacation and very reasonable.,"Orem, Utah","GeorgeGKing</div><div class=""userLoc""><strong>Orem, Utah</strong>",5,5.0
651358625,https://www.tripadvisor.com/Hotel_Review-g60982-d87097-Reviews-Royal_Grove_Waikiki-Honolulu_Oahu_Hawaii-or50.html?filterLang=en,Royal Grove Waikiki,"February 10, 2019","The hotel looks like an old converted apartment complex. It is old and a little nostalgic. I got a studio, it was fine by me. Don't expect anything too high and you won't get disappointed. It is very close to Waikiki beach and next door to the Hyatt, from where they do a lot of pickups for tours, so that was great.","San Antonio, Texas","Sandeep S</div><div class=""userLoc""><strong>San Antonio, Texas</strong>",8,3.0
647818662,https://www.tripadvisor.com/Hotel_Review-g60982-d87097-Reviews-Royal_Grove_Waikiki-Honolulu_Oahu_Hawaii-or50.html?filterLang=en,Royal Grove Waikiki,"January 23, 2019","Check-in was swift and very welcoming. It is convenirntly located about a 5 minute walk from the beach and a central location to shopping and restaurants. Yes this means you are near a busy a noisy street, so without an AC room your open window will let in all the city noise during the day. The facilities are quite old and run down but relatively well kept. I booked the superior studio which is much tinier than I expected, it is essentially the size of a small bedroom with a bathroom attached. For one traveller it may be good, for 2 a bit cramped. Although the room was RELATIVELY clean, on a scale of 1-10 for cleanliness I would give it a 7.5. Lost points because the furniture was worn, the box spring and bed sheets had old stains on them, there were moldy ice trays in the mini fridge, some old dirt behind the sink handles, the terrace fence was broken, and mold spots on the shower curtain. Overall it is a decent hotel if you get a good price, want a great location, and dont mind the worn condition. My advice is look for a bargain for a bigger ""deluxe"" room.",,Mr B,2,3.0
647585339,https://www.tripadvisor.com/Hotel_Review-g60982-d87097-Reviews-Royal_Grove_Waikiki-Honolulu_Oahu_Hawaii-or55.html?filterLang=en,Royal Grove Waikiki,"January 22, 2019","Let me first say, that I didn’t have much time to research this last minute trip and needed more budget accommodations for our one night in Honolulu. I regret that deeply. First of all, I booked a room without an AC which was my fault for booking too quickly and the front desk staff was happy to accommodate if we needed AC. They did have 2 wall fans which we decided would be fine. I was prepared for “run down” and “budget” but not prepared for dirty and dingy. The place was just not clean. The trash cans in the hallway were overflowing. The pool was NOT what the pics looked like and appeared to have green algae/slime on the walls. The room towels were stained and two were just dirty. The sheets were thin and stained and the pillows were not much more than sleeping without one. The shower curtain was ripped up and dirt on the shower and curtain. Hair was in the sink and shower as well as crumbs on the chairs in the main area. Dirt and dust was caked on the baseboard and around the furniture. There is NO parking at the facility and having to pay $30 to park across the street in a tiny garage was very inconvenient. The staff there was VERY friendly and accommodating but in no way could have made up for the dirty, ill-kept room. ","Atlanta, Georgia","mamafly</div><div class=""userLoc""><strong>Atlanta, Georgia</strong>",84,2.0
638994533,https://www.tripadvisor.com/Hotel_Review-g60982-d87097-Reviews-Royal_Grove_Waikiki-Honolulu_Oahu_Hawaii-or55.html?filterLang=en,Royal Grove Waikiki,"December 11, 2018","I personally have never stayed here. But I wanted to point out that on Monday evenings starting at 7pm a jam session takes place by local musicians. In addition to listening to great music, there is hula dancing by both men and women. And everyone gets into a circle and sings a song when the performances end. My husband and I are always welcome to stop in. The location is great for walking around Waikiki. The bus stop is a short walk away.","Yuma, Arizona","Jeanne A</div><div class=""userLoc""><strong>Yuma, Arizona</strong>",50,4.0
634746740,https://www.tripadvisor.com/Hotel_Review-g60982-d87097-Reviews-Royal_Grove_Waikiki-Honolulu_Oahu_Hawaii-or55.html?filterLang=en,Royal Grove Waikiki,"November 20, 2018","We stayed at the Royal Grove for 8 days this November, and we are complete fans of this amazing little hotel. The staff are some of the friendliest we have met in our travels and really contributed to this being our favourite trip yet. The hotel is very kitschy and has lots of character. If you are looking for the blandness of corporate hotels then you may not be as happy as we are with this lodging. The Royal Grove fosters a strong sense of community - one we have not experienced in our travels to date. There is a music night (think it was Wednesday) that is a lot of fun. We just missed the American Thanksgiving potluck that was taking place on Sunday night, but looked like a good time. The hotel is spotless - the cleaning staff are among the best there is, and friendly. The rooms are quite big - they are the old style rooms, reminiscent of a time gone by. The lanais are nice size with a full kitchen in most of them. The water pressure in the shower is great - really strong, and the bed is comfortable. Wi-fi is available in the lobby, which is a bonus because when you are in the lobby on your laptop or phone, you are also interacting with the residents of the hotel. Even the laundry room is a social space and connected to the pool/social area. It is so much fun it is hard to describe. Support this small, independent business and book early. This place is not a hidden gem; it is well discovered so you need to plan ahead if you want to stay here. We will also point out you are 2 blocks from one of the best parts of Waikiki Beach, and there are many restaurants and places for coffee near by, including an ABC store 1/2 block from the entrance. Highest rating for the Royal Grove, and a special thank you to the front desk staff - I'll likely spell this wrong, but Battita (apologies if we got that wrong), the hard working Scottish lady we had the pleasure of getting to know a little bit on the front desk. Thank you for making our stay fantastic.","Vancouver, BC","SocialTraveller</div><div class=""userLoc""><strong>Vancouver, BC</strong>",29,5.0
633302300,https://www.tripadvisor.com/Hotel_Review-g60982-d87097-Reviews-Royal_Grove_Waikiki-Honolulu_Oahu_Hawaii-or55.html?filterLang=en,Royal Grove Waikiki,"November 13, 2018","has been a great hotel for us in the past ,have stayed probably 6 times or more,next year in september we are planning a family vacation and will need 8 or nine rooms,but the online booking has me baffled and the rates are increased.any comment there jerry l.","Auckland, New Zealand","fossil007</div><div class=""userLoc""><strong>Auckland, New Zealand</strong>",2,5.0
617963055,https://www.tripadvisor.com/Hotel_Review-g60982-d87097-Reviews-Royal_Grove_Waikiki-Honolulu_Oahu_Hawaii-or55.html?filterLang=en,Royal Grove Waikiki,"September 19, 2018","I cannot say enough good things about this hotel. We visited Hawaii the second week of September and stayed for a full 7 days. I would not recommend anyone stay anywhere but here. The two main factors were location and price, however everything else about our stay was excellent as well.If you’re the kind of person who plans to spend most of their vacation on Waikiki Beach and at the hotel itself, you may want to look elsewhere. However, for our purposes, this hotel was perfect. We had a large, clean room with a full kitchenette (oven, stove, microwave, toaster, full fridge, and plenty of cooking and eating utensils) and a balcony with a view of the ocean for under $650 for the week, which is ridiculous compared to other hotels in the area. We easily made breakfast in the mornings and ate on the balcony before heading out for the day. Royal Grove is just a two-block walk from Waikiki Beach, and very close to plenty of shopping, convenience stores, and restaurants. The hotel is also just a couple blocks from bus stop. To add further convenience, there are beach towels and accessories (floaties, noodles, chairs, etc.) you are able to use for the day and return (at no additional charge). Our sleep quality was good; there is a little bit of noise from the street, but you are in a city so it’s to be expected. The air conditioning worked well. The staff was helpful and polite, and other guests were pleasant as well. The only downside might be the lack of WiFi except for in the lobby, but who comes to Hawaii to sit on their computer/phone? The hotel is a little older, but we found it more charming than anything, the pink building reminiscent of old Hawaii. I feel like my review really can’t do this hotel justice, as it was exactly what we were looking for and turned out to be such a hidden gem. If we ever visit Honolulu in the future, we will definitely stay again!As an extra tip, if you are renting a vehicle, look for free overnight parking (after 6PM and before 7AM) at the metered streets over near the Honolulu Zoo. We utilized this during our stay, and it was wonderful compared to spending $30+ per night parking in a lot or garage.","Milwaukee, Wisconsin","mintysnowflake7</div><div class=""userLoc""><strong>Milwaukee, Wisconsin</strong>",30,5.0
