review_id,url,hotel_name,review_date,review_body,user_location,user_name,helpful_vote,rating
753570510,https://www.tripadvisor.com/Hotel_Review-g60982-d87097-Reviews-Royal_Grove_Waikiki-Honolulu_Oahu_Hawaii-or0.html?filterLang=en,Royal Grove Waikiki,"May 16, 2020",Super friendly and helpful staff! Front desk is always so nice and accommodating:) maids do an excellent job of keeping rooms clean and tidy :) we’ve been coming every weekend and they treat us like queens:) mahalo Royal Grove!!! You da best!!!,,96768,1,5.0
752942645,https://www.tripadvisor.com/Hotel_Review-g60982-d87097-Reviews-Royal_Grove_Waikiki-Honolulu_Oahu_Hawaii-or0.html?filterLang=en,Royal Grove Waikiki,"April 26, 2020","Hotel, good location, staff,front desk,maid, maintenance, all very friendly and polite. I would come back again, in the future. Thank you for a wonderful experience !!! It's a hard thing the world is going through now.","Honolulu, Hawaii","rickienakamura4</div><div class=""userLoc""><strong>Honolulu, Hawaii</strong>",0,5.0
752459547,https://www.tripadvisor.com/Hotel_Review-g60982-d87097-Reviews-Royal_Grove_Waikiki-Honolulu_Oahu_Hawaii-or0.html?filterLang=en,Royal Grove Waikiki,"April 10, 2020","Terrible! Awful! Dirty! Horrible! Hot! Small! And 0-NONE % CUSTOMER SERVICE Sloppy! Out of Date, Air Conditioning was a joke! It Took over three hours to even feel some kind of air/ wind in the hotel room","Honolulu, Hawaii","laieb0y</div><div class=""userLoc""><strong>Honolulu, Hawaii</strong>",0,1.0
751958353,https://www.tripadvisor.com/Hotel_Review-g60982-d87097-Reviews-Royal_Grove_Waikiki-Honolulu_Oahu_Hawaii-or0.html?filterLang=en,Royal Grove Waikiki,"March 28, 2020",The place seems humble and a bit old but for the price and the location it is worthy. The rooms were super clean as well as the bathroom. I have to say that the sink could a longer faucet because it was hard to wash our hands. Our room had a nice balcony were we could rest and our room offered a kitchen and a fridge really convenient in case you want to cook and also just to mingle a bit together. It has a small swimming pool which is convenient if you do not want to go to the really close Waikiki beach. But if you prefer to go to the beach it is less than 2 minutes walking. Staff at the hotel were really nice and helpful too. Besides being super close to the beach is near many Waikiki attractions as well as a shopping area. I believe for the prices they offer if you only need a place to sleep this is the prefect place.,"Norman, Oklahoma","DiegoValmon</div><div class=""userLoc""><strong>Norman, Oklahoma</strong>",13,5.0
751757115,https://www.tripadvisor.com/Hotel_Review-g60982-d87097-Reviews-Royal_Grove_Waikiki-Honolulu_Oahu_Hawaii-or0.html?filterLang=en,Royal Grove Waikiki,"March 24, 2020","The Royal Grove Waikiki, has excellent accommodations, quality customer care and great amenities. I will be happy to book a reservation in the future and recommend the Royal Grove Waikiki to my friends and business associates.",,Michael B,0,5.0
750146644,https://www.tripadvisor.com/Hotel_Review-g60982-d87097-Reviews-Royal_Grove_Waikiki-Honolulu_Oahu_Hawaii-or5.html?filterLang=en,Royal Grove Waikiki,"March 9, 2020",Everything you need is within a 5 minute walk including Wakiki beach. Hotel is old and dated and probably 1/2 the price of the larger updated high rises that surround it. We enjoyed our stay and spending time by the quiet pool area. Nothing fancy here but was clean and staff were there to assist you with your needs.,"Edmonton, Canada","724garryk</div><div class=""userLoc""><strong>Edmonton, Canada</strong>",0,4.0
749949662,https://www.tripadvisor.com/Hotel_Review-g60982-d87097-Reviews-Royal_Grove_Waikiki-Honolulu_Oahu_Hawaii-or5.html?filterLang=en,Royal Grove Waikiki,"March 8, 2020","Just stayed at the Royal Grove Hotel. The staff is very friendly and the location is very convienient. Unfortunatly, thats the only positive about the royal grove hotel. We had room 425 and I would recommand you avoid this room under all cost. We tried to do but it was the last avbl. The room is facing the big street and with old/broken windows, we could hear every car/bus and could not sleep the entire night. Rooms were also very old and not in a good shape. Finally, the shower was not working properly and we could not take a shower in the morning. After one night, we decided to go somewhere else...","Frankfurt, Germany","FlyFrederik</div><div class=""userLoc""><strong>Frankfurt, Germany</strong>",2,1.0
746193380,https://www.tripadvisor.com/Hotel_Review-g60982-d87097-Reviews-Royal_Grove_Waikiki-Honolulu_Oahu_Hawaii-or5.html?filterLang=en,Royal Grove Waikiki,"February 19, 2020","Hotel is old and showing its age. No parking so for the added cost of parking we could have stayed in a nicer place. Even with us just wanted a comfortable room to stay in as this was a special trip, and this room barely met those needs. The beds were far from comfortable and pillows were way too old. Do yourself a favor and book a nicer room.The staff was very friendly, about the only plus there was to staying here.","Portland, Oregon","jpicknell24</div><div class=""userLoc""><strong>Portland, Oregon</strong>",1,1.0
746171767,https://www.tripadvisor.com/Hotel_Review-g60982-d87097-Reviews-Royal_Grove_Waikiki-Honolulu_Oahu_Hawaii-or5.html?filterLang=en,Royal Grove Waikiki,"February 19, 2020",The whole stay at royal grove was wonderful. Central to everything including bus service. Really nice staff. My holiday generally in Hawaii has been a great experience. We tried out two rooms. Even the small room was quite sufficient. The larger room was overall cleaner and very tidy.,"California Desert, California","evekupa</div><div class=""userLoc""><strong>California Desert, California</strong>",0,5.0
745278994,https://www.tripadvisor.com/Hotel_Review-g60982-d87097-Reviews-Royal_Grove_Waikiki-Honolulu_Oahu_Hawaii-or5.html?filterLang=en,Royal Grove Waikiki,"February 15, 2020","This hotel is very old and run-down. You could see it from the street, in the hallways, etc. I find it dirty (not in a sense of not cleaning it up, but just very old, who knows how old are the stains on the spring boxes). The building sits at the very busy Kuhio avenue and it is low-rise, so you can hear all the noise, so if you have a weak sleep - you will have a bad time. There is a eat-out/in place downstairs as well as convenience store (with alcohol). Apart from street noise, this area is known for homeless people, so you could hear screams outside. Also, there is notice on the wall - do not leave valuables in room, safety box at front desk. Security seems to be an issue. Advertised as a non-smoking hotel, but cigarette butt almost hit my head while it was dropped from the hotel balcony. This is a walk-up building, easily accessible from street, particularly during daytime. Some positives - there is a daily housekeeping for making up beds, refreshing towels. Our unit had a fridge, stove, hot plate, toaster, microwave and coffee maker and some utensils, pots, glasses. It is also in the hearth of Waikiki, 5 minutes from the beach, with plenty shops and restaurants within walking distance. Front desk borrows beach towels and staff is friendly. Based on other visitors I could see in this hotel it seems that some (senior) like to return. A/C in room worked. But paying almost $200/night (with taxes) for 3 people (high season) for a very run-down hotel, it is not worth staying. I feel sorry not only for guests but also for housekeepers and the staff working in here, who really tried to keep it running.","Cambridge, Massachusetts","Azzi E</div><div class=""userLoc""><strong>Cambridge, Massachusetts</strong>",38,2.0
745242856,https://www.tripadvisor.com/Hotel_Review-g60982-d87097-Reviews-Royal_Grove_Waikiki-Honolulu_Oahu_Hawaii-or10.html?filterLang=en,Royal Grove Waikiki,"February 15, 2020","On the outside is looks passable. On the inside it is a different matter. Very old furnishings in the rooms, to the point of dilapidation. Rooms are accessed through long, gloomy corridors. The rooms don't have Wifi (!!!), almost unheard of in the 21st century. No security safe in the rooms. The AC is ancient (window type). The hotel desperately needs a thorough refurbishment indeed.",,flybr,0,2.0
744467087,https://www.tripadvisor.com/Hotel_Review-g60982-d87097-Reviews-Royal_Grove_Waikiki-Honolulu_Oahu_Hawaii-or10.html?filterLang=en,Royal Grove Waikiki,"February 11, 2020","SINCE the new management took over, the rates have skyrocketed and it’s all about making money. It used to be a family oriented hotel with some guests coming here for 50 years. They don’t accommodate returnees with a lower price. Probably be the last year we can afford to come here for 7 weeks. Positive note, 5 minutes from beach, friendly front staff, Gina and Donna.","Edmonton, Canada","Retirees47</div><div class=""userLoc""><strong>Edmonton, Canada</strong>",16,2.0
743211362,https://www.tripadvisor.com/Hotel_Review-g60982-d87097-Reviews-Royal_Grove_Waikiki-Honolulu_Oahu_Hawaii-or10.html?filterLang=en,Royal Grove Waikiki,"February 5, 2020","This hotel needs a complete renovation. Very dilapidated and overall outdated feel. Staff was nice and I had no issues with check in. The room was clean but again very old feeling. AC in room worked very well, comforter was very thin though which made it too cold. Location was fine but there are other budget hotels in the area I would stay at over this one due to quality. ","New York City, New York","Keri A</div><div class=""userLoc""><strong>New York City, New York</strong>",18,1.0
742345606,https://www.tripadvisor.com/Hotel_Review-g60982-d87097-Reviews-Royal_Grove_Waikiki-Honolulu_Oahu_Hawaii-or10.html?filterLang=en,Royal Grove Waikiki,"January 31, 2020","If you've been looking at hotel prices you'll be wondering why this one is reasonably priced. This is an older hotel that could use some upgrades and there are no frills. We had a basic room with a small kitchenette stocked with dishes, pots, pans, silverware, cleaning supplies and a small (full) size refridgerator. The room was decent size for 2 adults, a family of 4 may need more space. The bed was ok, bedding was clean. The bathroom was basic sink, toilet and tub. Overall, the place is clean, no bugs of any kind were spotted. However, the cleaning staff had overlooked dusting some areas for awhile. Our room was on the ground floor near the pool, but we heard very little noise. The pool is very small and in need of some maintenance, but clean and functional, and Waikiki Beach is only 1 block away!! WiFi is only available in the lobby/reception area. A designated unsheltered smoking area is located about 25 ft. from the side entrance along the street. As there is no smoking in all of Hawaii you're at the mercy of what area is available. We don't smoke, but even we thought it was inconvenient. The front desk staff was very nice. Beach accessories are available to the quests at no charge; chairs, umbrellas, boogie boards even a surf board! A public parking garage is across the street for a fee ($30/day). If you're not looking for anything special and not going to be in the room much, this place can save you a lot of money.","Syracuse, New York","Dottie H</div><div class=""userLoc""><strong>Syracuse, New York</strong>",49,3.0
739506791,https://www.tripadvisor.com/Hotel_Review-g60982-d87097-Reviews-Royal_Grove_Waikiki-Honolulu_Oahu_Hawaii-or10.html?filterLang=en,Royal Grove Waikiki,"January 16, 2020","I figured we were only staying one night, so we could deal with it, for the price, it should have come with a pillow for each occupant. Only 2 provided, and we had signed up as 3 guest. Asked for some and was told they couldn't find any. Finally got another one around 9 pm. Bathroom door wouldn't close, needs some work to be reasonable and expect you to pay 150 + per night.. I thought some were being too judgmental on the review, but I think I agree. ",,sheilamaloney,0,2.0
738547137,https://www.tripadvisor.com/Hotel_Review-g60982-d87097-Reviews-Royal_Grove_Waikiki-Honolulu_Oahu_Hawaii-or15.html?filterLang=en,Royal Grove Waikiki,"January 11, 2020","Despite looking rather old and being quite simple, the hotel is absolutely perfect in terms of cleanliness, location and staff friendliness. It's only a block and a half from the beach and close to all types of shops. There was a stove, microwave oven, toaster, kettle and kitchen appliances in the room, which might be very helpful for those who decide to stay longer and actually cook there.","Belo Horizonte, MG","RebecaHeringer</div><div class=""userLoc""><strong>Belo Horizonte, MG</strong>",41,5.0
738454503,https://www.tripadvisor.com/Hotel_Review-g60982-d87097-Reviews-Royal_Grove_Waikiki-Honolulu_Oahu_Hawaii-or15.html?filterLang=en,Royal Grove Waikiki,"January 11, 2020",The location was fantastic and staffs were very friendly. I also had great fun time with other guests and musicians at kani ka pila night. I want to come back again and dance with them. Only thing I might need to mention is that the street noise is a bit annoying because of the windows couldn’t tightly closed. But it’s rather not a big deal compared with all the good things. ,,anonymous5552020,0,5.0
736179301,https://www.tripadvisor.com/Hotel_Review-g60982-d87097-Reviews-Royal_Grove_Waikiki-Honolulu_Oahu_Hawaii-or15.html?filterLang=en,Royal Grove Waikiki,"January 1, 2020","Was not clean. Felt unsafe in the room AC did not work .hasn't been upgraded since the 80s . Cost way to much for what you get . Parking is horrible no SUVs, only place to park is at the Zoo . The only good thing they have is the location.",,83kennetha,0,1.0
736079982,https://www.tripadvisor.com/Hotel_Review-g60982-d87097-Reviews-Royal_Grove_Waikiki-Honolulu_Oahu_Hawaii-or15.html?filterLang=en,Royal Grove Waikiki,"January 1, 2020","Great experience, clean room, friendly staff. Our room was on the smaller size and had a little traffic noise at night but not terrible - for the price, it was an incredible value and we were very happy with our stay! ",,mn1234002,0,5.0
735786838,https://www.tripadvisor.com/Hotel_Review-g60982-d87097-Reviews-Royal_Grove_Waikiki-Honolulu_Oahu_Hawaii-or15.html?filterLang=en,Royal Grove Waikiki,"December 30, 2019","Been staying here a long time. Great location! Close to the beach and the bus. Full kitchen. Alas, prices have gone up, so not the bargain it used to be. Everything changes! Local entertainment on Mon. nights. Great Kanikapila! ","Santa Cruz, California","momsun</div><div class=""userLoc""><strong>Santa Cruz, California</strong>",6,4.0
734792386,https://www.tripadvisor.com/Hotel_Review-g60982-d87097-Reviews-Royal_Grove_Waikiki-Honolulu_Oahu_Hawaii-or20.html?filterLang=en,Royal Grove Waikiki,"December 26, 2019",We first heard about the Royal Grove from Frommers back in 2006. This is a family owned retro hotel that’s all about ohana (family). Absolutely beloved by locals and hotel guests that keep coming back like us.,"Toronto, Canada","grooney2019</div><div class=""userLoc""><strong>Toronto, Canada</strong>",0,5.0
734502000,https://www.tripadvisor.com/Hotel_Review-g60982-d87097-Reviews-Royal_Grove_Waikiki-Honolulu_Oahu_Hawaii-or20.html?filterLang=en,Royal Grove Waikiki,"December 24, 2019","However owner really should pay up to clean the very dirty staff areas down the stairs. Some countries would close them down for this. They were even making food there. Owner family make loads of money. How can they ignore the below stairs dirt. Floor, tiles, yuck. Bet their home is very different. Staff were lovely despite this and location excellent and money saving. ",,rleath593880,0,4.0
734476169,https://www.tripadvisor.com/Hotel_Review-g60982-d87097-Reviews-Royal_Grove_Waikiki-Honolulu_Oahu_Hawaii-or20.html?filterLang=en,Royal Grove Waikiki,"December 24, 2019","Very handy location, so close to the beach, restaurant, shops etc... Really lovely staff.The pool was just being finished as we left, it looks great, wished we could have tried it!!! Ask for a room with a balcony given to the pool to avoid street noise on the other side.This is an old hotel so dont be too picky on the cleanliness and the style but it has just what you need.","New Plymouth, New Zealand","celine j</div><div class=""userLoc""><strong>New Plymouth, New Zealand</strong>",0,4.0
734381103,https://www.tripadvisor.com/Hotel_Review-g60982-d87097-Reviews-Royal_Grove_Waikiki-Honolulu_Oahu_Hawaii-or20.html?filterLang=en,Royal Grove Waikiki,"December 23, 2019","This hotel is our home away from home. stayed here many times over, this is my first review on it. This hotel is retro Hawaii, it is older. BUT What this hotel lacks in stars they DEFINITELY make up for in hospitality. Our room was super clean. Beds comfortable. 2-3 minute walk to the beach. Monika at the front desk is the BEST!!! Her hospitality is one of the reasons we will definitely be booking this hotel again. ",,Edgar12345,12,5.0
734290446,https://www.tripadvisor.com/Hotel_Review-g60982-d87097-Reviews-Royal_Grove_Waikiki-Honolulu_Oahu_Hawaii-or20.html?filterLang=en,Royal Grove Waikiki,"December 23, 2019","What can I say, but this was another great stay at our favorite home away from home in Waikiki!We arrived early, a couple hours before the guaranteed check-in time, and Monica was so genuinely nice, accommodating, and she was able to get us into a room early...this was SO VERY helpful for us so we could drop our luggage off, and start our drive around the island. (Thank you Monica!)The room has everything we need, and is always clean. We love the balcony, fridge, stove top, coffee pot, microwave, plates/utensils/glasses, hair dryer, bathroom amenities, etc. And they put in new larger HDTVs and upgraded their TV content...and the WiFi is now available in the guestrooms...and it is complimentary. And the WiFi works famously as we were able to steam movies on Netflix/Hulu.This hotel's location is only 5 minute walk, at most to the beach! And there are so many ABCs close by for food/shopping, and Mitsuwa/Whalers General are really close as well for any food item you might need.We Will be BACK!","Palo Alto, California","Matt-TripActions</div><div class=""userLoc""><strong>Palo Alto, California</strong>",5,5.0
734151637,https://www.tripadvisor.com/Hotel_Review-g60982-d87097-Reviews-Royal_Grove_Waikiki-Honolulu_Oahu_Hawaii-or25.html?filterLang=en,Royal Grove Waikiki,"December 22, 2019","If your looking for luxury then your in wrong place, luxury here costs a lot more than you pay for this hotel.If your looking at something well priced and in good access for Waikiki beach and safe then this is for you. Its literally across the road for the buses to pearl harbour (No 42 and 20 i believe) its a 3 minute walk to the beach and has food and drink availability around it.Wifi worked well in the room, this may be essential for many travellers and i can confirm it worked well for us.The pool was being refurbished, but why do you want a pool when waikiki beach is 3 minute walk away.The Beach location at this hotel is perfect for sunset photos, there is also a huge spectacular tree at the beach that comes alive with bird noise as sun sets. If you want to learn to Surf, then at the beach turn right and walk a few yards down and ask for Dave. This man does cheaper surf lessons than the ones next to him and a real good teacher. So room was clean but smelt a bit musky or damp, we sprayed some perfume around to make it better. Staff seem friendly and helpful.They phoned taxi for us to airport, Cost is around $30 -$40 each way, dependant on traffic. Shops in the area go from soverneirs to high end shopping and its all just one block away.So if your on a bit of a budget, need a hotel close to beach and many things like shops and buses, then this is perfect hotel.I am not sure if they improved wifi, but can confirm in December 2019 the Wifi worked perfectly in our room. Safe is at main deskHope this helps",Cardiff,"pyrotech999</div><div class=""userLoc""><strong>Cardiff</strong>",11,4.0
733234470,https://www.tripadvisor.com/Hotel_Review-g60982-d87097-Reviews-Royal_Grove_Waikiki-Honolulu_Oahu_Hawaii-or25.html?filterLang=en,Royal Grove Waikiki,"December 17, 2019",We stayed here twice while on a stopover to Australia and it was adequate for that purposePros:Price Location short walk to beach and towels supplied.Great staff smiling and helpfulQuietCleanConsDated and a bit beat up...but what do you expect for the priceRooms vary...the first night our room was small and cramped and we would not want to stay any length of time in it.Second night on our return the room was bigger with a balcony overlooking courtyard .While I would not want to be based there for a week it was perfectly adequate for a couple of nights.This is a budget hotel so manage your expectations.,Vancouver,"Farrercove</div><div class=""userLoc""><strong>Vancouver</strong>",43,3.0
732129234,https://www.tripadvisor.com/Hotel_Review-g60982-d87097-Reviews-Royal_Grove_Waikiki-Honolulu_Oahu_Hawaii-or25.html?filterLang=en,Royal Grove Waikiki,"December 11, 2019",This place was a dump their pool was out of action and not notified before we arrived the fridge blocked half the bathroom door. So very tight squeeze doors didnt lock on balcony .Dont bother booking,"Newcastle, Australia","Elizabeth D</div><div class=""userLoc""><strong>Newcastle, Australia</strong>",3,2.0
729828483,https://www.tripadvisor.com/Hotel_Review-g60982-d87097-Reviews-Royal_Grove_Waikiki-Honolulu_Oahu_Hawaii-or25.html?filterLang=en,Royal Grove Waikiki,"November 30, 2019","To be honest, we arrived late so we were tired . We were actually worried about what our room would be like once we saw the front desk. Lighting was bad so it sure looked worse then it actually was but even in daylight it was not as nice as the pictures on the sight. The room was clean but lacked of care and love. And the furniture is very, very old, but not quaint old, more like cheap , rundown old! The fridge had been changed and was bigger then the space needed so it blocked 1/3 of the bathroom door. If, like me you get up in the dark to go pee..you would probably do what I did...walk right into it.The room is clean but the air conditioning unit definetly dad not been cleaned recently..Glad it was a one night thing because it was a bit depressing as first night ever in Honolulu..glad we had a condo rented the next day.It’s well situated and the people working there were nice. The pool is closed for reparations.","Montreal, Canada","Shou1</div><div class=""userLoc""><strong>Montreal, Canada</strong>",148,3.0
726679112,https://www.tripadvisor.com/Hotel_Review-g60982-d87097-Reviews-Royal_Grove_Waikiki-Honolulu_Oahu_Hawaii-or25.html?filterLang=en,Royal Grove Waikiki,"November 15, 2019","***I was awoken in the middle of the night by 2 men on my balcony very stealthily trying to get into my room***I have travelled extensively on my own and in all types of accomodation - I have never felt unsafe and am in no way super fussy - this is actually my first ever bad review. I was really excited about the retro look of the Royal Grove but this place is not safe and I highly recommend solo females not to stay here. Although I was offered another room and did receive a refund for my next 2 nights when I confirmed I would be leaving and asked for a refund, the staff didn’t seem all that shocked by the situation. This leads me to believe that this is not all that unusual here. If you have already booked here or are going to anyway, I would be asking for a high floor - but there is also a door beside the elevator in reception just left open 24/7 so.....It was worth the extra money spent to book somewhere else and get the hell out of there. ","Brisbane, Australia","vargasgirl1984</div><div class=""userLoc""><strong>Brisbane, Australia</strong>",48,1.0
725818707,https://www.tripadvisor.com/Hotel_Review-g60982-d87097-Reviews-Royal_Grove_Waikiki-Honolulu_Oahu_Hawaii-or30.html?filterLang=en,Royal Grove Waikiki,"November 11, 2019","An older style hotel but kept clean and fresh by daily housekeeping. The staff are very friendly and eager to help travellers. Our room had a large refrigerator, microwave, stove and all the utensils. Its only a couple of minutes walk to Waikiki Beach where all of the hop on/off trolley buses stop. Also only minutes walk to restaurants, take out meals and bars. We stayed here for seven nights and will certainly book here on our next visit to Hawaii.","South Bowenfels, Australia","999Denis999</div><div class=""userLoc""><strong>South Bowenfels, Australia</strong>",4,5.0
720043371,https://www.tripadvisor.com/Hotel_Review-g60982-d87097-Reviews-Royal_Grove_Waikiki-Honolulu_Oahu_Hawaii-or30.html?filterLang=en,Royal Grove Waikiki,"October 20, 2019","We like that and the location is great ...........we enjoyed our 6 days here.We were on the 5th floor in a corner room with a wrap around balcony and a glimpseOf the surfers in the ocean.We always had a breeze and the room was bright.Our room was large with a kitchen which was a real bonus and had all other necessities to make our stay comfortable.The lift was next door but not at all noisey.The pool seemed very popular although we didn't use it.Wifi was only available downstairs but at the time of our stay it was being installed in all rooms.Only a 5 minute direct walk to Waikiki Beach and all the action, surrounded by eating places and bars we thought it was very good value for Waikiki.The staff were very pleasant and very helpful.We would definately stay again.","Sydney, Australia","Lyrebird6</div><div class=""userLoc""><strong>Sydney, Australia</strong>",259,4.0
