review_id,url,hotel_name,review_date,review_body,user_location,user_name,helpful_vote,rating
221515155,https://www.tripadvisor.com/Hotel_Review-g1066444-d307375-Reviews-Royal_Park_Hotel-Chuo_Tokyo_Tokyo_Prefecture_Kanto-or385.html?filterLang=en,Royal Park Hotel,"August 13, 2014","Stayed here for 5 nights recently and had a very good stay. I arrived very early from the UK and managed to check in my room early, this was so good as I was desperate to shower and have a rest. I stayed on the Executive Floor, and enjoyed the breakfast buffet. The hotel was quiet at night time, my room was also quiet and the bed and all the amenities were very good. Wifi throughout the hotel was excellent and I managed to use it to FaceTime my parents back home, it never once dropped out or froze when loading. The staff were very friendly and helpful. I used the TCAT to get here and that was so easy to get to from Haneda. I agree that the rooms especially the bathroom need modernising but there was a card in my room about modernisation so this sounds like something is being done. I will be back, and look forward to seeing the improvements.","London, United Kingdom","girltravel88</div><div class=""userLoc""><strong>London, United Kingdom</strong>",39,4.0
221168351,https://www.tripadvisor.com/Hotel_Review-g1066444-d307375-Reviews-Royal_Park_Hotel-Chuo_Tokyo_Tokyo_Prefecture_Kanto-or385.html?filterLang=en,Royal Park Hotel,"August 11, 2014","Spending a week here for business, the service level was as you would expect from a Japanese hotel, very professional and efficient. Breakfast was nice and my room had a great view. Size was more than enough, and the hotel was close to subway, TCAT to airport and many restaurants in the Ningyocho area.","Hofheim am Taunus, Germany","Brizzy4ever</div><div class=""userLoc""><strong>Hofheim am Taunus, Germany</strong>",41,4.0
219507429,https://www.tripadvisor.com/Hotel_Review-g1066444-d307375-Reviews-Royal_Park_Hotel-Chuo_Tokyo_Tokyo_Prefecture_Kanto-or390.html?filterLang=en,Royal Park Hotel,"August 4, 2014",Stayed here on business because of the location which is wonderful. The service you get at Royal Park Hotel is also top-notch. The rooms were another story. I first had to carry around a heavy key vs most hotels that give you a key card. I could see it being a cool thing for someone on vacation but I HATE to carry anything extra in my pockets all day (esp. if they might scratch my smart phone). The room itself was also lacking. I feel like I transported back to the 80s or something. Otherwise it was a typical stay.,,Andrew C,7,3.0
218557394,https://www.tripadvisor.com/Hotel_Review-g1066444-d307375-Reviews-Royal_Park_Hotel-Chuo_Tokyo_Tokyo_Prefecture_Kanto-or390.html?filterLang=en,Royal Park Hotel,"July 30, 2014","Getting around Tokyo is difficult, especially when you do not read Japanese. The subway and trains are complicated. Make life easy and stay at the Royal Park Hotel, with easy access to Narita Airport and major Tokyo destinations. 1) Airport Access. Next to Royal Park is TCAT (Tokyo Central Air Terminal). There are busses that run every 20 minutes to and from Narita Airport from here. Cost is $30 for one trip. Outside of Narita baggage claim is TCAT ticket and the bus is right outside. Royal Park is the only hotel that is connected to TCAT. 2) Tokyo Access. Below the hotel is the Hanzomon subway line by Tokyo Metro. You can buy a 2 day pass at the hotel to use on this line ($9 for two days). I hate switching subway or moving to the JR Rail on the ground level, it can be crazy and getting lost is not good, so you can use this ONE line to get to 4 places you should visit in Tokyo - Shibuya, Ginza, Nihonbashi (visit the new COREDO buildings) and Tokyo Sky Tree. They are all on this ONE line and you can catch an elevator from your room floor directly to the station. That is convenient, and non-Japanese will be able to move around. 3) Other - all staff speak English and service is impeccable. Make sure you try to eat dinner at Sumida Teppanyaki on the 21st level with commanding night views of Tokyo Sky Tree and Tokyo Tower. The meals start at $120 per person, but they have a course dinner for hotel guests only that is $55. Highly recommended. Bring you running shoes too, next the hotel is the Sumida River and there is an amazing jogging path that runs on both sides. This place is the ideal location in Japan for non-Japanese.","Honolulu, Hawaii","Toby_Tamaye</div><div class=""userLoc""><strong>Honolulu, Hawaii</strong>",7,5.0
217965826,https://www.tripadvisor.com/Hotel_Review-g1066444-d307375-Reviews-Royal_Park_Hotel-Chuo_Tokyo_Tokyo_Prefecture_Kanto-or390.html?filterLang=en,Royal Park Hotel,"July 28, 2014","I stayed int his hotel with my wife for 6 nights. I attended a convention at the Tokyo International Forum and Imperial Hotel. First off, getting there from Haneda airport was a breeze because the hotel is right beside the TCAT where bus limousine makes a major stop. Also there is a major subway station directly connected to the hotel (Hanzomon Line via Suitengumae Stn). I have to walk about 10 minutes to the nearest subway line to take me directly to the convention centre (Hibiya line via Ningyocyo Stn). Going back to Haneda via bus limousine was also a breeze. Since it is directly connected to a main subway station, going around Tokyo was easy for sight seeing. Room was small as well as the bathroom. TV channels are limited. Nevertheless, stay was pleasant and we expected Tokyo hotels to be small. I would not mind staying in this hotel again. Food was expensive in the hotel but there are several Ramen restaurants, 7-11 and Family Mart in the area. I would not mind staying in this hotel again.","Makati, Philippines","docneff</div><div class=""userLoc""><strong>Makati, Philippines</strong>",13,4.0
217517911,https://www.tripadvisor.com/Hotel_Review-g1066444-d307375-Reviews-Royal_Park_Hotel-Chuo_Tokyo_Tokyo_Prefecture_Kanto-or390.html?filterLang=en,Royal Park Hotel,"July 25, 2014","Comfortable rooms,comfortable bed, good breakfast, quiet quiet quiet, love this hotel. Fast wifi. Easy access from Narita. Views of the Tokyo sky tree from my room - hotel's back side. Ver friendky staff. Real room keys - hot water kettle in room.","Golden, Colorado","Richard S</div><div class=""userLoc""><strong>Golden, Colorado</strong>",39,5.0
217020461,https://www.tripadvisor.com/Hotel_Review-g1066444-d307375-Reviews-Royal_Park_Hotel-Chuo_Tokyo_Tokyo_Prefecture_Kanto-or390.html?filterLang=en,Royal Park Hotel,"July 23, 2014","This was my second visit, except for the location, nothing is good in this hotel. The rooms this time around were very basic not even coffee sachets and sugar!!!The rooms are now worn out and this should either be blocked out for renovation or ready it for demolition. Even the bed was hard like a log and i was offered twin bed room..The keys to the room is a antique ones which weighs atleast 100 grams and made of pure brass!!!! This takes back the hotel into a age of its own. They dont even provide you with water bottles and its charged. Luckily we had supermarkets opposite to the hotel and everyday at 7am we used to go to the super market to buy water. When your neighbor slams the door you feel like you just faced an earthquake. The only plus point is Tokyo city air terminal bus service is located next door, or connected from the 2nd floor of the hotel and connects directly to the terminal. Subway station is easily connected from the hotel through the 2nd sub basement which goes to Suitengumei station(through exit 4)",Bangalore,"Kishan77</div><div class=""userLoc""><strong>Bangalore</strong>",85,2.0
213025951,https://www.tripadvisor.com/Hotel_Review-g1066444-d307375-Reviews-Royal_Park_Hotel-Chuo_Tokyo_Tokyo_Prefecture_Kanto-or395.html?filterLang=en,Royal Park Hotel,"July 1, 2014",The location of the hotel is prime and it is connected to the Suitengumae Metro station which makes it even more convenient for a first timer. Metro is the most ideal commuting mode in Tokyo and having a station attached to your hotel is more than what you can ask for. Service is excellent and Rooms are clean; my only complaint was regarding the TV channels as they have very minimum English channels (3 news channels to be precise) broadcasted. Staff at the Concierge and Front office are excellent and will go out of their way to serve you.,Bangalore,"Anjana-exploring</div><div class=""userLoc""><strong>Bangalore</strong>",9,5.0
212019970,https://www.tripadvisor.com/Hotel_Review-g1066444-d307375-Reviews-Royal_Park_Hotel-Chuo_Tokyo_Tokyo_Prefecture_Kanto-or395.html?filterLang=en,Royal Park Hotel,"June 25, 2014","The hotel is currently celebrating its 25th anniversary, and does appear a little bit dated in places (decor etc) but still very smart. The location is great (link to TCAT for buses to the airports), directly above a metro station and convenient for the Chuo business district. Service is excellent and staff are fantastically helpful. Buffet breakfast has a wide selection, with something to please almost everyone. There are a number of restaurants in the hotel which seem expensive, but which offer resident discounts. Tried the Japanese restaurant which was excellent. Have stayed here before (in 2011) and will probably stay again.","York, United Kingdom","DoctorToxic</div><div class=""userLoc""><strong>York, United Kingdom</strong>",107,4.0
211486860,https://www.tripadvisor.com/Hotel_Review-g1066444-d307375-Reviews-Royal_Park_Hotel-Chuo_Tokyo_Tokyo_Prefecture_Kanto-or395.html?filterLang=en,Royal Park Hotel,"June 22, 2014","Good hotel, good services but no complementary water bottles in the room even in the executive rooms and very bad extention policy (asked to keep my room 3 hours more due to a late flight, one night more!)","Bandol, France","Pierre Q</div><div class=""userLoc""><strong>Bandol, France</strong>",14,3.0
210432198,https://www.tripadvisor.com/Hotel_Review-g1066444-d307375-Reviews-Royal_Park_Hotel-Chuo_Tokyo_Tokyo_Prefecture_Kanto-or395.html?filterLang=en,Royal Park Hotel,"June 15, 2014",2nd time staying here and drew a very small room on 12 floor with virtually no view worthy of writing about. good wifi access which was important for early morning and late evening IP phone calls back to US and Europe. staff very attentive and pleasant. had breakfast on executive level which was great. good location for TAT and connections to/from Narita.,"Chicago, Illinois","565NOSTAY565</div><div class=""userLoc""><strong>Chicago, Illinois</strong>",30,4.0
209345030,https://www.tripadvisor.com/Hotel_Review-g1066444-d307375-Reviews-Royal_Park_Hotel-Chuo_Tokyo_Tokyo_Prefecture_Kanto-or395.html?filterLang=en,Royal Park Hotel,"June 7, 2014",Very good hotel .Easy to get from Narita . perfect for subway location .A bit old fashion looking .It is the fourth time we stay in this hotel Each time we travel To Tokyo we stay in this hotel. Beds are excellent ,"Montpellier, France","Jack D</div><div class=""userLoc""><strong>Montpellier, France</strong>",0,5.0
209327583,https://www.tripadvisor.com/Hotel_Review-g1066444-d307375-Reviews-Royal_Park_Hotel-Chuo_Tokyo_Tokyo_Prefecture_Kanto-or400.html?filterLang=en,Royal Park Hotel,"June 7, 2014","I am into my second long stay (8+days) here and, obviously chose to return after the first visit. It's a nice hotel with friendly staff and reasonable facilities, especially in the Exec. rooms which give access to the 20th floor lounge - all day tea, coffee, snacks, etc. evening bar and nibbles. My room is not huge, but it's adequate. The over-bath shower is not great as I am tall. But it's powerful and hot! Breakfast downstairs is very good with a wide choice. Proximity to the subway is very handy. ","London, United Kingdom","IOWman</div><div class=""userLoc""><strong>London, United Kingdom</strong>",162,4.0
208441306,https://www.tripadvisor.com/Hotel_Review-g1066444-d307375-Reviews-Royal_Park_Hotel-Chuo_Tokyo_Tokyo_Prefecture_Kanto-or400.html?filterLang=en,Royal Park Hotel,"June 1, 2014","The Royal Park in Chuo is my Company's pick for a hotel inTokyo and I have stayed there about 6 times. Every time I am struck by the fact that given the location, this hotel could be so much better than it is! However it is a clean and relatively comfortable place for a few nights.The decor and rooms could do with being a bit more modern, and the dusky pink decor is a bit of a 1980s throwback! Rooms whilst comfortable are far from modern, and the beds are on the spartan side!However you can't fault the courteous service from the staff, who are always great. Breakfast options are limited but I use the Executive lounge on the top floor which is a bit more calm than the lobby restaurant.The Japanese restaurant is, as other reviewers have said, good quality but very expensive!","Glasgow, United Kingdom","Les F</div><div class=""userLoc""><strong>Glasgow, United Kingdom</strong>",37,4.0
207866570,https://www.tripadvisor.com/Hotel_Review-g1066444-d307375-Reviews-Royal_Park_Hotel-Chuo_Tokyo_Tokyo_Prefecture_Kanto-or400.html?filterLang=en,Royal Park Hotel,"May 29, 2014",As always the entire staff at Nihonbashi Royal Park Hotel continue to provide outstanding customer service and go far beyond guest expectations!A tremendous thank you to the executive staff of the 20th floor...always a real pleasure to deal with.I would highly recommend this hotel to anyone conducting business travel in the greater Tokyo area. The hotel is located conveniently to all transit access points and offers everything that a business traveler would require.,"Vancouver, Canada","Jason_VanCity</div><div class=""userLoc""><strong>Vancouver, Canada</strong>",1,5.0
206000934,https://www.tripadvisor.com/Hotel_Review-g1066444-d307375-Reviews-Royal_Park_Hotel-Chuo_Tokyo_Tokyo_Prefecture_Kanto-or400.html?filterLang=en,Royal Park Hotel,"May 18, 2014","Stayed here twice in May (for two periods of 3 days each time). We were delighted to have chosen this hotel, over many others of similar price, based on Tripadvisor's reviews. The rooms are large and kept very clean, good quality bed and pillows and the amenities found in the bathroom include everything one might need- with even a kit of shaving cream, lotion and skin moisturizer. Totally sound proof, the large windows have Japanese style light curtains that allow light as well as very heavy curtains for the early morning sun.The location is excellent: the TCAT (with airport transfers to both Haneda and Narita) is next door (50 meters) and on the basement floor is the entrance to the tube station. The area is safe to walk around at night with many restaurants and shops and spotlessly clean- like the rest of Tokyo.The breakfast is outstanding with a great variety of Western and Japanese food and the executive club, with its three and a half hour Happy Hour, just perfect to end the day. Located on the 20th floor, it has excellent, unobtrusive service, with good wines, beer and spirits. Varied 'tapas' such as nuts, olives, cheese, crudites and hot finger food is available every evening from 5.30. The view compliments the calm and relaxed atmosphere of this special place.The lobby, the lifts and all the public areas are very clean. Excellent service all around and tips are not expected nor accepted. We would most definitely return to this hotel when we next visit Japan.","Nottingham, United Kingdom","luchyswanwick_10</div><div class=""userLoc""><strong>Nottingham, United Kingdom</strong>",130,5.0
205515707,https://www.tripadvisor.com/Hotel_Review-g1066444-d307375-Reviews-Royal_Park_Hotel-Chuo_Tokyo_Tokyo_Prefecture_Kanto-or400.html?filterLang=en,Royal Park Hotel,"May 14, 2014","High Quality Business Hotel, Just located next to TCAT a plus for airport Transfers. Ask for Higher Floors, to see beautiful Tokyo City through your room windows. Courteous Staff . Excelent guest service. Stayed there for 10 days. I Would like thenm to change their door to have electronic card ones as keys are too heavy and chance of misplacing is higher. I was staying alone so would have preferred Double bed rather than Twin Bed which was allocated to me.","Sydney, Australia","gurpreet_chawla</div><div class=""userLoc""><strong>Sydney, Australia</strong>",17,4.0
204898910,https://www.tripadvisor.com/Hotel_Review-g1066444-d307375-Reviews-Royal_Park_Hotel-Chuo_Tokyo_Tokyo_Prefecture_Kanto-or405.html?filterLang=en,Royal Park Hotel,"May 9, 2014","Stayed for 10 nights end April early May over Gold week. Great hotel, excellent, helpful courteous staff and location was perfect for our needs. Easy to get to from Narita airport as drop off is at the Tokyo City Air Terminal (TCAT), which is located next door to the hotel and has a connecting bridge. Had a small issue purchasing return limousine bus tickets on arrival at airport ie it wasn't offered until asked for (Visitors can get a return for 4500 JPY, normal rtn 6200 JPY) the assistant spoke good English so sorted quickly . Stayed in an Executive Floor room which offered access to Executive Lounge with complimentary coffee, tea, cocktails and snacks and very helpful staff. Complimentary breakfast buffet and complimentary access to the fitness Club, pool, and sauna. Two hours complimentary use of the meeting rooms if required and extension of check-out time to 3 PM Room size ideal for two adults, especially compared to many Tokyo hotel rooms. Had Breakfast in the 1ST floor restaurant as better selection sellection of food and still included in the executive room rate, one thing on busy weekends and Holidays it gets full and you have to wait to be seated due to Gold Week we has to wait 3 times to get a seat, same for the Executive lounge 5-7pm cocktail time is very busy on Holidays","Sheffield, United Kingdom","Darren C</div><div class=""userLoc""><strong>Sheffield, United Kingdom</strong>",15,4.0
204374637,https://www.tripadvisor.com/Hotel_Review-g1066444-d307375-Reviews-Royal_Park_Hotel-Chuo_Tokyo_Tokyo_Prefecture_Kanto-or405.html?filterLang=en,Royal Park Hotel,"May 6, 2014",Like all Tokyo hotels this is very well presented to a very high standard and is exactly what you would expect from this quality of hotel. Modern and very well fitted. You will not be disappointed. Traffic is very busy in Tokyo.,Yorkshire,"Feretdubois</div><div class=""userLoc""><strong>Yorkshire</strong>",28,4.0
204222730,https://www.tripadvisor.com/Hotel_Review-g1066444-d307375-Reviews-Royal_Park_Hotel-Chuo_Tokyo_Tokyo_Prefecture_Kanto-or405.html?filterLang=en,Royal Park Hotel,"May 5, 2014","Luxurious hotel on a good location, next to TCAT which can easily be reached from the airport by bus. Hotel is located directly above a metro station which makes it a good location for exploring the city.Only disappointment is that you have to pay separately for the gym, pool and sauna. From my point of view that should be part of the price you pay for the room.","Voorburg, The Netherlands","JurriaanS</div><div class=""userLoc""><strong>Voorburg, The Netherlands</strong>",10,5.0
203507987,https://www.tripadvisor.com/Hotel_Review-g1066444-d307375-Reviews-Royal_Park_Hotel-Chuo_Tokyo_Tokyo_Prefecture_Kanto-or405.html?filterLang=en,Royal Park Hotel,"April 30, 2014","Great hotel with top of the line service, tasty (Western) breakfast, and good location. If you like Japanese food, there is a restaurant in the same building. The place is great for business trips, would love to stay there again.","Rishon Lezion, Israel","N_K</div><div class=""userLoc""><strong>Rishon Lezion, Israel</strong>",275,5.0
202920760,https://www.tripadvisor.com/Hotel_Review-g1066444-d307375-Reviews-Royal_Park_Hotel-Chuo_Tokyo_Tokyo_Prefecture_Kanto-or405.html?filterLang=en,Royal Park Hotel,"April 26, 2014","We stayed at the Royal Park Hotel mid April 2014 and found it to be awesome! The subway is directly beneath the hotel, so we were able to go anywhere in Tokyo. We even took public transport out to Tokyo Disneyland, just like a real local. This hotel is well maintained and the front desk staff were courteous and very helpful. We would definitely stay at this hotel again.",Perth,"Tracey M</div><div class=""userLoc""><strong>Perth</strong>",10,5.0
202043643,https://www.tripadvisor.com/Hotel_Review-g1066444-d307375-Reviews-Royal_Park_Hotel-Chuo_Tokyo_Tokyo_Prefecture_Kanto-or410.html?filterLang=en,Royal Park Hotel,"April 21, 2014","We stayed here in March booking through Hotels.com. We booked an executive double which Hotel.com says is on floors 15-18. That didn't happen and a lot of the facilities listed didn't materialize. We realized later when we made bookings for two more nights and stayed on those floors...It was superb. When we questioned them they said that hotels. com had got it wrong!! So be very careful when you book- my recommendation is to go for the Deluxe double on the higher floors .On the positive side, the complimentary lounge access was very good. Great tea/coffee through the day and great breakfast. In the evenings excellent wine, champagne, sake and a host of alcoholic beverages served with a superb view of the Tokyo skyline. This was a terrific deal.I must mention that their concierge was extremely helpful. The one at the lobby guided us so wonderfully..thank you . He recommended some superb small Japanese restaurants close by. He made our trip!Should you stay here? I would say book early and stay in Ginza or other areas. This is a dead neighborhood and you have to take the subway to get to the other places.. The subway is right below the hotel but it still takes time!","Melbourne, Australia","friendlytipsMumbai</div><div class=""userLoc""><strong>Melbourne, Australia</strong>",13,3.0
201312604,https://www.tripadvisor.com/Hotel_Review-g1066444-d307375-Reviews-Royal_Park_Hotel-Chuo_Tokyo_Tokyo_Prefecture_Kanto-or410.html?filterLang=en,Royal Park Hotel,"April 15, 2014","Upon making the reservation for this hotel the rate included breakfast. When I arrived, it does not include breakfast. Instead the buffet cost $33 US. Mistakes happen, but the worst of it was the treatment I received from the staff, especially at the front desk. I should them where the reservation included breakfast and they failed to honor free breakfast and they were very rude. (Which may I add is very unusal in Japan!) I understand problems happen, but being rudee is unacceptable.On the positive side, the rooms are very modest and clean. It is not a luxury hotel. I will never stay here again.","Prosper, Texas","237kiml</div><div class=""userLoc""><strong>Prosper, Texas</strong>",12,2.0
201009128,https://www.tripadvisor.com/Hotel_Review-g1066444-d307375-Reviews-Royal_Park_Hotel-Chuo_Tokyo_Tokyo_Prefecture_Kanto-or410.html?filterLang=en,Royal Park Hotel,"April 13, 2014","Stayed for four nights early April. Great hotel, excellent, helpful (even lent me an umbrella for use during my stay) courteous staff, and location was perfect for our needs. Easy to get to from Narita airport as drop off is at the Tokyo City Air Terminal, which is located on the lower floor of the hotel, or an easy walk to the hotel from front entrance of the City Air Terminal. No issue purchasing limousine bus tickets on arrival at airport. Stayed in an Executive Floor room which offered access to Executive Lounge with complimentary coffee, tea, cocktails and snacks. Complimentary breakfast buffet and complimentary access to the fitness Club, pool, and sauna. Two hours complimentary use of the meeting rooms if required and extension of check-out time to 3 PM Room size ideal for two adults, especially compared to many Tokyo hotel rooms.","Adelaide, Australia","AdelaideTraveller_12</div><div class=""userLoc""><strong>Adelaide, Australia</strong>",12,5.0
201004344,https://www.tripadvisor.com/Hotel_Review-g1066444-d307375-Reviews-Royal_Park_Hotel-Chuo_Tokyo_Tokyo_Prefecture_Kanto-or410.html?filterLang=en,Royal Park Hotel,"April 13, 2014","Older hotel, but service is great!Right next subway station so access to anywhere very convenient.Also directly across the street from bus station so access to/from Narita airport is a breeze.Location near many restaurants and small village shops.Morning breakfast buffet had great choices.Hotel older/dated but clean and customer service is top notch!Would definitely stay here again if in the area!","Danville, California","rcwinter1</div><div class=""userLoc""><strong>Danville, California</strong>",30,5.0
200511381,https://www.tripadvisor.com/Hotel_Review-g1066444-d307375-Reviews-Royal_Park_Hotel-Chuo_Tokyo_Tokyo_Prefecture_Kanto-or410.html?filterLang=en,Royal Park Hotel,"April 9, 2014","Its been many years since I stayed at RP. I probably have hundreds of room nights from back around 1994 thru 2000 when we had a joint venture company with Kirin Brewry in a nearby office building. But even though the time has gone by, the hotel remains excellent and coming back gave me many fine memories. The service of your people is the MOST impressive and it is reflected in all the places. Scotts, Restaurant, Gym and of course check in and so forth. Congratulations to you and I look forward to a return trip in June of this year.",St. Louis,"budyzer</div><div class=""userLoc""><strong>St. Louis</strong>",1,5.0
