review_id,url,hotel_name,review_date,review_body,user_location,user_name,helpful_vote,rating
153405790,https://www.tripadvisor.com/Hotel_Review-g1066444-d307375-Reviews-Royal_Park_Hotel-Chuo_Tokyo_Tokyo_Prefecture_Kanto-or525.html?filterLang=en,Royal Park Hotel,"February 28, 2013","Royal Park is an amazing hotel. It's like a little slice of heaven in a hectic city. I stay there every time I come to Tokyo. All of restaurants are superb, and the staff is outstanding. I even like the quirky metal skelleton keys for the rooms. The room and bedding is sumptous, and very spacious. Highly recommend the executive floors if you can swing it.","Portland, Oregon","dguarnaccia</div><div class=""userLoc""><strong>Portland, Oregon</strong>",2,5.0
152844504,https://www.tripadvisor.com/Hotel_Review-g1066444-d307375-Reviews-Royal_Park_Hotel-Chuo_Tokyo_Tokyo_Prefecture_Kanto-or525.html?filterLang=en,Royal Park Hotel,"February 22, 2013","Great location, close to transport, but then again, what isn't in Japan. Really good staff, very quiet and comfortable hotel and executive floors and facilities were great. Excellent venue for business. Breakfast was very enjoyable too.","Brisbane, Australia","grahamh132</div><div class=""userLoc""><strong>Brisbane, Australia</strong>",2,4.0
150770272,https://www.tripadvisor.com/Hotel_Review-g1066444-d307375-Reviews-Royal_Park_Hotel-Chuo_Tokyo_Tokyo_Prefecture_Kanto-or530.html?filterLang=en,Royal Park Hotel,"January 27, 2013",love the location. puts you right in the Ningyo-cho district. Great food and local shopping. Take a walk to visit the seven luck shrines of Nihonbashi. Easy transportation from NRT airport to the Tokyo City Air Terminal,"Stinson Beach, California","BrianH458</div><div class=""userLoc""><strong>Stinson Beach, California</strong>",18,4.0
149935752,https://www.tripadvisor.com/Hotel_Review-g1066444-d307375-Reviews-Royal_Park_Hotel-Chuo_Tokyo_Tokyo_Prefecture_Kanto-or530.html?filterLang=en,Royal Park Hotel,"January 18, 2013","Have stayed many times at the Royal Park Hotel, and every time I am met with a smiling face in the reception. The hospitality is great and beds are very nice. Some rooms are though a bit ""tired"" however still good value for money. Especially I love the breakfast at the 20th floor, where you can sit and enjoy a nice breakfast with a perfect view of the city","Aalborg, Denmark","Melsenstyle</div><div class=""userLoc""><strong>Aalborg, Denmark</strong>",5,5.0
149312163,https://www.tripadvisor.com/Hotel_Review-g1066444-d307375-Reviews-Royal_Park_Hotel-Chuo_Tokyo_Tokyo_Prefecture_Kanto-or530.html?filterLang=en,Royal Park Hotel,"January 9, 2013","Posh hotel thus expensivePROS-------Located literally over a metro station. Time from room to metro < 3 minTaxi rank outside the hotelHuge selection of restaurants within 5 min walk max5-6 restaurants in the hotelNice breakfast quality and selection (although not the best I've had). You can also have sushi-style breakfastStaff can speak great englishStaff has great mannersStaff very helpful with all kinds of requests (even for an umbrella!)Very well lit and safe area to walk inRoom huge for japanese standards, equal to a Marriott or Intercontinental roomAll kinds of amenities in the room (several pillows, free wifi, complimentary toiletry)4 lifts so you never wait for more than a couple of minutes, even in busy hoursFree drinks and snacks for executive room guests for several hours each day (on the 16th floor lobby)Great view from executive guests breakfast area (19th floor I think)ATMs in the main lobbyBus station from/to Narita airport opposite the hotelCONS-------Hotel can get very busy, so twice I was told that there is no free seat for breakfast and that I had to wait. It was on New Year's Eve and New Year's day. I know, busy period, but still unacceptable","Patras, Greece","megatim1</div><div class=""userLoc""><strong>Patras, Greece</strong>",29,5.0
148189273,https://www.tripadvisor.com/Hotel_Review-g1066444-d307375-Reviews-Royal_Park_Hotel-Chuo_Tokyo_Tokyo_Prefecture_Kanto-or530.html?filterLang=en,Royal Park Hotel,"December 28, 2012",The hotel is a perfect choice for travellers as it is situated near TCAT (direct bus service from Narita) and Suitengumae station. Rooms are spacious and clean. Staff is very nice and extremely helpful but u might face some problem communicating in English. Breakfast is wonderful. I enjoyed my stay and look forward to going there again.,Mumbai,"ShaliniS227</div><div class=""userLoc""><strong>Mumbai</strong>",39,5.0
147881562,https://www.tripadvisor.com/Hotel_Review-g1066444-d307375-Reviews-Royal_Park_Hotel-Chuo_Tokyo_Tokyo_Prefecture_Kanto-or530.html?filterLang=en,Royal Park Hotel,"December 21, 2012",Location is great near bus station for Airport but room price is a way too high For this price you would expect to get more but every thing cost more- GYM / POOL / SAUNA / Breakfest - each cost more ~ 2.5K yen extra- In the lobby you have nice coffee shop and resturants but if you want just to sit taliking to someone only 4 arm chairs and 2 sofa (total max 6-7 ppl. can be sitted in Lobby and not in one of the coffee shop or resturant (and in the coffee shop even a Jappnise firend told me the price of the coffee is exaggerated - but since I paiy he didn't mind).Sum all the above -> you can get much better deal in the same area.,"Tokyo, Japan","RSIMA</div><div class=""userLoc""><strong>Tokyo, Japan</strong>",1,3.0
147437002,https://www.tripadvisor.com/Hotel_Review-g1066444-d307375-Reviews-Royal_Park_Hotel-Chuo_Tokyo_Tokyo_Prefecture_Kanto-or535.html?filterLang=en,Royal Park Hotel,"December 14, 2012",Great location and comfortable for business travelers. This was my second trip to Tokyo and it is on my list of top / best places to work / visit. I highly recommend the executive floor. One urgent consideration for Royal Park is to expand food choices with lower prices. The cost of dining in the hotel is prohibitive; it is extremely expensive and the value is not commensurate with what is charged. This would enhance all this fine hotel has to offer. Breakfast is wonderful so keep that up!,"Pomona, New York","NCelini</div><div class=""userLoc""><strong>Pomona, New York</strong>",3,5.0
147159615,https://www.tripadvisor.com/Hotel_Review-g1066444-d307375-Reviews-Royal_Park_Hotel-Chuo_Tokyo_Tokyo_Prefecture_Kanto-or535.html?filterLang=en,Royal Park Hotel,"December 10, 2012","Executive floor was all well organised with Japanese hospitality, parfect choise for business and private travelors from abroad, excellent access to T-CAT (bus station attached to the hotel where frequent services are available from /to Narita airport). Non smoking Queen Bed room was spacious enough with clean, also enjoyed Japanese style bath room at Spa. Breakfast restaurant at 20th floor gave us a good western style of food with view. Hakozaki (where the hotel locates) is not in the city centre but instead has a quiet down town (shita-machi) atmosphere. In fact it had easier access to Ginza, Tsukiji, Asaksa and most of other polular places by Tokyo Metro. Myself (Japanese) and my colleague (non Japanese) both appreciated lots of hospitalities during the stay.","London, England, United Kingdom","Ota_Hitoshi</div><div class=""userLoc""><strong>London, England, United Kingdom</strong>",3,5.0
147032532,https://www.tripadvisor.com/Hotel_Review-g1066444-d307375-Reviews-Royal_Park_Hotel-Chuo_Tokyo_Tokyo_Prefecture_Kanto-or535.html?filterLang=en,Royal Park Hotel,"December 8, 2012","1. right next to TCAT (Tokyo City Airport Terminal: place where the airport limo arrives and departs) so very convenient, plus there is an underground station right below it. 10-15 mins taxi drive from most locations in central Tokyo.. you cant go wrong for its location.having said that, there are other things i'd like to dwell upon:2. Service: Excellent, (pricey ...but still excellent) ask for anything and you get it, for the 3 nights that i stayed there I had a very good experience.3. Old hotel: not been renovated since a long time, its shows its dated nature.. I am not complaining, just setting your expectations right, so that you are not disappointed when you check in.4. Executive Lounge: free snacks, drinks.. its all charged in your room rate, but its a nice warm fuzzy cozy feeling up there in the executive lounge.5. decent choice of restaurants near by: ask the bell desk for help on eating out nearby.6. Breakfast: 20th floor has a nice view but limited breakfast options: Symphony on level 1 serves a wider spread for breakfast and is more comfortable and recommended for flexible timing and a bigger spread.","Singapore, Singapore","Farawayjfk</div><div class=""userLoc""><strong>Singapore, Singapore</strong>",86,4.0
146933712,https://www.tripadvisor.com/Hotel_Review-g1066444-d307375-Reviews-Royal_Park_Hotel-Chuo_Tokyo_Tokyo_Prefecture_Kanto-or535.html?filterLang=en,Royal Park Hotel,"December 7, 2012","We stayed in the Royal Park Hotel in November of 2012. It's a very nice hotel, centrally located and close to the subway system. We booked a room on the 16th floor, which is the club level and it did not disappoint. The happy hour food and drink was awesome. Great food, a great selection of drinks and very pleasant service. We booked several excursions and all went well, except you need to make sure that they return you to the hotel when the tour is completed. One of our excursions did not bring us back to the hotel, but we enjoyed finding our way back on the subway system. We enjoyed the breakfast in the hotel everyday. A very nice buffet on the lobby level as well as the top floor. The food in the lobby was better, but the view from the 20th floor was worth the effort. You can not go wrong with this very nice hotel in central Tokyo, Japan.","Tucker, Georgia","Milks77</div><div class=""userLoc""><strong>Tucker, Georgia</strong>",5,5.0
146836837,https://www.tripadvisor.com/Hotel_Review-g1066444-d307375-Reviews-Royal_Park_Hotel-Chuo_Tokyo_Tokyo_Prefecture_Kanto-or535.html?filterLang=en,Royal Park Hotel,"December 5, 2012","I am a regular visitor to the Royal Park and have found it a very comfortable hotel for extended business stays. Rooms are always clean, service is very polite and the hotel offers many restaurants if you are unsure about venturing out on the town! (You really should--lots of great 'local' places to visit nearby.) I prefer the executive floors so you get free wifi as well as access to the top floor breakfast buffet each day (it is a little more cozy/quiet than going to the main restaurant downstairs for breakfast). I will say, however, that while the service and food are very good I do think it has been scaled back 'just a bit' over the past few years--fewer buffet choices, a bit less fruit etc. Still though a very nice place to have breakfast, I've just been spoiled in the past.Be sure to take a stroll down to the Sumida River (less than five minutes) and enjoy the walk there, especially if the cherry blossoms are out in force!TCAT is just across the street (take the elevated walkway from the second floor) and very convenient for travel to/from Narita/Haneda airports.Great place to say, you will enjoy it.","Overland Park, KS","weathermankc</div><div class=""userLoc""><strong>Overland Park, KS</strong>",109,5.0
146672455,https://www.tripadvisor.com/Hotel_Review-g1066444-d307375-Reviews-Royal_Park_Hotel-Chuo_Tokyo_Tokyo_Prefecture_Kanto-or540.html?filterLang=en,Royal Park Hotel,"December 3, 2012","Many times, I stayed in this Hotel and you start knowing all the details and you recognize the staff. it is very well located, 2 minutes walking from the TCAT (direct Bus from Narita Airport into Tokyo). Being so far way from home it is important the feeling as being at home. My trips to Tokyo are all about business and coming back from the meetings in the evening you do not even need to eat out, since the offer of restaurants, the diversity and quality in the Hotel is very good. It is a pleasure to stay here.","Obidos, Portugal","antonio c</div><div class=""userLoc""><strong>Obidos, Portugal</strong>",55,5.0
146651329,https://www.tripadvisor.com/Hotel_Review-g1066444-d307375-Reviews-Royal_Park_Hotel-Chuo_Tokyo_Tokyo_Prefecture_Kanto-or540.html?filterLang=en,Royal Park Hotel,"December 2, 2012","excellent location,wonderful restaurants and staff with a helpful and genuine smile.Being attached to the TCAT makes the journey to and from the hotel so easy. Will definitely return here whenever in Tokyo",Liverpool,"denis s</div><div class=""userLoc""><strong>Liverpool</strong>",2,4.0
146420077,https://www.tripadvisor.com/Hotel_Review-g1066444-d307375-Reviews-Royal_Park_Hotel-Chuo_Tokyo_Tokyo_Prefecture_Kanto-or540.html?filterLang=en,Royal Park Hotel,"November 29, 2012",The Royal Park Hotel is next door to the TCAT limousine bus station and has direct bus links to both Haneda and Narita airport which makes it extremely convenient for overseas business travellers. It is also directly above a Metro station. Within 5 mintes walk is the Sumida river with good walks in both directions along the river bank if you want to escape the crowds of the city. I have stayed here many times over the past few years and the hotel has continued to upgrade its rooms and amenities to ensure that it always feels fresh and new. There is complimentary wi-fi available throughout the hotel. The buffet breakfast choice is good.,"Manchester, United Kingdom","isaacparkin</div><div class=""userLoc""><strong>Manchester, United Kingdom</strong>",25,5.0
146102230,https://www.tripadvisor.com/Hotel_Review-g1066444-d307375-Reviews-Royal_Park_Hotel-Chuo_Tokyo_Tokyo_Prefecture_Kanto-or540.html?filterLang=en,Royal Park Hotel,"November 24, 2012","I have been using this hotel for over 20 years, and since I stay at least 4 times a year, I am guaranteed a warm welcome.Unlike many Tokyo hotels, the Royal park is small enough to feel cosy, though has a wide range of restaurants and bars.The rooms, particularly on the executive floors are fine for a weeks stay, and the bathrooms have large baths, and even a neck pillow - a first in any hotel I have stayed in.The Executive floor is worth the extra, as you get Breakfast, use of the lounge all day for coffee and snacks and in the eveniing 3 hours of drinking !!! Also included is Wifi and use of the Gym and pool.The pool in particular, is a wonderful way to release the stresses of business travel. After a water workout, the sauna and plunge bath are not to be missed.","Godalming, United Kingdom","domtheirishman</div><div class=""userLoc""><strong>Godalming, United Kingdom</strong>",64,5.0
145919623,https://www.tripadvisor.com/Hotel_Review-g1066444-d307375-Reviews-Royal_Park_Hotel-Chuo_Tokyo_Tokyo_Prefecture_Kanto-or540.html?filterLang=en,Royal Park Hotel,"November 21, 2012","My wife and I stayed at the Royal Park for six weeks on business in October and November 2012. We had a fantastic stay at this wonderful hotel. The staff at the hotel were the amazing and the best I have come across anywhere in the world. Without exception they were always friendly, courtesy and helpful. A special mention must go to the ladies in the Executive floor who were so helpful and genuinely warm and friendly to us. I would strongly recommend anyone staying at the Royal Park to upgrade to an Executive room so as to have breakfast, use of the spa and Executive lounge included. The breakfasts were excellent, both on the ground floor and 20th. We ate at the hotel's Chinese and Teppanyaki restaurants. The Chinese was good and the Teppanyaki excellent. The Orpheus Sky Lounge is a great place to unwind over a cocktail and enjoy the fantastic views. The location of the hotel is good, with plenty of excellent and varied restaurants within a five to ten minute stroll. I would thoroughly recommend this hotel to anyone visiting Tokyo.","Alcalali, Spain","David_L-M22</div><div class=""userLoc""><strong>Alcalali, Spain</strong>",1,5.0
145876992,https://www.tripadvisor.com/Hotel_Review-g1066444-d307375-Reviews-Royal_Park_Hotel-Chuo_Tokyo_Tokyo_Prefecture_Kanto-or545.html?filterLang=en,Royal Park Hotel,"November 21, 2012","The location of the hotel is very vonvenient because it s very close to the TCAT, directly connected to the Metro and also centrally located in Tokyo. At my arrival I was told that I had been upgraded to benefit from the facilities of the business lounge, incl.complimentaryuse of the spa (ppol, sauna, gym). I made frequent use of this wonderfulk opportunity. offer. The room itself (1526) was a bit small compared to other hotels of this category. (i.e. Hilton, Imperial, etc.) The room service was fine and never disturbing. I can recommend the Royal Park Hotel to other visitors without any limitations.  ",Tokyo,"Safari412346</div><div class=""userLoc""><strong>Tokyo</strong>",0,4.0
145858303,https://www.tripadvisor.com/Hotel_Review-g1066444-d307375-Reviews-Royal_Park_Hotel-Chuo_Tokyo_Tokyo_Prefecture_Kanto-or545.html?filterLang=en,Royal Park Hotel,"November 20, 2012","Stayed here for 2 nights. This hotel can be pricey, but you could find good discounted rates online. Conveniently located next to TCAT (Tokyo City Air Terminal), which gives you access to Haneda or Narita using the Limo bus service. The Hotel is located above the Tokyo Metro Suitengumae station, so makes it so convenient to take the subway. Mitsukoshi Dept Store is located just one station away.Concierge staff is very helpful in planning travel and your way around Tokyo using the subway. They are also helpful assisting you planning your trip to the airport just going across the street to the T CAT. Tip, have cash to buy your ticket at Limo bus to either Haneda or Narita. I do not think this Limo bus station takes credit cards. Rooms are Ok, but are well overdue for a refurbish or remodel. Still clean and decent, but show aging. Size is small, but probably what you expect in Tokyo small size rooms. TV selection is poor for westerner. One great thing is that they have a bank Seven (Seven Eleven) ATM. Your overseas ATM card will work there. Japanese banks ATMs do not work with overseas cards. You can only make your overseas cards work at seven eleven stores, postal office ATMs, and I was told Chase bank, but I did not try it.Overall all personal is friendly, polite, courteous, and helpful, accommodating your needs, like you would find of any Japanese. The only one that might not be as friendly is the only Western lady that works there, but she does not do a bad job either. Restaurants are nice, Gym is really good as well as pool. Street were hotel is locates seems safe and there are a couple of convenience stores, which makes it easy to buy snacks. There is a Mc Donalds across the street on the T CAT station.Breakfast buffet is decent not really extraordinary not bad either. It has both Western and Japanese options. Stick with the Omelet station which is the best feature of this breakfast buffet. The rest is OK, not memorable.Location is great for business. Maybe for a vacation, but if for a vacation trip, I would stay on the Ginza or Roppongi area. There are some not so pricey decent boutiques hotel that would be also a good choice","Riverside, California","ericuchon</div><div class=""userLoc""><strong>Riverside, California</strong>",178,4.0
145498992,https://www.tripadvisor.com/Hotel_Review-g1066444-d307375-Reviews-Royal_Park_Hotel-Chuo_Tokyo_Tokyo_Prefecture_Kanto-or545.html?filterLang=en,Royal Park Hotel,"November 15, 2012","The hotel is excellent. Very luxury, very posh.A very good selection of different restaurants.Everything is very clean, very good service !The staff is helpfull with good English skills.The direct connection to the TCAT is very convenient.","Darmstadt, Hessen, Germany","woluda</div><div class=""userLoc""><strong>Darmstadt, Hessen, Germany</strong>",6,5.0
145047207,https://www.tripadvisor.com/Hotel_Review-g1066444-d307375-Reviews-Royal_Park_Hotel-Chuo_Tokyo_Tokyo_Prefecture_Kanto-or545.html?filterLang=en,Royal Park Hotel,"November 9, 2012","My business associate and I needed 2 last minute rooms while we were in Tokyo the first week of October and we walked in and the assistant manager took care of us right away...even set us up with a great rate. Hotels (or anywhere for that matter) with wifi are very few and far between in Tokyo. RP has it complimentary. Breakfast buffet is always wonderful and I always love how easy it is to jump on the train from below the hotel. If you want to walk to Ningyo-cho station it's about 5 minutes but as long as you know where you are going, catching the train from below the hotel, Suitengu, is nothing short of awesome. Thanks again, Royal Park.","Vancouver, Canada","80sguy_10</div><div class=""userLoc""><strong>Vancouver, Canada</strong>",3,5.0
144888826,https://www.tripadvisor.com/Hotel_Review-g1066444-d307375-Reviews-Royal_Park_Hotel-Chuo_Tokyo_Tokyo_Prefecture_Kanto-or545.html?filterLang=en,Royal Park Hotel,"November 7, 2012","Stayed at this hotel many, many times over the past 20 years and never regretted it. perhaps the greatest feature is its location as it is on the edge of Tokyo closest to Narita and Haneda Airports and connected to the Tokyo City Air Terminal. This means no traffic coming in or going out on the Limousine Bus.Recently upgraded many of the rooms. Workout facility never crowded and one of the best indoor pools in Tokyo.Subway into city accessed via elevator underground.","San Diego, California","slappy_12</div><div class=""userLoc""><strong>San Diego, California</strong>",0,5.0
144589248,https://www.tripadvisor.com/Hotel_Review-g1066444-d307375-Reviews-Royal_Park_Hotel-Chuo_Tokyo_Tokyo_Prefecture_Kanto-or550.html?filterLang=en,Royal Park Hotel,"November 5, 2012","Convenient location, good service, helpful staff, clean rooms. Stayed for 9 days, would be good if breakfast buffet spread could be varied instead of serving same daily. The first hotel I stayed in that charges for gym usage, and don't provide complimentary bottled water.",,Paulgui,10,5.0
143783553,https://www.tripadvisor.com/Hotel_Review-g1066444-d307375-Reviews-Royal_Park_Hotel-Chuo_Tokyo_Tokyo_Prefecture_Kanto-or550.html?filterLang=en,Royal Park Hotel,"October 26, 2012","I have stayed at this hotel twice this past week. First time I was given a lovely room with nice outlook. Services both time were impeccable The thing to watch is when you check in is they try to sell you additional packages. In all my travels I have never had to pay to use a hotel gym. Seems to be a Japanese thing.I paid 4000 yen for club access, late check out and breakfast.On my first stay earlier this week after I had to wait 45 minutes for breakfast entry so finally gave up and went down the road for a delicious local breakfast of 160yen.This is my second stay this week after a side trip to osaka and once again paid the 4000 yen.Tonight I couldn't find a seat at the club lounge which is part of the package as there seemed to be big groups of people taking all the chairs leaving none for the long traveller. Basically I was told to come back later......not sure how much later as it is only had an hour to run Now I just rang reception to confirm my 3pm check out to be told I couldn't have it as my room is booked and I have to be out by midday !So beware of the up sell where they don't deliver",Sydney,"BigMacca0_0</div><div class=""userLoc""><strong>Sydney</strong>",11,2.0
143676516,https://www.tripadvisor.com/Hotel_Review-g1066444-d307375-Reviews-Royal_Park_Hotel-Chuo_Tokyo_Tokyo_Prefecture_Kanto-or550.html?filterLang=en,Royal Park Hotel,"October 25, 2012","We had 3 nights on the Exec Floor which included breakfast. Room was a good size, including a desk, chair and footstool. Check in for the Exec floors was on the 16th floor where you got to sit down and refresh with a cold washer (cloth/flannel depending what you call it). Could also purchase metro passes, one or two days from here too, which surprisingly were cheaper than you could get them from the metro itself. Best way to move around city.We arrived by metro to Suitegumae Station, walked to exit 4 and there was the entrance (side entrance) to the hotel. Breakfast each morning was on the 20th floor with a great view of the city and a great range of foods to choose from. Staff were very courteous and spoke English all the time.The train line we came in continued onto the Tokyo Skytree so very handy.Ate at the Chinese restaurant on the ground floor, beautiful food but quite pricey. There were coupons we could us at certain restaurants in the hotel but they all included fish which we dont eat.Used the gym once. It opened at 6am which is a bit late since breakfast finishes with last orders 8:30am. Small exercise area but huge stretching room.",Brisbane,"BrisbaneRaewyn</div><div class=""userLoc""><strong>Brisbane</strong>",94,5.0
143648927,https://www.tripadvisor.com/Hotel_Review-g1066444-d307375-Reviews-Royal_Park_Hotel-Chuo_Tokyo_Tokyo_Prefecture_Kanto-or550.html?filterLang=en,Royal Park Hotel,"October 24, 2012","The hotel is very well located, in particular its adjacent to the Tokyo City Air Terminal making connections to the airport via bus very easy. The overall feel of the hotel is one of quiet luxury, all the staff is very accommodating and gracious. The rooms themselves are 'OK', they are not large, but well laid out. Soundproofing is excellent. The decor is, however, dated and starting to feel a bit run down. The gym and restaurants are great.","Boston, Massachusetts","boston65</div><div class=""userLoc""><strong>Boston, Massachusetts</strong>",19,4.0
