review_id,url,hotel_name,review_date,review_body,user_location,user_name,helpful_vote,rating
469826903,https://www.tripadvisor.com/Hotel_Review-g60982-d227765-Reviews-The_Surfjack_Hotel_Swim_Club-Honolulu_Oahu_Hawaii-or770.html?filterLang=en,The Surfjack Hotel & Swim Club,"March 24, 2017","The Surfjack has a great vibe. Although it is tiny compared to other resort-style hotels in Honolulu, the rooms are clean and well-stocked, the staff is attentive and well-trained, and the amenities are plentiful. From the chic artwork and whimsical details in the lobby, it's obvious that the owners have considered how to maintain a fun and relaxing ambience without sacrificing the functional charm of an excellent boutique hotel. Our room was large, immaculate, and featured nice conveniences like USB charging stations and a huge balcony with deck chairs, although it looked directly onto the neighboring apartment building. The bathroom was small but had an excellent shower with great water pressure and regularly refilled bath products. Big props to the wonderful housekeeping staff. The Surfjack is located a few blocks from the busier, more touristy beachfront areas. This was great since we wanted to explore the city and not simply plant ourselves in the sand. There were convenience stores, shops, bars and restaurants just steps away. The onsite restaurant and bar, Mahina and Sun's, was also great, with a locally-sourced menu. It was also often busy, so make reservations in advance. The only minor issue I had with the Surfjack was the various unforeseen charges added to our bill. Valet parking, morning coffee, beach towels, bicycles—they were all provided but required daily fees. With some added consideration for budget-conscious travelers, the Surfjack would really be the perfect hotel.","Brooklyn, New York","Adnan L</div><div class=""userLoc""><strong>Brooklyn, New York</strong>",13,4.0
469279942,https://www.tripadvisor.com/Hotel_Review-g60982-d227765-Reviews-The_Surfjack_Hotel_Swim_Club-Honolulu_Oahu_Hawaii-or770.html?filterLang=en,The Surfjack Hotel & Swim Club,"March 21, 2017","A last minute stay turned in to a delightful surprise. Really beautifully appointed, extremely clean rooms wth great food at the onsite restaurant. Ideal location to walk to everything. Really exceptional customer service too.","Edinburgh, United Kingdom","Mirabibble</div><div class=""userLoc""><strong>Edinburgh, United Kingdom</strong>",9,5.0
469037799,https://www.tripadvisor.com/Hotel_Review-g60982-d227765-Reviews-The_Surfjack_Hotel_Swim_Club-Honolulu_Oahu_Hawaii-or775.html?filterLang=en,The Surfjack Hotel & Swim Club,"March 21, 2017","This place was hands down the best Hotel I've ever stayed at. From the moment you pull up all the way through check out was a great experience. The staff, rooms, pool, restaurant, food and all of the above was just outstanding. The Staff (especially Benjamin) was absolutely amazing. They cared for us like we were family. We also had the opportunity to ride beach cruiser bikes around the strip which is amazing. So instead of driving we used bikes and they also provided us with bike locks. I can't thank the staff enough for the hospitality and the treatment we received at this Hotel. Also awesome live music by the pool an art gallery and even the location of the hotel is awesome!! Just an endless list of awesomeness about this Hotel. Thanks again for making our couples weekend a weekend we will never forget.",,Kevin R,1,5.0
469037431,https://www.tripadvisor.com/Hotel_Review-g60982-d227765-Reviews-The_Surfjack_Hotel_Swim_Club-Honolulu_Oahu_Hawaii-or775.html?filterLang=en,The Surfjack Hotel & Swim Club,"March 21, 2017","The Surfjack has excellent service, beautiful rooms, and the overall atmosphere is amazing!! It's a relaxing spot filled with ALOHA The staff were all oh so kind and helped in every way that we requested. This is definitely now our go to place!! My husband and I loved that the hotel offered the ability to take cruiser bikes out for a ride downtown. We took a ride around and it was an awesome experience. Love love love this place! The restaurant Mahina and Suns was superb. Once again the waiters were so sweet and the food was so delicious!! I have nothing negative to say about this place.",,lexylex28,1,5.0
468663713,https://www.tripadvisor.com/Hotel_Review-g60982-d227765-Reviews-The_Surfjack_Hotel_Swim_Club-Honolulu_Oahu_Hawaii-or775.html?filterLang=en,The Surfjack Hotel & Swim Club,"March 19, 2017","I almost don't want to write this because I'd hate to have this hotel get oversold during my next trip. By far, the best boutique hotel I've ever stayed in. The hotel rooms are great, close to everything, free bike rentals and the staff is amazing! Huge props to: Jordyn, Kenny, Sai, Robbie, Benjamin and the awesome server from Korea (I can't remember her name unfortunately- but she's fabulous).Again, highly, highly recommended... just please don't visit when I need to stay there :)","Encinitas, California","elizabethcarlin2011</div><div class=""userLoc""><strong>Encinitas, California</strong>",2,5.0
468181822,https://www.tripadvisor.com/Hotel_Review-g60982-d227765-Reviews-The_Surfjack_Hotel_Swim_Club-Honolulu_Oahu_Hawaii-or775.html?filterLang=en,The Surfjack Hotel & Swim Club,"March 17, 2017","I usually stay at another hotel in Waikiki, but decided to give the SurfJack a try after reading some of the reviews. So far it has been great, friendly staff and bar. The rooms are small but quaint. Nice spacious bathroom and bedroom. Showers have great water pressure. 2 free bottles of water each day, free wifi, awesome pool beside bar, and free beach towels you must return. Overall a great experience. ",,Joseph S,2,5.0
468130149,https://www.tripadvisor.com/Hotel_Review-g60982-d227765-Reviews-The_Surfjack_Hotel_Swim_Club-Honolulu_Oahu_Hawaii-or775.html?filterLang=en,The Surfjack Hotel & Swim Club,"March 17, 2017","We enjoyed staying at the Surfjack. It is a smaller property than I expected and it is about a 10 minute walk to the beach. We enjoyed how friendly it was. There is a little refrigerator and it is next door to the ABC Store so we were able to have cereal and milk, yogurt, wine, etc. There are two bedrooms and a small lounge so everyone had their own space. There is one bathroom. I would happily stay there again. ","Kansas City, Missouri","ClarissaHarlowe</div><div class=""userLoc""><strong>Kansas City, Missouri</strong>",2,5.0
467664311,https://www.tripadvisor.com/Hotel_Review-g60982-d227765-Reviews-The_Surfjack_Hotel_Swim_Club-Honolulu_Oahu_Hawaii-or780.html?filterLang=en,The Surfjack Hotel & Swim Club,"March 15, 2017","My wife and I stayed at the Surfjack for a family vacation.ALL of the staff there are great: Dexter, Sai, Kenny, Roberto with the man bun (he likes to be acknowledged for his man bun), and Zack our server at Mahina & Sun’s.THE FOOD AT MAHINA & SUN’S IS AMAZING. The poke dish with the spicy tuna is one of the best food I've had in my life. I've been craving for it since we left. The dish was so excellent and so well-balanced. Every forkful had just the right amount of balance of flavor.My wife gave me some of her food to try (she got the vegetarian poke dish), but it threw the balance off my plate. What I'm trying to say is the dish was already well-balanced, that I didn't need to add anything else to my plate and ruin the palate the chef already designed in that dish. I hope that makes sense.I especially loved that all of the ingredients are fresh, organic, and locally sourced right there. Zack, our server, was SO helpful. My wife and I just got off our early flight, feeling sleepy and hungry at the same time. We were up since 4am PST. He served us promptly, and we felt so relaxed for our lunch.He talked with us, and gave us SO many helpful tips on exploring Waikiki, he answered all of my questions with confidence and helpfulness.It was my first time in Hawaii (my wife's fourth or fifth time), and Zack was the best person to welcome me to Hawaii for the first time.We liked the food so much that when the rest of our family flew in the next day, we invited them to join us at Mahina & Sun's. I had the same dish (poke with spicy tuna).We considered other food options in Waikiki, but they seemed either too expensive or didn't feel authentic for what we were looking for. Which was a more of a local flavor and dish, not something like P.F. Chang that we can eat back at home.Okay, enough about the food.The hotel itself was a real pleasure to stay in. We couldn’t afford of any of the high-end hotels near the beach, but you know what, we really liked the Surfjack. The Surfjack felt like a real treasure to find in the middle of Waikiki, where you have all of these high-end resort hotels to chose from. It felt more low-key, the ambiance and decor was fresh and new. It felt more dynamic. We would’ve missed out on that if we went to a more polished and scrubbed high end hotel. The lounging furniture is a real nice touch. You can order drinks and food from there tool. The interior decor of the rooms are pleasant, fresh, and laid-back. In fact, my wife and want to design our living room now like the room we stayed in. We loved it that much.My wife and I would highly recommend this place to anyone we know that will be visiting Waikiki in the future, even if they don't end up staying at the Surfjack.And we'll definitely want to come back to Mahina & Sun's.","Garden Grove, California","Mokuahi</div><div class=""userLoc""><strong>Garden Grove, California</strong>",3,5.0
467653163,https://www.tripadvisor.com/Hotel_Review-g60982-d227765-Reviews-The_Surfjack_Hotel_Swim_Club-Honolulu_Oahu_Hawaii-or780.html?filterLang=en,The Surfjack Hotel & Swim Club,"March 15, 2017","What an amazing stay! I couldn't have ask for more! This hotel is chic/cool/with great vibe and good value for your $$$. NOTE: Call the front desk first thing in the morning and have a fresh cup of coffee delivered to your room. That first sip will change everything! Awesome staff, great restaurant (Mahina & Sun's - voted Best New Restaurant 2017) and coffee/gift shop on-site, rooms are trendy and very comfortable! THE place to stay in Waikiki! Highly recommended!!!!!","Honolulu, Hawaii","Danilo C</div><div class=""userLoc""><strong>Honolulu, Hawaii</strong>",1,5.0
467595234,https://www.tripadvisor.com/Hotel_Review-g60982-d227765-Reviews-The_Surfjack_Hotel_Swim_Club-Honolulu_Oahu_Hawaii-or780.html?filterLang=en,The Surfjack Hotel & Swim Club,"March 15, 2017","Surfjack is good! Great location. Next to the best Thai food in the city. Walking distance to almost everything in Waikiki. Attention to detail within the room and service is stellar. As soon as the valet collects your car, you are whisked off to a comfortable seating area with a beverage to be checked into the hotel. You walk by the ""wish you were here"" pool to the elevator. 50's beach decor. Dimmer and auto lights on each switch. Even in the closets. All the drawers in the room were soft close. The mini fridge is stocked daily with complimentary bottles of water. I've taken notes of the bathroom finishes for our own renovation. As close to natural light for a vanity as any makeup artist can ask for since my bathroom did not have a window. The river stone floored shower massages weary feet while the perfect temperature and pressure of the stream soothes away a day's work. Davine products! Try to get a room in higher floors facing the pool then you'll love it. Only thing is no tub. And call down for your car before heading down. Otherwise valet may be a wait. As a hotel guest, you are entitled to $10 dining credit for each night's stay which does not apply to the coffee/gift shop. Recommended. ","Los Angeles, California","D9047CQsarahw</div><div class=""userLoc""><strong>Los Angeles, California</strong>",53,4.0
467405590,https://www.tripadvisor.com/Hotel_Review-g60982-d227765-Reviews-The_Surfjack_Hotel_Swim_Club-Honolulu_Oahu_Hawaii-or780.html?filterLang=en,The Surfjack Hotel & Swim Club,"March 14, 2017","I did a last minute booking for a stopover on the way to New Zealand from Canada, and was really just looking for a reasonable place to sleep for a couple of nights, near the heart of things. The Surfjack well exceeded our expectations. We had a couple of one-bedroom suites which were roomy, airy, light and beautifully decorated. We loved the mid-century modern vibe of the whole hotel. The bathroom amenities were lovely, and the beds comfy. We ate at the restaurant for dinner and the pizza was fantastic, as was the service.What I really need to do is commend the staff. Each member was above and beyond friendly. They were accommodating to my dad's needs (he's in a wheelchair), and super helpful in every possible way. We had a great time hanging by the pool during the day and listening to the DJ. While this place isn't on the beach, it's an easy walk. I will never stay anywhere else in Honolulu in the future (assuming I can get a room here, as I'm sure it's going to get very popular). We actually stayed again on our way back from NZ, as we loved it so much. Many thanks to all the great staff.",Vancouver,"FairviewVancouver</div><div class=""userLoc""><strong>Vancouver</strong>",14,5.0
467372462,https://www.tripadvisor.com/Hotel_Review-g60982-d227765-Reviews-The_Surfjack_Hotel_Swim_Club-Honolulu_Oahu_Hawaii-or780.html?filterLang=en,The Surfjack Hotel & Swim Club,"March 14, 2017","At first I was a little concerned as we were traveling as a group of 8 (2 of them being 8 and 10) but this is a great little gem! PROS: 1. Staff were all amazing and super friendly 2. Small property so you got to know other travelers and the staff3. The food was great 4. Coffee available downstairs every morning5. Rooms were smaller but perfect for sleeping, showering and chilling before bed. We had a 2 bedroom suite for 6 of us (4 adults and 2 kids). 6. Great location (short walk to the beach and the main strip) 7. Good pool - sometimes it got busy so there wasn't always lounge chairs available but there was always somewhere to sit near the pool (tables, couches) 8. The hotel provides towels for the pool and the beach CONS (not much of one): 1. Kids were not allowed in the pool after 5pm - this caused my kids to get a little upset. It is adult time from 5-9pm but there was NEVER anyone in the pool during that time. 2. Have to pay for parking","Sherwood Park, Canada","LaurenV633</div><div class=""userLoc""><strong>Sherwood Park, Canada</strong>",36,5.0
467116298,https://www.tripadvisor.com/Hotel_Review-g60982-d227765-Reviews-The_Surfjack_Hotel_Swim_Club-Honolulu_Oahu_Hawaii-or785.html?filterLang=en,The Surfjack Hotel & Swim Club,"March 13, 2017","Surf jack is the most exciting and new experience to happen in Honolulu! Amazing value and perfectly placed close to the shops and wikkii beach. This cool retro vibe hotel feels like home with every tiny detail, keeping its Hawaiian heritage at its roots, each room perfectly bespoke. I'm a solo traveller and feel like family, very sad to leave but after this review hoping for the penthouse next time lol. Food amazing!! Live music every night, bicycles free to go and explore the island don't do too many hills though... best cocktail on the menu is 'uncles punch' apparetly made from Agricole another thing I've learnt yum. Shout out to Marshall the bar tender who knows everything there is to know about fish Dreams are made of surfjack","Melbourne, Australia","Saravasey</div><div class=""userLoc""><strong>Melbourne, Australia</strong>",16,5.0
467067292,https://www.tripadvisor.com/Hotel_Review-g60982-d227765-Reviews-The_Surfjack_Hotel_Swim_Club-Honolulu_Oahu_Hawaii-or785.html?filterLang=en,The Surfjack Hotel & Swim Club,"March 13, 2017",We only stayed here for one night which is unfortunate because it's an awesome hotel!! The only negative reviews on here I can only assume are from an older crowd. This hotel is super trendy and really good value. The food is awesome and has a great coffee shop downstairs. The atmosphere was awesome and a lot of younger people downstairs. Also suitable for couples with children however the pool resets at 5:30pm at which time all children must be out of the pool for adults only time. Wish we had of stayed here the whole trip. ,"Brisbane, Queensland, Australia","372shaunaa</div><div class=""userLoc""><strong>Brisbane, Queensland, Australia</strong>",20,5.0
467041876,https://www.tripadvisor.com/Hotel_Review-g60982-d227765-Reviews-The_Surfjack_Hotel_Swim_Club-Honolulu_Oahu_Hawaii-or785.html?filterLang=en,The Surfjack Hotel & Swim Club,"March 13, 2017","Just came back from this hotel last week... Place is perfect. Old throw back style, not pretentious but super chill and laid back... Great restaurant and bar on site, super dope rooms with great modern touches... This is now the only place I'd stay in Honolulu...Kennie the front desk was super cool and helpful, and they have the islands best coffee... Id 1000% recommend this place to anyone. ","Whitby, Canada","Jeff C</div><div class=""userLoc""><strong>Whitby, Canada</strong>",64,5.0
467029806,https://www.tripadvisor.com/Hotel_Review-g60982-d227765-Reviews-The_Surfjack_Hotel_Swim_Club-Honolulu_Oahu_Hawaii-or785.html?filterLang=en,The Surfjack Hotel & Swim Club,"March 13, 2017","My boyfriend and I planned our first Hawaiian vacation without much knowledge of where to go or stay. We did some research and spoke to some people who had travelled to Hawaii and decided on Oahu and Maui. Our trip started in Oahu at the Surfjack Hotel. Our flight arrived late in the evening so we did not get to the hotel until approximately midnight. There were staff on hand that greeted us with a smile and got us settled. The Hotel itself is very cool and our 1 bdrm suite was awesome! Very clean and unique. We overlooked the pool, such a great view. They told us at check in that coffee was free until 11am each day and that it was the best coffee in town. They weren't wrong. It was literally THE best coffee I've had in my life and that says a lot! We spent some time on Waikiki Beach and shopping in the district, all of which is walking distance to the Surf Jack Hotel. The beach is beautiful and the shops are plentiful. A lot of luxury shopping and the food was pricey. We found Waikiki in general to be pretty commercialised. We rented a car one day and drove up to the North Shore which we HIGHLY recommend. Here you will get a true sense of the beauty of Oahu. We stumbled upon a little macadamia nut farm, stopped at a number of surf beaches to watch the surfers and of course hit Giovanni's shrimp truck! This is a MUST do. Best shrimp ever. We also did the Oahu Falls hike which was pretty cool with all the bamboo trees. We flew Island Air over to Maui after 3 days in Oahu. Although we enjoyed our time at Waikiki beach, Maui is hands down more our speed. We absolutely loved our stay at Surf Jack and would highly recommend this hotel if you are going to visit Waikiki!","Whitby, Canada","Tammietown</div><div class=""userLoc""><strong>Whitby, Canada</strong>",6,5.0
466962518,https://www.tripadvisor.com/Hotel_Review-g60982-d227765-Reviews-The_Surfjack_Hotel_Swim_Club-Honolulu_Oahu_Hawaii-or785.html?filterLang=en,The Surfjack Hotel & Swim Club,"March 13, 2017","What a treat! Could not imagine a better experience for my first trip to Hawaii. The Surfjack, Mahina and Suns (restaurant), and Oliver (café/shop) teams are incredible. A big Mahalo to you all!!! Can't wait to come back for an ahi poke bowl, spicy margarita, and a dip in the pool. Avocado tacos too, obviously! You all rock and make the whole experience fantastic. See you next year? Heck yeah!","Astoria, New York","maynardelvis</div><div class=""userLoc""><strong>Astoria, New York</strong>",0,5.0
466588880,https://www.tripadvisor.com/Hotel_Review-g60982-d227765-Reviews-The_Surfjack_Hotel_Swim_Club-Honolulu_Oahu_Hawaii-or790.html?filterLang=en,The Surfjack Hotel & Swim Club,"March 12, 2017","Hello! We had such a fabulous stay at The Surfjack Hotel last week! Wish we were still there! We had been deciding between saving a bit of money and staying a few blocks in from the water or splurging on an oceanfront hotel with higher (and annoying) resort fees. Well, once we found out about the Surfjack, we decided to try it out, save some money (which went toward some delicious Poke Bowls at Mahina and Suns...), and don't regret it one bit! What I loved the most was the brand new, hip, retro beach style interior, cleanliness, fabulous location (about a 5 min walk from the beach), and AWESOME STAFF! Thanks so much guys! p.s. the shower in our room was sooooooo cool! p.p.s. a few other perks: they brought coffee to our room, had beach towels and a tote to use, it was a great hangout spot for my hungry family who had just flown in and was picking us up to move on to Kailua for the rest of our Hawaii stay. The servers at Mahina and Suns (Zach and a lovely woman from Canada) were just phenomenal - I tried my first Poke bowl (don't like fish) but loved the root/veggie version and ate it the next day! Anyways, hope to come back soon! Mahalo!","Orange County, California","mayathewestie</div><div class=""userLoc""><strong>Orange County, California</strong>",0,5.0
466431695,https://www.tripadvisor.com/Hotel_Review-g60982-d227765-Reviews-The_Surfjack_Hotel_Swim_Club-Honolulu_Oahu_Hawaii-or790.html?filterLang=en,The Surfjack Hotel & Swim Club,"March 11, 2017","Recently stayed at The Surfjack and already planning my return for next year. These guys really know what they're doing. From the moment you arrive you're made to feel special ... your made to feel like a guest! Nothing is a bother; staff incredibly attentive and it's not just lip service, there's a genuine warmth at Surfjack. The creative detail, the eclectic retro designs are amazing. You get the sense you've walked on to the set of a 60's Elvis Hawaii movie. It's obvious a great deal of thought has gone into creating the right vibe at Surfjack and I must say they've nailed it! The Restaurant dining is delicious, the local chef is renowned for using super fresh local produce. The food is so good Barack and Michelle Obarma recently dined there. If you want to experience a super relaxed holiday vibe surrounded by people who do the guest experience exceptionally well, then this is the place to come. Within easy walking distance to the beach (5 min) and downtown Waikiki. Check out the delicious local Thai restaurant 2 doors down. Mahalo Surfjack, see you again next year. ",Honolulu,"helenpS7386ZH</div><div class=""userLoc""><strong>Honolulu</strong>",0,5.0
466384620,https://www.tripadvisor.com/Hotel_Review-g60982-d227765-Reviews-The_Surfjack_Hotel_Swim_Club-Honolulu_Oahu_Hawaii-or790.html?filterLang=en,The Surfjack Hotel & Swim Club,"March 11, 2017","We came for business and pleasure from Maui and loved this hotel. The staff was fantastic - after only 3 days they knew our names and we did theirs. Sad to leave - we will come back. Mahalo Chenny, Benjamin, Sai, Robert, Haley Star, Clifford and everyone else who makes staying there special!","Makawao, Hawaii","CudraClover</div><div class=""userLoc""><strong>Makawao, Hawaii</strong>",0,5.0
466213053,https://www.tripadvisor.com/Hotel_Review-g60982-d227765-Reviews-The_Surfjack_Hotel_Swim_Club-Honolulu_Oahu_Hawaii-or790.html?filterLang=en,The Surfjack Hotel & Swim Club,"March 10, 2017","Had a great stay at Surfjack in waikiki. Such a wonderful base for time in waikiki and too escape back here after being amongst the hussle is just perfect. Boutique hotel with retro hawaiin vibe which is magic. Its so not big corporate hotel and the masses. On arrival the team realised it was our honeymoon and we got upgraded straight away. Room was great and thanks guys for looking after us.Resturant is all fresh custom made and cooked food with live music on basically each nite. Compared to whats around in waikiki , which is all about big and mass tourist crap, this place is cool and a real blessing. Perfectly central location to all waikiki has to offer. Staff very attentive and want to be there. That says a lot about the pkace. Well done guys.But sshhhhhh. Dont tell to many cause i want to stay again !!Highly recommend. P.s. The jack coffee is best in oahu. My opinion :) ","Penrith, Australia","rppv</div><div class=""userLoc""><strong>Penrith, Australia</strong>",27,5.0
466110062,https://www.tripadvisor.com/Hotel_Review-g60982-d227765-Reviews-The_Surfjack_Hotel_Swim_Club-Honolulu_Oahu_Hawaii-or790.html?filterLang=en,The Surfjack Hotel & Swim Club,"March 10, 2017","Room 546 has a nice view of the center courtyard, great for selfies or overhead shot of the pool! Front Desk answered any and all random questions I had. Quite accomodating in my normal, but excessive requests. Handy to have the microwave and electric kettle in the room. My friend and I enjoyed breakfast at the restaurant on my last day of stay. fresh and locally sourced ingredients made my meal delicious. I cannot say enough wonderful things about Kenny, Robbie and Sai! So gracious.Esthel made our stay comfy and clean. Happy to be left such sweet notes when returning to the hotel after a day out.Only thing I can complain about is the Ricotta Toast, it just wasn't my friend's jam. (Get it? Since it is topped with local jam? Nevermind...)",,Kay S,2,5.0
