review_id,url,hotel_name,review_date,review_body,user_location,user_name,helpful_vote,rating
543233987,https://www.tripadvisor.com/Hotel_Review-g60982-d227765-Reviews-The_Surfjack_Hotel_Swim_Club-Honolulu_Oahu_Hawaii-or545.html?filterLang=en,The Surfjack Hotel & Swim Club,"November 25, 2017","I work in hospitality and, currently, with large corporate groups at resorts and boutique properties in San Diego. So, I hope, there's a little bit of credibility in this review.The Surfjack is easily the best boutique hotel I've ever visited. The team is amazing: incredibly warm--they knew my entire party by name before we arrived (we were 3 rooms and 5 guests); they were incredible on the phone; and genuinely seemed stoked that we'd be staying with them. Over the course of my 7 days, I found myself drifting to the front desk just to talk for a minute. I feel bad that I haven't called to say hello, or sent a card. They are really that good. All of our rooms were immaculate, and returned to that state every day. And, even more, they look exactly like the photos on their website. Beds are comfortable, bathrooms are spacious, and the rooms just feel lovely. We stayed in suites and loved them. I, for one, loved my time in O'ahu, and largely account that to our time at The Surfjack. I often find myself sighing and thinking ""I want to go back home to the Surfjack"".Waikiki is lovely, and it is the easiest gateway to beautiful O'ahu, but it is also flush with tourists like Florence in August. The Surfjack is positioned beautifully in Waikiki: you can be in the middle of it with a 5 minute walk, yet easily escape to the big city of Honolulu and the reset of the island. It is a place to take a breath and enjoy your vacation.Marina & Sun's is great: essential dining in Waikiki right downstairs. I ate 2/3 of my meals with them. Not a touch of regret: they were consistently the best meals of my trip. One night I walked around for 2 hours looking for a quiet and civilized place for a cocktail. I returned back to the hotel to realize that I'd been walking around looking for Mahina & Sun's--this is no hyperbole. The cocktail program is great, the team at M&S treated us like old friends, and always seemed legitimately happy to see us. And this is really what makes the Surfjack so great: the entire place is open to you. The entire team wants you there: not just some guest, not your money--You. They want you to be there. They want to host you, and greet you. This is embodied in the openness of the hotel's design; the cabanas that don't need reservations; the blurring between inside & outside; the seamless flow between lobby, pool, cocktail area and restaurant; the onsite/offsite programs; the dining & art recommendations that extend beyond the tourist monster that is Waikiki; and the $10.00 per day dining credit. The entire hotel welcomes you to participate in the swell little happening that is the Surfjack. And you should.","San Diego, California","RevSantos</div><div class=""userLoc""><strong>San Diego, California</strong>",0,5.0
543073661,https://www.tripadvisor.com/Hotel_Review-g60982-d227765-Reviews-The_Surfjack_Hotel_Swim_Club-Honolulu_Oahu_Hawaii-or545.html?filterLang=en,The Surfjack Hotel & Swim Club,"November 24, 2017","My partner and I stayed at the Surfjack for a few nights in November for a holiday in Hawaii and loved it. The hotel room was very clean, spacious and well decorated. The hotel restaurant is awesome and has great food (breakfast, lunch and dinner) and serves nice cocktails as well. All staff are very friendly and helpful.The pool is great, there are quite a few sun chairs for the Surfjack guests and we were always able to get a couple throughout the day. It’s a few mins to walk to the beach but still very close to all of Waikiki’s restaurants, bars etc.Would absolutely stay there again.",,Denise Z,4,5.0
542811581,https://www.tripadvisor.com/Hotel_Review-g60982-d227765-Reviews-The_Surfjack_Hotel_Swim_Club-Honolulu_Oahu_Hawaii-or545.html?filterLang=en,The Surfjack Hotel & Swim Club,"November 23, 2017","The hotel (except parking) and the staff are very good. However, the valet parking is possibly the worst experience of my life as they lost my car key 2 hrs before my flight. As per their records it was as though I had not given them the keys the night before. Additionally they showed zero concern and was doing very little about the situation until I got hotel employees involved. Finally they found the car but without the key so they asked whether we wanted them to break into the car for the things we had left in the car the night before (would break my insurance or if any claims made by rental company). Eventually when I was at the airport and about to board I was informed that they found the keys and would return the car to the rental, the guy on the phone also assured that he would mail the stuff I left in the car - never mailed anything. End of story - if you have a rental car the park somewhere else - DO NOT USE THE HOTEL’S parking ",,Redder02,6,2.0
542560976,https://www.tripadvisor.com/Hotel_Review-g60982-d227765-Reviews-The_Surfjack_Hotel_Swim_Club-Honolulu_Oahu_Hawaii-or550.html?filterLang=en,The Surfjack Hotel & Swim Club,"November 21, 2017","We went to Honolulu as two couples to experience the delights of Hawaii and ended up in the Surfjack as recommended by of holiday supplier and what a good choice it turned out to be.When we arrived late evening we were greeted by Chris at reception who couldn’t do enough to help us. We knew there was not a kettle or microwave in the rooms so we asked if we could have the same, he said most certainly and they would be with us in five mins - at no extra cost! Wow that was a surprise as in the US you are normally charge for any ""extra"".The rooms were clean and fit for purpose, everything worked and the rooms were serviced every day.Downstairs there was a swimming pool, bar, coffee shop and restaurant which all worked well.There was a $25 per day amenities charge which was new to us as being English, apparently this is custom and practice in this part of the world. So for the $25 you get Wifi, pool towels and $10 per day towards your restaurant bill.Adjacent to the hotel entrance there are stores that you can get almost anything day or night such as food and drink. turn left as you come out of the hotel you have the 123 store 30 seconds away, take care you can easily walk straight past it and if you turn right you have the ABC again less the a minuet away.The bus service is excellent and not too expensive, you can get 24 hour hop on hop off tickets, for example if you’re going to Pearl Harbour it works well.In conclusion it is a very friendly quiet and well place hotel and I would recommend it to one and all. Thanks to the staff for making our stay happy and memorable.","Weaverham, United Kingdom","roadless120</div><div class=""userLoc""><strong>Weaverham, United Kingdom</strong>",62,5.0
542521766,https://www.tripadvisor.com/Hotel_Review-g60982-d227765-Reviews-The_Surfjack_Hotel_Swim_Club-Honolulu_Oahu_Hawaii-or550.html?filterLang=en,The Surfjack Hotel & Swim Club,"November 21, 2017","Very nice small, intimate boutique hotel with great customer service. The one bed suite on 5th floor we had was clean and renovated; Music around pool and evenings is very good.We found the hotel's restaurant to be excellent; had lunch and a dinner. Pork adobo bowl for lunch was well prepared. For dinner the Opah was outstanding. They use fresh sourced local ingredients. Hotel is suitable for families with small children; but be careful the pool is slippery; also great place for single couples.While not on the beach the hotel is close to almost everything.The $10 per day credit on the resort fee is nice touch. I would come back to avoid the crowds and tourists at the larger hotels.","Roseville, California","drastler</div><div class=""userLoc""><strong>Roseville, California</strong>",61,4.0
542473598,https://www.tripadvisor.com/Hotel_Review-g60982-d227765-Reviews-The_Surfjack_Hotel_Swim_Club-Honolulu_Oahu_Hawaii-or550.html?filterLang=en,The Surfjack Hotel & Swim Club,"November 21, 2017","I was there for business but I enjoyed the Surfjack! Wonderful service from front desk, housekeeping, and valet! Loved the amenities. The unit was perfect! The bed was very comfortable! Loved the small steamer in the unit!!! Enjoyed the welcome note from housekeeping! Thank you very much for the wonderful service!",,mauigirl8082017,0,5.0
542335693,https://www.tripadvisor.com/Hotel_Review-g60982-d227765-Reviews-The_Surfjack_Hotel_Swim_Club-Honolulu_Oahu_Hawaii-or550.html?filterLang=en,The Surfjack Hotel & Swim Club,"November 20, 2017","Loved our stay at the Surfjack! The rooms are very comfortable, the pool area was nice and the restaurant serves amazing cocktail, breakfast and happy hour specials! They have an artist perform every day and a dj to set the atmosphere! They also lend you beach towels and beach chairs! I would definitely recommend it ! ",,pascaled322,13,5.0
542272020,https://www.tripadvisor.com/Hotel_Review-g60982-d227765-Reviews-The_Surfjack_Hotel_Swim_Club-Honolulu_Oahu_Hawaii-or550.html?filterLang=en,The Surfjack Hotel & Swim Club,"November 20, 2017","Great property, I love the attention and care that goes behind every little detail. The bathroom amenities were great quality. The one bedroom suite was spacious and airy and clean. Comfy bed, spacious shower, upgraded fixtures and complimentary water and snacks. Love the different spaces like the cabanas and lounge seating as well as the coffee place was a hit. The lavender latte was delicious. The staff are friendly, energetic, enthusiastic and add to the overall experience. I highly recommend this property to Hawaii visitors or local residents (they offer Kama'aina too). ","Lahaina, Hawaii","jenniferpU8691MR</div><div class=""userLoc""><strong>Lahaina, Hawaii</strong>",4,5.0
542256255,https://www.tripadvisor.com/Hotel_Review-g60982-d227765-Reviews-The_Surfjack_Hotel_Swim_Club-Honolulu_Oahu_Hawaii-or555.html?filterLang=en,The Surfjack Hotel & Swim Club,"November 20, 2017","This is a really good smaller hotel for when you don't need all the usual trappings of a big Waikiki resort. Delicious restaurant, warm friendly front desk, great location without getting overburdened by being too touristy or too crowded.",,JDLC_SFO,0,5.0
542111055,https://www.tripadvisor.com/Hotel_Review-g60982-d227765-Reviews-The_Surfjack_Hotel_Swim_Club-Honolulu_Oahu_Hawaii-or555.html?filterLang=en,The Surfjack Hotel & Swim Club,"November 19, 2017",Comfortable atmosphere with daily live music performance and fashionable room interiors. The staff was kind enough to find us in Olive and Oliver boutique shop and let us know that the room would be available earlier than initially instructed at the timing of checking in. We would visit again and join daily event of the hotel next time.,"Tokyo, Japan","tosihyvaa87</div><div class=""userLoc""><strong>Tokyo, Japan</strong>",1,5.0
542060948,https://www.tripadvisor.com/Hotel_Review-g60982-d227765-Reviews-The_Surfjack_Hotel_Swim_Club-Honolulu_Oahu_Hawaii-or555.html?filterLang=en,The Surfjack Hotel & Swim Club,"November 19, 2017","The hotel is greatly located, just off the main strip of Waikiki, and easy to get to. check in was easy. We were only staying one night, to accommodate flights back to Australia. at midday we were lucky and our room was available. the Receptionist staff very helpful and explained everything.We had booked a two bedroom suite and the suite was great. the main bedroom was located right next door to the ensuite. 544 was a corner room, with 2 Lanai's. they were small but big enough for a small table and chairs.The pool area is really cool, with a bar very close (they serve beer in plastic cups so you can sit by the pool) There is a restaurant on site.Would recommend staying here, and will again on our next trip.My only criticism - on the TripAdvisor entry it says free internet....there is a $25 daily amenities fee, that includes the internet, and the use of the pool. you get a card to exchange for a towel, and must return the towel to get the card back. As we were checking out early, we didnt get the free morning coffee or newspaper. A great atmosphere, and a lovely place to stay in Honolulu.","Padstow, Australia","robl276</div><div class=""userLoc""><strong>Padstow, Australia</strong>",57,4.0
541867688,https://www.tripadvisor.com/Hotel_Review-g60982-d227765-Reviews-The_Surfjack_Hotel_Swim_Club-Honolulu_Oahu_Hawaii-or555.html?filterLang=en,The Surfjack Hotel & Swim Club,"November 18, 2017","Our first trip to Honolulu will be remembered primarily for the top notch stay at Surfjack. The energy, vibe, food and room were so perfectly timed with the sunny weather and our activities. We will return.","Philadelphia, Pennsylvania","LeLeandRobin</div><div class=""userLoc""><strong>Philadelphia, Pennsylvania</strong>",9,5.0
541853008,https://www.tripadvisor.com/Hotel_Review-g60982-d227765-Reviews-The_Surfjack_Hotel_Swim_Club-Honolulu_Oahu_Hawaii-or555.html?filterLang=en,The Surfjack Hotel & Swim Club,"November 18, 2017","The Surfjack is an awesome hotel. This boutique hotel is nice awesome and fabulous. They paid great attention to detail in their furniture, art and lighting. This hotel is so awesome. I highly recommended this hotel.",Mililani,"Janden S</div><div class=""userLoc""><strong>Mililani</strong>",1,5.0
541799242,https://www.tripadvisor.com/Hotel_Review-g60982-d227765-Reviews-The_Surfjack_Hotel_Swim_Club-Honolulu_Oahu_Hawaii-or560.html?filterLang=en,The Surfjack Hotel & Swim Club,"November 18, 2017",The hotel is wonderful. Nice team. Great room and vintage decoration. Have all the facilities to enjoy Honolulu. Good price vs value. Todo me encanto. Los detalles en cada cosa y el restaurante es muy bueno.,,marcelam58,0,5.0
541446276,https://www.tripadvisor.com/Hotel_Review-g60982-d227765-Reviews-The_Surfjack_Hotel_Swim_Club-Honolulu_Oahu_Hawaii-or560.html?filterLang=en,The Surfjack Hotel & Swim Club,"November 16, 2017",Awesome experience. I would highly recommend anyone who wants a relaxing vacation to stay here. We loved the hip modern vibe of the hotel and staff. Our son had so much fun in the pool as well as there were floaties that he could use. ,,daynao939,0,5.0
541408436,https://www.tripadvisor.com/Hotel_Review-g60982-d227765-Reviews-The_Surfjack_Hotel_Swim_Club-Honolulu_Oahu_Hawaii-or560.html?filterLang=en,The Surfjack Hotel & Swim Club,"November 16, 2017","Stayed here for me and my husband's wedding anniversary trip. We loved the location, the room was perfect and comfortable. Most importantly the staff was amazing. Everyone was so warm and friendly. What really makes this hotel unique is the thoughtful and stylish decor and live music and movies that are poolside. ",,cindyv884,0,5.0
541249918,https://www.tripadvisor.com/Hotel_Review-g60982-d227765-Reviews-The_Surfjack_Hotel_Swim_Club-Honolulu_Oahu_Hawaii-or560.html?filterLang=en,The Surfjack Hotel & Swim Club,"November 15, 2017","Love the vibe at this hotel. The penthouse roof top was perfect for hosting a get together with friends. The pool area is relaxing, not too crowded, not too hot. Mahina and Suns had amazing pizza, and our favorite drinks served by the best bartender Nehu, ask for his special mezcal cocktail! Theres another one he makes thats also very good, forgot what its called, but it was perfect for lounging by the pool. ",,X6841NVvirginias,0,5.0
539999274,https://www.tripadvisor.com/Hotel_Review-g60982-d227765-Reviews-The_Surfjack_Hotel_Swim_Club-Honolulu_Oahu_Hawaii-or560.html?filterLang=en,The Surfjack Hotel & Swim Club,"November 10, 2017","We stayed at the Surfjack for our honeymoon! Was beyond amazing, all the staff are so friendly not just when you arrive every time you walk past one another! It’s such a hip/modern place, the rooms are tidy & so beautiful.. we will 100% be staying here again when we return... Mahalo Surfjack ","Bacchus Marsh, Australia","601kaileem</div><div class=""userLoc""><strong>Bacchus Marsh, Australia</strong>",2,5.0
537658886,https://www.tripadvisor.com/Hotel_Review-g60982-d227765-Reviews-The_Surfjack_Hotel_Swim_Club-Honolulu_Oahu_Hawaii-or565.html?filterLang=en,The Surfjack Hotel & Swim Club,"November 1, 2017","My husband and I stayed at the Surfjack Hotel & Swim Club for the first three days of our honeymoon and were both absolutely in love with everything about it. The employees are all so friendly and offer such a great level of customer service that we were reluctant to leave for our next destination. The hotel itself has a retro/vintage vibe which lends itself to a wonderful overall ambiance, we will definitely be staying here again on any return trips to Honolulu.","Philadelphia, Pennsylvania","snsully11</div><div class=""userLoc""><strong>Philadelphia, Pennsylvania</strong>",0,5.0
536686510,https://www.tripadvisor.com/Hotel_Review-g60982-d227765-Reviews-The_Surfjack_Hotel_Swim_Club-Honolulu_Oahu_Hawaii-or565.html?filterLang=en,The Surfjack Hotel & Swim Club,"October 28, 2017",Great place perfectly located near everything in Honolulu. The efficient valet parking came in handy. Food and drinks left nothing to complain about. Complimentary coffee and super staff to really good care of all of us. Loved the ambiance. Will for sure stay there again if we come back to Honolulu. Aloha Surfjack!,"Stockholm, Sweden","MattiasJ38</div><div class=""userLoc""><strong>Stockholm, Sweden</strong>",7,4.0
535815264,https://www.tripadvisor.com/Hotel_Review-g60982-d227765-Reviews-The_Surfjack_Hotel_Swim_Club-Honolulu_Oahu_Hawaii-or565.html?filterLang=en,The Surfjack Hotel & Swim Club,"October 24, 2017","Our five night stay here was fabulous. Surfjack is a small, intimate hotel with the friendliest staff there to serve and assist guests in every way, from directions to restaurant suggestions. Our standard room was upgraded to a spacious suite at no additional cost. The beds were comfortable, the linens fresh and the bathroom large. Surfjack is conveniently located within walking distance to Waikiki beaches, the luxury Kalakaua and other shopping districts, restaurants and bus stops. The hotel provides beach chairs and towels. I wouldn't hesitate to stay at Surfjack again.",Michigan,"donnasS3933QC</div><div class=""userLoc""><strong>Michigan</strong>",3,5.0
535559589,https://www.tripadvisor.com/Hotel_Review-g60982-d227765-Reviews-The_Surfjack_Hotel_Swim_Club-Honolulu_Oahu_Hawaii-or565.html?filterLang=en,The Surfjack Hotel & Swim Club,"October 23, 2017","The service @ this place was always so pleasant and professional, the team were genuinely friendly and there was always a great atmosphere. This place is incredible, and the service is second to none. Highly recommend this place to anyone staying in Waikiki, its retro/coastal feel takes you away from the bustle in the city yet its location is so close to everything. Shout out to Sai who made our stay comfortable, so welcoming, and the fam just felt at home while he was around. Sai your a true professional bro, and an asset to the team @Surfjack. Our absolute first option when we go back and #1 recommendation to our friends. Thanks for having us Surfjack!",,StevenB5241,1,5.0
535226878,https://www.tripadvisor.com/Hotel_Review-g60982-d227765-Reviews-The_Surfjack_Hotel_Swim_Club-Honolulu_Oahu_Hawaii-or565.html?filterLang=en,The Surfjack Hotel & Swim Club,"October 22, 2017","We are just on our way home to the East Coast after our Hawaiian honeymoon, it was fantastic! We started with three nights at the surf jack hotel and swim club. The hotel is very cute, has a nice pool, they upgraded our room for free because it was our honeymoon and our balcony faced the pool! The restaurant that is attached to the hotel was fabulous, we ate breakfast there every morning and the service staff was incredibly helpful, giving us ideas of what to do during the day in Oahu and then what to do on our next adventure taking the Norwegian cruise to Maui, the big Island, and Kauai. We took a lot of their advice to heart and rented cars on each island, the food was fantastic and the service was incredible. The hotel is a few blocks away from the beach, but not a difficult walk. On your walk to the beach you will see lots of shops and restaurants. There are also other great places to eat around the hotel. We are especially grateful the the restaurant's manager, Julia. Her tips and kindness were so appreciated! Aloha!",,Flyer737370,5,5.0
534753591,https://www.tripadvisor.com/Hotel_Review-g60982-d227765-Reviews-The_Surfjack_Hotel_Swim_Club-Honolulu_Oahu_Hawaii-or570.html?filterLang=en,The Surfjack Hotel & Swim Club,"October 20, 2017",Stayed here for 4 nights after a week on the North Shore. The Surfjack was everything we wanted it to be. 1. Great location right in Waikiki.2. Super cool staff. Everyone I interacted with was so chill and went out of their way to make our time there perfect. 3. Fab decor. This is the most grammable hotel in Waikiki (make sure you get a pool shot) 4. The onsite restaurant is delish. ,,820robinm,20,5.0
534408167,https://www.tripadvisor.com/Hotel_Review-g60982-d227765-Reviews-The_Surfjack_Hotel_Swim_Club-Honolulu_Oahu_Hawaii-or570.html?filterLang=en,The Surfjack Hotel & Swim Club,"October 19, 2017","The pictures on the website and description lead me to believe I was going to an oasis. The truth is this multi story hotel has no bungalows and is in a Back street area. A little misleading. However, it’s not a bad location with the airport bus 2 minutes walk, lots of good restaurants, great coffee shop co-located, a restaurant in house with great food, and bike hire. The bungalows are small (where can I open my case?), the pool is adequate, the wifi works well and beds are comfy. Staff are fun and informative. A boutique hotel, the daily amenity fee had some inclusions like snack basket - but to have anything refilled you needed to ask. The restuarant served delicious food, but we ordered entree and main and whilst eating the entree portion the main arrived so we had to hold the entree plates in our hands to eat it so the main could be sat on the table to go cold, shame really as it was my birthday dinner. Overall it was a good experience but could have been great.",bittern,"bitterntraveller</div><div class=""userLoc""><strong>bittern</strong>",210,4.0
533902637,https://www.tripadvisor.com/Hotel_Review-g60982-d227765-Reviews-The_Surfjack_Hotel_Swim_Club-Honolulu_Oahu_Hawaii-or570.html?filterLang=en,The Surfjack Hotel & Swim Club,"October 17, 2017","My 13 year old daughter & I stayed her for 6 nights last week. The staff were lovely, with Crystal upgrading us to a better room at a reduced rate. All of the staff were fantastic and really seem to enjoy their jobs!Great location in the centre of Waikiki with restaurants & shopping all around & a short walk to the beach. We utilised the free pushbike hire and concierge were flexible with return times. Snacks in the room were yummy and we spent a few evenings at the bar enjoying the boiled peanuts and a fantastic pizza. ","The Entrance, Australia","120tamarao</div><div class=""userLoc""><strong>The Entrance, Australia</strong>",9,5.0
533589470,https://www.tripadvisor.com/Hotel_Review-g60982-d227765-Reviews-The_Surfjack_Hotel_Swim_Club-Honolulu_Oahu_Hawaii-or570.html?filterLang=en,The Surfjack Hotel & Swim Club,"October 16, 2017","We stayed at this lovely hotel last week as part of our honeymoon. I just wanted to give my complements to all the staff there especially the front staff and Dexter. Dexter was so friendly and awesome for hooking us up with an upgrade for part of our stay. From the moment he helped us check in, he was so helpful in suggesting things to do and made us feel so welcomed. It made our trip so much more special. We appreciate everything he did and wanted to thank him in person but missed him on our last day when we checked out. My husband (Shannon) actually just left you guys a great review but mistakenly referred to Dexter as Daniel, I think. So I just wanted to leave this review here with you guys to make sure that Dexter gets the recognition and thanks he deserves! Mahalo and much love from Toronto, Canada. ","Toronto, Canada","jocO8366JZ</div><div class=""userLoc""><strong>Toronto, Canada</strong>",33,5.0
533254733,https://www.tripadvisor.com/Hotel_Review-g60982-d227765-Reviews-The_Surfjack_Hotel_Swim_Club-Honolulu_Oahu_Hawaii-or570.html?filterLang=en,The Surfjack Hotel & Swim Club,"October 15, 2017","Our room was stylish, just the right size and well decorated. It was just the right place for the night. Also enjoyed the $10 restaurant credit for a great breakfast at the restaurant.Great location in the heart of Waikiki, within walking distance of all important places, but quite a walk to the beach.","San Antonio, Texas","Peter A</div><div class=""userLoc""><strong>San Antonio, Texas</strong>",17,5.0
532958563,https://www.tripadvisor.com/Hotel_Review-g60982-d227765-Reviews-The_Surfjack_Hotel_Swim_Club-Honolulu_Oahu_Hawaii-or575.html?filterLang=en,The Surfjack Hotel & Swim Club,"October 14, 2017","Every member of staff we met was very nice. The pool is cute, the coffee is good (and free every morning!) and the room was cute. We only ate breakfast at the restaurant, and I thought that it was a little bit overpriced (avocado toast) for what I'm used to in Montreal. We had a great time!","Montreal, Canada","Mafarlouche</div><div class=""userLoc""><strong>Montreal, Canada</strong>",23,4.0
