review_id,url,hotel_name,review_date,review_body,user_location,user_name,helpful_vote,rating
633532718,https://www.tripadvisor.com/Hotel_Review-g60982-d227765-Reviews-The_Surfjack_Hotel_Swim_Club-Honolulu_Oahu_Hawaii-or275.html?filterLang=en,The Surfjack Hotel & Swim Club,"November 14, 2018","Awesome service, location & atmosphere. My only problems were (we were in room 442) the bed & the pillows are not very comfortable, so we didn’t sleep very well. The water pressure from the main shower head is not great at all for such a beautiful shower, and it leaks of out of the bottom of the door around the toilet so we had to pile towels up to prevent it from flooding! Those are easy fixes and it wasn’t enough to turn our experience into a bad one. We will be back. Lovely housekeepers who are very thorough in their cleaning standards, thank you for a lovely first time in Hawaii. ","Hamilton Island, Australia","jodahn</div><div class=""userLoc""><strong>Hamilton Island, Australia</strong>",0,4.0
632715366,https://www.tripadvisor.com/Hotel_Review-g60982-d227765-Reviews-The_Surfjack_Hotel_Swim_Club-Honolulu_Oahu_Hawaii-or275.html?filterLang=en,The Surfjack Hotel & Swim Club,"November 11, 2018","We were very satisfied with this hotel. The location was close to the main shoppingstreet and the beach. Free coffe and tea all day, and calm and relaxing atmosphere at the pool. It was top service in the reseption and all employees were very serviceminded and helpful.",,abf96,0,5.0
632655390,https://www.tripadvisor.com/Hotel_Review-g60982-d227765-Reviews-The_Surfjack_Hotel_Swim_Club-Honolulu_Oahu_Hawaii-or275.html?filterLang=en,The Surfjack Hotel & Swim Club,"November 11, 2018","We just checked out after 2 nights at the SurfJack hotel and we loved it. It’s a very cute and ready boutique hotel in the middle of the Waikiki madness. The staff was very friendly and welcoming!! We had a couple of minor things happen, and they were very responsive and helpful!! We had a 2 bedroom and found it to be spacious and perfect for us. We were two couples traveling together. The restaurant, Mahina and Sons, is absolutely delicious!! We LOVED it!! The adobo fried rice at breakfast was so good!! The pool area was a super chill place to hang out! We we’re on Oahu for the Bruno Mars concert and we’re surprised when the hotel had a Bruno Mars Rum tasting event!!I LOVED all of the little details at this hotel!! The retro Hawaiian decor and the little extra touches make this the perfect place for me!! We will definitely be back!!!! ","Kihei, Hawaii","Maui2Italy</div><div class=""userLoc""><strong>Kihei, Hawaii</strong>",4,5.0
631807252,https://www.tripadvisor.com/Hotel_Review-g60982-d227765-Reviews-The_Surfjack_Hotel_Swim_Club-Honolulu_Oahu_Hawaii-or280.html?filterLang=en,The Surfjack Hotel & Swim Club,"November 7, 2018",if you are looking for something more than your standard Waikiki hotel...you will find it right here. In a great spot...close to everything...retro rooms and pool area. But what makes it are the staff. They go out of their way to make sure you are having a great time.After an initial issue (twin beds on a honeymoon was never going to work!!) they couldn't have been nicer about it...and upgraded us for the remainder of our stay. Would definitely recommend to friends...and we will definitely return.,,Myfriendvic,5,5.0
631802604,https://www.tripadvisor.com/Hotel_Review-g60982-d227765-Reviews-The_Surfjack_Hotel_Swim_Club-Honolulu_Oahu_Hawaii-or280.html?filterLang=en,The Surfjack Hotel & Swim Club,"November 7, 2018",My husband and i stayed here for 3 nights. We had a great time! The staff was so friendly and willing to help us out with every need. We would definitely stay here again! Absolutely LOVED it here.yay!,"Spokane, Washington","M1D9H80</div><div class=""userLoc""><strong>Spokane, Washington</strong>",1,5.0
631790331,https://www.tripadvisor.com/Hotel_Review-g60982-d227765-Reviews-The_Surfjack_Hotel_Swim_Club-Honolulu_Oahu_Hawaii-or280.html?filterLang=en,The Surfjack Hotel & Swim Club,"November 7, 2018","Nice, quiet location. Kids get to swim until 5pm. Free surf safe sunscreen. Near a bus stop, 2 convenience stores. Great morning coffee, beach chair, beach towel. Pool is small. Decor feels like a beach-chalet. ","Singapore, Singapore","HazelnMummy</div><div class=""userLoc""><strong>Singapore, Singapore</strong>",3,4.0
631061057,https://www.tripadvisor.com/Hotel_Review-g60982-d227765-Reviews-The_Surfjack_Hotel_Swim_Club-Honolulu_Oahu_Hawaii-or280.html?filterLang=en,The Surfjack Hotel & Swim Club,"November 5, 2018",A really easy and well positioned hotel for a family break. In the midst of it all but still small and personal. A great restaurant (but make sure you book as it’s really busy). Rooms well set out and staff very helpful. ,"Manila, Philippines","MatK633</div><div class=""userLoc""><strong>Manila, Philippines</strong>",15,5.0
631036465,https://www.tripadvisor.com/Hotel_Review-g60982-d227765-Reviews-The_Surfjack_Hotel_Swim_Club-Honolulu_Oahu_Hawaii-or280.html?filterLang=en,The Surfjack Hotel & Swim Club,"November 5, 2018","Fabulous. Had a 3 bedroom suite, we requested a microwave and crib, got it. Crib was free of charge, whereas other hotels usually charge for it.Little things matter and made the stay so enjoyable. - free cold water in lobby to fill up your water bottle- free sunscreen in lobby- towels, tote bag, beach chairs included to take to beach - friendly staff all around: front desk, valets, cleaners- Best part: we had a late flight back home, they gave us a hospitality room after check out free of charge, which was so helpful, especially since we had a baby- great location- tea/ coffee in the morning- feels more personal than the other hotels The only downside: we found the parking a bit costly. Not sure how it compares to other hotels.","Edmonton, Canada","719mimi</div><div class=""userLoc""><strong>Edmonton, Canada</strong>",10,5.0
630962190,https://www.tripadvisor.com/Hotel_Review-g60982-d227765-Reviews-The_Surfjack_Hotel_Swim_Club-Honolulu_Oahu_Hawaii-or285.html?filterLang=en,The Surfjack Hotel & Swim Club,"November 5, 2018",Love love love the Surfjack! Awesome retro boutique hotel in the heart of Waikiki. The vibe in the place is so cool. The staff are all so friendly and caring. The food at the restaurant is awesome. And the rooms are way cool.,"Seattle, Washington","Scott G</div><div class=""userLoc""><strong>Seattle, Washington</strong>",11,5.0
629311722,https://www.tripadvisor.com/Hotel_Review-g60982-d227765-Reviews-The_Surfjack_Hotel_Swim_Club-Honolulu_Oahu_Hawaii-or285.html?filterLang=en,The Surfjack Hotel & Swim Club,"October 29, 2018",The hotel is within easy walking distance of Waikiki beach and shops but it is a basic hotel. The pool isn't large and if you arrive before check-in you will need to change in toilets which pretty ordinary.There is also a service fee and if your not eating at the resturant onsite or grabbing a coffee $25.00 per day is steep just for WiFi access.,"Melbourne, Victoria, Australia","Lynda G</div><div class=""userLoc""><strong>Melbourne, Victoria, Australia</strong>",8,3.0
629272825,https://www.tripadvisor.com/Hotel_Review-g60982-d227765-Reviews-The_Surfjack_Hotel_Swim_Club-Honolulu_Oahu_Hawaii-or285.html?filterLang=en,The Surfjack Hotel & Swim Club,"October 28, 2018","Stayed here for the first week of our holiday. Hotel is nice and small compared to the monsters Waikiki have. Reception staff and valet service were nice and attentive. Rooms are clean and modern. Limited storage space, bedrooms only have a bed and two side tables in it. Had to live out of our suitcases as there wasn’t enough space for the four of us sharing a two bedded suite. No coffee making facilities in the rooms, however unlimited coffee is available from the bar which was great. Pool area is small but clean. Restaurant served Hawaiian cuisine with a twist, it was very nice but the fussy eaters of the family struggled with the small menu. Hotel hosts daily evening entertainment, which can be heard from the bedrooms due to the layout of the hotel. It’s particularly noisy on the weekend, I’m not sure if it would be suitable if I was travelling with small people. Overall I am pleased to have stayed here, it was a good start to the holiday. ","Coventry, United Kingdom","nao2004</div><div class=""userLoc""><strong>Coventry, United Kingdom</strong>",28,5.0
629266428,https://www.tripadvisor.com/Hotel_Review-g60982-d227765-Reviews-The_Surfjack_Hotel_Swim_Club-Honolulu_Oahu_Hawaii-or285.html?filterLang=en,The Surfjack Hotel & Swim Club,"October 28, 2018","Firstly, this hotel is overpriced for the quality of service and facilities. The manager had the attitude of a dive bar bouncer rather than a hospitality manager. They also do not allow guests to take food or beverage out of their rooms so that they can force guests to patronize their bar at the hotel pool. Drinks were about $12 each which is fine for Waikiki but they are served in a small paper coffee cup that was no more that 10 oz. The room was not clean: there was rust and soap residue on the shower door, mildew in shower, and dried food particle caked to the sink counter. The hotel vibe is very hip and charming but management seems to be more in the business of running a bar than providing good guest experience. I would never stay at the Surfjack again and I would recommend that others choose a more modern hotel near the beach that is hospitality focused. For $250 a night, you can find much better.","Kaneohe, Hawaii","JCantiberos</div><div class=""userLoc""><strong>Kaneohe, Hawaii</strong>",1,2.0
629253886,https://www.tripadvisor.com/Hotel_Review-g60982-d227765-Reviews-The_Surfjack_Hotel_Swim_Club-Honolulu_Oahu_Hawaii-or285.html?filterLang=en,The Surfjack Hotel & Swim Club,"October 28, 2018","We stayed two nights at Surfjack at the end of a 3 week holiday and I wish it had been longer! They've done a gorgeous refurb/fitout that gives the whole place a funky, relaxed vibe.We ate both breakfasts and one dinner at the semi-alfresco restaurant in the hotel (Mahina and Sun's) which was delicious food with really friendly and fun servers.Olive and Oliver is a gorgeous cafe / boutique just off reception and the coffee there is diviiine (I'm a Melbourne coffee snob).The pool area is like a little oasis and you feel far away from the hustle and bustle.It was nice to stay at a smaller place rather than the big chain skyscraper hotels, it definitely had more personality and I would go back in a heartbeat.","Melbourne, Australia","RaeR934</div><div class=""userLoc""><strong>Melbourne, Australia</strong>",11,5.0
629241310,https://www.tripadvisor.com/Hotel_Review-g60982-d227765-Reviews-The_Surfjack_Hotel_Swim_Club-Honolulu_Oahu_Hawaii-or290.html?filterLang=en,The Surfjack Hotel & Swim Club,"October 28, 2018","This small hotel has the most remarkable employees. Our 2nd stay was even more amazing with ""ALOHA"" practiced by each and every employee we came in contact with. I am dazed.... in a good way... that a place like this even exists within this price range. It is an easy drive from the hotel to the Queens Hospital. There is a nice Irish Bar within walking distance that has live music nightly. ",Kailua Kona,"beckyonbigisland</div><div class=""userLoc""><strong>Kailua Kona</strong>",3,5.0
629219008,https://www.tripadvisor.com/Hotel_Review-g60982-d227765-Reviews-The_Surfjack_Hotel_Swim_Club-Honolulu_Oahu_Hawaii-or290.html?filterLang=en,The Surfjack Hotel & Swim Club,"October 28, 2018","This was a bit of a letdown, after having seen all the great reviews: To start off with the Elephant in the room, our room had a very strong moldy for smell in the living room area, making it a pain to remain there without opening the window; generally speaking, the hotel did not make a clean impression, there was a little bit of mold in the shower, and stains on the ceiling; also the bed was a bit too soft and the mattress quite worn; otherwise the room was actually quite alright: good equipment (good tv sets, usb chargers, safe, fridge), stylish design (although terribly lit), decent water pressure in the shower; the common areas are quite nice to look at, but the noise from the pool area resonates in the rooms (we were on an elevated floor); staff was very friendly and forthcoming, no complaints in that area; given we paid more than USD 200 per night, made me consider an even lower rating, since this is definitely not what I would have expected for this price category (a 2 felt too harsh but it is close, I would say 2 and a half); we tried another, cheaper hotel on our last night in Waikiki, which was way better; would certainly not return...","Luxembourg City, Luxembourg","luxbrain</div><div class=""userLoc""><strong>Luxembourg City, Luxembourg</strong>",110,3.0
628488823,https://www.tripadvisor.com/Hotel_Review-g60982-d227765-Reviews-The_Surfjack_Hotel_Swim_Club-Honolulu_Oahu_Hawaii-or290.html?filterLang=en,The Surfjack Hotel & Swim Club,"October 26, 2018","The hotel is so beautiful; like to be on a 70’s movie. Its open air but if you like it theres AC. The front desk girl it was so lovely. My room is so nice, the rest down stairs is delicious and you will be just 5min walking to the nicest shopping area. ABAOLUTLY LOVE THIS HOTEL ","Mexico City, Mexico","La_Carcedo</div><div class=""userLoc""><strong>Mexico City, Mexico</strong>",20,5.0
628014814,https://www.tripadvisor.com/Hotel_Review-g60982-d227765-Reviews-The_Surfjack_Hotel_Swim_Club-Honolulu_Oahu_Hawaii-or290.html?filterLang=en,The Surfjack Hotel & Swim Club,"October 25, 2018","We arrived late at night and were warmly welcomed and congratulated about being on our honeymoon! And sent a bottle of champagne to the room for us enjoy. Everything was explained to us. The hotel has a resort fee but here you feel like are actually getting something for it. WiFi, beach towels/umbrellas, bike hireand sun protection and a bag. Free tea and coffee from the bar (as it’s not in the room) and a $10 credit for the restaurant for each night stay(that you can accumulate). The hotel is a short walk from the beach and posh shops in the center of town. So it’s very convenient. We walked to the Aloha Moana Mall (30Mins) and used their bikes to cycle to Diamond Head. We had a bungalow (odd description for a high rise room) which had a lounge and bedroom. I choose Surfjack because I didn’t want to stay as a generic hotel. The design of the hotel rooms and the rest of the hotel as so unique giving it great personality. The amenities where top quality and the room was spotless. I loved the signature scent. Such attention to details. The service doesn’t let it down either be it the staff serving breakfast who where fun and informative giving us ideas on what to do. Or the guy who issued us with our bikes to the chap that looked after our luggage. They were all so happy to help and so natural about it too. They are a credit to you. The hotel is part of the community which I do like (see their Facebook page) as we saw some yoga classes taking place, and live music by the pool. Which may put some guests off, as it’s not too big around the pool so can seem to take over. So if you are looking for a carefree stay in Honolulu with unique atmosphere and vibe stay here you won’t be disappointed. Thanks for making our stay such a memorable one. We hope to return one day. ","West Midlands, United Kingdom","disrich</div><div class=""userLoc""><strong>West Midlands, United Kingdom</strong>",38,5.0
627319600,https://www.tripadvisor.com/Hotel_Review-g60982-d227765-Reviews-The_Surfjack_Hotel_Swim_Club-Honolulu_Oahu_Hawaii-or290.html?filterLang=en,The Surfjack Hotel & Swim Club,"October 22, 2018","My dad and I were travelling from New York City to Australia for work, and at the last minute we decided to do a 2 day layover in Honolulu to try to break up the trip and so we could arrive rested. I read about Surfjack in an article about now hotels in Hawaii and we booked it because it looked fun and wasn't too expensive. I was a little nervous, since my dad is a total snob, but I didn't want to spend a fortune on this layover. SURFJACK WAS THE HIGHLIGHT OF OUR ENTIRE TRIP! From the minute we stepped into the lobby we were overwhelmed by how great this place was. The lobby smelled amazing, the staff couldn't have been nicer, the design was fabulous, the rooms were ready when we arrived and everything made you smile. The food at the restaurant is delicious and at night they project old movies onto the wall over the pool. It's a magical place that we didn't want to leave. My dad was so obsessed with this place that he bought a Surfjack tote bag that he now uses every day :) In fact, after a week in Australia, we had a 4 hour layover in Hawaii on our way back... and we hopped in a cab to Surfjack so we could have lunch and go for a swim there. When we walked in, the whole staff remembered us (they even remembered our lunch orders!) and made us feel so welcomed and at home. All of our other hotels on this trip were proud to be ""5 STAR LUXURY HOTELS""... but Surfjack was FAR AND AWAY our favorite hotel. It's quirky but fabulous.","New York City, New York","Tess M</div><div class=""userLoc""><strong>New York City, New York</strong>",40,5.0
627037530,https://www.tripadvisor.com/Hotel_Review-g60982-d227765-Reviews-The_Surfjack_Hotel_Swim_Club-Honolulu_Oahu_Hawaii-or295.html?filterLang=en,The Surfjack Hotel & Swim Club,"October 21, 2018","Rocked up here at half 9 off the cruise boat expecting to dump luggage but our room was ready which was a bonus. Unfortunately whilst waiting they gave us a drink, No milk for our coffee despite asking and then no stirrer for the sweeteners given so lacking detail a little. Our room /suite was good size and excellent air con. It did have a bit of a 'drainy' smell when we first checked in which we then didn't notice on subsequent days- perhaps there is a bit f a back flow problem if the sink and shower aren't being used daily?? The staff were helpful with advice for taxis and restaurants etc,There is a daily club charge for swim towels which we were told could be used against any purchase at the bar /restaurant- however when we cam to check out this then was not used against our purchase at the bar. As it was only $20 we didn't argue but perhaps that is the plan rather than another error???","Hockley, United Kingdom","Caroline H</div><div class=""userLoc""><strong>Hockley, United Kingdom</strong>",194,4.0
626791618,https://www.tripadvisor.com/Hotel_Review-g60982-d227765-Reviews-The_Surfjack_Hotel_Swim_Club-Honolulu_Oahu_Hawaii-or295.html?filterLang=en,The Surfjack Hotel & Swim Club,"October 20, 2018","This year our Ohana celebrated many milestones. My husband and celebrated our 35th Anniversary, his 60th, our son's 30th and our daughter's engagement. Since I once lived on the island many years ago I wanted my kids first experience on the island to be a memorable one. Choosing Surf Jack was the best decision we made! From the minute we pulled up the valet staff greeted us warmly each morning and evening. As did the front desk and Sai took excellent care of us giving us the best room and Robbie made sure we had everything we needed everyday. Our Imelda kept our room in excellent condition daily. The food was amazing in the restaurant, the entertainment they provide each night makes you want to stay in and never leave but best of all the love and warmth of the staff including Tiki, Darian, Marshall, Mahina and Krystle just to name a few all made us feel like Ohana. This is exactly what my kids got to experience what this island is all about true Ohana feeling at Surf Jack:). I call this hotel a ""Gem"" in Waikiki and I hated to leave but look forward to returning one day soon to my Surf Jack Ohana! Much Aloha!","Pleasant Hill, California","4MommaC</div><div class=""userLoc""><strong>Pleasant Hill, California</strong>",7,5.0
626646913,https://www.tripadvisor.com/Hotel_Review-g60982-d227765-Reviews-The_Surfjack_Hotel_Swim_Club-Honolulu_Oahu_Hawaii-or295.html?filterLang=en,The Surfjack Hotel & Swim Club,"October 19, 2018","The Surfjack is a great little boutique hotel with hip vibes, great style and excellent food and beverage service. All the employees are super friendly and the service is excellent throughout. The décor in the rooms is very cool and they're quite comfortable and very clean as well.","Wailuku, Hawaii","scotkerivan</div><div class=""userLoc""><strong>Wailuku, Hawaii</strong>",1,5.0
625960915,https://www.tripadvisor.com/Hotel_Review-g60982-d227765-Reviews-The_Surfjack_Hotel_Swim_Club-Honolulu_Oahu_Hawaii-or295.html?filterLang=en,The Surfjack Hotel & Swim Club,"October 17, 2018","This hotel is located in the perfect area, with great service and friendly staff. Super cute design and fair pricing. Loved the restaurant and all of the programming. Lots of amenities and the room was clean.","New York City, New York","amydadi</div><div class=""userLoc""><strong>New York City, New York</strong>",2,5.0
625622283,https://www.tripadvisor.com/Hotel_Review-g60982-d227765-Reviews-The_Surfjack_Hotel_Swim_Club-Honolulu_Oahu_Hawaii-or295.html?filterLang=en,The Surfjack Hotel & Swim Club,"October 16, 2018","I just came back from 5 nights at The Surfjack celebrating a special birthday with 4 other friends. The hotel was fantastic, the decor was gorgeous, the little additional amenities appreciated and the staff so very friendly and helpful. It was the perfect base for us and the 3 bedroom suite was great. Highly recommend the restaurant and especially the Bloody Mary’s are the best we have ever tried. Nothing was too difficult for the staff and they were so helpful with advice, making bookings at other establishments and just always smiling. Very impressed with the management meeting we witnessed one morning with all staff looking genuinely happy to be there Would definetly stay again and would recommend to families, groups etc",,Claire W,3,5.0
624987477,https://www.tripadvisor.com/Hotel_Review-g60982-d227765-Reviews-The_Surfjack_Hotel_Swim_Club-Honolulu_Oahu_Hawaii-or300.html?filterLang=en,The Surfjack Hotel & Swim Club,"October 15, 2018","We planned a happy hour event with the Surfjack hotel in October of 2018, and could not have had a better experience. We hosted 120-150 people in the outdoor area of the Surfjack, and in addition to the space, the hotel provided the food, drinks, and (amazing!) live music. All event attendees were absolutely abuzz with how incredible every element was - and this is truly because of the amazing work that Natalie, Jordyn, Ross, and the entire staff of the Surfjack did in planning and running the event. No detail was left uncovered, and their attentiveness before and during the event was unparalleled. Also, the vibe of this hotel is absolutely incredible. Highly recommended for an event, but I'm also dying to stay there myself!",,Lucy W,2,5.0
624797426,https://www.tripadvisor.com/Hotel_Review-g60982-d227765-Reviews-The_Surfjack_Hotel_Swim_Club-Honolulu_Oahu_Hawaii-or300.html?filterLang=en,The Surfjack Hotel & Swim Club,"October 14, 2018","We spent time in an old school experience Hawaii hotel, a private resort, a major chain resort and the Surfjack. Great vibe, service, food and location. if we hadn't been so focused on beach time we would choose this hotel for our main base camp.","Atlanta, Georgia","kwittersheim</div><div class=""userLoc""><strong>Atlanta, Georgia</strong>",1,5.0
624422593,https://www.tripadvisor.com/Hotel_Review-g60982-d227765-Reviews-The_Surfjack_Hotel_Swim_Club-Honolulu_Oahu_Hawaii-or300.html?filterLang=en,The Surfjack Hotel & Swim Club,"October 13, 2018","初ハワイ3世代旅行の前半に4泊しました。街中の便利な場所にあり、どこへ行くにも便利でした。お部屋はリビングルームのついた部屋で夜みんなで団欒したり、ご飯を食べたりもしやすくまるで自宅のように過ごせました。センスの良い家具やファブリックが良かったです。何よりも到着した瞬間からホテルのスタッフさん達が温かく迎えてくださり、感動しました。ジョークを言ったり、子どもと遊んでくれたりして、2日目くらいからはSAIさんというスタッフさんは子どもの名前も覚えてくださっていて、出かける時や帰ってくる時に、いってらっしゃい〜的な感じで子どもを名前で呼んでくれました。初ハワイでの1番の印象は色々な場所で地元の方が優しくしてくださったことですが、このホテルのスタッフさんたちも皆さん良い方ばかりでした。後半はこちらのホテルと比較するとグレードの高いホテルに泊まりましたが、アットホームさやオシャレ感では負けていないと思います。特に自宅のように過ごしたい方はぜひこのホテルをおススメします。またいつかハワイに行く時は利用したいです。Thank you,Sai and Krystle!!I enjoyed staying at this hotel sooo much!See you again!",,hinakoro,0,5.0
